Collar ID,Acq. Time [UTC],Acq. Time [MST],SCTS [UTC],SCTS [LMT],Origin,Latitude[deg],Longitude[deg],Altitude[m],DOP,Fix Type,Mortality Status,Temp[°C],Main[V],Beacon [V],Animal
40907,12/31/2022 13:01,12/31/2022 7:01,12/31/2022 15:02,2022-12-31 08:02:41-07:00,Iridium,46.76073,-113.94971,1386,3.8,3D Validated,Nothing Detected,11,3.36,3.6,Animal with Collar 40907
40907,12/31/2022 12:00,12/31/2022 6:00,12/31/2022 15:02,2022-12-31 08:02:41-07:00,Iridium,46.76075,-113.94984,1395,4,3D Validated,Nothing Detected,10,3.36,3.6,Animal with Collar 40907
40907,12/28/2022 19:00,12/28/2022 13:00,12/28/2022 19:01,2022-12-28 12:01:28-07:00,Iridium,46.76076,-113.94983,1399,6.6,3D Validated,Nothing Detected,7,3.36,3.6,Animal with Collar 40907
40907,12/28/2022 18:00,12/28/2022 12:00,12/28/2022 19:01,2022-12-28 12:01:28-07:00,Iridium,46.76074,-113.94982,1405,4.2,3D,Nothing Detected,8,3.36,3.6,Animal with Collar 40907
40907,12/28/2022 17:00,12/28/2022 11:00,12/28/2022 19:01,2022-12-28 12:01:28-07:00,Iridium,46.76073,-113.94978,1406,3.2,3D Validated,Nothing Detected,7,3.36,3.6,Animal with Collar 40907
40907,12/28/2022 16:00,12/28/2022 10:00,12/28/2022 19:01,2022-12-28 12:01:28-07:00,Iridium,46.76075,-113.94981,1409,4.4,3D Validated,Nothing Detected,7,3.36,3.6,Animal with Collar 40907
40907,12/28/2022 15:00,12/28/2022 9:00,12/28/2022 19:01,2022-12-28 12:01:38-07:00,Iridium,46.76073,-113.94983,1408,3,3D Validated,Nothing Detected,6,3.36,3.6,Animal with Collar 40907
40907,12/28/2022 14:00,12/28/2022 8:00,12/28/2022 19:01,2022-12-28 12:01:38-07:00,Iridium,46.76081,-113.94985,1390,3,3D Validated,Nothing Detected,6,3.36,3.6,Animal with Collar 40907
40907,12/28/2022 13:00,12/28/2022 7:00,12/28/2022 19:01,2022-12-28 12:01:38-07:00,Iridium,46.76082,-113.94991,1397,4.2,3D Validated,Nothing Detected,6,3.36,3.6,Animal with Collar 40907
40907,12/28/2022 12:00,12/28/2022 6:00,12/28/2022 19:01,2022-12-28 12:01:38-07:00,Iridium,46.76073,-113.94984,1400,4.6,3D Validated,Nothing Detected,6,3.36,3.6,Animal with Collar 40907
40907,12/22/2022 15:00,12/22/2022 9:00,12/22/2022 15:00,2022-12-22 08:00:41-07:00,Iridium,46.76076,-113.94981,1395,3.4,3D Validated,Nothing Detected,-1,3.36,3.6,Animal with Collar 40907
40907,12/22/2022 14:00,12/22/2022 8:00,12/22/2022 15:00,2022-12-22 08:00:41-07:00,Iridium,46.76073,-113.94987,1406,2.2,3D Validated,Nothing Detected,0,3.36,3.6,Animal with Collar 40907
40907,12/22/2022 13:00,12/22/2022 7:00,12/22/2022 15:00,2022-12-22 08:00:41-07:00,Iridium,46.76058,-113.94983,1413,3,3D Validated,Nothing Detected,-1,3.36,3.6,Animal with Collar 40907
40907,12/22/2022 12:00,12/22/2022 6:00,12/22/2022 15:00,2022-12-22 08:00:41-07:00,Iridium,46.76073,-113.9498,1394,2.8,3D Validated,Nothing Detected,3,3.36,3.6,Animal with Collar 40907
40907,12/22/2022 11:00,12/22/2022 5:00,12/22/2022 15:01,2022-12-22 08:01:06-07:00,Iridium,46.76079,-113.94973,1397,3.8,3D Validated,Nothing Detected,12,3.36,3.6,Animal with Collar 40907
40907,12/22/2022 9:03,12/22/2022 3:03,12/22/2022 15:01,2022-12-22 08:01:06-07:00,Iridium,46.76077,-113.94971,1371,6,3D,Nothing Detected,3,3.36,3.6,Animal with Collar 40907
40907,12/22/2022 8:00,12/22/2022 2:00,12/22/2022 15:01,2022-12-22 08:01:06-07:00,Iridium,46.76069,-113.94976,1407,4.2,3D Validated,Nothing Detected,-5,3.36,3.6,Animal with Collar 40907
40907,12/22/2022 7:00,12/22/2022 1:00,12/22/2022 15:01,2022-12-22 08:01:14-07:00,Iridium,46.76075,-113.94979,1398,4,3D Validated,Nothing Detected,-5,3.36,3.6,Animal with Collar 40907
40907,12/22/2022 6:00,12/22/2022 0:00,12/22/2022 15:01,2022-12-22 08:01:14-07:00,Iridium,46.76075,-113.94979,1398,3.2,3D Validated,Nothing Detected,-4,3.36,3.6,Animal with Collar 40907
40907,12/22/2022 5:00,12/21/2022 23:00,12/22/2022 15:01,2022-12-22 08:01:14-07:00,Iridium,46.76075,-113.94979,1398,2,3D Validated,Nothing Detected,-4,3.36,3.6,Animal with Collar 40907
40907,12/22/2022 4:00,12/21/2022 22:00,12/22/2022 15:01,2022-12-22 08:01:14-07:00,Iridium,46.76076,-113.94984,1397,3.4,3D Validated,Nothing Detected,-3,3.36,3.6,Animal with Collar 40907
40907,12/22/2022 3:00,12/21/2022 21:00,12/22/2022 15:01,2022-12-22 08:01:24-07:00,Iridium,46.7607,-113.94982,1407,2.8,3D Validated,Nothing Detected,-1,3.36,3.6,Animal with Collar 40907
40907,12/22/2022 2:00,12/21/2022 20:00,12/22/2022 15:01,2022-12-22 08:01:24-07:00,Iridium,46.76071,-113.94988,1408,2.2,3D Validated,Nothing Detected,2,3.36,3.6,Animal with Collar 40907
40907,12/22/2022 1:01,12/21/2022 19:01,12/22/2022 15:01,2022-12-22 08:01:24-07:00,Iridium,46.76075,-113.9498,1396,3.8,3D Validated,Nothing Detected,15,3.36,3.6,Animal with Collar 40907
40907,12/21/2022 20:03,12/21/2022 14:03,12/22/2022 15:01,2022-12-22 08:01:32-07:00,Iridium,46.76072,-113.94982,1404,3.8,3D Validated,Nothing Detected,3,3.36,3.6,Animal with Collar 40907
40907,12/21/2022 19:03,12/21/2022 13:03,12/21/2022 19:04,2022-12-21 12:04:46-07:00,Iridium,46.76075,-113.94979,1398,7,3D Validated,Nothing Detected,2,3.36,3.6,Animal with Collar 40907
40907,12/21/2022 17:01,12/21/2022 11:01,12/21/2022 19:04,2022-12-21 12:04:46-07:00,Iridium,46.76061,-113.94974,1418,7.8,3D Validated,Nothing Detected,5,3.36,3.6,Animal with Collar 40907
40907,12/21/2022 16:01,12/21/2022 10:01,12/21/2022 19:04,2022-12-21 12:04:46-07:00,Iridium,46.76076,-113.94979,1400,3,3D Validated,Nothing Detected,6,3.36,3.6,Animal with Collar 40907
40907,12/21/2022 14:02,12/21/2022 8:02,12/22/2022 15:01,2022-12-22 08:01:51-07:00,Iridium,46.76061,-113.94968,1418,8.4,3D Validated,Nothing Detected,5,3.36,3.6,Animal with Collar 40907
40907,12/21/2022 13:01,12/21/2022 7:01,12/22/2022 15:01,2022-12-22 08:01:51-07:00,Iridium,46.76075,-113.94981,1401,4.4,3D Validated,Nothing Detected,6,3.36,3.6,Animal with Collar 40907
40907,12/21/2022 8:00,12/21/2022 2:00,12/22/2022 15:02,2022-12-22 08:02:02-07:00,Iridium,46.76071,-113.94974,1405,8.6,3D Validated,Nothing Detected,11,3.36,3.6,Animal with Collar 40907
40907,12/21/2022 7:00,12/21/2022 1:00,12/22/2022 15:02,2022-12-22 08:02:11-07:00,Iridium,46.7608,-113.94987,1385,5.6,3D Validated,Nothing Detected,12,3.36,3.6,Animal with Collar 40907
40907,12/21/2022 6:01,12/21/2022 0:01,12/22/2022 15:02,2022-12-22 08:02:11-07:00,Iridium,46.76075,-113.9498,1396,5.8,3D Validated,Nothing Detected,13,3.36,3.6,Animal with Collar 40907
40907,12/21/2022 5:03,12/20/2022 23:03,12/22/2022 15:02,2022-12-22 08:02:11-07:00,Iridium,46.76071,-113.94984,1403,3.6,3D,Nothing Detected,17,3.36,3.6,Animal with Collar 40907
40907,12/21/2022 3:01,12/20/2022 21:01,12/22/2022 15:02,2022-12-22 08:02:18-07:00,Iridium,46.76075,-113.94985,1398,4,3D Validated,Nothing Detected,11,3.36,3.6,Animal with Collar 40907
40907,12/21/2022 1:00,12/20/2022 19:00,12/22/2022 15:02,2022-12-22 08:02:18-07:00,Iridium,46.7608,-113.94985,1388,4.4,3D Validated,Nothing Detected,12,3.36,3.6,Animal with Collar 40907
40907,12/21/2022 0:03,12/20/2022 18:03,12/22/2022 15:02,2022-12-22 08:02:18-07:00,Iridium,46.76076,-113.94984,1394,7.8,3D,Nothing Detected,13,3.36,3.6,Animal with Collar 40907
40907,12/20/2022 23:01,12/20/2022 17:01,12/22/2022 15:02,2022-12-22 08:02:25-07:00,Iridium,46.76076,-113.94994,1386,3.2,3D Validated,Nothing Detected,15,3.36,3.6,Animal with Collar 40907
40907,12/20/2022 22:01,12/20/2022 16:01,12/22/2022 15:02,2022-12-22 08:02:25-07:00,Iridium,46.76075,-113.94984,1401,4.8,3D Validated,Nothing Detected,16,3.36,3.6,Animal with Collar 40907
40907,12/20/2022 21:01,12/20/2022 15:01,12/22/2022 15:02,2022-12-22 08:02:25-07:00,Iridium,46.76079,-113.94979,1397,2.8,3D Validated,Nothing Detected,21,3.36,3.6,Animal with Collar 40907
40907,12/20/2022 18:01,12/20/2022 12:01,12/22/2022 15:02,2022-12-22 08:02:32-07:00,Iridium,46.76075,-113.94981,1415,5.2,3D Validated,Nothing Detected,13,3.36,3.6,Animal with Collar 40907
40907,12/20/2022 16:00,12/20/2022 10:00,12/22/2022 15:02,2022-12-22 08:02:32-07:00,Iridium,46.76071,-113.94979,1394,3.2,3D Validated,Nothing Detected,10,3.36,3.6,Animal with Collar 40907
40907,12/20/2022 15:00,12/20/2022 9:00,12/22/2022 15:02,2022-12-22 08:02:41-07:00,Iridium,46.76071,-113.94974,1399,4.8,3D Validated,Nothing Detected,11,3.36,3.6,Animal with Collar 40907
40907,12/20/2022 14:00,12/20/2022 8:00,12/22/2022 15:02,2022-12-22 08:02:41-07:00,Iridium,46.76069,-113.94981,1402,2.2,3D Validated,Nothing Detected,12,3.36,3.6,Animal with Collar 40907
40907,12/20/2022 13:00,12/20/2022 7:00,12/22/2022 15:02,2022-12-22 08:02:41-07:00,Iridium,46.76077,-113.94986,1399,3.8,3D Validated,Nothing Detected,14,3.36,3.6,Animal with Collar 40907
40907,12/20/2022 12:00,12/20/2022 6:00,12/22/2022 15:02,2022-12-22 08:02:41-07:00,Iridium,46.76071,-113.94978,1410,9,3D Validated,Nothing Detected,18,3.36,3.6,Animal with Collar 40907
40907,12/20/2022 11:00,12/20/2022 5:00,12/22/2022 15:02,2022-12-22 08:02:50-07:00,Iridium,46.76077,-113.94979,1401,4,3D Validated,Nothing Detected,17,3.36,3.6,Animal with Collar 40907
40907,12/20/2022 10:01,12/20/2022 4:01,12/22/2022 15:02,2022-12-22 08:02:50-07:00,Iridium,46.76074,-113.94981,1402,3,3D Validated,Nothing Detected,17,3.36,3.6,Animal with Collar 40907
40907,12/20/2022 9:00,12/20/2022 3:00,12/22/2022 15:02,2022-12-22 08:02:50-07:00,Iridium,46.76076,-113.94978,1387,3.8,3D Validated,Nothing Detected,14,3.36,3.6,Animal with Collar 40907
40907,12/20/2022 8:00,12/20/2022 2:00,12/22/2022 15:02,2022-12-22 08:02:50-07:00,Iridium,46.76072,-113.94978,1404,3.8,3D Validated,Nothing Detected,14,3.36,3.6,Animal with Collar 40907
40907,12/20/2022 7:00,12/20/2022 1:00,12/22/2022 15:02,2022-12-22 08:02:59-07:00,Iridium,46.76076,-113.9498,1391,6.2,3D Validated,Nothing Detected,12,3.36,3.6,Animal with Collar 40907
40907,12/20/2022 6:00,12/20/2022 0:00,12/22/2022 15:02,2022-12-22 08:02:59-07:00,Iridium,46.76076,-113.94981,1402,3,3D Validated,Nothing Detected,10,3.36,3.6,Animal with Collar 40907
40907,12/20/2022 5:00,12/19/2022 23:00,12/22/2022 15:02,2022-12-22 08:02:59-07:00,Iridium,46.76071,-113.94979,1394,3.8,3D Validated,Nothing Detected,10,3.36,3.6,Animal with Collar 40907
40907,12/20/2022 4:00,12/19/2022 22:00,12/22/2022 15:02,2022-12-22 08:02:59-07:00,Iridium,46.76073,-113.94985,1403,9.2,3D Validated,Nothing Detected,8,3.36,3.6,Animal with Collar 40907
40907,12/20/2022 3:00,12/19/2022 21:00,12/22/2022 15:03,2022-12-22 08:03:10-07:00,Iridium,46.76071,-113.94977,1400,3.4,3D Validated,Nothing Detected,8,3.36,3.6,Animal with Collar 40907
40907,12/20/2022 2:00,12/19/2022 20:00,12/22/2022 15:03,2022-12-22 08:03:10-07:00,Iridium,46.76076,-113.94978,1389,2.8,3D Validated,Nothing Detected,8,3.36,3.6,Animal with Collar 40907
40907,12/20/2022 1:00,12/19/2022 19:00,12/22/2022 15:03,2022-12-22 08:03:10-07:00,Iridium,46.7608,-113.94978,1385,3.4,3D Validated,Nothing Detected,8,3.36,3.6,Animal with Collar 40907
40907,12/20/2022 0:00,12/19/2022 18:00,12/22/2022 15:03,2022-12-22 08:03:10-07:00,Iridium,46.76073,-113.94985,1397,4,3D Validated,Nothing Detected,8,3.36,3.6,Animal with Collar 40907
40907,12/17/2022 3:01,12/16/2022 21:01,12/17/2022 3:02,2022-12-16 20:02:35-07:00,Iridium,46.76071,-113.94977,1394,4,3D Validated,Nothing Detected,12,3.36,3.6,Animal with Collar 40907
40907,12/17/2022 2:00,12/16/2022 20:00,12/17/2022 3:02,2022-12-16 20:02:35-07:00,Iridium,46.7608,-113.94987,1393,3.8,3D Validated,Nothing Detected,18,3.36,3.6,Animal with Collar 40907
40907,12/17/2022 1:00,12/16/2022 19:00,12/17/2022 3:02,2022-12-16 20:02:35-07:00,Iridium,46.76076,-113.94981,1395,3.8,3D Validated,Nothing Detected,16,3.36,3.6,Animal with Collar 40907
40907,12/16/2022 22:01,12/16/2022 16:01,12/17/2022 3:03,2022-12-16 20:03:03-07:00,Iridium,46.76071,-113.94991,1407,6.4,3D Validated,Nothing Detected,11,3.36,3.6,Animal with Collar 40907
40907,12/16/2022 21:00,12/16/2022 15:00,12/17/2022 3:03,2022-12-16 20:03:03-07:00,Iridium,46.76076,-113.94981,1402,2.8,3D Validated,Nothing Detected,8,3.36,3.6,Animal with Collar 40907
40907,12/16/2022 20:00,12/16/2022 14:00,12/17/2022 3:03,2022-12-16 20:03:03-07:00,Iridium,46.76075,-113.94981,1393,5.2,3D Validated,Nothing Detected,8,3.36,3.6,Animal with Collar 40907
40907,12/16/2022 19:00,12/16/2022 13:00,12/17/2022 3:03,2022-12-16 20:03:10-07:00,Iridium,46.76075,-113.94982,1384,3,3D Validated,Nothing Detected,10,3.36,3.6,Animal with Collar 40907
40907,12/16/2022 18:02,12/16/2022 12:02,12/17/2022 3:03,2022-12-16 20:03:10-07:00,Iridium,46.76079,-113.94986,1394,4.2,3D Validated,Nothing Detected,10,3.36,3.6,Animal with Collar 40907
40907,12/16/2022 17:01,12/16/2022 11:01,12/17/2022 3:03,2022-12-16 20:03:10-07:00,Iridium,46.76075,-113.94984,1401,8.6,3D Validated,Nothing Detected,8,3.36,3.6,Animal with Collar 40907
40907,12/16/2022 16:00,12/16/2022 10:00,12/17/2022 3:03,2022-12-16 20:03:10-07:00,Iridium,46.76075,-113.94978,1409,3,3D Validated,Nothing Detected,5,3.36,3.6,Animal with Collar 40907
40907,12/16/2022 15:00,12/16/2022 9:00,12/17/2022 3:03,2022-12-16 20:03:18-07:00,Iridium,46.76078,-113.94981,1403,3.4,3D Validated,Nothing Detected,4,3.36,3.6,Animal with Collar 40907
40907,12/16/2022 14:00,12/16/2022 8:00,12/17/2022 3:03,2022-12-16 20:03:18-07:00,Iridium,46.76076,-113.9498,1397,3.2,3D Validated,Nothing Detected,7,3.36,3.6,Animal with Collar 40907
40907,12/16/2022 13:01,12/16/2022 7:01,12/17/2022 3:03,2022-12-16 20:03:18-07:00,Iridium,46.76064,-113.94969,1410,5.2,3D Validated,Nothing Detected,10,3.36,3.6,Animal with Collar 40907
40907,12/6/2022 17:00,12/6/2022 11:00,12/6/2022 19:02,2022-12-06 12:02:01-07:00,Iridium,46.76073,-113.94987,1406,4.2,3D Validated,Nothing Detected,9,3.36,3.6,Animal with Collar 40907
40907,12/6/2022 15:00,12/6/2022 9:00,12/6/2022 19:02,2022-12-06 12:02:10-07:00,Iridium,46.76082,-113.94984,1396,3.6,3D Validated,Nothing Detected,11,3.36,3.6,Animal with Collar 40907
40907,12/6/2022 14:00,12/6/2022 8:00,12/6/2022 19:02,2022-12-06 12:02:10-07:00,Iridium,46.7607,-113.94978,1403,3.8,3D Validated,Nothing Detected,11,3.36,3.6,Animal with Collar 40907
40907,12/6/2022 13:00,12/6/2022 7:00,12/6/2022 19:02,2022-12-06 12:02:10-07:00,Iridium,46.76073,-113.94982,1411,8.6,3D Validated,Nothing Detected,11,3.36,3.6,Animal with Collar 40907
40907,12/6/2022 11:00,12/6/2022 5:00,12/6/2022 19:02,2022-12-06 12:02:19-07:00,Iridium,46.76085,-113.94984,1407,3.2,3D Validated,Nothing Detected,11,3.36,3.6,Animal with Collar 40907
40907,12/6/2022 10:02,12/6/2022 4:02,12/6/2022 19:02,2022-12-06 12:02:19-07:00,Iridium,46.76065,-113.94997,1437,5.8,3D Validated,Nothing Detected,11,3.36,3.6,Animal with Collar 40907
40907,12/6/2022 9:00,12/6/2022 3:00,12/6/2022 19:02,2022-12-06 12:02:19-07:00,Iridium,46.76076,-113.94986,1397,3.4,3D Validated,Nothing Detected,12,3.36,3.6,Animal with Collar 40907
40907,12/6/2022 8:00,12/6/2022 2:00,12/6/2022 19:02,2022-12-06 12:02:19-07:00,Iridium,46.76069,-113.94973,1437,6,3D Validated,Nothing Detected,10,3.36,3.6,Animal with Collar 40907
40907,12/6/2022 7:00,12/6/2022 1:00,12/6/2022 19:02,2022-12-06 12:02:28-07:00,Iridium,46.76077,-113.94983,1413,2.8,3D Validated,Nothing Detected,10,3.36,3.6,Animal with Collar 40907
40907,12/6/2022 6:00,12/6/2022 0:00,12/6/2022 19:02,2022-12-06 12:02:28-07:00,Iridium,46.76076,-113.94983,1399,2.8,3D Validated,Nothing Detected,9,3.36,3.6,Animal with Collar 40907
40907,12/6/2022 5:00,12/5/2022 23:00,12/6/2022 19:02,2022-12-06 12:02:28-07:00,Iridium,46.76076,-113.94983,1405,3.4,3D Validated,Nothing Detected,10,3.36,3.6,Animal with Collar 40907
40907,12/6/2022 4:03,12/5/2022 22:03,12/6/2022 19:02,2022-12-06 12:02:28-07:00,Iridium,46.76073,-113.9498,1394,3.4,3D Validated,Nothing Detected,10,3.36,3.6,Animal with Collar 40907
40907,11/30/2022 3:00,11/29/2022 21:00,11/30/2022 3:00,2022-11-29 20:00:42-07:00,Iridium,46.76075,-113.94983,1398,4.4,3D Validated,Nothing Detected,14,3.36,3.6,Animal with Collar 40907
40907,11/30/2022 2:00,11/29/2022 20:00,11/30/2022 3:00,2022-11-29 20:00:42-07:00,Iridium,46.76079,-113.94979,1397,3.4,3D Validated,Nothing Detected,11,3.36,3.6,Animal with Collar 40907
40907,11/30/2022 1:00,11/29/2022 19:00,11/30/2022 3:00,2022-11-29 20:00:42-07:00,Iridium,46.76069,-113.94984,1410,4,3D Validated,Nothing Detected,5,3.36,3.6,Animal with Collar 40907
40907,11/29/2022 23:00,11/29/2022 17:00,11/30/2022 3:00,2022-11-29 20:00:50-07:00,Iridium,46.76075,-113.94981,1393,3.8,3D Validated,Nothing Detected,7,3.36,3.6,Animal with Collar 40907
40907,11/29/2022 22:01,11/29/2022 16:01,11/30/2022 3:00,2022-11-29 20:00:50-07:00,Iridium,46.76066,-113.94981,1399,2.8,3D Validated,Nothing Detected,10,3.36,3.6,Animal with Collar 40907
40907,11/29/2022 21:00,11/29/2022 15:00,11/30/2022 3:00,2022-11-29 20:00:50-07:00,Iridium,46.76079,-113.94981,1391,6,3D Validated,Nothing Detected,10,3.36,3.6,Animal with Collar 40907
40907,11/29/2022 20:01,11/29/2022 14:01,11/30/2022 3:00,2022-11-29 20:00:50-07:00,Iridium,46.76076,-113.94983,1399,3,3D Validated,Nothing Detected,7,3.36,3.6,Animal with Collar 40907
40907,11/29/2022 19:00,11/29/2022 13:00,11/30/2022 3:00,2022-11-29 20:00:58-07:00,Iridium,46.76075,-113.94983,1404,3.2,3D Validated,Nothing Detected,7,3.36,3.6,Animal with Collar 40907
40907,11/29/2022 18:00,11/29/2022 12:00,11/30/2022 3:00,2022-11-29 20:00:58-07:00,Iridium,46.76074,-113.94982,1405,4.2,3D Validated,Nothing Detected,6,3.36,3.6,Animal with Collar 40907
40907,11/29/2022 17:00,11/29/2022 11:00,11/30/2022 3:00,2022-11-29 20:00:58-07:00,Iridium,46.76075,-113.94981,1403,3.4,3D Validated,Nothing Detected,5,3.36,3.6,Animal with Collar 40907
40907,11/29/2022 16:00,11/29/2022 10:00,11/30/2022 3:00,2022-11-29 20:00:58-07:00,Iridium,46.76078,-113.94982,1395,2.8,3D Validated,Nothing Detected,4,3.36,3.6,Animal with Collar 40907
40907,11/29/2022 15:00,11/29/2022 9:00,11/29/2022 15:00,2022-11-29 08:00:58-07:00,Iridium,46.76079,-113.94988,1402,4,3D Validated,Nothing Detected,2,3.36,3.6,Animal with Collar 40907
40907,11/29/2022 14:00,11/29/2022 8:00,11/29/2022 15:00,2022-11-29 08:00:58-07:00,Iridium,46.76072,-113.94982,1404,2.8,3D Validated,Nothing Detected,0,3.36,3.6,Animal with Collar 40907
40907,11/29/2022 13:01,11/29/2022 7:01,11/29/2022 15:00,2022-11-29 08:00:58-07:00,Iridium,46.76079,-113.94981,1391,8,3D Validated,Nothing Detected,0,3.36,3.6,Animal with Collar 40907
40907,11/29/2022 12:00,11/29/2022 6:00,11/29/2022 15:00,2022-11-29 08:00:58-07:00,Iridium,46.7608,-113.94984,1393,4.2,3D Validated,Nothing Detected,0,3.36,3.6,Animal with Collar 40907
40907,11/29/2022 11:00,11/29/2022 5:00,11/29/2022 11:01,2022-11-29 04:01:03-07:00,Iridium,46.76075,-113.94981,1401,2.2,3D Validated,Nothing Detected,-1,3.36,3.6,Animal with Collar 40907
40907,11/29/2022 10:00,11/29/2022 4:00,11/29/2022 11:01,2022-11-29 04:01:03-07:00,Iridium,46.76072,-113.94983,1407,4.2,3D Validated,Nothing Detected,-1,3.36,3.6,Animal with Collar 40907
40907,11/29/2022 9:00,11/29/2022 3:00,11/29/2022 11:01,2022-11-29 04:01:03-07:00,Iridium,46.76074,-113.94981,1402,5,3D Validated,Nothing Detected,-2,3.36,3.6,Animal with Collar 40907
40907,11/29/2022 8:00,11/29/2022 2:00,11/29/2022 11:01,2022-11-29 04:01:03-07:00,Iridium,46.76072,-113.94981,1406,6.2,3D Validated,Nothing Detected,-2,3.36,3.6,Animal with Collar 40907
40907,11/29/2022 7:00,11/29/2022 1:00,11/29/2022 11:01,2022-11-29 04:01:12-07:00,Iridium,46.76074,-113.94976,1413,3.8,3D Validated,Nothing Detected,-2,3.36,3.6,Animal with Collar 40907
40907,11/29/2022 6:01,11/29/2022 0:01,11/29/2022 11:01,2022-11-29 04:01:12-07:00,Iridium,46.76074,-113.94981,1402,2.8,3D Validated,Nothing Detected,1,3.36,3.6,Animal with Collar 40907
40907,11/29/2022 5:00,11/28/2022 23:00,11/29/2022 11:01,2022-11-29 04:01:12-07:00,Iridium,46.76075,-113.9498,1396,3,3D Validated,Nothing Detected,4,3.36,3.6,Animal with Collar 40907
40907,11/29/2022 4:00,11/28/2022 22:00,11/29/2022 11:01,2022-11-29 04:01:12-07:00,Iridium,46.76073,-113.94985,1397,3,3D Validated,Nothing Detected,5,3.36,3.6,Animal with Collar 40907
40907,11/29/2022 3:00,11/28/2022 21:00,11/29/2022 11:01,2022-11-29 04:01:20-07:00,Iridium,46.76081,-113.94985,1390,4,3D Validated,Nothing Detected,7,3.36,3.6,Animal with Collar 40907
40907,11/29/2022 2:01,11/28/2022 20:01,11/29/2022 11:01,2022-11-29 04:01:20-07:00,Iridium,46.76076,-113.94979,1394,4.2,3D Validated,Nothing Detected,8,3.36,3.6,Animal with Collar 40907
40907,11/29/2022 1:02,11/28/2022 19:02,11/29/2022 11:01,2022-11-29 04:01:20-07:00,Iridium,46.76064,-113.94978,1410,16,3D,Nothing Detected,10,3.28,3.6,Animal with Collar 40907
40907,11/29/2022 0:01,11/28/2022 18:01,11/29/2022 11:01,2022-11-29 04:01:20-07:00,Iridium,46.76071,-113.94975,1389,5,3D Validated,Nothing Detected,15,3.36,3.6,Animal with Collar 40907
40907,11/28/2022 23:02,11/28/2022 17:02,11/29/2022 11:01,2022-11-29 04:01:29-07:00,Iridium,46.76075,-113.9498,1396,2.6,3D Validated,Nothing Detected,13,3.36,3.6,Animal with Collar 40907
40907,11/28/2022 19:00,11/28/2022 13:00,11/29/2022 11:01,2022-11-29 04:01:38-07:00,Iridium,46.76074,-113.94983,1402,3.2,3D Validated,Nothing Detected,9,3.36,3.6,Animal with Collar 40907
40907,11/28/2022 18:01,11/28/2022 12:01,11/29/2022 11:01,2022-11-29 04:01:38-07:00,Iridium,46.76069,-113.94974,1402,6.2,3D Validated,Nothing Detected,8,3.36,3.6,Animal with Collar 40907
40907,11/28/2022 17:01,11/28/2022 11:01,11/29/2022 11:01,2022-11-29 04:01:38-07:00,Iridium,46.76076,-113.94977,1392,3.6,3D Validated,Nothing Detected,7,3.36,3.6,Animal with Collar 40907
40907,11/28/2022 14:01,11/28/2022 8:01,11/29/2022 11:01,2022-11-29 04:01:46-07:00,Iridium,46.76073,-113.94979,1403,4.2,3D Validated,Nothing Detected,6,3.36,3.6,Animal with Collar 40907
40907,11/28/2022 13:02,11/28/2022 7:02,11/29/2022 11:01,2022-11-29 04:01:46-07:00,Iridium,46.76076,-113.94977,1392,2.8,3D Validated,Nothing Detected,5,3.36,3.6,Animal with Collar 40907
40907,11/28/2022 12:03,11/28/2022 6:03,11/29/2022 11:01,2022-11-29 04:01:46-07:00,Iridium,46.76075,-113.94986,1396,10.2,3D,Nothing Detected,3,3.36,3.6,Animal with Collar 40907
40907,11/28/2022 11:00,11/28/2022 5:00,11/29/2022 11:01,2022-11-29 04:01:55-07:00,Iridium,46.76067,-113.94988,1439,5,3D Validated,Nothing Detected,6,3.36,3.6,Animal with Collar 40907
40907,11/28/2022 10:00,11/28/2022 4:00,11/29/2022 11:01,2022-11-29 04:01:55-07:00,Iridium,46.76074,-113.94981,1399,5,3D Validated,Nothing Detected,9,3.36,3.6,Animal with Collar 40907
40907,11/28/2022 9:00,11/28/2022 3:00,11/29/2022 11:01,2022-11-29 04:01:55-07:00,Iridium,46.76074,-113.94981,1399,4.2,3D Validated,Nothing Detected,10,3.36,3.6,Animal with Collar 40907
40907,11/28/2022 8:00,11/28/2022 2:00,11/29/2022 11:01,2022-11-29 04:01:55-07:00,Iridium,46.76073,-113.94983,1408,9,3D Validated,Nothing Detected,9,3.36,3.6,Animal with Collar 40907
40907,11/28/2022 7:00,11/28/2022 1:00,11/29/2022 11:02,2022-11-29 04:02:04-07:00,Iridium,46.76071,-113.94976,1408,2.6,3D Validated,Nothing Detected,9,3.36,3.6,Animal with Collar 40907
40907,11/28/2022 6:00,11/28/2022 0:00,11/29/2022 11:02,2022-11-29 04:02:04-07:00,Iridium,46.76074,-113.94981,1399,3,3D Validated,Nothing Detected,7,3.36,3.6,Animal with Collar 40907
40907,11/28/2022 5:01,11/27/2022 23:01,11/29/2022 11:02,2022-11-29 04:02:04-07:00,Iridium,46.76074,-113.94981,1402,3.4,3D Validated,Nothing Detected,6,3.36,3.6,Animal with Collar 40907
40907,11/28/2022 0:03,11/27/2022 18:03,11/29/2022 11:02,2022-11-29 04:02:13-07:00,Iridium,46.76083,-113.94979,1379,5.4,3D,Nothing Detected,10,3.36,3.6,Animal with Collar 40907
40907,11/27/2022 23:02,11/27/2022 17:02,11/29/2022 11:02,2022-11-29 04:02:21-07:00,Iridium,46.76074,-113.94981,1399,5.4,3D Validated,Nothing Detected,10,3.36,3.6,Animal with Collar 40907
40907,11/27/2022 19:00,11/27/2022 13:00,11/29/2022 11:02,2022-11-29 04:02:30-07:00,Iridium,46.76078,-113.94986,1400,3.2,3D Validated,Nothing Detected,13,3.36,3.6,Animal with Collar 40907
40907,11/27/2022 18:00,11/27/2022 12:00,11/29/2022 11:02,2022-11-29 04:02:30-07:00,Iridium,46.76068,-113.94984,1422,3.2,3D Validated,Nothing Detected,15,3.36,3.6,Animal with Collar 40907
40907,11/27/2022 16:00,11/27/2022 10:00,11/29/2022 11:02,2022-11-29 04:02:30-07:00,Iridium,46.76073,-113.94979,1397,4.2,3D Validated,Nothing Detected,15,3.36,3.6,Animal with Collar 40907
40907,11/27/2022 15:00,11/27/2022 9:00,11/29/2022 11:02,2022-11-29 04:02:38-07:00,Iridium,46.76081,-113.94987,1400,4.6,3D Validated,Nothing Detected,16,3.36,3.6,Animal with Collar 40907
40907,11/27/2022 14:00,11/27/2022 8:00,11/29/2022 11:02,2022-11-29 04:02:38-07:00,Iridium,46.76076,-113.94979,1400,4.8,3D Validated,Nothing Detected,13,3.36,3.6,Animal with Collar 40907
40907,11/27/2022 13:00,11/27/2022 7:00,11/29/2022 11:02,2022-11-29 04:02:38-07:00,Iridium,46.76066,-113.9498,1402,3.2,3D Validated,Nothing Detected,12,3.36,3.6,Animal with Collar 40907
40907,11/27/2022 12:00,11/27/2022 6:00,11/29/2022 11:02,2022-11-29 04:02:38-07:00,Iridium,46.76076,-113.94983,1399,2.8,3D Validated,Nothing Detected,12,3.36,3.6,Animal with Collar 40907
40907,11/27/2022 11:00,11/27/2022 5:00,11/29/2022 11:02,2022-11-29 04:02:47-07:00,Iridium,46.76075,-113.94979,1406,2.6,3D Validated,Nothing Detected,13,3.36,3.6,Animal with Collar 40907
40907,11/27/2022 10:00,11/27/2022 4:00,11/29/2022 11:02,2022-11-29 04:02:47-07:00,Iridium,46.76069,-113.94982,1413,5,3D Validated,Nothing Detected,14,3.36,3.6,Animal with Collar 40907
40907,11/27/2022 9:00,11/27/2022 3:00,11/29/2022 11:02,2022-11-29 04:02:47-07:00,Iridium,46.76075,-113.94985,1398,2.4,3D Validated,Nothing Detected,12,3.36,3.6,Animal with Collar 40907
40907,11/27/2022 8:00,11/27/2022 2:00,11/29/2022 11:02,2022-11-29 04:02:47-07:00,Iridium,46.76075,-113.94981,1409,6.8,3D Validated,Nothing Detected,11,3.36,3.6,Animal with Collar 40907
40907,11/27/2022 7:01,11/27/2022 1:01,11/29/2022 11:03,2022-11-29 04:03:01-07:00,Iridium,46.7608,-113.94977,1396,2.6,3D Validated,Nothing Detected,11,3.36,3.6,Animal with Collar 40907
40907,11/27/2022 6:03,11/27/2022 0:03,11/29/2022 11:03,2022-11-29 04:03:01-07:00,Iridium,46.76076,-113.9498,1397,6.8,3D,Nothing Detected,11,3.36,3.6,Animal with Collar 40907
40907,11/27/2022 3:00,11/26/2022 21:00,11/27/2022 3:00,2022-11-26 20:00:41-07:00,Iridium,46.7607,-113.94984,1411,4.6,3D Validated,Nothing Detected,13,3.36,3.6,Animal with Collar 40907
40907,11/27/2022 2:01,11/26/2022 20:01,11/27/2022 3:00,2022-11-26 20:00:41-07:00,Iridium,46.76063,-113.94988,1405,3.6,3D Validated,Nothing Detected,13,3.36,3.6,Animal with Collar 40907
40907,11/26/2022 22:03,11/26/2022 16:03,11/27/2022 3:00,2022-11-26 20:00:51-07:00,Iridium,46.76071,-113.94984,1397,6,3D,Nothing Detected,15,3.36,3.6,Animal with Collar 40907
40907,11/26/2022 21:01,11/26/2022 15:01,11/27/2022 3:00,2022-11-26 20:00:51-07:00,Iridium,46.7607,-113.94988,1420,3.6,3D Validated,Nothing Detected,17,3.36,3.6,Animal with Collar 40907
40907,11/26/2022 20:01,11/26/2022 14:01,11/27/2022 3:00,2022-11-26 20:00:51-07:00,Iridium,46.76081,-113.94982,1398,3,3D Validated,Nothing Detected,16,3.36,3.6,Animal with Collar 40907
40907,11/26/2022 19:00,11/26/2022 13:00,11/29/2022 15:01,2022-11-29 08:01:07-07:00,Iridium,46.76064,-113.94984,1410,3.4,3D Validated,Nothing Detected,18,3.36,3.6,Animal with Collar 40907
40907,11/26/2022 18:02,11/26/2022 12:02,11/29/2022 15:01,2022-11-29 08:01:07-07:00,Iridium,46.76074,-113.94984,1407,6.8,3D Validated,Nothing Detected,19,3.36,3.6,Animal with Collar 40907
40907,11/26/2022 17:00,11/26/2022 11:00,11/29/2022 15:01,2022-11-29 08:01:07-07:00,Iridium,46.76066,-113.94974,1424,3.8,3D Validated,Nothing Detected,17,3.36,3.6,Animal with Collar 40907
40907,11/26/2022 15:00,11/26/2022 9:00,11/29/2022 15:01,2022-11-29 08:01:17-07:00,Iridium,46.76075,-113.94991,1412,5.2,3D Validated,Nothing Detected,17,3.36,3.6,Animal with Collar 40907
40907,11/26/2022 14:00,11/26/2022 8:00,11/29/2022 15:01,2022-11-29 08:01:17-07:00,Iridium,46.76077,-113.94981,1396,3,3D Validated,Nothing Detected,16,3.36,3.6,Animal with Collar 40907
40907,11/26/2022 13:00,11/26/2022 7:00,11/29/2022 15:01,2022-11-29 08:01:17-07:00,Iridium,46.76072,-113.94979,1402,4.8,3D Validated,Nothing Detected,15,3.36,3.6,Animal with Collar 40907
40907,11/26/2022 12:00,11/26/2022 6:00,11/29/2022 15:01,2022-11-29 08:01:17-07:00,Iridium,46.76076,-113.94981,1402,2.8,3D Validated,Nothing Detected,14,3.36,3.6,Animal with Collar 40907
40907,11/26/2022 11:00,11/26/2022 5:00,11/30/2022 3:01,2022-11-29 20:01:07-07:00,Iridium,46.76074,-113.94981,1408,3.8,3D Validated,Nothing Detected,13,3.36,3.6,Animal with Collar 40907
40907,11/26/2022 10:00,11/26/2022 4:00,11/30/2022 3:01,2022-11-29 20:01:07-07:00,Iridium,46.76071,-113.94983,1405,2.2,3D Validated,Nothing Detected,13,3.36,3.6,Animal with Collar 40907
40907,11/26/2022 9:00,11/26/2022 3:00,11/30/2022 3:01,2022-11-29 20:01:07-07:00,Iridium,46.7607,-113.94977,1414,4.2,3D Validated,Nothing Detected,13,3.36,3.6,Animal with Collar 40907
40907,11/26/2022 8:00,11/26/2022 2:00,11/30/2022 3:01,2022-11-29 20:01:07-07:00,Iridium,46.76072,-113.94983,1407,4,3D Validated,Nothing Detected,11,3.36,3.6,Animal with Collar 40907
40907,11/26/2022 7:01,11/26/2022 1:01,11/30/2022 3:01,2022-11-29 20:01:31-07:00,Iridium,46.76067,-113.94988,1417,2.4,3D Validated,Nothing Detected,11,3.36,3.6,Animal with Collar 40907
40907,11/26/2022 6:00,11/26/2022 0:00,11/30/2022 3:01,2022-11-29 20:01:31-07:00,Iridium,46.76075,-113.94981,1401,4.2,3D Validated,Nothing Detected,13,3.36,3.6,Animal with Collar 40907
40907,11/26/2022 5:00,11/25/2022 23:00,11/30/2022 3:01,2022-11-29 20:01:31-07:00,Iridium,46.76073,-113.94985,1409,2.8,3D Validated,Nothing Detected,14,3.36,3.6,Animal with Collar 40907
40907,11/26/2022 4:00,11/25/2022 22:00,11/30/2022 3:01,2022-11-29 20:01:31-07:00,Iridium,46.76095,-113.94989,1383,4.6,3D Validated,Nothing Detected,13,3.36,3.6,Animal with Collar 40907
40907,11/24/2022 7:00,11/24/2022 1:00,11/24/2022 7:00,2022-11-24 00:00:53-07:00,Iridium,46.76168,-113.95031,1458,1.8,3D Validated,Nothing Detected,8,3.36,3.6,Animal with Collar 40907
40907,11/24/2022 6:00,11/24/2022 0:00,11/24/2022 7:00,2022-11-24 00:00:53-07:00,Iridium,46.76164,-113.95031,1453,2.6,3D Validated,Nothing Detected,9,3.36,3.6,Animal with Collar 40907
40907,11/24/2022 5:00,11/23/2022 23:00,11/24/2022 7:00,2022-11-24 00:00:53-07:00,Iridium,46.76167,-113.95033,1451,2,3D Validated,Nothing Detected,10,3.36,3.6,Animal with Collar 40907
40907,11/24/2022 4:00,11/23/2022 22:00,11/24/2022 7:00,2022-11-24 00:00:53-07:00,Iridium,46.76166,-113.95031,1449,1.6,3D Validated,Nothing Detected,9,3.36,3.6,Animal with Collar 40907
40907,11/24/2022 3:00,11/23/2022 21:00,11/24/2022 3:00,2022-11-23 20:00:31-07:00,Iridium,46.76165,-113.95028,1447,1.8,3D Validated,Nothing Detected,9,3.36,3.6,Animal with Collar 40907
40907,11/24/2022 2:00,11/23/2022 20:00,11/24/2022 3:00,2022-11-23 20:00:31-07:00,Iridium,46.76156,-113.95024,1446,1.8,3D Validated,Nothing Detected,12,3.36,3.6,Animal with Collar 40907
40907,11/23/2022 22:00,11/23/2022 16:00,11/24/2022 3:00,2022-11-23 20:00:42-07:00,Iridium,46.76076,-113.94981,1395,3.2,3D Validated,Nothing Detected,14,3.36,3.6,Animal with Collar 40907
40907,11/23/2022 21:00,11/23/2022 15:00,11/24/2022 3:00,2022-11-23 20:00:42-07:00,Iridium,46.76076,-113.94987,1411,3,3D Validated,Nothing Detected,14,3.36,3.6,Animal with Collar 40907
40907,11/23/2022 20:00,11/23/2022 14:00,11/24/2022 3:00,2022-11-23 20:00:42-07:00,Iridium,46.76075,-113.94991,1370,8.8,3D,Nothing Detected,15,3.36,3.6,Animal with Collar 40907
40907,11/23/2022 19:01,11/23/2022 13:01,11/24/2022 3:00,2022-11-23 20:00:49-07:00,Iridium,46.76069,-113.94983,1396,4.2,3D Validated,Nothing Detected,16,3.36,3.6,Animal with Collar 40907
40907,11/23/2022 18:02,11/23/2022 12:02,11/24/2022 3:00,2022-11-23 20:00:49-07:00,Iridium,46.76069,-113.94978,1407,3.4,3D Validated,Nothing Detected,16,3.36,3.6,Animal with Collar 40907
40907,11/23/2022 15:00,11/23/2022 9:00,11/24/2022 3:00,2022-11-23 20:00:57-07:00,Iridium,46.76072,-113.94983,1401,3.2,3D Validated,Nothing Detected,12,3.36,3.6,Animal with Collar 40907
40907,11/23/2022 12:01,11/23/2022 6:01,11/24/2022 3:00,2022-11-23 20:00:57-07:00,Iridium,46.76064,-113.94979,1407,5.2,3D Validated,Nothing Detected,14,3.36,3.6,Animal with Collar 40907
40907,11/23/2022 3:00,11/22/2022 21:00,11/24/2022 3:01,2022-11-23 20:01:28-07:00,Iridium,46.76078,-113.9498,1400,3.6,3D Validated,Nothing Detected,11,3.36,3.6,Animal with Collar 40907
40907,11/23/2022 0:00,11/22/2022 18:00,11/24/2022 3:01,2022-11-23 20:01:28-07:00,Iridium,46.76071,-113.94982,1402,5.6,3D Validated,Nothing Detected,14,3.36,3.6,Animal with Collar 40907
40907,11/22/2022 23:01,11/22/2022 17:01,11/24/2022 3:01,2022-11-23 20:01:38-07:00,Iridium,46.76069,-113.94981,1402,5.6,3D Validated,Nothing Detected,11,3.36,3.6,Animal with Collar 40907
40907,11/22/2022 22:01,11/22/2022 16:01,11/24/2022 3:01,2022-11-23 20:01:38-07:00,Iridium,46.76075,-113.94979,1398,2.6,3D Validated,Nothing Detected,14,3.36,3.6,Animal with Collar 40907
40907,11/22/2022 21:01,11/22/2022 15:01,11/24/2022 3:01,2022-11-23 20:01:38-07:00,Iridium,46.76079,-113.94981,1391,3.2,3D Validated,Nothing Detected,17,3.36,3.6,Animal with Collar 40907
40907,11/22/2022 19:01,11/22/2022 13:01,11/24/2022 3:01,2022-11-23 20:01:51-07:00,Iridium,46.7607,-113.94971,1398,6,3D Validated,Nothing Detected,18,3.36,3.6,Animal with Collar 40907
40907,11/22/2022 17:01,11/22/2022 11:01,11/24/2022 3:01,2022-11-23 20:01:51-07:00,Iridium,46.76071,-113.94982,1402,4.6,3D Validated,Nothing Detected,13,3.36,3.6,Animal with Collar 40907
40907,11/22/2022 15:00,11/22/2022 9:00,11/24/2022 3:01,2022-11-23 20:01:59-07:00,Iridium,46.76062,-113.94984,1415,3.8,3D Validated,Nothing Detected,10,3.36,3.6,Animal with Collar 40907
40907,11/22/2022 14:02,11/22/2022 8:02,11/24/2022 3:01,2022-11-23 20:01:59-07:00,Iridium,46.76076,-113.94979,1394,7.8,3D Validated,Nothing Detected,8,3.36,3.6,Animal with Collar 40907
40907,11/22/2022 13:00,11/22/2022 7:00,11/24/2022 3:01,2022-11-23 20:01:59-07:00,Iridium,46.76079,-113.94979,1397,3.6,3D Validated,Nothing Detected,8,3.36,3.6,Animal with Collar 40907
40907,11/22/2022 12:00,11/22/2022 6:00,11/24/2022 3:01,2022-11-23 20:01:59-07:00,Iridium,46.76076,-113.94983,1405,3,3D Validated,Nothing Detected,6,3.36,3.6,Animal with Collar 40907
40907,11/22/2022 11:00,11/22/2022 5:00,11/24/2022 3:02,2022-11-23 20:02:08-07:00,Iridium,46.76082,-113.94981,1388,4.6,3D Validated,Nothing Detected,5,3.36,3.6,Animal with Collar 40907
40907,11/22/2022 10:00,11/22/2022 4:00,11/24/2022 3:02,2022-11-23 20:02:08-07:00,Iridium,46.76055,-113.94987,1421,2.2,3D Validated,Nothing Detected,5,3.36,3.6,Animal with Collar 40907
40907,11/22/2022 9:00,11/22/2022 3:00,11/24/2022 3:02,2022-11-23 20:02:08-07:00,Iridium,46.7607,-113.94968,1420,5.6,3D Validated,Nothing Detected,5,3.36,3.6,Animal with Collar 40907
40907,11/22/2022 8:00,11/22/2022 2:00,11/24/2022 3:02,2022-11-23 20:02:08-07:00,Iridium,46.76074,-113.94985,1404,4,3D Validated,Nothing Detected,7,3.36,3.6,Animal with Collar 40907
40907,11/22/2022 7:00,11/22/2022 1:00,11/24/2022 3:02,2022-11-23 20:02:20-07:00,Iridium,46.76073,-113.9498,1409,2.2,3D Validated,Nothing Detected,7,3.36,3.6,Animal with Collar 40907
40907,11/22/2022 6:00,11/22/2022 0:00,11/24/2022 3:02,2022-11-23 20:02:20-07:00,Iridium,46.76074,-113.94979,1391,7,3D Validated,Nothing Detected,9,3.36,3.6,Animal with Collar 40907
40907,11/22/2022 3:00,11/21/2022 21:00,11/24/2022 3:02,2022-11-23 20:02:41-07:00,Iridium,46.76077,-113.94981,1396,3.4,3D Validated,Nothing Detected,10,3.36,3.6,Animal with Collar 40907
40907,11/21/2022 19:00,11/21/2022 13:00,11/24/2022 3:03,2022-11-23 20:03:02-07:00,Iridium,46.76076,-113.94981,1402,4.6,3D Validated,Nothing Detected,14,3.36,3.6,Animal with Collar 40907
40907,11/21/2022 18:01,11/21/2022 12:01,11/24/2022 3:03,2022-11-23 20:03:02-07:00,Iridium,46.76075,-113.94979,1398,3.2,3D Validated,Nothing Detected,15,3.36,3.6,Animal with Collar 40907
40907,11/21/2022 16:02,11/21/2022 10:02,11/24/2022 3:03,2022-11-23 20:03:02-07:00,Iridium,46.76078,-113.94975,1398,3.6,3D Validated,Nothing Detected,15,3.36,3.6,Animal with Collar 40907
40907,11/21/2022 15:00,11/21/2022 9:00,11/24/2022 3:03,2022-11-23 20:03:12-07:00,Iridium,46.76076,-113.94983,1399,3.8,3D Validated,Nothing Detected,15,3.36,3.6,Animal with Collar 40907
40907,11/21/2022 14:01,11/21/2022 8:01,11/24/2022 3:03,2022-11-23 20:03:12-07:00,Iridium,46.76071,-113.94982,1416,8.4,3D Validated,Nothing Detected,22,3.36,3.6,Animal with Collar 40907
40907,11/21/2022 12:01,11/21/2022 6:01,11/24/2022 3:03,2022-11-23 20:03:12-07:00,Iridium,46.76076,-113.9499,1408,9.4,3D,Nothing Detected,22,3.36,3.6,Animal with Collar 40907
40907,11/21/2022 3:00,11/20/2022 21:00,11/24/2022 7:01,2022-11-24 00:01:02-07:00,Iridium,46.76075,-113.94981,1401,3.4,3D Validated,Nothing Detected,15,3.36,3.6,Animal with Collar 40907
40907,11/21/2022 2:00,11/20/2022 20:00,11/24/2022 7:01,2022-11-24 00:01:02-07:00,Iridium,46.76072,-113.94979,1402,4.2,3D Validated,Nothing Detected,24,3.36,3.6,Animal with Collar 40907
40907,11/20/2022 19:01,11/20/2022 13:01,11/24/2022 7:01,2022-11-24 00:01:19-07:00,Iridium,46.76075,-113.94983,1398,5.8,3D Validated,Nothing Detected,18,3.36,3.6,Animal with Collar 40907
40907,11/20/2022 18:01,11/20/2022 12:01,11/24/2022 7:01,2022-11-24 00:01:19-07:00,Iridium,46.76075,-113.94978,1401,3.2,3D Validated,Nothing Detected,18,3.36,3.6,Animal with Collar 40907
40907,11/20/2022 9:01,11/20/2022 3:01,11/24/2022 7:01,2022-11-24 00:01:46-07:00,Iridium,46.76073,-113.94979,1403,6.4,3D Validated,Nothing Detected,21,3.36,3.6,Animal with Collar 40907
40907,11/20/2022 7:01,11/20/2022 1:01,11/24/2022 7:01,2022-11-24 00:01:46-07:00,Iridium,46.76075,-113.94982,1406,2.2,3D Validated,Nothing Detected,25,3.36,3.6,Animal with Collar 40907
40907,11/19/2022 5:01,11/18/2022 23:01,11/24/2022 7:02,2022-11-24 00:02:49-07:00,Iridium,46.76073,-113.94978,1400,4,3D Validated,Nothing Detected,17,3.36,3.6,Animal with Collar 40907
40907,11/19/2022 4:01,11/18/2022 22:01,11/24/2022 7:02,2022-11-24 00:02:49-07:00,Iridium,46.76085,-113.94988,1380,4.4,3D Validated,Nothing Detected,15,3.36,3.6,Animal with Collar 40907
40907,11/19/2022 3:00,11/18/2022 21:00,11/24/2022 7:02,2022-11-24 00:02:49-07:00,Iridium,46.76071,-113.94975,1396,3.4,3D Validated,Nothing Detected,14,3.36,3.6,Animal with Collar 40907
40907,11/19/2022 2:00,11/18/2022 20:00,11/24/2022 7:02,2022-11-24 00:02:49-07:00,Iridium,46.76076,-113.9498,1391,4.2,3D Validated,Nothing Detected,14,3.36,3.6,Animal with Collar 40907
40907,11/19/2022 1:02,11/18/2022 19:02,11/24/2022 7:02,2022-11-24 00:02:58-07:00,Iridium,46.76071,-113.94981,1399,3.8,3D Validated,Nothing Detected,12,3.36,3.6,Animal with Collar 40907
40907,11/19/2022 0:01,11/18/2022 18:01,11/24/2022 7:02,2022-11-24 00:02:58-07:00,Iridium,46.7607,-113.94989,1411,4.4,3D Validated,Nothing Detected,14,3.36,3.6,Animal with Collar 40907
40907,11/18/2022 21:01,11/18/2022 15:01,11/24/2022 7:03,2022-11-24 00:03:08-07:00,Iridium,46.76072,-113.94978,1407,7.2,3D,Nothing Detected,17,3.36,3.6,Animal with Collar 40907
40907,11/18/2022 20:02,11/18/2022 14:02,11/24/2022 7:03,2022-11-24 00:03:08-07:00,Iridium,46.76076,-113.94981,1395,3.6,3D Validated,Nothing Detected,13,3.36,3.6,Animal with Collar 40907
40907,11/18/2022 19:01,11/18/2022 13:01,11/24/2022 7:03,2022-11-24 00:03:08-07:00,Iridium,46.76078,-113.94984,1389,4.2,3D Validated,Nothing Detected,13,3.36,3.6,Animal with Collar 40907
40907,11/11/2022 23:00,11/11/2022 17:00,11/11/2022 23:01,2022-11-11 16:01:05-07:00,Iridium,46.76078,-113.94984,1392,2.2,3D Validated,Nothing Detected,8,3.36,3.6,Animal with Collar 40907
40907,11/11/2022 22:00,11/11/2022 16:00,11/11/2022 23:01,2022-11-11 16:01:05-07:00,Iridium,46.76075,-113.94984,1395,3.6,3D Validated,Nothing Detected,7,3.36,3.6,Animal with Collar 40907
40907,11/11/2022 21:01,11/11/2022 15:01,11/11/2022 23:01,2022-11-11 16:01:05-07:00,Iridium,46.76064,-113.94976,1365,4,3D Validated,Nothing Detected,8,3.36,3.6,Animal with Collar 40907
40907,11/11/2022 20:01,11/11/2022 14:01,11/11/2022 23:01,2022-11-11 16:01:05-07:00,Iridium,46.76076,-113.94984,1389,4,3D Validated,Nothing Detected,8,3.36,3.6,Animal with Collar 40907
40907,11/11/2022 19:00,11/11/2022 13:00,11/11/2022 19:01,2022-11-11 12:01:09-07:00,Iridium,46.76073,-113.94981,1414,4.8,3D Validated,Nothing Detected,7,3.36,3.6,Animal with Collar 40907
40907,11/11/2022 18:01,11/11/2022 12:01,11/11/2022 19:01,2022-11-11 12:01:09-07:00,Iridium,46.76072,-113.9498,1393,5.6,3D Validated,Nothing Detected,4,3.36,3.6,Animal with Collar 40907
40907,11/11/2022 17:01,11/11/2022 11:01,11/11/2022 19:01,2022-11-11 12:01:09-07:00,Iridium,46.76069,-113.9498,1405,2.4,3D Validated,Nothing Detected,2,3.36,3.6,Animal with Collar 40907
40907,11/11/2022 16:00,11/11/2022 10:00,11/11/2022 19:01,2022-11-11 12:01:09-07:00,Iridium,46.76073,-113.94978,1400,5,3D Validated,Nothing Detected,4,3.36,3.6,Animal with Collar 40907
40907,11/11/2022 15:01,11/11/2022 9:01,11/11/2022 15:02,2022-11-11 08:02:37-07:00,Iridium,46.76074,-113.94981,1399,4.6,3D Validated,Nothing Detected,5,3.36,3.6,Animal with Collar 40907
40907,11/11/2022 13:00,11/11/2022 7:00,11/11/2022 15:02,2022-11-11 08:02:37-07:00,Iridium,46.76062,-113.94984,1415,5.8,3D Validated,Nothing Detected,6,3.36,3.6,Animal with Collar 40907
40907,11/11/2022 12:02,11/11/2022 6:02,11/11/2022 15:02,2022-11-11 08:02:37-07:00,Iridium,46.76072,-113.94978,1398,4,3D Validated,Nothing Detected,8,3.36,3.6,Animal with Collar 40907
40907,11/11/2022 11:03,11/11/2022 5:03,11/11/2022 19:01,2022-11-11 12:01:27-07:00,Iridium,46.76073,-113.94985,1403,11.8,3D,Nothing Detected,8,3.36,3.6,Animal with Collar 40907
40907,11/11/2022 10:00,11/11/2022 4:00,11/11/2022 19:01,2022-11-11 12:01:27-07:00,Iridium,46.76077,-113.9498,1399,4.8,3D Validated,Nothing Detected,8,3.36,3.6,Animal with Collar 40907
40907,11/11/2022 9:02,11/11/2022 3:02,11/11/2022 19:01,2022-11-11 12:01:27-07:00,Iridium,46.76078,-113.94978,1398,4.8,3D Validated,Nothing Detected,10,3.36,3.6,Animal with Collar 40907
40907,11/9/2022 18:00,11/9/2022 12:00,11/11/2022 19:03,2022-11-11 12:03:02-07:00,Iridium,46.76073,-113.9498,1394,3.4,3D Validated,Nothing Detected,11,3.36,3.6,Animal with Collar 40907
40907,11/9/2022 17:01,11/9/2022 11:01,11/11/2022 19:03,2022-11-11 12:03:02-07:00,Iridium,46.76084,-113.9499,1405,5.4,3D Validated,Nothing Detected,13,3.36,3.6,Animal with Collar 40907
40907,11/9/2022 16:00,11/9/2022 10:00,11/11/2022 19:03,2022-11-11 12:03:02-07:00,Iridium,46.76077,-113.94981,1396,4.6,3D Validated,Nothing Detected,18,3.36,3.6,Animal with Collar 40907
40907,11/9/2022 15:02,11/9/2022 9:02,11/11/2022 19:03,2022-11-11 12:03:12-07:00,Iridium,46.7607,-113.94984,1409,6.6,3D Validated,Nothing Detected,17,3.36,3.6,Animal with Collar 40907
40907,11/9/2022 13:00,11/9/2022 7:00,11/11/2022 19:03,2022-11-11 12:03:12-07:00,Iridium,46.76088,-113.9499,1393,5.2,3D Validated,Nothing Detected,19,3.36,3.6,Animal with Collar 40907
40907,11/9/2022 12:01,11/9/2022 6:01,11/11/2022 19:03,2022-11-11 12:03:12-07:00,Iridium,46.76076,-113.9498,1397,3.8,3D Validated,Nothing Detected,13,3.36,3.6,Animal with Collar 40907
40907,11/9/2022 11:00,11/9/2022 5:00,11/9/2022 11:01,2022-11-09 04:01:04-07:00,Iridium,46.76065,-113.94986,1414,7.4,3D Validated,Nothing Detected,8,3.36,3.6,Animal with Collar 40907
40907,11/9/2022 10:00,11/9/2022 4:00,11/9/2022 11:01,2022-11-09 04:01:04-07:00,Iridium,46.76093,-113.94966,1366,5.2,3D Validated,Nothing Detected,9,3.36,3.6,Animal with Collar 40907
40907,11/9/2022 9:00,11/9/2022 3:00,11/9/2022 11:01,2022-11-09 04:01:04-07:00,Iridium,46.76074,-113.94979,1404,3.4,3D Validated,Nothing Detected,8,3.36,3.6,Animal with Collar 40907
40907,11/9/2022 8:01,11/9/2022 2:01,11/9/2022 11:01,2022-11-09 04:01:04-07:00,Iridium,46.76079,-113.94972,1400,3,3D Validated,Nothing Detected,9,3.36,3.6,Animal with Collar 40907
40907,11/9/2022 7:00,11/9/2022 1:00,11/9/2022 11:01,2022-11-09 04:01:13-07:00,Iridium,46.76071,-113.94994,1430,5.2,3D Validated,Nothing Detected,12,3.36,3.6,Animal with Collar 40907
40907,11/9/2022 6:01,11/9/2022 0:01,11/9/2022 11:01,2022-11-09 04:01:13-07:00,Iridium,46.76076,-113.9498,1391,3.4,3D Validated,Nothing Detected,15,3.36,3.6,Animal with Collar 40907
40907,11/9/2022 5:00,11/8/2022 23:00,11/9/2022 11:01,2022-11-09 04:01:13-07:00,Iridium,46.76079,-113.9498,1394,2.8,3D Validated,Nothing Detected,14,3.36,3.6,Animal with Collar 40907
40907,11/9/2022 4:00,11/8/2022 22:00,11/9/2022 11:01,2022-11-09 04:01:13-07:00,Iridium,46.76074,-113.94981,1402,4,3D Validated,Nothing Detected,14,3.36,3.6,Animal with Collar 40907
40907,11/9/2022 3:00,11/8/2022 21:00,11/9/2022 11:01,2022-11-09 04:01:22-07:00,Iridium,46.76077,-113.94973,1388,3.6,3D Validated,Nothing Detected,14,3.36,3.6,Animal with Collar 40907
40907,11/9/2022 1:01,11/8/2022 19:01,11/9/2022 11:01,2022-11-09 04:01:22-07:00,Iridium,46.76085,-113.9498,1379,3.6,3D Validated,Nothing Detected,11,3.36,3.6,Animal with Collar 40907
40907,11/9/2022 0:03,11/8/2022 18:03,11/9/2022 11:01,2022-11-09 04:01:22-07:00,Iridium,46.76076,-113.94979,1400,6.2,3D,Nothing Detected,12,3.36,3.6,Animal with Collar 40907
40907,11/8/2022 23:00,11/8/2022 17:00,11/9/2022 11:01,2022-11-09 04:01:28-07:00,Iridium,46.76076,-113.94982,1392,3,3D Validated,Nothing Detected,10,3.36,3.6,Animal with Collar 40907
40907,11/8/2022 22:01,11/8/2022 16:01,11/9/2022 11:01,2022-11-09 04:01:28-07:00,Iridium,46.76074,-113.94991,1410,3,3D Validated,Nothing Detected,14,3.36,3.6,Animal with Collar 40907
40907,11/8/2022 21:00,11/8/2022 15:00,11/9/2022 11:01,2022-11-09 04:01:28-07:00,Iridium,46.76074,-113.94979,1404,5.6,3D Validated,Nothing Detected,14,3.36,3.6,Animal with Collar 40907
40907,11/8/2022 20:00,11/8/2022 14:00,11/9/2022 11:01,2022-11-09 04:01:28-07:00,Iridium,46.76071,-113.94985,1407,3.8,3D Validated,Nothing Detected,13,3.36,3.6,Animal with Collar 40907
40907,11/8/2022 19:00,11/8/2022 13:00,11/9/2022 11:01,2022-11-09 04:01:38-07:00,Iridium,46.76075,-113.94991,1404,4.2,3D Validated,Nothing Detected,12,3.36,3.6,Animal with Collar 40907
40907,11/8/2022 18:02,11/8/2022 12:02,11/9/2022 11:01,2022-11-09 04:01:38-07:00,Iridium,46.76067,-113.94983,1423,5.4,3D Validated,Nothing Detected,11,3.36,3.6,Animal with Collar 40907
40907,11/8/2022 17:00,11/8/2022 11:00,11/9/2022 11:01,2022-11-09 04:01:38-07:00,Iridium,46.76075,-113.94984,1392,5.2,3D Validated,Nothing Detected,8,3.36,3.6,Animal with Collar 40907
40907,11/8/2022 16:00,11/8/2022 10:00,11/9/2022 11:01,2022-11-09 04:01:38-07:00,Iridium,46.76075,-113.9498,1396,2.4,3D Validated,Nothing Detected,8,3.36,3.6,Animal with Collar 40907
40907,11/8/2022 15:00,11/8/2022 9:00,11/9/2022 11:01,2022-11-09 04:01:51-07:00,Iridium,46.76073,-113.94981,1400,4.4,3D Validated,Nothing Detected,7,3.36,3.6,Animal with Collar 40907
40907,11/8/2022 14:00,11/8/2022 8:00,11/9/2022 11:01,2022-11-09 04:01:51-07:00,Iridium,46.76076,-113.94994,1398,3.6,3D Validated,Nothing Detected,7,3.36,3.6,Animal with Collar 40907
40907,11/8/2022 13:00,11/8/2022 7:00,11/9/2022 11:01,2022-11-09 04:01:51-07:00,Iridium,46.76071,-113.94982,1408,2.8,3D Validated,Nothing Detected,6,3.36,3.6,Animal with Collar 40907
40907,11/8/2022 12:00,11/8/2022 6:00,11/9/2022 11:01,2022-11-09 04:01:51-07:00,Iridium,46.76073,-113.94981,1414,3.6,3D Validated,Nothing Detected,6,3.36,3.6,Animal with Collar 40907
40907,11/8/2022 11:00,11/8/2022 5:00,11/11/2022 23:01,2022-11-11 16:01:14-07:00,Iridium,46.76073,-113.94985,1409,4.8,3D Validated,Nothing Detected,6,3.36,3.6,Animal with Collar 40907
40907,11/8/2022 10:00,11/8/2022 4:00,11/11/2022 23:01,2022-11-11 16:01:14-07:00,Iridium,46.76075,-113.94983,1398,2.8,3D Validated,Nothing Detected,9,3.36,3.6,Animal with Collar 40907
40907,11/8/2022 9:01,11/8/2022 3:01,11/11/2022 23:01,2022-11-11 16:01:14-07:00,Iridium,46.7607,-113.94982,1407,3.6,3D Validated,Nothing Detected,9,3.36,3.6,Animal with Collar 40907
40907,11/8/2022 8:01,11/8/2022 2:01,11/11/2022 23:01,2022-11-11 16:01:14-07:00,Iridium,46.76077,-113.94986,1399,4.6,3D Validated,Nothing Detected,13,3.36,3.6,Animal with Collar 40907
40907,11/8/2022 3:00,11/7/2022 21:00,11/8/2022 3:01,2022-11-07 20:01:10-07:00,Iridium,46.76064,-113.94984,1404,4.2,3D Validated,Nothing Detected,12,3.36,3.6,Animal with Collar 40907
40907,11/7/2022 11:00,11/7/2022 5:00,11/7/2022 11:01,2022-11-07 04:01:59-07:00,Iridium,46.76075,-113.94973,1399,8,3D Validated,Nothing Detected,12,3.36,3.6,Animal with Collar 40907
40907,11/7/2022 10:00,11/7/2022 4:00,11/7/2022 11:01,2022-11-07 04:01:59-07:00,Iridium,46.76075,-113.94985,1398,6.6,3D Validated,Nothing Detected,12,3.36,3.6,Animal with Collar 40907
40907,11/7/2022 9:02,11/7/2022 3:02,11/7/2022 11:01,2022-11-07 04:01:59-07:00,Iridium,46.76077,-113.9498,1399,5.2,3D Validated,Nothing Detected,9,3.36,3.6,Animal with Collar 40907
40907,11/7/2022 4:00,11/6/2022 22:00,11/7/2022 11:02,2022-11-07 04:02:15-07:00,Iridium,46.76073,-113.94984,1400,3.6,3D Validated,Nothing Detected,11,3.36,3.6,Animal with Collar 40907
40907,11/7/2022 3:00,11/6/2022 21:00,11/7/2022 11:02,2022-11-07 04:02:23-07:00,Iridium,46.76073,-113.94979,1403,4.2,3D Validated,Nothing Detected,12,3.36,3.6,Animal with Collar 40907
40907,11/7/2022 2:01,11/6/2022 20:01,11/7/2022 11:02,2022-11-07 04:02:23-07:00,Iridium,46.76075,-113.94981,1401,2.8,3D Validated,Nothing Detected,12,3.36,3.6,Animal with Collar 40907
40907,11/7/2022 1:00,11/6/2022 19:00,11/7/2022 11:02,2022-11-07 04:02:23-07:00,Iridium,46.76077,-113.94979,1401,3.6,3D Validated,Nothing Detected,12,3.36,3.6,Animal with Collar 40907
40907,11/7/2022 0:03,11/6/2022 18:03,11/7/2022 11:02,2022-11-07 04:02:23-07:00,Iridium,46.76078,-113.94974,1400,6,3D,Nothing Detected,9,3.36,3.6,Animal with Collar 40907
40907,11/4/2022 15:00,11/4/2022 9:00,11/4/2022 15:01,2022-11-04 09:01:57-06:00,Iridium,46.76077,-113.94981,1412,3.4,3D Validated,Nothing Detected,8,3.36,3.6,Animal with Collar 40907
40907,11/4/2022 14:00,11/4/2022 8:00,11/4/2022 15:01,2022-11-04 09:01:57-06:00,Iridium,46.76078,-113.94977,1401,2,3D Validated,Nothing Detected,8,3.36,3.6,Animal with Collar 40907
40907,11/4/2022 13:00,11/4/2022 7:00,11/4/2022 15:01,2022-11-04 09:01:57-06:00,Iridium,46.76075,-113.94974,1406,2.4,3D Validated,Nothing Detected,8,3.36,3.6,Animal with Collar 40907
40907,11/4/2022 12:00,11/4/2022 6:00,11/4/2022 15:01,2022-11-04 09:01:57-06:00,Iridium,46.76076,-113.94977,1405,2,3D Validated,Nothing Detected,8,3.36,3.6,Animal with Collar 40907
40907,11/4/2022 11:00,11/4/2022 5:00,11/4/2022 15:02,2022-11-04 09:02:07-06:00,Iridium,46.76073,-113.94971,1409,3.4,3D Validated,Nothing Detected,7,3.36,3.6,Animal with Collar 40907
40907,11/4/2022 10:00,11/4/2022 4:00,11/4/2022 15:02,2022-11-04 09:02:07-06:00,Iridium,46.76075,-113.94975,1401,6.4,3D Validated,Nothing Detected,7,3.36,3.6,Animal with Collar 40907
40907,11/4/2022 9:00,11/4/2022 3:00,11/4/2022 15:02,2022-11-04 09:02:07-06:00,Iridium,46.76078,-113.94979,1403,2,3D Validated,Nothing Detected,7,3.36,3.6,Animal with Collar 40907
40907,11/4/2022 8:00,11/4/2022 2:00,11/4/2022 15:02,2022-11-04 09:02:07-06:00,Iridium,46.76073,-113.94976,1405,3.6,3D Validated,Nothing Detected,7,3.36,3.6,Animal with Collar 40907
40907,11/4/2022 7:00,11/4/2022 1:00,11/4/2022 15:02,2022-11-04 09:02:17-06:00,Iridium,46.76073,-113.9498,1394,3,3D Validated,Nothing Detected,6,3.36,3.6,Animal with Collar 40907
40907,11/4/2022 6:00,11/4/2022 0:00,11/4/2022 15:02,2022-11-04 09:02:17-06:00,Iridium,46.76057,-113.94984,1403,2.8,3D Validated,Nothing Detected,7,3.36,3.6,Animal with Collar 40907
40907,11/4/2022 5:00,11/3/2022 23:00,11/4/2022 15:02,2022-11-04 09:02:17-06:00,Iridium,46.76086,-113.94972,1408,2.6,3D Validated,Nothing Detected,10,3.36,3.6,Animal with Collar 40907
40907,11/4/2022 4:00,11/3/2022 22:00,11/4/2022 15:02,2022-11-04 09:02:17-06:00,Iridium,46.76081,-113.9498,1403,3.6,3D Validated,Nothing Detected,12,3.36,3.6,Animal with Collar 40907
40907,11/4/2022 3:00,11/3/2022 21:00,11/4/2022 15:02,2022-11-04 09:02:24-06:00,Iridium,46.76078,-113.94974,1406,4.2,3D Validated,Nothing Detected,10,3.36,3.6,Animal with Collar 40907
40907,11/4/2022 2:00,11/3/2022 20:00,11/4/2022 15:02,2022-11-04 09:02:24-06:00,Iridium,46.76076,-113.94978,1403,2,3D Validated,Nothing Detected,10,3.36,3.6,Animal with Collar 40907
40907,11/4/2022 1:00,11/3/2022 19:00,11/4/2022 15:02,2022-11-04 09:02:24-06:00,Iridium,46.76075,-113.94978,1395,3.4,3D Validated,Nothing Detected,11,3.36,3.6,Animal with Collar 40907
40907,11/4/2022 0:00,11/3/2022 18:00,11/4/2022 15:02,2022-11-04 09:02:24-06:00,Iridium,46.76076,-113.94974,1397,2.4,3D Validated,Nothing Detected,14,3.28,3.6,Animal with Collar 40907
40907,11/3/2022 23:00,11/3/2022 17:00,11/4/2022 15:02,2022-11-04 09:02:42-06:00,Iridium,46.76076,-113.94992,1410,2.8,3D Validated,Nothing Detected,13,3.36,3.6,Animal with Collar 40907
40907,11/3/2022 22:00,11/3/2022 16:00,11/4/2022 15:02,2022-11-04 09:02:42-06:00,Iridium,46.76078,-113.94973,1403,4.2,3D Validated,Nothing Detected,11,3.36,3.6,Animal with Collar 40907
40907,11/3/2022 21:00,11/3/2022 15:00,11/4/2022 15:02,2022-11-04 09:02:42-06:00,Iridium,46.76077,-113.94979,1401,2.2,3D Validated,Nothing Detected,11,3.36,3.6,Animal with Collar 40907
40907,11/3/2022 20:00,11/3/2022 14:00,11/4/2022 15:02,2022-11-04 09:02:42-06:00,Iridium,46.76078,-113.94978,1398,2.4,3D Validated,Nothing Detected,10,3.36,3.6,Animal with Collar 40907
40907,11/3/2022 19:00,11/3/2022 13:00,11/4/2022 15:03,2022-11-04 09:03:07-06:00,Iridium,46.76073,-113.94971,1409,3,3D Validated,Nothing Detected,10,3.36,3.6,Animal with Collar 40907
40907,11/3/2022 18:00,11/3/2022 12:00,11/4/2022 15:03,2022-11-04 09:03:07-06:00,Iridium,46.76073,-113.94975,1398,3.4,3D Validated,Nothing Detected,10,3.36,3.6,Animal with Collar 40907
40907,11/3/2022 17:00,11/3/2022 11:00,11/4/2022 15:03,2022-11-04 09:03:07-06:00,Iridium,46.76074,-113.94978,1410,3,3D Validated,Nothing Detected,9,3.36,3.6,Animal with Collar 40907
40907,11/3/2022 16:00,11/3/2022 10:00,11/4/2022 15:03,2022-11-04 09:03:07-06:00,Iridium,46.76071,-113.94974,1405,2.4,3D Validated,Nothing Detected,9,3.36,3.6,Animal with Collar 40907
40907,11/3/2022 15:00,11/3/2022 9:00,11/3/2022 15:00,2022-11-03 09:00:38-06:00,Iridium,46.76068,-113.94985,1455,3,3D Validated,Nothing Detected,8,3.36,3.6,Animal with Collar 40907
40907,11/3/2022 14:00,11/3/2022 8:00,11/3/2022 15:00,2022-11-03 09:00:38-06:00,Iridium,46.76078,-113.94977,1401,2.2,3D Validated,Nothing Detected,7,3.36,3.6,Animal with Collar 40907
40907,11/3/2022 13:00,11/3/2022 7:00,11/3/2022 15:00,2022-11-03 09:00:38-06:00,Iridium,46.76073,-113.94978,1406,2,3D Validated,Nothing Detected,8,3.36,3.6,Animal with Collar 40907
40907,11/3/2022 12:00,11/3/2022 6:00,11/3/2022 15:00,2022-11-03 09:00:38-06:00,Iridium,46.76076,-113.94983,1405,3.6,3D Validated,Nothing Detected,8,3.36,3.6,Animal with Collar 40907
40907,11/3/2022 11:00,11/3/2022 5:00,11/3/2022 11:00,2022-11-03 05:00:29-06:00,Iridium,46.76075,-113.94978,1401,2,3D Validated,Nothing Detected,5,3.36,3.6,Animal with Collar 40907
40907,11/3/2022 10:00,11/3/2022 4:00,11/3/2022 11:00,2022-11-03 05:00:29-06:00,Iridium,46.76072,-113.94976,1404,2,3D Validated,Nothing Detected,5,3.36,3.6,Animal with Collar 40907
40907,11/3/2022 9:00,11/3/2022 3:00,11/3/2022 11:00,2022-11-03 05:00:29-06:00,Iridium,46.76073,-113.94976,1405,3.2,3D Validated,Nothing Detected,3,3.36,3.6,Animal with Collar 40907
40907,11/3/2022 8:00,11/3/2022 2:00,11/3/2022 11:00,2022-11-03 05:00:29-06:00,Iridium,46.76075,-113.94981,1401,2,3D Validated,Nothing Detected,3,3.36,3.6,Animal with Collar 40907
40907,11/3/2022 7:00,11/3/2022 1:00,11/3/2022 7:00,2022-11-03 01:00:31-06:00,Iridium,46.76069,-113.94971,1397,2.8,3D Validated,Nothing Detected,6,3.36,3.6,Animal with Collar 40907
40907,11/3/2022 6:00,11/3/2022 0:00,11/3/2022 7:00,2022-11-03 01:00:31-06:00,Iridium,46.76075,-113.94977,1398,3.4,3D Validated,Nothing Detected,6,3.36,3.6,Animal with Collar 40907
40907,11/3/2022 5:00,11/2/2022 23:00,11/3/2022 7:00,2022-11-03 01:00:31-06:00,Iridium,46.76077,-113.94976,1410,1.8,3D Validated,Nothing Detected,8,3.36,3.6,Animal with Collar 40907
40907,11/3/2022 4:00,11/2/2022 22:00,11/3/2022 7:00,2022-11-03 01:00:31-06:00,Iridium,46.76073,-113.94974,1411,3.2,3D Validated,Nothing Detected,11,3.36,3.6,Animal with Collar 40907
40907,11/3/2022 3:00,11/2/2022 21:00,11/3/2022 3:01,2022-11-02 21:01:58-06:00,Iridium,46.76068,-113.9498,1403,2.8,3D Validated,Nothing Detected,10,3.36,3.6,Animal with Collar 40907
40907,11/3/2022 2:00,11/2/2022 20:00,11/3/2022 3:01,2022-11-02 21:01:58-06:00,Iridium,46.76078,-113.94975,1404,2.2,3D Validated,Nothing Detected,9,3.36,3.6,Animal with Collar 40907
40907,11/3/2022 1:01,11/2/2022 19:01,11/3/2022 3:01,2022-11-02 21:01:58-06:00,Iridium,46.76073,-113.94974,1403,2,3D Validated,Nothing Detected,9,3.36,3.6,Animal with Collar 40907
40907,11/3/2022 0:00,11/2/2022 18:00,11/3/2022 3:01,2022-11-02 21:01:58-06:00,Iridium,46.76077,-113.94977,1393,3.4,3D Validated,Nothing Detected,10,3.36,3.6,Animal with Collar 40907
40907,11/2/2022 23:00,11/2/2022 17:00,11/2/2022 23:00,2022-11-02 17:00:44-06:00,Iridium,46.76083,-113.94968,1428,2.8,3D Validated,Nothing Detected,11,3.36,3.6,Animal with Collar 40907
40907,11/2/2022 22:00,11/2/2022 16:00,11/2/2022 23:00,2022-11-02 17:00:44-06:00,Iridium,46.76076,-113.94975,1395,4.2,3D Validated,Nothing Detected,10,3.36,3.6,Animal with Collar 40907
40907,11/2/2022 21:00,11/2/2022 15:00,11/2/2022 23:00,2022-11-02 17:00:44-06:00,Iridium,46.76073,-113.94974,1400,2,3D Validated,Nothing Detected,11,3.36,3.6,Animal with Collar 40907
40907,11/2/2022 20:00,11/2/2022 14:00,11/2/2022 23:00,2022-11-02 17:00:44-06:00,Iridium,46.76053,-113.94966,1421,9,3D Validated,Nothing Detected,9,3.36,3.6,Animal with Collar 40907
40907,11/2/2022 19:00,11/2/2022 13:00,11/2/2022 23:00,2022-11-02 17:00:55-06:00,Iridium,46.76074,-113.94979,1404,3,3D Validated,Nothing Detected,9,3.36,3.6,Animal with Collar 40907
40907,11/2/2022 18:00,11/2/2022 12:00,11/2/2022 23:00,2022-11-02 17:00:55-06:00,Iridium,46.76072,-113.94986,1399,3.2,3D Validated,Nothing Detected,9,3.36,3.6,Animal with Collar 40907
40907,11/2/2022 17:00,11/2/2022 11:00,11/2/2022 23:00,2022-11-02 17:00:55-06:00,Iridium,46.76074,-113.94981,1408,3,3D Validated,Nothing Detected,7,3.36,3.6,Animal with Collar 40907
40907,11/2/2022 16:00,11/2/2022 10:00,11/2/2022 23:00,2022-11-02 17:00:55-06:00,Iridium,46.76078,-113.9498,1400,2.6,3D Validated,Nothing Detected,6,3.36,3.6,Animal with Collar 40907
40907,11/2/2022 15:00,11/2/2022 9:00,11/2/2022 15:00,2022-11-02 09:00:34-06:00,Iridium,46.76072,-113.94981,1406,5.2,3D Validated,Nothing Detected,6,3.36,3.6,Animal with Collar 40907
40907,11/2/2022 14:00,11/2/2022 8:00,11/2/2022 15:00,2022-11-02 09:00:34-06:00,Iridium,46.76075,-113.94982,1406,2,3D Validated,Nothing Detected,7,3.36,3.6,Animal with Collar 40907
40907,11/2/2022 13:00,11/2/2022 7:00,11/2/2022 15:00,2022-11-02 09:00:34-06:00,Iridium,46.76076,-113.94966,1425,5.4,3D Validated,Nothing Detected,8,3.36,3.6,Animal with Collar 40907
40907,11/2/2022 12:00,11/2/2022 6:00,11/2/2022 15:00,2022-11-02 09:00:34-06:00,Iridium,46.76078,-113.9498,1387,3.6,3D Validated,Nothing Detected,8,3.36,3.6,Animal with Collar 40907
40907,11/2/2022 11:00,11/2/2022 5:00,11/2/2022 15:00,2022-11-02 09:00:46-06:00,Iridium,46.7608,-113.94971,1395,2.2,3D Validated,Nothing Detected,9,3.36,3.6,Animal with Collar 40907
40907,11/2/2022 10:00,11/2/2022 4:00,11/2/2022 15:00,2022-11-02 09:00:46-06:00,Iridium,46.76075,-113.94981,1429,6.6,3D Validated,Nothing Detected,15,3.36,3.6,Animal with Collar 40907
40907,11/2/2022 9:00,11/2/2022 3:00,11/2/2022 15:00,2022-11-02 09:00:46-06:00,Iridium,46.76073,-113.9498,1409,2.4,3D Validated,Nothing Detected,15,3.36,3.6,Animal with Collar 40907
40907,11/2/2022 8:00,11/2/2022 2:00,11/2/2022 15:00,2022-11-02 09:00:46-06:00,Iridium,46.7608,-113.94977,1410,3.4,3D Validated,Nothing Detected,14,3.36,3.6,Animal with Collar 40907
40907,11/2/2022 7:00,11/2/2022 1:00,11/2/2022 7:01,2022-11-02 01:01:03-06:00,Iridium,46.76077,-113.94985,1407,2,3D Validated,Nothing Detected,11,3.36,3.6,Animal with Collar 40907
40907,11/2/2022 6:00,11/2/2022 0:00,11/2/2022 7:01,2022-11-02 01:01:03-06:00,Iridium,46.76076,-113.94974,1397,2,3D Validated,Nothing Detected,12,3.36,3.6,Animal with Collar 40907
40907,11/2/2022 5:00,11/1/2022 23:00,11/2/2022 7:01,2022-11-02 01:01:03-06:00,Iridium,46.76082,-113.94972,1388,2.4,3D Validated,Nothing Detected,11,3.36,3.6,Animal with Collar 40907
40907,11/2/2022 4:00,11/1/2022 22:00,11/2/2022 7:01,2022-11-02 01:01:03-06:00,Iridium,46.76075,-113.9497,1401,3.6,3D Validated,Nothing Detected,12,3.36,3.6,Animal with Collar 40907
40907,11/2/2022 3:00,11/1/2022 21:00,11/2/2022 3:00,2022-11-01 21:00:57-06:00,Iridium,46.76066,-113.94981,1399,4,3D Validated,Nothing Detected,15,3.36,3.6,Animal with Collar 40907
40907,11/2/2022 2:00,11/1/2022 20:00,11/2/2022 3:00,2022-11-01 21:00:57-06:00,Iridium,46.76086,-113.94976,1420,1.8,3D Validated,Nothing Detected,18,3.36,3.6,Animal with Collar 40907
40907,11/2/2022 1:00,11/1/2022 19:00,11/2/2022 3:00,2022-11-01 21:00:57-06:00,Iridium,46.76084,-113.94971,1400,2,3D Validated,Nothing Detected,18,3.36,3.6,Animal with Collar 40907
40907,11/2/2022 0:00,11/1/2022 18:00,11/2/2022 3:00,2022-11-01 21:00:57-06:00,Iridium,46.76088,-113.94978,1401,2,3D Validated,Nothing Detected,19,3.36,3.6,Animal with Collar 40907
40907,11/1/2022 23:00,11/1/2022 17:00,11/2/2022 15:01,2022-11-02 09:01:01-06:00,Iridium,46.76069,-113.94984,1410,2.4,3D Validated,Nothing Detected,21,3.36,3.6,Animal with Collar 40907
40907,11/1/2022 22:00,11/1/2022 16:00,11/2/2022 15:01,2022-11-02 09:01:01-06:00,Iridium,46.76077,-113.94976,1410,2.4,3D Validated,Nothing Detected,21,3.36,3.6,Animal with Collar 40907
40907,11/1/2022 21:00,11/1/2022 15:00,11/2/2022 15:01,2022-11-02 09:01:01-06:00,Iridium,46.7608,-113.94974,1409,2.4,3D Validated,Nothing Detected,22,3.36,3.6,Animal with Collar 40907
40907,11/1/2022 20:00,11/1/2022 14:00,11/2/2022 15:01,2022-11-02 09:01:01-06:00,Iridium,46.76075,-113.94978,1395,2.4,3D Validated,Nothing Detected,24,3.36,3.6,Animal with Collar 40907
40907,11/1/2022 19:00,11/1/2022 13:00,11/1/2022 19:00,2022-11-01 13:00:35-06:00,Iridium,46.76074,-113.94978,1416,3,3D Validated,Nothing Detected,24,3.36,3.6,Animal with Collar 40907
40907,11/1/2022 18:00,11/1/2022 12:00,11/1/2022 19:00,2022-11-01 13:00:35-06:00,Iridium,46.76075,-113.94977,1404,2.2,3D Validated,Nothing Detected,19,3.36,3.6,Animal with Collar 40907
40907,11/1/2022 17:00,11/1/2022 11:00,11/1/2022 19:00,2022-11-01 13:00:35-06:00,Iridium,46.76051,-113.94957,1426,7.8,3D Validated,Nothing Detected,16,3.36,3.6,Animal with Collar 40907
40907,11/1/2022 16:00,11/1/2022 10:00,11/1/2022 19:00,2022-11-01 13:00:35-06:00,Iridium,46.76079,-113.94977,1402,4,3D Validated,Nothing Detected,13,3.36,3.6,Animal with Collar 40907
40907,11/1/2022 15:00,11/1/2022 9:00,11/1/2022 15:00,2022-11-01 09:00:34-06:00,Iridium,46.76071,-113.94978,1413,3,3D Validated,Nothing Detected,9,3.36,3.6,Animal with Collar 40907
40907,11/1/2022 14:00,11/1/2022 8:00,11/1/2022 15:00,2022-11-01 09:00:34-06:00,Iridium,46.7607,-113.94977,1392,3,3D Validated,Nothing Detected,8,3.36,3.6,Animal with Collar 40907
40907,11/1/2022 13:00,11/1/2022 7:00,11/1/2022 15:00,2022-11-01 09:00:34-06:00,Iridium,46.76078,-113.94974,1409,2,3D Validated,Nothing Detected,7,3.36,3.6,Animal with Collar 40907
40907,11/1/2022 12:00,11/1/2022 6:00,11/1/2022 15:00,2022-11-01 09:00:34-06:00,Iridium,46.76083,-113.94982,1429,2.2,3D Validated,Nothing Detected,9,3.36,3.6,Animal with Collar 40907
40907,11/1/2022 11:00,11/1/2022 5:00,11/1/2022 11:01,2022-11-01 05:01:02-06:00,Iridium,46.76066,-113.94976,1396,2.2,3D Validated,Nothing Detected,11,3.36,3.6,Animal with Collar 40907
40907,11/1/2022 10:00,11/1/2022 4:00,11/1/2022 11:01,2022-11-01 05:01:02-06:00,Iridium,46.76078,-113.94977,1408,6.8,3D Validated,Nothing Detected,9,3.36,3.6,Animal with Collar 40907
40907,11/1/2022 9:00,11/1/2022 3:00,11/1/2022 11:01,2022-11-01 05:01:02-06:00,Iridium,46.76082,-113.94972,1410,3.2,3D Validated,Nothing Detected,9,3.36,3.6,Animal with Collar 40907
40907,11/1/2022 8:00,11/1/2022 2:00,11/1/2022 11:01,2022-11-01 05:01:02-06:00,Iridium,46.76076,-113.94977,1405,1.6,3D Validated,Nothing Detected,9,3.36,3.6,Animal with Collar 40907
40907,11/1/2022 7:00,11/1/2022 1:00,11/1/2022 7:02,2022-11-01 01:02:24-06:00,Iridium,46.76079,-113.94988,1383,3.6,3D Validated,Nothing Detected,9,3.36,3.6,Animal with Collar 40907
40907,11/1/2022 6:00,11/1/2022 0:00,11/1/2022 7:02,2022-11-01 01:02:24-06:00,Iridium,46.76074,-113.94977,1396,3.4,3D Validated,Nothing Detected,11,3.36,3.6,Animal with Collar 40907
40907,11/1/2022 5:00,10/31/2022 23:00,11/1/2022 7:02,2022-11-01 01:02:24-06:00,Iridium,46.76079,-113.94973,1397,2,3D Validated,Nothing Detected,13,3.36,3.6,Animal with Collar 40907
40907,11/1/2022 4:00,10/31/2022 22:00,11/1/2022 7:02,2022-11-01 01:02:24-06:00,Iridium,46.7608,-113.94977,1410,2.2,3D Validated,Nothing Detected,13,3.36,3.6,Animal with Collar 40907
40907,11/1/2022 3:00,10/31/2022 21:00,11/1/2022 3:01,2022-10-31 21:01:00-06:00,Iridium,46.7608,-113.94976,1412,4,3D Validated,Nothing Detected,15,3.36,3.6,Animal with Collar 40907
40907,11/1/2022 2:00,10/31/2022 20:00,11/1/2022 3:01,2022-10-31 21:01:00-06:00,Iridium,46.76079,-113.94978,1400,4.8,3D Validated,Nothing Detected,15,3.36,3.6,Animal with Collar 40907
40907,11/1/2022 1:00,10/31/2022 19:00,11/1/2022 3:01,2022-10-31 21:01:00-06:00,Iridium,46.7608,-113.94975,1399,2,3D Validated,Nothing Detected,14,3.36,3.6,Animal with Collar 40907
40907,11/1/2022 0:00,10/31/2022 18:00,11/1/2022 3:01,2022-10-31 21:01:00-06:00,Iridium,46.76075,-113.94976,1407,5.2,3D Validated,Nothing Detected,14,3.36,3.6,Animal with Collar 40907
40907,10/31/2022 23:00,10/31/2022 17:00,11/1/2022 7:02,2022-11-01 01:02:57-06:00,Iridium,46.76081,-113.94975,1400,2.4,3D Validated,Nothing Detected,16,3.36,3.6,Animal with Collar 40907
40907,10/31/2022 22:00,10/31/2022 16:00,11/1/2022 7:02,2022-11-01 01:02:57-06:00,Iridium,46.76075,-113.94969,1423,3.6,3D Validated,Nothing Detected,16,3.36,3.6,Animal with Collar 40907
40907,10/31/2022 21:00,10/31/2022 15:00,11/1/2022 7:02,2022-11-01 01:02:57-06:00,Iridium,46.76074,-113.94971,1413,2.4,3D Validated,Nothing Detected,16,3.36,3.6,Animal with Collar 40907
40907,10/31/2022 20:00,10/31/2022 14:00,11/1/2022 7:02,2022-11-01 01:02:57-06:00,Iridium,46.76074,-113.94978,1407,7,3D Validated,Nothing Detected,17,3.36,3.6,Animal with Collar 40907
40907,10/31/2022 19:00,10/31/2022 13:00,11/1/2022 7:03,2022-11-01 01:03:07-06:00,Iridium,46.76072,-113.94978,1404,3,3D Validated,Nothing Detected,18,3.36,3.6,Animal with Collar 40907
40907,10/31/2022 18:00,10/31/2022 12:00,11/1/2022 7:03,2022-11-01 01:03:07-06:00,Iridium,46.76076,-113.94979,1400,2.4,3D Validated,Nothing Detected,16,3.36,3.6,Animal with Collar 40907
40907,10/31/2022 17:00,10/31/2022 11:00,11/1/2022 7:03,2022-11-01 01:03:07-06:00,Iridium,46.76071,-113.94967,1405,3.4,3D Validated,Nothing Detected,17,3.36,3.6,Animal with Collar 40907
40907,10/31/2022 16:00,10/31/2022 10:00,11/1/2022 7:03,2022-11-01 01:03:07-06:00,Iridium,46.76071,-113.94982,1408,2.4,3D Validated,Nothing Detected,18,3.36,3.6,Animal with Collar 40907
40907,10/31/2022 15:00,10/31/2022 9:00,11/1/2022 7:03,2022-11-01 01:03:16-06:00,Iridium,46.76073,-113.94975,1414,1.8,3D Validated,Nothing Detected,15,3.36,3.6,Animal with Collar 40907
40907,10/31/2022 14:00,10/31/2022 8:00,11/1/2022 7:03,2022-11-01 01:03:16-06:00,Iridium,46.76085,-113.94981,1390,2.6,3D Validated,Nothing Detected,13,3.36,3.6,Animal with Collar 40907
40907,10/31/2022 13:00,10/31/2022 7:00,11/1/2022 7:03,2022-11-01 01:03:16-06:00,Iridium,46.76079,-113.94976,1389,2.8,3D Validated,Nothing Detected,12,3.36,3.6,Animal with Collar 40907
40907,10/31/2022 12:00,10/31/2022 6:00,11/1/2022 7:03,2022-11-01 01:03:16-06:00,Iridium,46.7607,-113.94978,1403,2.6,3D Validated,Nothing Detected,11,3.36,3.6,Animal with Collar 40907
40907,10/31/2022 11:00,10/31/2022 5:00,11/1/2022 7:03,2022-11-01 01:03:37-06:00,Iridium,46.76068,-113.94974,1411,8.6,3D Validated,Nothing Detected,12,3.36,3.6,Animal with Collar 40907
40907,10/31/2022 10:00,10/31/2022 4:00,11/1/2022 7:03,2022-11-01 01:03:37-06:00,Iridium,46.76077,-113.94977,1407,7.2,3D Validated,Nothing Detected,16,3.36,3.6,Animal with Collar 40907
40907,10/31/2022 9:00,10/31/2022 3:00,11/1/2022 7:03,2022-11-01 01:03:37-06:00,Iridium,46.76077,-113.94981,1412,1.8,3D Validated,Nothing Detected,14,3.36,3.6,Animal with Collar 40907
40907,10/31/2022 8:00,10/31/2022 2:00,11/1/2022 7:03,2022-11-01 01:03:37-06:00,Iridium,46.76077,-113.9498,1399,3.4,3D Validated,Nothing Detected,13,3.36,3.6,Animal with Collar 40907
40907,10/31/2022 7:00,10/31/2022 1:00,10/31/2022 7:01,2022-10-31 01:01:15-06:00,Iridium,46.76079,-113.94985,1438,2,3D Validated,Nothing Detected,16,3.36,3.6,Animal with Collar 40907
40907,10/31/2022 6:00,10/31/2022 0:00,10/31/2022 7:01,2022-10-31 01:01:15-06:00,Iridium,46.76067,-113.94968,1415,3,3D Validated,Nothing Detected,17,3.36,3.6,Animal with Collar 40907
40907,10/31/2022 5:00,10/30/2022 23:00,10/31/2022 7:01,2022-10-31 01:01:15-06:00,Iridium,46.76074,-113.94982,1405,1.8,3D Validated,Nothing Detected,18,3.36,3.6,Animal with Collar 40907
40907,10/31/2022 4:00,10/30/2022 22:00,10/31/2022 7:01,2022-10-31 01:01:15-06:00,Iridium,46.76075,-113.94984,1420,3.2,3D Validated,Nothing Detected,17,3.36,3.6,Animal with Collar 40907
40907,10/31/2022 3:00,10/30/2022 21:00,10/31/2022 3:01,2022-10-30 21:01:33-06:00,Iridium,46.76065,-113.94989,1398,8,3D Validated,Nothing Detected,17,3.36,3.6,Animal with Collar 40907
40907,10/31/2022 2:00,10/30/2022 20:00,10/31/2022 3:01,2022-10-30 21:01:33-06:00,Iridium,46.76075,-113.94978,1417,5,3D Validated,Nothing Detected,16,3.36,3.6,Animal with Collar 40907
40907,10/31/2022 1:00,10/30/2022 19:00,10/31/2022 3:01,2022-10-30 21:01:33-06:00,Iridium,46.76081,-113.9498,1403,2.8,3D Validated,Nothing Detected,18,3.36,3.6,Animal with Collar 40907
40907,10/31/2022 0:00,10/30/2022 18:00,10/31/2022 3:01,2022-10-30 21:01:33-06:00,Iridium,46.76069,-113.94976,1407,2,3D Validated,Nothing Detected,19,3.28,3.6,Animal with Collar 40907
40907,10/30/2022 23:00,10/30/2022 17:00,10/31/2022 3:01,2022-10-30 21:01:44-06:00,Iridium,46.76073,-113.94981,1400,2.6,3D Validated,Nothing Detected,19,3.36,3.6,Animal with Collar 40907
40907,10/30/2022 22:01,10/30/2022 16:01,10/31/2022 3:01,2022-10-30 21:01:44-06:00,Iridium,46.76075,-113.94982,1412,5,3D Validated,Nothing Detected,20,3.28,3.6,Animal with Collar 40907
40907,10/30/2022 21:00,10/30/2022 15:00,10/31/2022 3:01,2022-10-30 21:01:44-06:00,Iridium,46.76084,-113.94986,1400,3,3D Validated,Nothing Detected,16,3.36,3.6,Animal with Collar 40907
40907,10/30/2022 20:00,10/30/2022 14:00,10/31/2022 3:01,2022-10-30 21:01:44-06:00,Iridium,46.76067,-113.94975,1413,3.2,3D Validated,Nothing Detected,15,3.36,3.6,Animal with Collar 40907
40907,10/30/2022 19:00,10/30/2022 13:00,10/31/2022 3:01,2022-10-30 21:01:52-06:00,Iridium,46.76083,-113.94981,1390,3.6,3D Validated,Nothing Detected,15,3.36,3.6,Animal with Collar 40907
40907,10/30/2022 18:00,10/30/2022 12:00,10/31/2022 3:01,2022-10-30 21:01:52-06:00,Iridium,46.76079,-113.94977,1402,2.2,3D Validated,Nothing Detected,15,3.36,3.6,Animal with Collar 40907
40907,10/30/2022 17:00,10/30/2022 11:00,10/31/2022 3:01,2022-10-30 21:01:52-06:00,Iridium,46.76076,-113.94975,1402,1.8,3D Validated,Nothing Detected,15,3.36,3.6,Animal with Collar 40907
40907,10/30/2022 16:00,10/30/2022 10:00,10/31/2022 3:01,2022-10-30 21:01:52-06:00,Iridium,46.76076,-113.94975,1402,3.4,3D Validated,Nothing Detected,13,3.36,3.6,Animal with Collar 40907
40907,10/30/2022 15:00,10/30/2022 9:00,10/31/2022 3:02,2022-10-30 21:02:08-06:00,Iridium,46.76075,-113.94974,1406,2.2,3D Validated,Nothing Detected,12,3.36,3.6,Animal with Collar 40907
40907,10/30/2022 14:00,10/30/2022 8:00,10/31/2022 3:02,2022-10-30 21:02:08-06:00,Iridium,46.76079,-113.94979,1397,1.8,3D Validated,Nothing Detected,14,3.36,3.6,Animal with Collar 40907
40907,10/30/2022 13:00,10/30/2022 7:00,10/31/2022 3:02,2022-10-30 21:02:08-06:00,Iridium,46.76074,-113.94975,1399,2.6,3D Validated,Nothing Detected,14,3.36,3.6,Animal with Collar 40907
40907,10/30/2022 12:00,10/30/2022 6:00,10/31/2022 3:02,2022-10-30 21:02:08-06:00,Iridium,46.76078,-113.94973,1396,2,3D Validated,Nothing Detected,12,3.36,3.6,Animal with Collar 40907
40907,10/30/2022 11:00,10/30/2022 5:00,10/31/2022 3:02,2022-10-30 21:02:17-06:00,Iridium,46.7607,-113.94969,1417,7.4,3D Validated,Nothing Detected,12,3.36,3.6,Animal with Collar 40907
40907,10/30/2022 10:00,10/30/2022 4:00,10/31/2022 3:02,2022-10-30 21:02:17-06:00,Iridium,46.76075,-113.9498,1418,7.2,3D Validated,Nothing Detected,11,3.36,3.6,Animal with Collar 40907
40907,10/30/2022 9:00,10/30/2022 3:00,10/31/2022 3:02,2022-10-30 21:02:17-06:00,Iridium,46.76071,-113.94981,1405,2.2,3D Validated,Nothing Detected,13,3.36,3.6,Animal with Collar 40907
40907,10/30/2022 8:00,10/30/2022 2:00,10/31/2022 3:02,2022-10-30 21:02:17-06:00,Iridium,46.76083,-113.94982,1393,4.4,3D Validated,Nothing Detected,14,3.36,3.6,Animal with Collar 40907
40907,10/30/2022 7:00,10/30/2022 1:00,10/31/2022 3:02,2022-10-30 21:02:24-06:00,Iridium,46.76076,-113.94974,1405,2.6,3D Validated,Nothing Detected,13,3.36,3.6,Animal with Collar 40907
40907,10/30/2022 6:00,10/30/2022 0:00,10/31/2022 3:02,2022-10-30 21:02:24-06:00,Iridium,46.76077,-113.94974,1399,2.6,3D Validated,Nothing Detected,12,3.36,3.6,Animal with Collar 40907
40907,10/30/2022 5:00,10/29/2022 23:00,10/31/2022 3:02,2022-10-30 21:02:24-06:00,Iridium,46.76076,-113.94977,1399,2.2,3D Validated,Nothing Detected,14,3.36,3.6,Animal with Collar 40907
40907,10/30/2022 4:00,10/29/2022 22:00,10/31/2022 3:02,2022-10-30 21:02:24-06:00,Iridium,46.76078,-113.94979,1403,2,3D Validated,Nothing Detected,12,3.36,3.6,Animal with Collar 40907
40907,10/30/2022 3:00,10/29/2022 21:00,10/30/2022 3:01,2022-10-29 21:01:16-06:00,Iridium,46.76078,-113.94977,1408,5,3D Validated,Nothing Detected,11,3.36,3.6,Animal with Collar 40907
40907,10/30/2022 2:00,10/29/2022 20:00,10/30/2022 3:01,2022-10-29 21:01:16-06:00,Iridium,46.7608,-113.94979,1404,2.2,3D Validated,Nothing Detected,13,3.36,3.6,Animal with Collar 40907
40907,10/30/2022 1:00,10/29/2022 19:00,10/30/2022 3:01,2022-10-29 21:01:16-06:00,Iridium,46.76073,-113.94979,1403,2.2,3D Validated,Nothing Detected,15,3.36,3.6,Animal with Collar 40907
40907,10/30/2022 0:00,10/29/2022 18:00,10/30/2022 3:01,2022-10-29 21:01:16-06:00,Iridium,46.76071,-113.94984,1388,4.2,3D Validated,Nothing Detected,17,3.36,3.6,Animal with Collar 40907
40907,10/29/2022 23:00,10/29/2022 17:00,10/31/2022 3:02,2022-10-30 21:02:35-06:00,Iridium,46.76073,-113.94978,1408,2.2,3D Validated,Nothing Detected,19,3.36,3.6,Animal with Collar 40907
40907,10/29/2022 22:00,10/29/2022 16:00,10/31/2022 3:02,2022-10-30 21:02:35-06:00,Iridium,46.76064,-113.94952,1490,4.4,3D Validated,Nothing Detected,16,3.36,3.6,Animal with Collar 40907
40907,10/29/2022 21:00,10/29/2022 15:00,10/31/2022 3:02,2022-10-30 21:02:35-06:00,Iridium,46.76075,-113.94981,1401,2.6,3D Validated,Nothing Detected,18,3.36,3.6,Animal with Collar 40907
40907,10/29/2022 20:00,10/29/2022 14:00,10/31/2022 3:02,2022-10-30 21:02:35-06:00,Iridium,46.76085,-113.9498,1401,5.6,3D Validated,Nothing Detected,19,3.36,3.6,Animal with Collar 40907
40907,10/29/2022 19:00,10/29/2022 13:00,10/29/2022 19:00,2022-10-29 13:00:35-06:00,Iridium,46.76078,-113.94977,1401,3,3D Validated,Nothing Detected,19,3.36,3.6,Animal with Collar 40907
40907,10/29/2022 18:00,10/29/2022 12:00,10/29/2022 19:00,2022-10-29 13:00:35-06:00,Iridium,46.76086,-113.94975,1414,1.8,3D Validated,Nothing Detected,15,3.36,3.6,Animal with Collar 40907
40907,10/29/2022 17:00,10/29/2022 11:00,10/29/2022 19:00,2022-10-29 13:00:35-06:00,Iridium,46.76089,-113.9498,1406,2.4,3D Validated,Nothing Detected,13,3.36,3.6,Animal with Collar 40907
40907,10/29/2022 16:00,10/29/2022 10:00,10/29/2022 19:00,2022-10-29 13:00:35-06:00,Iridium,46.76085,-113.94984,1391,2.4,3D Validated,Nothing Detected,14,3.36,3.6,Animal with Collar 40907
40907,10/29/2022 15:00,10/29/2022 9:00,10/29/2022 19:00,2022-10-29 13:00:44-06:00,Iridium,46.76066,-113.94978,1413,2.4,3D Validated,Nothing Detected,12,3.36,3.6,Animal with Collar 40907
40907,10/29/2022 14:00,10/29/2022 8:00,10/29/2022 19:00,2022-10-29 13:00:44-06:00,Iridium,46.76084,-113.94982,1395,2.6,3D Validated,Nothing Detected,9,3.36,3.6,Animal with Collar 40907
40907,10/29/2022 13:00,10/29/2022 7:00,10/29/2022 19:00,2022-10-29 13:00:44-06:00,Iridium,46.76073,-113.94977,1402,2.6,3D Validated,Nothing Detected,10,3.36,3.6,Animal with Collar 40907
40907,10/29/2022 12:00,10/29/2022 6:00,10/29/2022 19:00,2022-10-29 13:00:44-06:00,Iridium,46.76078,-113.94978,1398,1.6,3D Validated,Nothing Detected,10,3.36,3.6,Animal with Collar 40907
40907,10/29/2022 11:00,10/29/2022 5:00,10/29/2022 19:01,2022-10-29 13:01:09-06:00,Iridium,46.76077,-113.94977,1407,6.6,3D Validated,Nothing Detected,8,3.36,3.6,Animal with Collar 40907
40907,10/29/2022 10:00,10/29/2022 4:00,10/29/2022 19:01,2022-10-29 13:01:09-06:00,Iridium,46.76078,-113.94979,1425,3.2,3D Validated,Nothing Detected,8,3.36,3.6,Animal with Collar 40907
40907,10/29/2022 9:00,10/29/2022 3:00,10/29/2022 19:01,2022-10-29 13:01:09-06:00,Iridium,46.76079,-113.94978,1413,2.4,3D Validated,Nothing Detected,8,3.36,3.6,Animal with Collar 40907
40907,10/29/2022 8:00,10/29/2022 2:00,10/29/2022 19:01,2022-10-29 13:01:09-06:00,Iridium,46.76081,-113.9498,1403,3,3D Validated,Nothing Detected,8,3.36,3.6,Animal with Collar 40907
40907,10/29/2022 7:00,10/29/2022 1:00,10/29/2022 7:02,2022-10-29 01:02:36-06:00,Iridium,46.76072,-113.94977,1401,2.2,3D Validated,Nothing Detected,11,3.36,3.6,Animal with Collar 40907
40907,10/29/2022 6:00,10/29/2022 0:00,10/29/2022 7:02,2022-10-29 01:02:36-06:00,Iridium,46.7607,-113.94984,1382,4.6,3D Validated,Nothing Detected,17,3.36,3.6,Animal with Collar 40907
40907,10/29/2022 5:00,10/28/2022 23:00,10/29/2022 7:02,2022-10-29 01:02:36-06:00,Iridium,46.76078,-113.94977,1401,2.8,3D Validated,Nothing Detected,17,3.36,3.6,Animal with Collar 40907
40907,10/29/2022 4:00,10/28/2022 22:00,10/29/2022 7:02,2022-10-29 01:02:36-06:00,Iridium,46.76072,-113.94985,1395,2.8,3D Validated,Nothing Detected,17,3.36,3.6,Animal with Collar 40907
40907,10/29/2022 3:00,10/28/2022 21:00,10/31/2022 3:02,2022-10-30 21:02:42-06:00,Iridium,46.76076,-113.94974,1397,3.4,3D Validated,Nothing Detected,15,3.36,3.6,Animal with Collar 40907
40907,10/29/2022 2:00,10/28/2022 20:00,10/31/2022 3:02,2022-10-30 21:02:42-06:00,Iridium,46.76079,-113.9498,1388,5.4,3D Validated,Nothing Detected,14,3.36,3.6,Animal with Collar 40907
40907,10/29/2022 1:00,10/28/2022 19:00,10/31/2022 3:02,2022-10-30 21:02:42-06:00,Iridium,46.76082,-113.94981,1382,5.8,3D Validated,Nothing Detected,17,3.36,3.6,Animal with Collar 40907
40907,10/29/2022 0:00,10/28/2022 18:00,10/31/2022 3:02,2022-10-30 21:02:42-06:00,Iridium,46.76072,-113.94984,1398,3,3D Validated,Nothing Detected,20,3.36,3.6,Animal with Collar 40907
40907,10/28/2022 23:00,10/28/2022 17:00,10/31/2022 3:03,2022-10-30 21:03:00-06:00,Iridium,46.76075,-113.94982,1390,2.6,3D Validated,Nothing Detected,19,3.36,3.6,Animal with Collar 40907
40907,10/28/2022 22:00,10/28/2022 16:00,10/31/2022 3:03,2022-10-30 21:03:00-06:00,Iridium,46.76073,-113.94971,1409,3.8,3D Validated,Nothing Detected,17,3.36,3.6,Animal with Collar 40907
40907,10/28/2022 21:00,10/28/2022 15:00,10/31/2022 3:03,2022-10-30 21:03:00-06:00,Iridium,46.76073,-113.94971,1409,2.8,3D Validated,Nothing Detected,16,3.36,3.6,Animal with Collar 40907
40907,10/28/2022 20:00,10/28/2022 14:00,10/31/2022 3:03,2022-10-30 21:03:00-06:00,Iridium,46.76075,-113.94981,1415,5,3D Validated,Nothing Detected,16,3.36,3.6,Animal with Collar 40907
40907,10/28/2022 19:00,10/28/2022 13:00,10/31/2022 3:03,2022-10-30 21:03:09-06:00,Iridium,46.76076,-113.94975,1395,3.2,3D Validated,Nothing Detected,14,3.36,3.6,Animal with Collar 40907
40907,10/28/2022 18:00,10/28/2022 12:00,10/31/2022 3:03,2022-10-30 21:03:09-06:00,Iridium,46.76077,-113.94978,1410,1.8,3D Validated,Nothing Detected,12,3.36,3.6,Animal with Collar 40907
40907,10/28/2022 17:00,10/28/2022 11:00,10/31/2022 3:03,2022-10-30 21:03:09-06:00,Iridium,46.76073,-113.94978,1406,2.8,3D Validated,Nothing Detected,10,3.36,3.6,Animal with Collar 40907
40907,10/28/2022 16:00,10/28/2022 10:00,10/31/2022 3:03,2022-10-30 21:03:09-06:00,Iridium,46.76072,-113.9498,1415,2.4,3D Validated,Nothing Detected,9,3.36,3.6,Animal with Collar 40907
40907,10/28/2022 15:00,10/28/2022 9:00,10/31/2022 3:03,2022-10-30 21:03:15-06:00,Iridium,46.76069,-113.94983,1419,2.6,3D Validated,Nothing Detected,9,3.36,3.6,Animal with Collar 40907
40907,10/28/2022 14:00,10/28/2022 8:00,10/31/2022 3:03,2022-10-30 21:03:15-06:00,Iridium,46.76076,-113.94978,1397,1.8,3D Validated,Nothing Detected,12,3.36,3.6,Animal with Collar 40907
40907,10/28/2022 13:00,10/28/2022 7:00,10/31/2022 3:03,2022-10-30 21:03:15-06:00,Iridium,46.76072,-113.94978,1398,3.4,3D Validated,Nothing Detected,12,3.36,3.6,Animal with Collar 40907
40907,10/28/2022 12:00,10/28/2022 6:00,10/31/2022 3:03,2022-10-30 21:03:15-06:00,Iridium,46.76079,-113.94986,1407,6,3D Validated,Nothing Detected,10,3.36,3.6,Animal with Collar 40907
40907,10/28/2022 11:00,10/28/2022 5:00,10/28/2022 11:00,2022-10-28 05:00:39-06:00,Iridium,46.76073,-113.94977,1402,4,3D Validated,Nothing Detected,6,3.36,3.6,Animal with Collar 40907
40907,10/28/2022 10:00,10/28/2022 4:00,10/28/2022 11:00,2022-10-28 05:00:39-06:00,Iridium,46.76072,-113.94975,1390,2.6,3D Validated,Nothing Detected,6,3.36,3.6,Animal with Collar 40907
40907,10/28/2022 9:00,10/28/2022 3:00,10/28/2022 11:00,2022-10-28 05:00:39-06:00,Iridium,46.76076,-113.94977,1399,4.8,3D Validated,Nothing Detected,6,3.36,3.6,Animal with Collar 40907
40907,10/28/2022 8:00,10/28/2022 2:00,10/28/2022 11:00,2022-10-28 05:00:39-06:00,Iridium,46.76077,-113.94979,1401,2.4,3D Validated,Nothing Detected,9,3.36,3.6,Animal with Collar 40907
40907,10/28/2022 7:00,10/28/2022 1:00,10/28/2022 7:01,2022-10-28 01:01:02-06:00,Iridium,46.76075,-113.94977,1404,2,3D Validated,Nothing Detected,8,3.36,3.6,Animal with Collar 40907
40907,10/28/2022 6:00,10/28/2022 0:00,10/28/2022 7:01,2022-10-28 01:01:02-06:00,Iridium,46.76045,-113.94961,1424,3.2,3D Validated,Nothing Detected,8,3.36,3.6,Animal with Collar 40907
40907,10/28/2022 5:00,10/27/2022 23:00,10/28/2022 7:01,2022-10-28 01:01:02-06:00,Iridium,46.76076,-113.94983,1427,3,3D Validated,Nothing Detected,9,3.36,3.6,Animal with Collar 40907
40907,10/28/2022 4:00,10/27/2022 22:00,10/28/2022 7:01,2022-10-28 01:01:02-06:00,Iridium,46.76075,-113.94977,1398,1.8,3D Validated,Nothing Detected,10,3.36,3.6,Animal with Collar 40907
40907,10/28/2022 3:00,10/27/2022 21:00,10/28/2022 7:01,2022-10-28 01:01:09-06:00,Iridium,46.76071,-113.94983,1405,2.6,3D Validated,Nothing Detected,10,3.36,3.6,Animal with Collar 40907
40907,10/28/2022 2:00,10/27/2022 20:00,10/28/2022 7:01,2022-10-28 01:01:09-06:00,Iridium,46.76072,-113.94977,1401,2.4,3D Validated,Nothing Detected,10,3.36,3.6,Animal with Collar 40907
40907,10/28/2022 1:00,10/27/2022 19:00,10/28/2022 7:01,2022-10-28 01:01:09-06:00,Iridium,46.76072,-113.94978,1404,2.6,3D Validated,Nothing Detected,14,3.36,3.6,Animal with Collar 40907
40907,10/28/2022 0:00,10/27/2022 18:00,10/28/2022 7:01,2022-10-28 01:01:09-06:00,Iridium,46.76077,-113.94998,1404,2.4,3D Validated,Nothing Detected,19,3.28,3.6,Animal with Collar 40907
40907,10/27/2022 23:00,10/27/2022 17:00,10/28/2022 7:01,2022-10-28 01:01:16-06:00,Iridium,46.76078,-113.94989,1407,2.8,3D Validated,Nothing Detected,19,3.36,3.6,Animal with Collar 40907
40907,10/27/2022 22:00,10/27/2022 16:00,10/28/2022 7:01,2022-10-28 01:01:16-06:00,Iridium,46.7607,-113.94996,1373,3.8,3D Validated,Nothing Detected,14,3.36,3.6,Animal with Collar 40907
40907,10/27/2022 21:00,10/27/2022 15:00,10/28/2022 7:01,2022-10-28 01:01:16-06:00,Iridium,46.76068,-113.94978,1409,2.8,3D Validated,Nothing Detected,21,3.36,3.6,Animal with Collar 40907
40907,10/27/2022 20:00,10/27/2022 14:00,10/28/2022 7:01,2022-10-28 01:01:16-06:00,Iridium,46.76079,-113.94988,1402,3,3D Validated,Nothing Detected,23,3.28,3.6,Animal with Collar 40907
40907,10/27/2022 19:00,10/27/2022 13:00,10/28/2022 7:01,2022-10-28 01:01:25-06:00,Iridium,46.76074,-113.94981,1399,2.4,3D Validated,Nothing Detected,20,3.28,3.6,Animal with Collar 40907
40907,10/27/2022 18:00,10/27/2022 12:00,10/28/2022 7:01,2022-10-28 01:01:25-06:00,Iridium,46.76085,-113.94987,1405,5.6,3D Validated,Nothing Detected,17,3.36,3.6,Animal with Collar 40907
40907,10/27/2022 17:00,10/27/2022 11:00,10/28/2022 7:01,2022-10-28 01:01:25-06:00,Iridium,46.76048,-113.94952,1421,2.8,3D Validated,Nothing Detected,13,3.36,3.6,Animal with Collar 40907
40907,10/27/2022 16:00,10/27/2022 10:00,10/28/2022 7:01,2022-10-28 01:01:25-06:00,Iridium,46.76077,-113.94977,1407,3,3D Validated,Nothing Detected,11,3.36,3.6,Animal with Collar 40907
40907,10/27/2022 15:00,10/27/2022 9:00,10/27/2022 15:00,2022-10-27 09:00:50-06:00,Iridium,46.76059,-113.94982,1429,6.6,3D Validated,Nothing Detected,12,3.36,3.6,Animal with Collar 40907
40907,10/27/2022 14:00,10/27/2022 8:00,10/27/2022 15:00,2022-10-27 09:00:50-06:00,Iridium,46.76072,-113.94978,1407,1.8,3D Validated,Nothing Detected,11,3.36,3.6,Animal with Collar 40907
40907,10/27/2022 13:00,10/27/2022 7:00,10/27/2022 15:00,2022-10-27 09:00:50-06:00,Iridium,46.76079,-113.94978,1394,1.8,3D Validated,Nothing Detected,11,3.36,3.6,Animal with Collar 40907
40907,10/27/2022 12:00,10/27/2022 6:00,10/27/2022 15:00,2022-10-27 09:00:50-06:00,Iridium,46.7606,-113.94955,1420,5.4,3D Validated,Nothing Detected,13,3.36,3.6,Animal with Collar 40907
40907,10/27/2022 11:00,10/27/2022 5:00,10/27/2022 15:01,2022-10-27 09:01:03-06:00,Iridium,46.76072,-113.94974,1406,3.4,3D Validated,Nothing Detected,13,3.36,3.6,Animal with Collar 40907
40907,10/27/2022 10:00,10/27/2022 4:00,10/27/2022 15:01,2022-10-27 09:01:03-06:00,Iridium,46.76076,-113.94975,1402,3.6,3D Validated,Nothing Detected,13,3.36,3.6,Animal with Collar 40907
40907,10/27/2022 9:00,10/27/2022 3:00,10/27/2022 15:01,2022-10-27 09:01:03-06:00,Iridium,46.76076,-113.94974,1405,2.2,3D Validated,Nothing Detected,13,3.36,3.6,Animal with Collar 40907
40907,10/27/2022 8:00,10/27/2022 2:00,10/27/2022 15:01,2022-10-27 09:01:03-06:00,Iridium,46.76065,-113.94984,1441,2.6,3D Validated,Nothing Detected,10,3.36,3.6,Animal with Collar 40907
40907,10/27/2022 7:00,10/27/2022 1:00,10/27/2022 15:01,2022-10-27 09:01:30-06:00,Iridium,46.76076,-113.94984,1403,2,3D Validated,Nothing Detected,10,3.36,3.6,Animal with Collar 40907
40907,10/27/2022 6:00,10/27/2022 0:00,10/27/2022 15:01,2022-10-27 09:01:30-06:00,Iridium,46.76066,-113.94964,1419,3,3D Validated,Nothing Detected,10,3.36,3.6,Animal with Collar 40907
40907,10/27/2022 5:00,10/26/2022 23:00,10/27/2022 15:01,2022-10-27 09:01:30-06:00,Iridium,46.76075,-113.94975,1401,2.4,3D Validated,Nothing Detected,10,3.36,3.6,Animal with Collar 40907
40907,10/27/2022 4:00,10/26/2022 22:00,10/27/2022 15:01,2022-10-27 09:01:30-06:00,Iridium,46.76086,-113.94978,1386,2.8,3D Validated,Nothing Detected,12,3.36,3.6,Animal with Collar 40907
40907,10/27/2022 3:00,10/26/2022 21:00,10/27/2022 3:01,2022-10-26 21:01:07-06:00,Iridium,46.76073,-113.94978,1400,1.8,3D Validated,Nothing Detected,13,3.36,3.6,Animal with Collar 40907
40907,10/27/2022 2:00,10/26/2022 20:00,10/27/2022 3:01,2022-10-26 21:01:07-06:00,Iridium,46.76075,-113.94976,1407,3.2,3D Validated,Nothing Detected,13,3.36,3.6,Animal with Collar 40907
40907,10/27/2022 1:00,10/26/2022 19:00,10/27/2022 3:01,2022-10-26 21:01:07-06:00,Iridium,46.76078,-113.94978,1398,2,3D Validated,Nothing Detected,18,3.36,3.6,Animal with Collar 40907
40907,10/27/2022 0:00,10/26/2022 18:00,10/27/2022 3:01,2022-10-26 21:01:07-06:00,Iridium,46.76076,-113.94977,1405,3.6,3D Validated,Nothing Detected,15,3.36,3.6,Animal with Collar 40907
40907,10/26/2022 23:00,10/26/2022 17:00,10/27/2022 3:01,2022-10-26 21:01:15-06:00,Iridium,46.76074,-113.94979,1391,3.4,3D Validated,Nothing Detected,13,3.36,3.6,Animal with Collar 40907
40907,10/26/2022 22:00,10/26/2022 16:00,10/27/2022 3:01,2022-10-26 21:01:15-06:00,Iridium,46.76075,-113.94976,1407,2.2,3D Validated,Nothing Detected,15,3.36,3.6,Animal with Collar 40907
40907,10/26/2022 21:00,10/26/2022 15:00,10/27/2022 3:01,2022-10-26 21:01:15-06:00,Iridium,46.76075,-113.94975,1401,2.8,3D Validated,Nothing Detected,15,3.36,3.6,Animal with Collar 40907
40907,10/26/2022 20:00,10/26/2022 14:00,10/27/2022 3:01,2022-10-26 21:01:15-06:00,Iridium,46.76071,-113.94974,1405,4.4,3D Validated,Nothing Detected,15,3.36,3.6,Animal with Collar 40907
40907,10/26/2022 19:00,10/26/2022 13:00,10/28/2022 7:01,2022-10-28 01:01:32-06:00,Iridium,46.76076,-113.94971,1400,3.2,3D Validated,Nothing Detected,15,3.36,3.6,Animal with Collar 40907
40907,10/26/2022 18:00,10/26/2022 12:00,10/28/2022 7:01,2022-10-28 01:01:32-06:00,Iridium,46.76076,-113.94973,1400,2,3D Validated,Nothing Detected,15,3.36,3.6,Animal with Collar 40907
40907,10/26/2022 17:00,10/26/2022 11:00,10/28/2022 7:01,2022-10-28 01:01:32-06:00,Iridium,46.76065,-113.94971,1400,4,3D Validated,Nothing Detected,13,3.36,3.6,Animal with Collar 40907
40907,10/26/2022 16:00,10/26/2022 10:00,10/28/2022 7:01,2022-10-28 01:01:32-06:00,Iridium,46.76078,-113.94978,1398,6.6,3D Validated,Nothing Detected,12,3.36,3.6,Animal with Collar 40907
40907,10/26/2022 15:00,10/26/2022 9:00,10/26/2022 15:02,2022-10-26 09:02:08-06:00,Iridium,46.76075,-113.94978,1401,1.8,3D Validated,Nothing Detected,11,3.36,3.6,Animal with Collar 40907
40907,10/26/2022 14:00,10/26/2022 8:00,10/26/2022 15:02,2022-10-26 09:02:08-06:00,Iridium,46.76077,-113.94971,1407,2.4,3D Validated,Nothing Detected,16,3.36,3.6,Animal with Collar 40907
40907,10/26/2022 13:00,10/26/2022 7:00,10/26/2022 15:02,2022-10-26 09:02:08-06:00,Iridium,46.76071,-113.94978,1391,2.8,3D Validated,Nothing Detected,8,3.36,3.6,Animal with Collar 40907
40907,10/26/2022 12:00,10/26/2022 6:00,10/26/2022 15:02,2022-10-26 09:02:08-06:00,Iridium,46.76072,-113.94978,1407,2.6,3D Validated,Nothing Detected,10,3.36,3.6,Animal with Collar 40907
40907,10/26/2022 11:00,10/26/2022 5:00,10/26/2022 15:02,2022-10-26 09:02:33-06:00,Iridium,46.76075,-113.94968,1390,8.2,3D Validated,Nothing Detected,11,3.36,3.6,Animal with Collar 40907
40907,10/26/2022 10:00,10/26/2022 4:00,10/26/2022 15:02,2022-10-26 09:02:33-06:00,Iridium,46.76077,-113.94979,1401,6,3D Validated,Nothing Detected,10,3.36,3.6,Animal with Collar 40907
40907,10/26/2022 9:00,10/26/2022 3:00,10/26/2022 15:02,2022-10-26 09:02:33-06:00,Iridium,46.76075,-113.94981,1401,2.4,3D Validated,Nothing Detected,9,3.36,3.6,Animal with Collar 40907
40907,10/26/2022 8:00,10/26/2022 2:00,10/26/2022 15:02,2022-10-26 09:02:33-06:00,Iridium,46.76072,-113.94987,1412,4.8,3D Validated,Nothing Detected,9,3.36,3.6,Animal with Collar 40907
40907,10/26/2022 7:00,10/26/2022 1:00,10/26/2022 15:02,2022-10-26 09:02:44-06:00,Iridium,46.76072,-113.9498,1393,2,3D Validated,Nothing Detected,8,3.36,3.6,Animal with Collar 40907
40907,10/26/2022 6:00,10/26/2022 0:00,10/26/2022 15:02,2022-10-26 09:02:44-06:00,Iridium,46.7608,-113.94988,1396,2.8,3D Validated,Nothing Detected,8,3.36,3.6,Animal with Collar 40907
40907,10/26/2022 5:00,10/25/2022 23:00,10/26/2022 15:02,2022-10-26 09:02:44-06:00,Iridium,46.76079,-113.94983,1416,3.4,3D Validated,Nothing Detected,7,3.36,3.6,Animal with Collar 40907
40907,10/26/2022 4:00,10/25/2022 22:00,10/26/2022 15:02,2022-10-26 09:02:44-06:00,Iridium,46.76078,-113.94981,1403,1.8,3D Validated,Nothing Detected,9,3.36,3.6,Animal with Collar 40907
40907,10/26/2022 3:00,10/25/2022 21:00,10/26/2022 15:03,2022-10-26 09:03:03-06:00,Iridium,46.76073,-113.94977,1402,2,3D Validated,Nothing Detected,13,3.36,3.6,Animal with Collar 40907
40907,10/26/2022 2:00,10/25/2022 20:00,10/26/2022 15:03,2022-10-26 09:03:03-06:00,Iridium,46.76068,-113.94981,1414,1.6,3D Validated,Nothing Detected,25,3.36,3.6,Animal with Collar 40907
40907,10/26/2022 1:00,10/25/2022 19:00,10/26/2022 15:03,2022-10-26 09:03:03-06:00,Iridium,46.76082,-113.94968,1427,5.4,3D Validated,Nothing Detected,27,3.36,3.6,Animal with Collar 40907
40907,10/26/2022 0:02,10/25/2022 18:02,10/26/2022 15:03,2022-10-26 09:03:03-06:00,Iridium,46.76079,-113.94981,1408,3.4,3D Validated,Nothing Detected,30,3.36,3.6,Animal with Collar 40907
40907,10/25/2022 23:00,10/25/2022 17:00,10/28/2022 7:01,2022-10-28 01:01:40-06:00,Iridium,46.76074,-113.94978,1410,3,3D Validated,Nothing Detected,23,3.36,3.6,Animal with Collar 40907
40907,10/25/2022 22:00,10/25/2022 16:00,10/28/2022 7:01,2022-10-28 01:01:40-06:00,Iridium,46.76071,-113.94982,1402,2.4,3D Validated,Nothing Detected,11,3.36,3.6,Animal with Collar 40907
40907,10/25/2022 21:00,10/25/2022 15:00,10/28/2022 7:01,2022-10-28 01:01:40-06:00,Iridium,46.76088,-113.94984,1404,2.8,3D Validated,Nothing Detected,12,3.36,3.6,Animal with Collar 40907
40907,10/25/2022 20:00,10/25/2022 14:00,10/28/2022 7:01,2022-10-28 01:01:40-06:00,Iridium,46.7608,-113.94981,1399,2.4,3D Validated,Nothing Detected,14,3.36,3.6,Animal with Collar 40907
40907,10/25/2022 19:00,10/25/2022 13:00,10/28/2022 7:01,2022-10-28 01:01:48-06:00,Iridium,46.76069,-113.94981,1402,4.2,3D Validated,Nothing Detected,13,3.36,3.6,Animal with Collar 40907
40907,10/25/2022 18:00,10/25/2022 12:00,10/28/2022 7:01,2022-10-28 01:01:48-06:00,Iridium,46.76077,-113.94973,1402,2,3D Validated,Nothing Detected,12,3.36,3.6,Animal with Collar 40907
40907,10/25/2022 17:00,10/25/2022 11:00,10/28/2022 7:01,2022-10-28 01:01:48-06:00,Iridium,46.76055,-113.94965,1403,2.6,3D Validated,Nothing Detected,11,3.36,3.6,Animal with Collar 40907
40907,10/25/2022 16:00,10/25/2022 10:00,10/28/2022 7:01,2022-10-28 01:01:48-06:00,Iridium,46.76079,-113.94981,1405,3,3D Validated,Nothing Detected,10,3.36,3.6,Animal with Collar 40907
40907,10/25/2022 15:00,10/25/2022 9:00,10/28/2022 7:01,2022-10-28 01:01:55-06:00,Iridium,46.76078,-113.94962,1430,3.8,3D Validated,Nothing Detected,10,3.36,3.6,Animal with Collar 40907
40907,10/25/2022 14:00,10/25/2022 8:00,10/28/2022 7:01,2022-10-28 01:01:55-06:00,Iridium,46.76078,-113.9498,1400,2,3D Validated,Nothing Detected,8,3.36,3.6,Animal with Collar 40907
40907,10/25/2022 13:00,10/25/2022 7:00,10/28/2022 7:01,2022-10-28 01:01:55-06:00,Iridium,46.76078,-113.94974,1400,2.4,3D Validated,Nothing Detected,6,3.36,3.6,Animal with Collar 40907
40907,10/25/2022 12:00,10/25/2022 6:00,10/28/2022 7:01,2022-10-28 01:01:55-06:00,Iridium,46.76035,-113.94923,1442,4.8,3D Validated,Nothing Detected,5,3.36,3.6,Animal with Collar 40907
40907,10/25/2022 11:00,10/25/2022 5:00,10/25/2022 11:02,2022-10-25 05:02:29-06:00,Iridium,46.76076,-113.94975,1402,3.6,3D Validated,Nothing Detected,5,3.36,3.6,Animal with Collar 40907
40907,10/25/2022 10:00,10/25/2022 4:00,10/25/2022 11:02,2022-10-25 05:02:29-06:00,Iridium,46.76073,-113.94977,1402,2.2,3D Validated,Nothing Detected,10,3.36,3.6,Animal with Collar 40907
40907,10/25/2022 9:00,10/25/2022 3:00,10/25/2022 11:02,2022-10-25 05:02:29-06:00,Iridium,46.76065,-113.94968,1414,4.6,3D Validated,Nothing Detected,9,3.36,3.6,Animal with Collar 40907
40907,10/25/2022 8:00,10/25/2022 2:00,10/25/2022 11:02,2022-10-25 05:02:29-06:00,Iridium,46.76077,-113.94974,1399,2.6,3D Validated,Nothing Detected,10,3.36,3.6,Animal with Collar 40907
40907,10/25/2022 7:00,10/25/2022 1:00,10/25/2022 7:00,2022-10-25 01:00:59-06:00,Iridium,46.76076,-113.94977,1392,2,3D Validated,Nothing Detected,10,3.36,3.6,Animal with Collar 40907
40907,10/25/2022 6:00,10/25/2022 0:00,10/25/2022 7:00,2022-10-25 01:00:59-06:00,Iridium,46.76064,-113.94966,1412,2,3D Validated,Nothing Detected,13,3.36,3.6,Animal with Collar 40907
40907,10/25/2022 5:00,10/24/2022 23:00,10/25/2022 7:00,2022-10-25 01:00:59-06:00,Iridium,46.76078,-113.94974,1400,2.4,3D Validated,Nothing Detected,12,3.36,3.6,Animal with Collar 40907
40907,10/25/2022 4:00,10/24/2022 22:00,10/25/2022 7:00,2022-10-25 01:00:59-06:00,Iridium,46.76074,-113.94979,1391,3.8,3D Validated,Nothing Detected,12,3.36,3.6,Animal with Collar 40907
40907,10/25/2022 3:00,10/24/2022 21:00,10/25/2022 3:01,2022-10-24 21:01:08-06:00,Iridium,46.76078,-113.94975,1404,1.8,3D Validated,Nothing Detected,11,3.36,3.6,Animal with Collar 40907
40907,10/25/2022 2:00,10/24/2022 20:00,10/25/2022 3:01,2022-10-24 21:01:08-06:00,Iridium,46.76075,-113.94971,1420,2.4,3D Validated,Nothing Detected,11,3.36,3.6,Animal with Collar 40907
40907,10/25/2022 1:00,10/24/2022 19:00,10/25/2022 3:01,2022-10-24 21:01:08-06:00,Iridium,46.76071,-113.9498,1391,5.8,3D Validated,Nothing Detected,14,3.36,3.6,Animal with Collar 40907
40907,10/25/2022 0:00,10/24/2022 18:00,10/25/2022 3:01,2022-10-24 21:01:08-06:00,Iridium,46.76075,-113.94963,1404,2.8,3D Validated,Nothing Detected,15,3.28,3.6,Animal with Collar 40907
40907,10/24/2022 23:00,10/24/2022 17:00,10/25/2022 7:01,2022-10-25 01:01:07-06:00,Iridium,46.76066,-113.94986,1408,3.6,3D Validated,Nothing Detected,13,3.36,3.6,Animal with Collar 40907
40907,10/24/2022 22:00,10/24/2022 16:00,10/25/2022 7:01,2022-10-25 01:01:07-06:00,Iridium,46.76073,-113.94976,1405,2.2,3D Validated,Nothing Detected,19,3.28,3.6,Animal with Collar 40907
40907,10/24/2022 21:00,10/24/2022 15:00,10/25/2022 7:01,2022-10-25 01:01:07-06:00,Iridium,46.76073,-113.94968,1401,3.8,3D Validated,Nothing Detected,19,3.28,3.6,Animal with Collar 40907
40907,10/24/2022 20:00,10/24/2022 14:00,10/25/2022 7:01,2022-10-25 01:01:07-06:00,Iridium,46.76076,-113.94978,1403,3.2,3D Validated,Nothing Detected,17,3.36,3.6,Animal with Collar 40907
40907,10/24/2022 18:01,10/24/2022 12:01,10/25/2022 7:01,2022-10-25 01:01:16-06:00,Iridium,46.76075,-113.94981,1403,4,3D Validated,Nothing Detected,14,3.36,3.6,Animal with Collar 40907
40907,10/24/2022 17:00,10/24/2022 11:00,10/25/2022 7:01,2022-10-25 01:01:16-06:00,Iridium,46.76068,-113.94973,1413,4.4,3D Validated,Nothing Detected,13,3.36,3.6,Animal with Collar 40907
40907,10/24/2022 16:01,10/24/2022 10:01,10/25/2022 7:01,2022-10-25 01:01:16-06:00,Iridium,46.76071,-113.94986,1413,4.6,3D Validated,Nothing Detected,11,3.36,3.6,Animal with Collar 40907
40907,10/24/2022 14:00,10/24/2022 8:00,10/25/2022 7:01,2022-10-25 01:01:24-06:00,Iridium,46.76088,-113.94974,1396,2.8,3D Validated,Nothing Detected,9,3.36,3.6,Animal with Collar 40907
40907,10/24/2022 13:00,10/24/2022 7:00,10/25/2022 7:01,2022-10-25 01:01:24-06:00,Iridium,46.76071,-113.94974,1399,4,3D Validated,Nothing Detected,7,3.36,3.6,Animal with Collar 40907
40907,10/24/2022 5:01,10/23/2022 23:01,10/25/2022 7:02,2022-10-25 01:02:37-06:00,Iridium,46.7608,-113.94984,1393,5.6,3D Validated,Nothing Detected,10,3.36,3.6,Animal with Collar 40907
40907,10/23/2022 22:00,10/23/2022 16:00,10/28/2022 7:02,2022-10-28 01:02:18-06:00,Iridium,46.76054,-113.94936,1510,4.8,3D Validated,Nothing Detected,9,3.36,3.6,Animal with Collar 40907
40907,10/23/2022 21:00,10/23/2022 15:00,10/28/2022 7:02,2022-10-28 01:02:18-06:00,Iridium,46.76068,-113.94984,1400,3.4,3D Validated,Nothing Detected,10,3.36,3.6,Animal with Collar 40907
40907,10/23/2022 20:00,10/23/2022 14:00,10/28/2022 7:02,2022-10-28 01:02:18-06:00,Iridium,46.76085,-113.94995,1399,3.6,3D Validated,Nothing Detected,8,3.36,3.6,Animal with Collar 40907
40907,10/23/2022 19:00,10/23/2022 13:00,10/28/2022 7:02,2022-10-28 01:02:27-06:00,Iridium,46.76064,-113.94976,1423,4.8,3D Validated,Nothing Detected,6,3.36,3.6,Animal with Collar 40907
40907,10/23/2022 18:00,10/23/2022 12:00,10/28/2022 7:02,2022-10-28 01:02:27-06:00,Iridium,46.76062,-113.94979,1406,2.2,3D Validated,Nothing Detected,6,3.36,3.6,Animal with Collar 40907
40907,10/23/2022 17:00,10/23/2022 11:00,10/28/2022 7:02,2022-10-28 01:02:27-06:00,Iridium,46.76075,-113.94981,1401,7.2,3D Validated,Nothing Detected,12,3.28,3.6,Animal with Collar 40907
40907,10/23/2022 9:01,10/23/2022 3:01,10/28/2022 7:03,2022-10-28 01:03:24-06:00,Iridium,46.7607,-113.94984,1417,2.6,3D Validated,Nothing Detected,15,3.36,3.6,Animal with Collar 40907
