Collar ID,Acq. Time [UTC],Acq. Time [MST],SCTS [UTC],SCTS [LMT],Origin,Latitude[deg],Longitude[deg],Altitude[m],DOP,Fix Type,Mortality Status,Temp[°C],Main[V],Beacon [V],Animal
40922,11/4/2022 0:00,11/3/2022 18:00,11/4/2022 0:00,2022-11-03 18:00:58-06:00,Iridium,46.70789,-113.89304,1459,2.4,3D Validated,Nothing Detected,11,3.36,3.6,Animal with Collar 40922
40922,11/3/2022 23:00,11/3/2022 17:00,11/4/2022 0:00,2022-11-03 18:00:58-06:00,Iridium,46.70783,-113.89304,1466,4,3D Validated,Nothing Detected,11,3.36,3.6,Animal with Collar 40922
40922,11/3/2022 22:00,11/3/2022 16:00,11/4/2022 0:00,2022-11-03 18:00:58-06:00,Iridium,46.7079,-113.89309,1461,2,3D Validated,Nothing Detected,12,3.36,3.6,Animal with Collar 40922
40922,11/3/2022 21:00,11/3/2022 15:00,11/4/2022 0:00,2022-11-03 18:00:58-06:00,Iridium,46.70796,-113.89299,1457,3.4,3D Validated,Nothing Detected,12,3.28,3.6,Animal with Collar 40922
40922,11/3/2022 20:00,11/3/2022 14:00,11/3/2022 20:01,2022-11-03 14:01:05-06:00,Iridium,46.70802,-113.89322,1449,1.8,3D Validated,Nothing Detected,11,3.28,3.6,Animal with Collar 40922
40922,11/3/2022 19:00,11/3/2022 13:00,11/3/2022 20:01,2022-11-03 14:01:05-06:00,Iridium,46.71569,-113.89549,1401,3.4,3D Validated,Nothing Detected,12,3.28,3.6,Animal with Collar 40922
40922,11/3/2022 18:01,11/3/2022 12:01,11/3/2022 20:01,2022-11-03 14:01:05-06:00,Iridium,46.7136,-113.88945,1430,5.4,3D Validated,Nothing Detected,7,3.28,3.6,Animal with Collar 40922
40922,11/3/2022 17:00,11/3/2022 11:00,11/3/2022 20:01,2022-11-03 14:01:05-06:00,Iridium,46.72154,-113.88615,1563,4,3D Validated,Nothing Detected,7,3.36,3.6,Animal with Collar 40922
40922,11/3/2022 16:00,11/3/2022 10:00,11/3/2022 16:01,2022-11-03 10:01:01-06:00,Iridium,46.72262,-113.88776,1496,2.6,3D Validated,Nothing Detected,6,3.36,3.6,Animal with Collar 40922
40922,11/3/2022 15:01,11/3/2022 9:01,11/3/2022 16:01,2022-11-03 10:01:01-06:00,Iridium,46.72258,-113.88781,1514,2.8,3D Validated,Nothing Detected,7,3.36,3.6,Animal with Collar 40922
40922,11/3/2022 14:00,11/3/2022 8:00,11/3/2022 16:01,2022-11-03 10:01:01-06:00,Iridium,46.72264,-113.8878,1508,3.4,3D Validated,Nothing Detected,7,3.36,3.6,Animal with Collar 40922
40922,11/3/2022 13:00,11/3/2022 7:00,11/3/2022 16:01,2022-11-03 10:01:01-06:00,Iridium,46.7226,-113.88779,1493,2.6,3D Validated,Nothing Detected,6,3.36,3.6,Animal with Collar 40922
40922,11/3/2022 12:00,11/3/2022 6:00,11/3/2022 16:01,2022-11-03 10:01:10-06:00,Iridium,46.72268,-113.8878,1512,6.2,3D Validated,Nothing Detected,7,3.36,3.6,Animal with Collar 40922
40922,11/3/2022 11:00,11/3/2022 5:00,11/3/2022 16:01,2022-11-03 10:01:10-06:00,Iridium,46.72265,-113.88775,1493,2.6,3D Validated,Nothing Detected,7,3.36,3.6,Animal with Collar 40922
40922,11/3/2022 10:00,11/3/2022 4:00,11/3/2022 16:01,2022-11-03 10:01:10-06:00,Iridium,46.72269,-113.88776,1495,2.4,3D Validated,Nothing Detected,8,3.36,3.6,Animal with Collar 40922
40922,11/3/2022 9:00,11/3/2022 3:00,11/3/2022 16:01,2022-11-03 10:01:10-06:00,Iridium,46.72266,-113.88776,1501,2.6,3D Validated,Nothing Detected,8,3.36,3.6,Animal with Collar 40922
40922,11/3/2022 8:00,11/3/2022 2:00,11/3/2022 16:01,2022-11-03 10:01:18-06:00,Iridium,46.72296,-113.88809,1486,5.2,3D Validated,Nothing Detected,9,3.36,3.6,Animal with Collar 40922
40922,11/3/2022 7:01,11/3/2022 1:01,11/3/2022 16:01,2022-11-03 10:01:18-06:00,Iridium,46.72264,-113.88782,1518,3.4,3D Validated,Nothing Detected,12,3.36,3.6,Animal with Collar 40922
40922,11/3/2022 6:01,11/3/2022 0:01,11/3/2022 16:01,2022-11-03 10:01:18-06:00,Iridium,46.72265,-113.88773,1498,4,3D Validated,Nothing Detected,11,3.36,3.6,Animal with Collar 40922
40922,11/3/2022 5:00,11/2/2022 23:00,11/3/2022 16:01,2022-11-03 10:01:18-06:00,Iridium,46.72281,-113.88786,1479,4.4,3D Validated,Nothing Detected,9,3.36,3.6,Animal with Collar 40922
40922,11/3/2022 4:00,11/2/2022 22:00,11/3/2022 16:01,2022-11-03 10:01:25-06:00,Iridium,46.7227,-113.88779,1488,6.8,3D Validated,Nothing Detected,8,3.36,3.6,Animal with Collar 40922
40922,11/3/2022 3:00,11/2/2022 21:00,11/3/2022 16:01,2022-11-03 10:01:25-06:00,Iridium,46.72248,-113.88785,1513,2.8,3D Validated,Nothing Detected,7,3.36,3.6,Animal with Collar 40922
40922,11/3/2022 2:02,11/2/2022 20:02,11/3/2022 16:01,2022-11-03 10:01:25-06:00,Iridium,46.7243,-113.88772,1438,9.6,3D Validated,Nothing Detected,8,3.36,3.6,Animal with Collar 40922
40922,11/3/2022 1:00,11/2/2022 19:00,11/3/2022 16:01,2022-11-03 10:01:25-06:00,Iridium,46.72451,-113.88844,1444,2.8,3D Validated,Nothing Detected,8,3.36,3.6,Animal with Collar 40922
40922,11/3/2022 0:00,11/2/2022 18:00,11/3/2022 16:01,2022-11-03 10:01:44-06:00,Iridium,46.72452,-113.88847,1431,2.2,3D Validated,Nothing Detected,9,3.36,3.6,Animal with Collar 40922
40922,11/2/2022 23:00,11/2/2022 17:00,11/3/2022 16:01,2022-11-03 10:01:44-06:00,Iridium,46.72393,-113.88815,1348,4,3D Validated,Nothing Detected,13,3.36,3.6,Animal with Collar 40922
40922,11/2/2022 22:00,11/2/2022 16:00,11/3/2022 16:01,2022-11-03 10:01:44-06:00,Iridium,46.7245,-113.8885,1436,2,3D Validated,Nothing Detected,12,3.36,3.6,Animal with Collar 40922
40922,11/2/2022 21:00,11/2/2022 15:00,11/3/2022 16:01,2022-11-03 10:01:44-06:00,Iridium,46.72452,-113.88849,1429,2.4,3D Validated,Nothing Detected,13,3.36,3.6,Animal with Collar 40922
40922,11/2/2022 20:00,11/2/2022 14:00,11/2/2022 20:01,2022-11-02 14:01:37-06:00,Iridium,46.72451,-113.8885,1430,2.4,3D Validated,Nothing Detected,12,3.36,3.6,Animal with Collar 40922
40922,11/2/2022 19:00,11/2/2022 13:00,11/2/2022 20:01,2022-11-02 14:01:37-06:00,Iridium,46.72438,-113.88842,1421,4.4,3D Validated,Nothing Detected,11,3.36,3.6,Animal with Collar 40922
40922,11/2/2022 18:00,11/2/2022 12:00,11/2/2022 20:01,2022-11-02 14:01:37-06:00,Iridium,46.72459,-113.88837,1444,3.2,3D Validated,Nothing Detected,13,3.36,3.6,Animal with Collar 40922
40922,11/2/2022 17:00,11/2/2022 11:00,11/2/2022 20:01,2022-11-02 14:01:37-06:00,Iridium,46.72459,-113.88848,1446,1.8,3D Validated,Nothing Detected,11,3.36,3.6,Animal with Collar 40922
40922,11/2/2022 16:00,11/2/2022 10:00,11/2/2022 16:01,2022-11-02 10:01:02-06:00,Iridium,46.72455,-113.88847,1437,1.8,3D Validated,Nothing Detected,10,3.36,3.6,Animal with Collar 40922
40922,11/2/2022 15:00,11/2/2022 9:00,11/2/2022 16:01,2022-11-02 10:01:02-06:00,Iridium,46.72452,-113.8885,1426,3.6,3D Validated,Nothing Detected,10,3.36,3.6,Animal with Collar 40922
40922,11/2/2022 14:02,11/2/2022 8:02,11/2/2022 16:01,2022-11-02 10:01:02-06:00,Iridium,46.72554,-113.88863,1377,4.4,3D Validated,Nothing Detected,7,3.28,3.6,Animal with Collar 40922
40922,11/2/2022 13:00,11/2/2022 7:00,11/2/2022 16:01,2022-11-02 10:01:02-06:00,Iridium,46.73581,-113.89139,1686,2.6,3D Validated,Nothing Detected,10,3.28,3.6,Animal with Collar 40922
40922,11/2/2022 12:00,11/2/2022 6:00,11/2/2022 16:01,2022-11-02 10:01:11-06:00,Iridium,46.74226,-113.89715,1753,4.8,3D Validated,Nothing Detected,10,3.28,3.6,Animal with Collar 40922
40922,11/2/2022 11:00,11/2/2022 5:00,11/2/2022 16:01,2022-11-02 10:01:11-06:00,Iridium,46.7413,-113.89716,1802,1.8,3D Validated,Nothing Detected,9,3.28,3.6,Animal with Collar 40922
40922,11/2/2022 10:00,11/2/2022 4:00,11/2/2022 16:01,2022-11-02 10:01:11-06:00,Iridium,46.74202,-113.90128,1743,2.8,3D Validated,Nothing Detected,15,3.36,3.6,Animal with Collar 40922
40922,11/2/2022 9:00,11/2/2022 3:00,11/2/2022 16:01,2022-11-02 10:01:11-06:00,Iridium,46.74199,-113.90127,1743,2,3D Validated,Nothing Detected,13,3.36,3.6,Animal with Collar 40922
40922,11/2/2022 8:00,11/2/2022 2:00,11/2/2022 8:00,2022-11-02 02:00:36-06:00,Iridium,46.74173,-113.90204,1727,3,3D Validated,Nothing Detected,10,3.36,3.6,Animal with Collar 40922
40922,11/2/2022 7:00,11/2/2022 1:00,11/2/2022 8:00,2022-11-02 02:00:36-06:00,Iridium,46.7416,-113.90198,1741,2.8,3D Validated,Nothing Detected,10,3.36,3.6,Animal with Collar 40922
40922,11/2/2022 6:00,11/2/2022 0:00,11/2/2022 8:00,2022-11-02 02:00:36-06:00,Iridium,46.74189,-113.90205,1731,3.4,3D Validated,Nothing Detected,15,3.28,3.6,Animal with Collar 40922
40922,11/2/2022 5:01,11/1/2022 23:01,11/2/2022 8:00,2022-11-02 02:00:36-06:00,Iridium,46.74486,-113.9042,1489,4,3D Validated,Nothing Detected,15,3.28,3.6,Animal with Collar 40922
40922,11/2/2022 4:01,11/1/2022 22:01,11/2/2022 4:02,2022-11-01 22:02:45-06:00,Iridium,46.7518,-113.91476,1625,3.6,3D Validated,Nothing Detected,16,3.28,3.6,Animal with Collar 40922
40922,11/2/2022 3:00,11/1/2022 21:00,11/2/2022 4:02,2022-11-01 22:02:45-06:00,Iridium,46.7596,-113.91842,1626,4.4,3D Validated,Nothing Detected,15,3.36,3.6,Animal with Collar 40922
40922,11/2/2022 2:00,11/1/2022 20:00,11/2/2022 4:02,2022-11-01 22:02:45-06:00,Iridium,46.76022,-113.91627,1629,3.4,3D Validated,Nothing Detected,15,3.36,3.6,Animal with Collar 40922
40922,11/2/2022 1:01,11/1/2022 19:01,11/2/2022 4:02,2022-11-01 22:02:45-06:00,Iridium,46.76021,-113.91631,1617,3.2,3D Validated,Nothing Detected,17,3.36,3.6,Animal with Collar 40922
40922,11/2/2022 0:00,11/1/2022 18:00,11/2/2022 4:03,2022-11-01 22:03:31-06:00,Iridium,46.76035,-113.9164,1640,3.8,3D Validated,Nothing Detected,19,3.36,3.6,Animal with Collar 40922
40922,11/1/2022 23:00,11/1/2022 17:00,11/2/2022 4:03,2022-11-01 22:03:31-06:00,Iridium,46.75995,-113.91633,1603,3.4,3D Validated,Nothing Detected,19,3.36,3.6,Animal with Collar 40922
40922,11/1/2022 22:00,11/1/2022 16:00,11/2/2022 4:03,2022-11-01 22:03:31-06:00,Iridium,46.7602,-113.91635,1620,1.6,3D Validated,Nothing Detected,19,3.36,3.6,Animal with Collar 40922
40922,11/1/2022 21:00,11/1/2022 15:00,11/2/2022 4:03,2022-11-01 22:03:31-06:00,Iridium,46.76027,-113.91637,1632,3,3D Validated,Nothing Detected,20,3.36,3.6,Animal with Collar 40922
40922,11/1/2022 20:00,11/1/2022 14:00,11/1/2022 20:01,2022-11-01 14:01:29-06:00,Iridium,46.76026,-113.91639,1617,2,3D Validated,Nothing Detected,20,3.36,3.6,Animal with Collar 40922
40922,11/1/2022 19:00,11/1/2022 13:00,11/1/2022 20:01,2022-11-01 14:01:29-06:00,Iridium,46.76023,-113.91615,1623,4.6,3D Validated,Nothing Detected,20,3.36,3.6,Animal with Collar 40922
40922,11/1/2022 18:00,11/1/2022 12:00,11/1/2022 20:01,2022-11-01 14:01:29-06:00,Iridium,46.7622,-113.91046,1559,3.2,3D Validated,Nothing Detected,20,3.36,3.6,Animal with Collar 40922
40922,11/1/2022 17:00,11/1/2022 11:00,11/1/2022 20:01,2022-11-01 14:01:29-06:00,Iridium,46.76149,-113.90507,1722,3.2,3D Validated,Nothing Detected,17,3.36,3.6,Animal with Collar 40922
40922,11/1/2022 16:00,11/1/2022 10:00,11/1/2022 16:01,2022-11-01 10:01:36-06:00,Iridium,46.76152,-113.90505,1738,2.8,3D Validated,Nothing Detected,15,3.36,3.6,Animal with Collar 40922
40922,11/1/2022 15:00,11/1/2022 9:00,11/1/2022 16:01,2022-11-01 10:01:36-06:00,Iridium,46.76149,-113.90511,1727,2,3D Validated,Nothing Detected,13,3.36,3.6,Animal with Collar 40922
40922,11/1/2022 14:00,11/1/2022 8:00,11/1/2022 16:01,2022-11-01 10:01:36-06:00,Iridium,46.76152,-113.90513,1719,2.6,3D Validated,Nothing Detected,15,3.36,3.6,Animal with Collar 40922
40922,11/1/2022 13:00,11/1/2022 7:00,11/1/2022 16:01,2022-11-01 10:01:36-06:00,Iridium,46.76147,-113.90514,1740,2.6,3D Validated,Nothing Detected,14,3.36,3.6,Animal with Collar 40922
40922,11/1/2022 12:00,11/1/2022 6:00,11/1/2022 16:01,2022-11-01 10:01:46-06:00,Iridium,46.76151,-113.90507,1719,2.6,3D Validated,Nothing Detected,15,3.28,3.6,Animal with Collar 40922
40922,11/1/2022 11:00,11/1/2022 5:00,11/1/2022 16:01,2022-11-01 10:01:46-06:00,Iridium,46.75758,-113.90012,1930,2,3D Validated,Nothing Detected,12,3.28,3.6,Animal with Collar 40922
40922,11/1/2022 10:00,11/1/2022 4:00,11/1/2022 16:01,2022-11-01 10:01:46-06:00,Iridium,46.76277,-113.88858,1983,2.2,3D Validated,Nothing Detected,13,3.28,3.6,Animal with Collar 40922
40922,11/1/2022 9:00,11/1/2022 3:00,11/1/2022 16:01,2022-11-01 10:01:46-06:00,Iridium,46.76711,-113.88116,1933,1.6,3D Validated,Nothing Detected,10,3.36,3.6,Animal with Collar 40922
40922,11/1/2022 8:00,11/1/2022 2:00,11/1/2022 16:01,2022-11-01 10:01:57-06:00,Iridium,46.76795,-113.8791,1903,3.8,3D Validated,Nothing Detected,8,3.36,3.6,Animal with Collar 40922
40922,11/1/2022 7:01,11/1/2022 1:01,11/1/2022 16:01,2022-11-01 10:01:57-06:00,Iridium,46.7679,-113.87907,1889,4,3D Validated,Nothing Detected,10,3.36,3.6,Animal with Collar 40922
40922,11/1/2022 6:00,11/1/2022 0:00,11/1/2022 16:01,2022-11-01 10:01:57-06:00,Iridium,46.76794,-113.87912,1884,2.2,3D Validated,Nothing Detected,11,3.36,3.6,Animal with Collar 40922
40922,11/1/2022 5:00,10/31/2022 23:00,11/1/2022 16:01,2022-11-01 10:01:57-06:00,Iridium,46.76804,-113.87918,1907,5.8,3D Validated,Nothing Detected,9,3.36,3.68,Animal with Collar 40922
40922,11/1/2022 4:00,10/31/2022 22:00,11/1/2022 16:02,2022-11-01 10:02:09-06:00,Iridium,46.76787,-113.8791,1887,3.4,3D Validated,Nothing Detected,10,3.36,3.6,Animal with Collar 40922
40922,11/1/2022 3:00,10/31/2022 21:00,11/1/2022 16:02,2022-11-01 10:02:09-06:00,Iridium,46.76787,-113.87913,1873,4.6,3D Validated,Nothing Detected,9,3.36,3.6,Animal with Collar 40922
40922,11/1/2022 2:00,10/31/2022 20:00,11/1/2022 16:02,2022-11-01 10:02:09-06:00,Iridium,46.76793,-113.87906,1883,3.2,3D Validated,Nothing Detected,10,3.36,3.6,Animal with Collar 40922
40922,11/1/2022 1:00,10/31/2022 19:00,11/1/2022 16:02,2022-11-01 10:02:09-06:00,Iridium,46.7679,-113.87907,1883,3.4,3D Validated,Nothing Detected,8,3.36,3.6,Animal with Collar 40922
40922,11/1/2022 0:00,10/31/2022 18:00,11/1/2022 16:02,2022-11-01 10:02:17-06:00,Iridium,46.7678,-113.87911,1861,3.8,3D Validated,Nothing Detected,8,3.36,3.6,Animal with Collar 40922
40922,10/31/2022 23:00,10/31/2022 17:00,11/1/2022 16:02,2022-11-01 10:02:17-06:00,Iridium,46.76802,-113.87906,1893,3.4,3D Validated,Nothing Detected,8,3.36,3.6,Animal with Collar 40922
40922,10/31/2022 22:00,10/31/2022 16:00,11/1/2022 16:02,2022-11-01 10:02:17-06:00,Iridium,46.76791,-113.87907,1885,3.6,3D Validated,Nothing Detected,6,3.36,3.6,Animal with Collar 40922
40922,10/31/2022 21:00,10/31/2022 15:00,11/1/2022 16:02,2022-11-01 10:02:17-06:00,Iridium,46.76774,-113.87927,1842,5,3D Validated,Nothing Detected,8,3.36,3.6,Animal with Collar 40922
40922,10/31/2022 20:00,10/31/2022 14:00,10/31/2022 20:00,2022-10-31 14:00:39-06:00,Iridium,46.76796,-113.87908,1888,2,3D Validated,Nothing Detected,8,3.36,3.6,Animal with Collar 40922
40922,10/31/2022 19:00,10/31/2022 13:00,10/31/2022 20:00,2022-10-31 14:00:39-06:00,Iridium,46.76793,-113.87907,1893,2.4,3D Validated,Nothing Detected,9,3.36,3.6,Animal with Collar 40922
40922,10/31/2022 18:00,10/31/2022 12:00,10/31/2022 20:00,2022-10-31 14:00:39-06:00,Iridium,46.76795,-113.87911,1894,4.2,3D Validated,Nothing Detected,12,3.36,3.6,Animal with Collar 40922
40922,10/31/2022 17:00,10/31/2022 11:00,10/31/2022 20:00,2022-10-31 14:00:39-06:00,Iridium,46.76799,-113.87918,1902,3,3D Validated,Nothing Detected,11,3.36,3.6,Animal with Collar 40922
40922,10/31/2022 16:00,10/31/2022 10:00,10/31/2022 16:02,2022-10-31 10:02:11-06:00,Iridium,46.76787,-113.87914,1886,2.8,3D Validated,Nothing Detected,11,3.36,3.6,Animal with Collar 40922
40922,10/31/2022 15:00,10/31/2022 9:00,10/31/2022 16:02,2022-10-31 10:02:11-06:00,Iridium,46.76783,-113.87923,1872,5.8,3D Validated,Nothing Detected,13,3.36,3.6,Animal with Collar 40922
40922,10/31/2022 14:00,10/31/2022 8:00,10/31/2022 16:02,2022-10-31 10:02:11-06:00,Iridium,46.76794,-113.87903,1892,7.8,3D Validated,Nothing Detected,14,3.28,3.6,Animal with Collar 40922
40922,10/31/2022 13:00,10/31/2022 7:00,10/31/2022 16:02,2022-10-31 10:02:11-06:00,Iridium,46.77177,-113.87144,1690,6.8,3D Validated,Nothing Detected,14,3.36,3.6,Animal with Collar 40922
40922,10/31/2022 12:00,10/31/2022 6:00,10/31/2022 12:00,2022-10-31 06:00:59-06:00,Iridium,46.77774,-113.86772,1780,4.4,3D Validated,Nothing Detected,12,3.36,3.6,Animal with Collar 40922
40922,10/31/2022 11:00,10/31/2022 5:00,10/31/2022 12:00,2022-10-31 06:00:59-06:00,Iridium,46.77777,-113.86774,1773,2.6,3D Validated,Nothing Detected,14,3.36,3.6,Animal with Collar 40922
40922,10/31/2022 10:00,10/31/2022 4:00,10/31/2022 12:00,2022-10-31 06:00:59-06:00,Iridium,46.77779,-113.86777,1783,9.2,3D Validated,Nothing Detected,15,3.28,3.6,Animal with Collar 40922
40922,10/31/2022 9:00,10/31/2022 3:00,10/31/2022 12:00,2022-10-31 06:00:59-06:00,Iridium,46.77305,-113.86488,1820,2.6,3D Validated,Nothing Detected,15,3.28,3.6,Animal with Collar 40922
40922,10/31/2022 8:00,10/31/2022 2:00,10/31/2022 8:01,2022-10-31 02:01:06-06:00,Iridium,46.76774,-113.87508,1925,2.8,3D Validated,Nothing Detected,13,3.28,3.6,Animal with Collar 40922
40922,10/31/2022 7:00,10/31/2022 1:00,10/31/2022 8:01,2022-10-31 02:01:06-06:00,Iridium,46.76486,-113.88994,1836,4.2,3D Validated,Nothing Detected,15,3.28,3.6,Animal with Collar 40922
40922,10/31/2022 6:00,10/31/2022 0:00,10/31/2022 8:01,2022-10-31 02:01:06-06:00,Iridium,46.76176,-113.90127,1775,3.2,3D Validated,Nothing Detected,17,3.28,3.6,Animal with Collar 40922
40922,10/31/2022 5:00,10/30/2022 23:00,10/31/2022 8:01,2022-10-31 02:01:06-06:00,Iridium,46.75427,-113.91576,1587,2.6,3D Validated,Nothing Detected,18,3.36,3.6,Animal with Collar 40922
40922,10/31/2022 4:00,10/30/2022 22:00,10/31/2022 8:01,2022-10-31 02:01:13-06:00,Iridium,46.74589,-113.92855,1411,2.6,3D Validated,Nothing Detected,18,3.36,3.6,Animal with Collar 40922
40922,10/31/2022 3:00,10/30/2022 21:00,10/31/2022 8:01,2022-10-31 02:01:13-06:00,Iridium,46.74039,-113.91621,1386,4.8,3D Validated,Nothing Detected,18,3.36,3.6,Animal with Collar 40922
40922,10/31/2022 2:00,10/30/2022 20:00,10/31/2022 8:01,2022-10-31 02:01:13-06:00,Iridium,46.73202,-113.9056,1570,1.6,3D Validated,Nothing Detected,18,3.36,3.6,Animal with Collar 40922
40922,10/31/2022 1:00,10/30/2022 19:00,10/31/2022 8:01,2022-10-31 02:01:13-06:00,Iridium,46.72823,-113.89258,1404,3.4,3D Validated,Nothing Detected,18,3.36,3.6,Animal with Collar 40922
40922,10/31/2022 0:00,10/30/2022 18:00,10/31/2022 8:01,2022-10-31 02:01:22-06:00,Iridium,46.72812,-113.8925,1410,3.4,3D Validated,Nothing Detected,18,3.36,3.6,Animal with Collar 40922
40922,10/30/2022 23:00,10/30/2022 17:00,10/31/2022 8:01,2022-10-31 02:01:22-06:00,Iridium,46.72817,-113.89258,1404,2.6,3D Validated,Nothing Detected,19,3.36,3.6,Animal with Collar 40922
40922,10/30/2022 22:00,10/30/2022 16:00,10/31/2022 8:01,2022-10-31 02:01:22-06:00,Iridium,46.72816,-113.8925,1430,3.6,3D Validated,Nothing Detected,21,3.36,3.6,Animal with Collar 40922
40922,10/30/2022 21:00,10/30/2022 15:00,10/31/2022 8:01,2022-10-31 02:01:22-06:00,Iridium,46.72815,-113.89253,1406,5.6,3D Validated,Nothing Detected,21,3.36,3.6,Animal with Collar 40922
40922,10/30/2022 20:01,10/30/2022 14:01,10/31/2022 8:01,2022-10-31 02:01:42-06:00,Iridium,46.72651,-113.88972,1389,5.8,3D Validated,Nothing Detected,21,3.28,3.6,Animal with Collar 40922
40922,10/30/2022 19:00,10/30/2022 13:00,10/31/2022 8:01,2022-10-31 02:01:42-06:00,Iridium,46.71715,-113.87086,1544,5.2,3D Validated,Nothing Detected,19,3.36,3.6,Animal with Collar 40922
40922,10/30/2022 18:00,10/30/2022 12:00,10/31/2022 8:01,2022-10-31 02:01:42-06:00,Iridium,46.70849,-113.87507,1575,4.4,3D Validated,Nothing Detected,19,3.28,3.6,Animal with Collar 40922
40922,10/30/2022 17:00,10/30/2022 11:00,10/31/2022 8:01,2022-10-31 02:01:42-06:00,Iridium,46.70897,-113.87602,1651,3.2,3D Validated,Nothing Detected,19,3.36,3.6,Animal with Collar 40922
40922,10/30/2022 16:01,10/30/2022 10:01,10/30/2022 16:02,2022-10-30 10:02:19-06:00,Iridium,46.70813,-113.8755,1596,4.6,3D Validated,Nothing Detected,17,3.28,3.6,Animal with Collar 40922
40922,10/30/2022 15:00,10/30/2022 9:00,10/30/2022 16:02,2022-10-30 10:02:19-06:00,Iridium,46.70277,-113.87223,1803,5.2,3D Validated,Nothing Detected,15,3.28,3.6,Animal with Collar 40922
40922,10/30/2022 14:00,10/30/2022 8:00,10/30/2022 16:02,2022-10-30 10:02:19-06:00,Iridium,46.69962,-113.88299,1790,2,3D Validated,Nothing Detected,17,3.36,3.6,Animal with Collar 40922
40922,10/30/2022 4:03,10/29/2022 22:03,10/31/2022 8:02,2022-10-31 02:02:30-06:00,Iridium,46.69819,-113.88307,1736,8.6,3D,Nothing Detected,16,3.28,3.6,Animal with Collar 40922
40922,10/30/2022 3:01,10/29/2022 21:01,10/31/2022 8:02,2022-10-31 02:02:30-06:00,Iridium,46.69811,-113.8831,1742,2.8,3D Validated,Nothing Detected,18,3.28,3.6,Animal with Collar 40922
40922,10/30/2022 1:02,10/29/2022 19:02,10/31/2022 8:02,2022-10-31 02:02:30-06:00,Iridium,46.69806,-113.88307,1750,4,3D Validated,Nothing Detected,19,3.28,3.6,Animal with Collar 40922
40922,10/29/2022 22:01,10/29/2022 16:01,10/31/2022 8:02,2022-10-31 02:02:40-06:00,Iridium,46.69806,-113.88302,1758,3.6,3D Validated,Nothing Detected,23,3.36,3.6,Animal with Collar 40922
40922,10/29/2022 21:00,10/29/2022 15:00,10/31/2022 8:02,2022-10-31 02:02:40-06:00,Iridium,46.69806,-113.88305,1755,3,3D Validated,Nothing Detected,28,3.28,3.6,Animal with Collar 40922
40922,10/29/2022 20:01,10/29/2022 14:01,10/29/2022 20:01,2022-10-29 14:01:29-06:00,Iridium,46.69808,-113.88309,1756,6.8,3D Validated,Nothing Detected,19,3.28,3.6,Animal with Collar 40922
40922,10/28/2022 21:01,10/28/2022 15:01,10/29/2022 20:02,2022-10-29 14:02:40-06:00,Iridium,46.69807,-113.88304,1760,3,3D Validated,Nothing Detected,19,3.36,3.6,Animal with Collar 40922
40922,10/27/2022 21:00,10/27/2022 15:00,10/29/2022 20:03,2022-10-29 14:03:32-06:00,Iridium,46.69805,-113.88303,1751,3.2,3D Validated,Nothing Detected,21,3.36,3.6,Animal with Collar 40922
40922,10/27/2022 16:00,10/27/2022 10:00,10/29/2022 20:03,2022-10-29 14:03:57-06:00,Iridium,46.69803,-113.88303,1751,2.4,3D Validated,Nothing Detected,12,3.28,3.6,Animal with Collar 40922
40922,10/27/2022 1:02,10/26/2022 19:02,10/31/2022 8:02,2022-10-31 02:02:49-06:00,Iridium,46.69808,-113.88303,1748,3.8,3D Validated,Nothing Detected,17,3.36,3.6,Animal with Collar 40922
40922,10/25/2022 7:00,10/25/2022 1:00,10/31/2022 12:01,2022-10-31 06:01:50-06:00,Iridium,46.70607,-113.87779,1707,3.2,3D Validated,Nothing Detected,13,3.36,3.6,Animal with Collar 40922
40922,10/25/2022 6:00,10/25/2022 0:00,10/31/2022 12:01,2022-10-31 06:01:57-06:00,Iridium,46.70729,-113.87608,1678,2.2,3D Validated,Nothing Detected,15,3.36,3.6,Animal with Collar 40922
40922,10/25/2022 5:00,10/24/2022 23:00,10/31/2022 12:01,2022-10-31 06:01:57-06:00,Iridium,46.70723,-113.87601,1644,2.8,3D Validated,Nothing Detected,16,3.36,3.6,Animal with Collar 40922
40922,10/25/2022 4:01,10/24/2022 22:01,10/31/2022 12:01,2022-10-31 06:01:57-06:00,Iridium,46.70735,-113.87616,1664,3,3D Validated,Nothing Detected,14,3.36,3.6,Animal with Collar 40922
40922,10/25/2022 3:00,10/24/2022 21:00,10/31/2022 12:01,2022-10-31 06:01:57-06:00,Iridium,46.70723,-113.8761,1649,3,3D Validated,Nothing Detected,11,3.36,3.6,Animal with Collar 40922
40922,10/25/2022 2:00,10/24/2022 20:00,10/31/2022 12:02,2022-10-31 06:02:54-06:00,Iridium,46.70733,-113.87601,1660,1.8,3D Validated,Nothing Detected,13,3.36,3.6,Animal with Collar 40922
40922,10/25/2022 1:00,10/24/2022 19:00,10/31/2022 12:02,2022-10-31 06:02:54-06:00,Iridium,46.70714,-113.8762,1612,2.4,3D Validated,Nothing Detected,13,3.36,3.6,Animal with Collar 40922
40922,10/25/2022 0:00,10/24/2022 18:00,10/31/2022 12:02,2022-10-31 06:02:54-06:00,Iridium,46.7072,-113.87605,1646,3.8,3D Validated,Nothing Detected,13,3.36,3.6,Animal with Collar 40922
40922,10/24/2022 23:00,10/24/2022 17:00,10/31/2022 12:02,2022-10-31 06:02:54-06:00,Iridium,46.70724,-113.87602,1656,3.4,3D Validated,Nothing Detected,13,3.36,3.6,Animal with Collar 40922
40922,10/24/2022 22:00,10/24/2022 16:00,10/31/2022 12:03,2022-10-31 06:03:01-06:00,Iridium,46.70725,-113.87598,1661,3.6,3D Validated,Nothing Detected,15,3.36,3.6,Animal with Collar 40922
40922,10/24/2022 21:00,10/24/2022 15:00,10/31/2022 12:03,2022-10-31 06:03:01-06:00,Iridium,46.70729,-113.87601,1649,2.4,3D Validated,Nothing Detected,15,3.36,3.6,Animal with Collar 40922
40922,10/24/2022 20:00,10/24/2022 14:00,10/24/2022 20:00,2022-10-24 14:00:39-06:00,Iridium,46.7073,-113.87608,1650,3.2,3D Validated,Nothing Detected,15,3.36,3.6,Animal with Collar 40922
40922,10/24/2022 19:00,10/24/2022 13:00,10/24/2022 20:00,2022-10-24 14:00:39-06:00,Iridium,46.70721,-113.87607,1654,2,3D Validated,Nothing Detected,15,3.36,3.6,Animal with Collar 40922
40922,10/24/2022 18:00,10/24/2022 12:00,10/24/2022 20:00,2022-10-24 14:00:39-06:00,Iridium,46.70808,-113.87607,1598,3.4,3D Validated,Nothing Detected,17,3.28,3.6,Animal with Collar 40922
40922,10/24/2022 16:00,10/24/2022 10:00,10/24/2022 16:01,2022-10-24 10:01:26-06:00,Iridium,46.70851,-113.87504,1579,3.2,3D Validated,Nothing Detected,9,3.36,3.6,Animal with Collar 40922
40922,10/24/2022 15:00,10/24/2022 9:00,10/24/2022 16:01,2022-10-24 10:01:26-06:00,Iridium,46.70572,-113.87551,1771,2.2,3D Validated,Nothing Detected,10,3.36,3.6,Animal with Collar 40922
40922,10/24/2022 14:00,10/24/2022 8:00,10/24/2022 16:01,2022-10-24 10:01:26-06:00,Iridium,46.70569,-113.87555,1766,2.2,3D Validated,Nothing Detected,10,3.36,3.6,Animal with Collar 40922
40922,10/24/2022 13:00,10/24/2022 7:00,10/24/2022 16:01,2022-10-24 10:01:26-06:00,Iridium,46.7057,-113.87552,1760,2.8,3D Validated,Nothing Detected,9,3.36,3.6,Animal with Collar 40922
40922,10/24/2022 12:00,10/24/2022 6:00,10/24/2022 12:01,2022-10-24 06:01:02-06:00,Iridium,46.70572,-113.87554,1763,2.6,3D Validated,Nothing Detected,8,3.36,3.6,Animal with Collar 40922
40922,10/24/2022 11:00,10/24/2022 5:00,10/24/2022 12:01,2022-10-24 06:01:02-06:00,Iridium,46.70556,-113.8756,1766,5,3D Validated,Nothing Detected,7,3.28,3.6,Animal with Collar 40922
40922,10/24/2022 9:00,10/24/2022 3:00,10/24/2022 12:01,2022-10-24 06:01:02-06:00,Iridium,46.70398,-113.88382,1676,2.2,3D Validated,Nothing Detected,13,3.36,3.6,Animal with Collar 40922
40922,10/24/2022 8:00,10/24/2022 2:00,10/24/2022 12:01,2022-10-24 06:01:12-06:00,Iridium,46.70402,-113.88384,1713,3,3D Validated,Nothing Detected,13,3.36,3.6,Animal with Collar 40922
40922,10/24/2022 7:00,10/24/2022 1:00,10/24/2022 12:01,2022-10-24 06:01:12-06:00,Iridium,46.70387,-113.88399,1636,3.6,3D Validated,Nothing Detected,13,3.36,3.6,Animal with Collar 40922
40922,10/24/2022 6:02,10/24/2022 0:02,10/24/2022 12:01,2022-10-24 06:01:12-06:00,Iridium,46.70403,-113.88389,1666,3.4,3D Validated,Nothing Detected,13,3.36,3.6,Animal with Collar 40922
40922,10/24/2022 5:00,10/23/2022 23:00,10/24/2022 12:01,2022-10-24 06:01:12-06:00,Iridium,46.70396,-113.8838,1651,4,3D Validated,Nothing Detected,12,3.36,3.6,Animal with Collar 40922
40922,10/24/2022 4:00,10/23/2022 22:00,10/24/2022 12:01,2022-10-24 06:01:35-06:00,Iridium,46.70394,-113.88397,1685,2.2,3D Validated,Nothing Detected,13,3.36,3.6,Animal with Collar 40922
40922,10/24/2022 3:00,10/23/2022 21:00,10/24/2022 12:01,2022-10-24 06:01:35-06:00,Iridium,46.70367,-113.88407,1648,5.8,3D Validated,Nothing Detected,12,3.36,3.6,Animal with Collar 40922
40922,10/24/2022 2:00,10/23/2022 20:00,10/24/2022 12:01,2022-10-24 06:01:35-06:00,Iridium,46.70397,-113.88377,1666,3.4,3D Validated,Nothing Detected,12,3.36,3.6,Animal with Collar 40922
40922,10/24/2022 1:00,10/23/2022 19:00,10/24/2022 12:01,2022-10-24 06:01:35-06:00,Iridium,46.70398,-113.88386,1668,2.6,3D Validated,Nothing Detected,12,3.36,3.6,Animal with Collar 40922
40922,10/24/2022 0:00,10/23/2022 18:00,10/24/2022 12:01,2022-10-24 06:01:46-06:00,Iridium,46.7039,-113.88405,1681,2.6,3D Validated,Nothing Detected,12,3.36,3.6,Animal with Collar 40922
40922,10/23/2022 23:00,10/23/2022 17:00,10/24/2022 12:01,2022-10-24 06:01:46-06:00,Iridium,46.70395,-113.88382,1688,3.4,3D Validated,Nothing Detected,13,3.36,3.6,Animal with Collar 40922
40922,10/23/2022 22:00,10/23/2022 16:00,10/24/2022 12:01,2022-10-24 06:01:46-06:00,Iridium,46.70399,-113.88374,1689,5.6,3D Validated,Nothing Detected,14,3.36,3.6,Animal with Collar 40922
40922,10/23/2022 21:00,10/23/2022 15:00,10/24/2022 12:01,2022-10-24 06:01:46-06:00,Iridium,46.70392,-113.88374,1652,2.2,3D Validated,Nothing Detected,14,3.36,3.6,Animal with Collar 40922
40922,10/23/2022 20:00,10/23/2022 14:00,10/24/2022 16:01,2022-10-24 10:01:40-06:00,Iridium,46.70392,-113.88382,1669,3.2,3D Validated,Nothing Detected,12,3.28,3.6,Animal with Collar 40922
40922,10/23/2022 19:00,10/23/2022 13:00,10/24/2022 16:01,2022-10-24 10:01:40-06:00,Iridium,46.70648,-113.88083,1673,4,3D Validated,Nothing Detected,12,3.28,3.6,Animal with Collar 40922
40922,10/23/2022 18:00,10/23/2022 12:00,10/24/2022 16:01,2022-10-24 10:01:40-06:00,Iridium,46.70851,-113.87508,1581,2.6,3D Validated,Nothing Detected,16,3.28,3.6,Animal with Collar 40922
40922,10/23/2022 17:01,10/23/2022 11:01,10/24/2022 16:01,2022-10-24 10:01:40-06:00,Iridium,46.70856,-113.87522,1603,4,3D Validated,Nothing Detected,12,3.28,3.6,Animal with Collar 40922
40922,10/23/2022 15:00,10/23/2022 9:00,10/24/2022 20:00,2022-10-24 14:00:49-06:00,Iridium,46.72221,-113.89191,1487,1.8,3D Validated,Nothing Detected,14,3.36,3.6,Animal with Collar 40922
40922,10/23/2022 14:00,10/23/2022 8:00,10/24/2022 20:00,2022-10-24 14:00:49-06:00,Iridium,46.72212,-113.89206,1483,1.8,3D Validated,Nothing Detected,13,3.36,3.6,Animal with Collar 40922
40922,10/23/2022 13:00,10/23/2022 7:00,10/24/2022 20:00,2022-10-24 14:00:49-06:00,Iridium,46.72205,-113.89203,1484,1.6,3D Validated,Nothing Detected,14,3.36,3.6,Animal with Collar 40922
40922,10/23/2022 12:00,10/23/2022 6:00,10/24/2022 20:00,2022-10-24 14:00:57-06:00,Iridium,46.72201,-113.892,1500,4,3D Validated,Nothing Detected,11,3.36,3.6,Animal with Collar 40922
40922,10/23/2022 11:00,10/23/2022 5:00,10/24/2022 20:00,2022-10-24 14:00:57-06:00,Iridium,46.72209,-113.89205,1489,2,3D Validated,Nothing Detected,10,3.36,3.6,Animal with Collar 40922
40922,10/23/2022 10:00,10/23/2022 4:00,10/24/2022 20:00,2022-10-24 14:00:57-06:00,Iridium,46.72213,-113.8921,1490,1.8,3D Validated,Nothing Detected,13,3.36,3.6,Animal with Collar 40922
40922,10/23/2022 9:00,10/23/2022 3:00,10/24/2022 20:00,2022-10-24 14:00:57-06:00,Iridium,46.72216,-113.89204,1487,2.2,3D Validated,Nothing Detected,14,3.36,3.6,Animal with Collar 40922
40922,10/23/2022 8:00,10/23/2022 2:00,10/31/2022 12:03,2022-10-31 06:03:01-06:00,Iridium,46.72215,-113.8921,1499,2,3D Validated,Nothing Detected,14,3.28,3.6,Animal with Collar 40922
40922,10/23/2022 6:00,10/23/2022 0:00,10/31/2022 12:03,2022-10-31 06:03:19-06:00,Iridium,46.74027,-113.89832,1799,4.6,3D Validated,Nothing Detected,9,3.28,3.6,Animal with Collar 40922
40922,10/23/2022 5:00,10/22/2022 23:00,10/31/2022 12:03,2022-10-31 06:03:19-06:00,Iridium,46.73889,-113.91016,1567,3.6,3D Validated,Nothing Detected,13,3.28,3.6,Animal with Collar 40922
40922,10/23/2022 4:00,10/22/2022 22:00,10/23/2022 4:01,2022-10-22 22:01:11-06:00,Iridium,46.74507,-113.91039,1484,4.4,3D Validated,Nothing Detected,9,3.28,3.6,Animal with Collar 40922
40922,10/23/2022 3:00,10/22/2022 21:00,10/23/2022 4:01,2022-10-22 22:01:11-06:00,Iridium,46.74972,-113.91859,1632,2.6,3D Validated,Nothing Detected,13,3.36,3.6,Animal with Collar 40922
40922,10/23/2022 2:00,10/22/2022 20:00,10/23/2022 4:01,2022-10-22 22:01:11-06:00,Iridium,46.74965,-113.9186,1621,2,3D Validated,Nothing Detected,12,3.36,3.6,Animal with Collar 40922
40922,10/23/2022 1:00,10/22/2022 19:00,10/23/2022 4:01,2022-10-22 22:01:11-06:00,Iridium,46.74978,-113.91872,1623,2.6,3D Validated,Nothing Detected,10,3.28,3.6,Animal with Collar 40922
40922,10/23/2022 0:00,10/22/2022 18:00,10/23/2022 4:01,2022-10-22 22:01:18-06:00,Iridium,46.75443,-113.91046,1691,4.2,3D Validated,Nothing Detected,11,3.36,3.6,Animal with Collar 40922
40922,10/22/2022 23:00,10/22/2022 17:00,10/23/2022 4:01,2022-10-22 22:01:18-06:00,Iridium,46.75526,-113.91061,1659,2.4,3D Validated,Nothing Detected,11,3.36,3.6,Animal with Collar 40922
40922,10/22/2022 22:00,10/22/2022 16:00,10/23/2022 4:01,2022-10-22 22:01:18-06:00,Iridium,46.75546,-113.91061,1699,1.8,3D Validated,Nothing Detected,11,3.36,3.6,Animal with Collar 40922
40922,10/22/2022 21:00,10/22/2022 15:00,10/23/2022 4:01,2022-10-22 22:01:18-06:00,Iridium,46.75456,-113.91007,1777,3.8,3D Validated,Nothing Detected,12,3.36,3.6,Animal with Collar 40922
40922,10/22/2022 20:00,10/22/2022 14:00,10/22/2022 20:00,2022-10-22 14:00:38-06:00,Iridium,46.75541,-113.91074,1696,2.4,3D Validated,Nothing Detected,11,3.36,3.6,Animal with Collar 40922
40922,10/22/2022 19:00,10/22/2022 13:00,10/22/2022 20:00,2022-10-22 14:00:38-06:00,Iridium,46.75544,-113.91071,1679,2.2,3D Validated,Nothing Detected,11,3.36,3.6,Animal with Collar 40922
40922,10/22/2022 18:00,10/22/2022 12:00,10/22/2022 20:00,2022-10-22 14:00:38-06:00,Iridium,46.75555,-113.91066,1681,3.6,3D Validated,Nothing Detected,12,3.36,3.6,Animal with Collar 40922
40922,10/22/2022 17:00,10/22/2022 11:00,10/22/2022 20:00,2022-10-22 14:00:38-06:00,Iridium,46.75557,-113.91063,1690,3.2,3D Validated,Nothing Detected,12,3.36,3.6,Animal with Collar 40922
40922,10/22/2022 16:00,10/22/2022 10:00,10/22/2022 16:01,2022-10-22 10:01:10-06:00,Iridium,46.75542,-113.91066,1681,2,3D Validated,Nothing Detected,13,3.36,3.6,Animal with Collar 40922
40922,10/22/2022 15:00,10/22/2022 9:00,10/22/2022 16:01,2022-10-22 10:01:10-06:00,Iridium,46.75555,-113.91067,1706,3,3D Validated,Nothing Detected,13,3.36,3.6,Animal with Collar 40922
40922,10/22/2022 14:00,10/22/2022 8:00,10/22/2022 16:01,2022-10-22 10:01:10-06:00,Iridium,46.75547,-113.91061,1690,2.4,3D Validated,Nothing Detected,11,3.36,3.6,Animal with Collar 40922
40922,10/22/2022 13:00,10/22/2022 7:00,10/22/2022 16:01,2022-10-22 10:01:10-06:00,Iridium,46.75545,-113.91067,1694,2.6,3D Validated,Nothing Detected,12,3.36,3.6,Animal with Collar 40922
40922,10/22/2022 12:00,10/22/2022 6:00,10/22/2022 12:01,2022-10-22 06:01:44-06:00,Iridium,46.75536,-113.91056,1684,4.2,3D Validated,Nothing Detected,11,3.28,3.6,Animal with Collar 40922
40922,10/22/2022 11:00,10/22/2022 5:00,10/22/2022 12:01,2022-10-22 06:01:44-06:00,Iridium,46.75854,-113.91087,1725,1.8,3D Validated,Nothing Detected,12,3.36,3.6,Animal with Collar 40922
40922,10/22/2022 10:00,10/22/2022 4:00,10/22/2022 12:01,2022-10-22 06:01:44-06:00,Iridium,46.75877,-113.90929,1715,2.6,3D Validated,Nothing Detected,15,3.36,3.6,Animal with Collar 40922
40922,10/22/2022 9:01,10/22/2022 3:01,10/22/2022 12:01,2022-10-22 06:01:44-06:00,Iridium,46.7586,-113.90935,1695,4.8,3D Validated,Nothing Detected,13,3.36,3.6,Animal with Collar 40922
40922,10/22/2022 8:00,10/22/2022 2:00,10/22/2022 12:02,2022-10-22 06:02:03-06:00,Iridium,46.75882,-113.90923,1715,3.2,3D Validated,Nothing Detected,12,3.36,3.6,Animal with Collar 40922
40922,10/22/2022 7:00,10/22/2022 1:00,10/22/2022 12:02,2022-10-22 06:02:03-06:00,Iridium,46.75882,-113.90924,1712,2.8,3D Validated,Nothing Detected,13,3.36,3.6,Animal with Collar 40922
40922,10/22/2022 6:00,10/22/2022 0:00,10/22/2022 12:02,2022-10-22 06:02:03-06:00,Iridium,46.75883,-113.90922,1719,4.2,3D Validated,Nothing Detected,13,3.36,3.6,Animal with Collar 40922
40922,10/22/2022 5:00,10/21/2022 23:00,10/22/2022 12:02,2022-10-22 06:02:03-06:00,Iridium,46.75883,-113.90924,1720,3.2,3D Validated,Nothing Detected,15,3.36,3.6,Animal with Collar 40922
40922,10/22/2022 4:00,10/21/2022 22:00,10/22/2022 12:02,2022-10-22 06:02:21-06:00,Iridium,46.75883,-113.90924,1720,3.6,3D Validated,Nothing Detected,14,3.36,3.6,Animal with Collar 40922
40922,10/22/2022 3:00,10/21/2022 21:00,10/22/2022 12:02,2022-10-22 06:02:21-06:00,Iridium,46.75878,-113.90919,1711,7.2,3D Validated,Nothing Detected,15,3.36,3.6,Animal with Collar 40922
40922,10/22/2022 2:00,10/21/2022 20:00,10/22/2022 12:02,2022-10-22 06:02:21-06:00,Iridium,46.7588,-113.90923,1712,2,3D Validated,Nothing Detected,14,3.36,3.6,Animal with Collar 40922
40922,10/22/2022 1:00,10/21/2022 19:00,10/22/2022 12:02,2022-10-22 06:02:21-06:00,Iridium,46.7588,-113.90928,1715,2.8,3D Validated,Nothing Detected,14,3.36,3.6,Animal with Collar 40922
40922,10/22/2022 0:02,10/21/2022 18:02,10/22/2022 0:02,2022-10-21 18:02:51-06:00,Iridium,46.75888,-113.90936,1719,4,3D Validated,Nothing Detected,14,3.28,3.6,Animal with Collar 40922
40922,10/21/2022 23:00,10/21/2022 17:00,10/22/2022 0:02,2022-10-21 18:02:51-06:00,Iridium,46.76259,-113.90231,1771,2.2,3D Validated,Nothing Detected,16,3.36,3.6,Animal with Collar 40922
40922,10/21/2022 22:00,10/21/2022 16:00,10/22/2022 0:02,2022-10-21 18:02:51-06:00,Iridium,46.76254,-113.9023,1774,2,3D Validated,Nothing Detected,17,3.36,3.6,Animal with Collar 40922
40922,10/21/2022 21:00,10/21/2022 15:00,10/22/2022 0:02,2022-10-21 18:02:51-06:00,Iridium,46.76268,-113.90237,1781,3,3D Validated,Nothing Detected,18,3.36,3.6,Animal with Collar 40922
40922,10/21/2022 20:00,10/21/2022 14:00,10/22/2022 0:03,2022-10-21 18:03:02-06:00,Iridium,46.76254,-113.90196,1779,3.6,3D Validated,Nothing Detected,16,3.36,3.6,Animal with Collar 40922
40922,10/21/2022 19:00,10/21/2022 13:00,10/22/2022 0:03,2022-10-21 18:03:02-06:00,Iridium,46.76236,-113.90153,1765,3.8,3D Validated,Nothing Detected,17,3.36,3.6,Animal with Collar 40922
40922,10/21/2022 18:00,10/21/2022 12:00,10/22/2022 0:03,2022-10-21 18:03:02-06:00,Iridium,46.76236,-113.9015,1767,1.8,3D Validated,Nothing Detected,20,3.36,3.6,Animal with Collar 40922
40922,10/21/2022 17:00,10/21/2022 11:00,10/22/2022 0:03,2022-10-21 18:03:02-06:00,Iridium,46.76257,-113.90151,1760,3.2,3D Validated,Nothing Detected,21,3.36,3.6,Animal with Collar 40922
40922,10/21/2022 16:00,10/21/2022 10:00,10/21/2022 16:01,2022-10-21 10:01:05-06:00,Iridium,46.76241,-113.90157,1774,2.4,3D Validated,Nothing Detected,19,3.36,3.6,Animal with Collar 40922
40922,10/21/2022 15:00,10/21/2022 9:00,10/21/2022 16:01,2022-10-21 10:01:05-06:00,Iridium,46.76256,-113.90143,1778,2.4,3D Validated,Nothing Detected,19,3.36,3.6,Animal with Collar 40922
40922,10/21/2022 14:00,10/21/2022 8:00,10/21/2022 16:01,2022-10-21 10:01:05-06:00,Iridium,46.76245,-113.90147,1770,4.8,3D Validated,Nothing Detected,19,3.36,3.6,Animal with Collar 40922
40922,10/21/2022 13:00,10/21/2022 7:00,10/21/2022 16:01,2022-10-21 10:01:05-06:00,Iridium,46.76241,-113.90151,1763,2.6,3D Validated,Nothing Detected,19,3.36,3.6,Animal with Collar 40922
40922,10/21/2022 12:00,10/21/2022 6:00,10/21/2022 16:01,2022-10-21 10:01:26-06:00,Iridium,46.76232,-113.90164,1731,7.4,3D Validated,Nothing Detected,18,3.36,3.6,Animal with Collar 40922
40922,10/21/2022 11:00,10/21/2022 5:00,10/21/2022 16:01,2022-10-21 10:01:26-06:00,Iridium,46.76242,-113.90158,1737,8.4,3D Validated,Nothing Detected,18,3.36,3.6,Animal with Collar 40922
40922,10/21/2022 10:03,10/21/2022 4:03,10/21/2022 16:01,2022-10-21 10:01:26-06:00,Iridium,46.76244,-113.90161,1782,8.4,3D,Nothing Detected,20,3.36,3.6,Animal with Collar 40922
40922,10/21/2022 9:03,10/21/2022 3:03,10/21/2022 16:01,2022-10-21 10:01:26-06:00,Iridium,46.76247,-113.90146,1781,7.4,3D,Nothing Detected,21,3.36,3.6,Animal with Collar 40922
40922,10/21/2022 8:00,10/21/2022 2:00,10/21/2022 8:01,2022-10-21 02:01:31-06:00,Iridium,46.76239,-113.90156,1762,3.4,3D Validated,Nothing Detected,20,3.36,3.6,Animal with Collar 40922
40922,10/21/2022 7:00,10/21/2022 1:00,10/21/2022 8:01,2022-10-21 02:01:31-06:00,Iridium,46.76244,-113.90152,1762,1.8,3D Validated,Nothing Detected,20,3.36,3.6,Animal with Collar 40922
40922,10/21/2022 6:00,10/21/2022 0:00,10/21/2022 8:01,2022-10-21 02:01:31-06:00,Iridium,46.76239,-113.90149,1757,4.8,3D Validated,Nothing Detected,20,3.36,3.6,Animal with Collar 40922
40922,10/21/2022 5:00,10/20/2022 23:00,10/21/2022 8:01,2022-10-21 02:01:31-06:00,Iridium,46.76249,-113.90161,1776,4.4,3D Validated,Nothing Detected,20,3.36,3.6,Animal with Collar 40922
40922,10/21/2022 4:00,10/20/2022 22:00,10/21/2022 4:01,2022-10-20 22:01:03-06:00,Iridium,46.76498,-113.89629,1699,4.2,3D Validated,Nothing Detected,19,3.28,3.6,Animal with Collar 40922
40922,10/21/2022 3:02,10/20/2022 21:02,10/21/2022 4:01,2022-10-20 22:01:03-06:00,Iridium,46.77285,-113.87577,1613,4.6,3D Validated,Nothing Detected,17,3.28,3.6,Animal with Collar 40922
40922,10/21/2022 2:00,10/20/2022 20:00,10/21/2022 4:01,2022-10-20 22:01:03-06:00,Iridium,46.77918,-113.86899,1819,2.2,3D Validated,Nothing Detected,19,3.36,3.6,Animal with Collar 40922
40922,10/21/2022 1:00,10/20/2022 19:00,10/21/2022 4:01,2022-10-20 22:01:03-06:00,Iridium,46.76823,-113.8639,1808,2.8,3D Validated,Nothing Detected,19,3.36,3.6,Animal with Collar 40922
40922,10/21/2022 0:02,10/20/2022 18:02,10/21/2022 0:03,2022-10-20 18:03:17-06:00,Iridium,46.76723,-113.87567,1967,3.8,3D Validated,Nothing Detected,19,3.36,3.6,Animal with Collar 40922
40922,10/20/2022 23:00,10/20/2022 17:00,10/21/2022 0:03,2022-10-20 18:03:17-06:00,Iridium,46.76718,-113.87592,1978,2.2,3D Validated,Nothing Detected,21,3.36,3.6,Animal with Collar 40922
40922,10/20/2022 22:00,10/20/2022 16:00,10/21/2022 0:03,2022-10-20 18:03:17-06:00,Iridium,46.76725,-113.87598,1979,2.2,3D Validated,Nothing Detected,22,3.36,3.6,Animal with Collar 40922
40922,10/20/2022 21:00,10/20/2022 15:00,10/21/2022 0:03,2022-10-20 18:03:17-06:00,Iridium,46.7671,-113.87584,1983,2.8,3D Validated,Nothing Detected,22,3.36,3.6,Animal with Collar 40922
40922,10/20/2022 20:00,10/20/2022 14:00,10/21/2022 0:03,2022-10-20 18:03:27-06:00,Iridium,46.76678,-113.87675,2012,2.4,3D Validated,Nothing Detected,20,3.36,3.6,Animal with Collar 40922
40922,10/20/2022 19:00,10/20/2022 13:00,10/21/2022 0:03,2022-10-20 18:03:27-06:00,Iridium,46.76668,-113.87672,1986,3.8,3D Validated,Nothing Detected,21,3.36,3.6,Animal with Collar 40922
40922,10/20/2022 18:00,10/20/2022 12:00,10/21/2022 0:03,2022-10-20 18:03:27-06:00,Iridium,46.76678,-113.87658,1975,3.2,3D Validated,Nothing Detected,20,3.36,3.6,Animal with Collar 40922
40922,10/20/2022 17:00,10/20/2022 11:00,10/21/2022 0:03,2022-10-20 18:03:27-06:00,Iridium,46.76675,-113.87671,2004,3.4,3D Validated,Nothing Detected,18,3.36,3.6,Animal with Collar 40922
40922,10/20/2022 16:00,10/20/2022 10:00,10/21/2022 0:03,2022-10-20 18:03:35-06:00,Iridium,46.76664,-113.87666,1998,2.8,3D Validated,Nothing Detected,18,3.36,3.6,Animal with Collar 40922
40922,10/20/2022 15:00,10/20/2022 9:00,10/21/2022 0:03,2022-10-20 18:03:35-06:00,Iridium,46.76745,-113.8867,1862,2.8,3D Validated,Nothing Detected,17,3.36,3.6,Animal with Collar 40922
40922,10/20/2022 14:00,10/20/2022 8:00,10/21/2022 0:03,2022-10-20 18:03:35-06:00,Iridium,46.76476,-113.89373,1814,2.8,3D Validated,Nothing Detected,17,3.36,3.6,Animal with Collar 40922
40922,10/20/2022 13:01,10/20/2022 7:01,10/21/2022 0:03,2022-10-20 18:03:35-06:00,Iridium,46.76416,-113.89398,1803,6.2,3D Validated,Nothing Detected,18,3.28,3.6,Animal with Collar 40922
40922,10/20/2022 12:00,10/20/2022 6:00,10/20/2022 12:01,2022-10-20 06:01:05-06:00,Iridium,46.76216,-113.90244,1778,3.4,3D Validated,Nothing Detected,17,3.36,3.6,Animal with Collar 40922
40922,10/20/2022 11:00,10/20/2022 5:00,10/20/2022 12:01,2022-10-20 06:01:05-06:00,Iridium,46.75941,-113.90276,1819,7.2,3D Validated,Nothing Detected,16,3.36,3.6,Animal with Collar 40922
40922,10/20/2022 10:00,10/20/2022 4:00,10/20/2022 12:01,2022-10-20 06:01:05-06:00,Iridium,46.75945,-113.90281,1798,3.2,3D Validated,Nothing Detected,15,3.36,3.6,Animal with Collar 40922
40922,10/20/2022 9:00,10/20/2022 3:00,10/20/2022 12:01,2022-10-20 06:01:05-06:00,Iridium,46.75941,-113.90291,1804,3.4,3D Validated,Nothing Detected,16,3.36,3.6,Animal with Collar 40922
40922,10/20/2022 8:00,10/20/2022 2:00,10/20/2022 12:01,2022-10-20 06:01:19-06:00,Iridium,46.75936,-113.90292,1837,8.2,3D Validated,Nothing Detected,15,3.36,3.6,Animal with Collar 40922
40922,10/20/2022 7:00,10/20/2022 1:00,10/20/2022 12:01,2022-10-20 06:01:19-06:00,Iridium,46.75938,-113.90284,1804,3.4,3D Validated,Nothing Detected,16,3.36,3.6,Animal with Collar 40922
40922,10/20/2022 6:00,10/20/2022 0:00,10/20/2022 12:01,2022-10-20 06:01:19-06:00,Iridium,46.75944,-113.90284,1788,3.6,3D Validated,Nothing Detected,15,3.36,3.6,Animal with Collar 40922
40922,10/20/2022 5:01,10/19/2022 23:01,10/20/2022 12:01,2022-10-20 06:01:19-06:00,Iridium,46.75996,-113.90112,1829,4.2,3D Validated,Nothing Detected,15,3.36,3.6,Animal with Collar 40922
40922,10/20/2022 4:00,10/19/2022 22:00,10/20/2022 4:01,2022-10-19 22:01:01-06:00,Iridium,46.75927,-113.90149,1836,3.2,3D Validated,Nothing Detected,16,3.36,3.6,Animal with Collar 40922
40922,10/20/2022 3:00,10/19/2022 21:00,10/20/2022 4:01,2022-10-19 22:01:01-06:00,Iridium,46.7594,-113.90153,1853,4.4,3D Validated,Nothing Detected,19,3.36,3.6,Animal with Collar 40922
40922,10/20/2022 2:00,10/19/2022 20:00,10/20/2022 4:01,2022-10-19 22:01:01-06:00,Iridium,46.75919,-113.90149,1833,2.2,3D Validated,Nothing Detected,20,3.36,3.6,Animal with Collar 40922
40922,10/20/2022 1:00,10/19/2022 19:00,10/20/2022 4:01,2022-10-19 22:01:01-06:00,Iridium,46.75922,-113.90151,1838,2.6,3D Validated,Nothing Detected,24,3.36,3.6,Animal with Collar 40922
40922,10/20/2022 0:00,10/19/2022 18:00,10/20/2022 4:01,2022-10-19 22:01:20-06:00,Iridium,46.75292,-113.89951,1920,2.4,3D Validated,Nothing Detected,27,3.36,3.6,Animal with Collar 40922
40922,10/19/2022 23:00,10/19/2022 17:00,10/20/2022 4:01,2022-10-19 22:01:20-06:00,Iridium,46.74805,-113.89307,1801,2.2,3D Validated,Nothing Detected,27,3.36,3.6,Animal with Collar 40922
40922,10/19/2022 22:00,10/19/2022 16:00,10/20/2022 4:01,2022-10-19 22:01:20-06:00,Iridium,46.74332,-113.89357,1727,3.2,3D Validated,Nothing Detected,22,3.36,3.6,Animal with Collar 40922
40922,10/19/2022 21:00,10/19/2022 15:00,10/20/2022 4:01,2022-10-19 22:01:20-06:00,Iridium,46.74125,-113.90263,1754,2,3D Validated,Nothing Detected,21,3.36,3.6,Animal with Collar 40922
40922,10/19/2022 20:00,10/19/2022 14:00,10/20/2022 4:01,2022-10-19 22:01:30-06:00,Iridium,46.74123,-113.90257,1749,4.4,3D Validated,Nothing Detected,23,3.36,3.6,Animal with Collar 40922
40922,10/19/2022 19:00,10/19/2022 13:00,10/20/2022 4:01,2022-10-19 22:01:30-06:00,Iridium,46.74162,-113.90254,1716,4,3D Validated,Nothing Detected,18,3.36,3.6,Animal with Collar 40922
40922,10/19/2022 18:00,10/19/2022 12:00,10/20/2022 4:01,2022-10-19 22:01:30-06:00,Iridium,46.74123,-113.90259,1759,2,3D Validated,Nothing Detected,15,3.36,3.6,Animal with Collar 40922
40922,10/19/2022 17:01,10/19/2022 11:01,10/20/2022 4:01,2022-10-19 22:01:30-06:00,Iridium,46.74184,-113.90425,1687,4,3D Validated,Nothing Detected,19,3.28,3.6,Animal with Collar 40922
40922,10/19/2022 16:00,10/19/2022 10:00,10/20/2022 4:01,2022-10-19 22:01:37-06:00,Iridium,46.74046,-113.91171,1519,2.2,3D Validated,Nothing Detected,18,3.36,3.6,Animal with Collar 40922
40922,10/19/2022 15:00,10/19/2022 9:00,10/20/2022 4:01,2022-10-19 22:01:37-06:00,Iridium,46.73975,-113.91462,1439,2,3D Validated,Nothing Detected,19,3.36,3.6,Animal with Collar 40922
40922,10/19/2022 14:00,10/19/2022 8:00,10/20/2022 4:01,2022-10-19 22:01:37-06:00,Iridium,46.7397,-113.9146,1431,2.2,3D Validated,Nothing Detected,19,3.36,3.6,Animal with Collar 40922
40922,10/19/2022 13:00,10/19/2022 7:00,10/20/2022 4:01,2022-10-19 22:01:37-06:00,Iridium,46.74012,-113.9147,1470,3.4,3D Validated,Nothing Detected,19,3.36,3.6,Animal with Collar 40922
40922,10/19/2022 12:00,10/19/2022 6:00,10/20/2022 4:01,2022-10-19 22:01:44-06:00,Iridium,46.73993,-113.91473,1434,2.4,3D Validated,Nothing Detected,20,3.36,3.6,Animal with Collar 40922
40922,10/19/2022 11:00,10/19/2022 5:00,10/20/2022 4:01,2022-10-19 22:01:44-06:00,Iridium,46.73991,-113.91463,1414,2.4,3D Validated,Nothing Detected,19,3.36,3.6,Animal with Collar 40922
40922,10/19/2022 10:00,10/19/2022 4:00,10/20/2022 4:01,2022-10-19 22:01:44-06:00,Iridium,46.73999,-113.91476,1425,2.2,3D Validated,Nothing Detected,21,3.36,3.6,Animal with Collar 40922
40922,10/19/2022 9:01,10/19/2022 3:01,10/20/2022 4:01,2022-10-19 22:01:44-06:00,Iridium,46.73989,-113.91472,1438,3.8,3D Validated,Nothing Detected,22,3.36,3.6,Animal with Collar 40922
40922,10/19/2022 8:00,10/19/2022 2:00,10/20/2022 4:01,2022-10-19 22:01:53-06:00,Iridium,46.73991,-113.91448,1412,3,3D Validated,Nothing Detected,22,3.36,3.6,Animal with Collar 40922
40922,10/19/2022 7:01,10/19/2022 1:01,10/20/2022 4:01,2022-10-19 22:01:53-06:00,Iridium,46.73984,-113.91454,1455,2.4,3D Validated,Nothing Detected,21,3.28,3.6,Animal with Collar 40922
40922,10/19/2022 6:00,10/19/2022 0:00,10/20/2022 4:01,2022-10-19 22:01:53-06:00,Iridium,46.74045,-113.91456,1413,4,3D Validated,Nothing Detected,23,3.36,3.6,Animal with Collar 40922
40922,10/19/2022 4:00,10/18/2022 22:00,10/20/2022 4:02,2022-10-19 22:02:02-06:00,Iridium,46.73981,-113.91453,1447,2.4,3D Validated,Nothing Detected,18,3.36,3.6,Animal with Collar 40922
40922,10/19/2022 3:00,10/18/2022 21:00,10/20/2022 4:02,2022-10-19 22:02:02-06:00,Iridium,46.74003,-113.91452,1432,4.4,3D Validated,Nothing Detected,21,3.36,3.6,Animal with Collar 40922
40922,10/19/2022 2:00,10/18/2022 20:00,10/20/2022 4:02,2022-10-19 22:02:02-06:00,Iridium,46.73994,-113.91469,1430,2.4,3D Validated,Nothing Detected,24,3.36,3.6,Animal with Collar 40922
40922,10/19/2022 1:01,10/18/2022 19:01,10/20/2022 4:02,2022-10-19 22:02:02-06:00,Iridium,46.73998,-113.91456,1431,3,3D Validated,Nothing Detected,25,3.36,3.6,Animal with Collar 40922
40922,10/18/2022 23:00,10/18/2022 17:00,10/20/2022 4:02,2022-10-19 22:02:10-06:00,Iridium,46.74036,-113.91532,1405,2.8,3D Validated,Nothing Detected,25,3.36,3.6,Animal with Collar 40922
40922,10/18/2022 22:00,10/18/2022 16:00,10/20/2022 4:02,2022-10-19 22:02:10-06:00,Iridium,46.74097,-113.91489,1405,2,3D Validated,Nothing Detected,26,3.36,3.6,Animal with Collar 40922
40922,10/18/2022 21:00,10/18/2022 15:00,10/20/2022 4:02,2022-10-19 22:02:10-06:00,Iridium,46.73925,-113.91884,1368,8,3D Validated,Nothing Detected,27,3.36,3.6,Animal with Collar 40922
40922,10/18/2022 20:00,10/18/2022 14:00,10/20/2022 4:02,2022-10-19 22:02:19-06:00,Iridium,46.73425,-113.91133,1472,4.4,3D Validated,Nothing Detected,24,3.36,3.6,Animal with Collar 40922
40922,10/18/2022 19:00,10/18/2022 13:00,10/20/2022 4:02,2022-10-19 22:02:19-06:00,Iridium,46.73433,-113.91027,1503,2.8,3D Validated,Nothing Detected,22,3.36,3.6,Animal with Collar 40922
40922,10/18/2022 18:00,10/18/2022 12:00,10/20/2022 4:02,2022-10-19 22:02:19-06:00,Iridium,46.73439,-113.91016,1511,1.8,3D Validated,Nothing Detected,20,3.36,3.6,Animal with Collar 40922
40922,10/18/2022 17:00,10/18/2022 11:00,10/20/2022 4:02,2022-10-19 22:02:19-06:00,Iridium,46.73441,-113.91006,1495,4.4,3D Validated,Nothing Detected,19,3.36,3.6,Animal with Collar 40922
40922,10/18/2022 16:00,10/18/2022 10:00,10/20/2022 4:02,2022-10-19 22:02:27-06:00,Iridium,46.73425,-113.91018,1501,2,3D Validated,Nothing Detected,18,3.36,3.6,Animal with Collar 40922
40922,10/18/2022 15:00,10/18/2022 9:00,10/20/2022 4:02,2022-10-19 22:02:27-06:00,Iridium,46.73434,-113.91035,1511,2.4,3D Validated,Nothing Detected,18,3.36,3.6,Animal with Collar 40922
40922,10/18/2022 14:00,10/18/2022 8:00,10/20/2022 4:02,2022-10-19 22:02:27-06:00,Iridium,46.73428,-113.91022,1495,1.8,3D Validated,Nothing Detected,19,3.28,3.6,Animal with Collar 40922
40922,10/18/2022 13:00,10/18/2022 7:00,10/20/2022 4:02,2022-10-19 22:02:27-06:00,Iridium,46.73419,-113.91045,1530,2.2,3D Validated,Nothing Detected,20,3.36,3.6,Animal with Collar 40922
40922,10/18/2022 12:00,10/18/2022 6:00,10/20/2022 4:02,2022-10-19 22:02:36-06:00,Iridium,46.7343,-113.91009,1493,1.4,3D Validated,Nothing Detected,19,3.36,3.6,Animal with Collar 40922
40922,10/18/2022 11:00,10/18/2022 5:00,10/20/2022 4:02,2022-10-19 22:02:36-06:00,Iridium,46.73431,-113.91013,1487,5.2,3D Validated,Nothing Detected,17,3.36,3.6,Animal with Collar 40922
40922,10/18/2022 10:00,10/18/2022 4:00,10/20/2022 4:02,2022-10-19 22:02:36-06:00,Iridium,46.7303,-113.90933,1421,2.8,3D Validated,Nothing Detected,18,3.36,3.6,Animal with Collar 40922
40922,10/18/2022 9:00,10/18/2022 3:00,10/20/2022 4:02,2022-10-19 22:02:36-06:00,Iridium,46.72934,-113.90952,1425,2.4,3D Validated,Nothing Detected,18,3.36,3.6,Animal with Collar 40922
40922,10/18/2022 8:00,10/18/2022 2:00,10/18/2022 8:00,2022-10-18 02:00:55-06:00,Iridium,46.72924,-113.90957,1410,2.2,3D Validated,Nothing Detected,18,3.36,3.6,Animal with Collar 40922
40922,10/18/2022 7:00,10/18/2022 1:00,10/18/2022 8:00,2022-10-18 02:00:55-06:00,Iridium,46.73351,-113.90176,1639,3.4,3D Validated,Nothing Detected,20,3.36,3.6,Animal with Collar 40922
40922,10/18/2022 6:00,10/18/2022 0:00,10/18/2022 8:00,2022-10-18 02:00:55-06:00,Iridium,46.74166,-113.90138,1783,1.8,3D Validated,Nothing Detected,19,3.36,3.6,Animal with Collar 40922
40922,10/18/2022 5:00,10/17/2022 23:00,10/18/2022 8:00,2022-10-18 02:00:55-06:00,Iridium,46.74161,-113.9014,1774,2.8,3D Validated,Nothing Detected,20,3.36,3.6,Animal with Collar 40922
40922,10/18/2022 4:01,10/17/2022 22:01,10/18/2022 4:01,2022-10-17 22:01:35-06:00,Iridium,46.74225,-113.8972,1760,7.8,3D Validated,Nothing Detected,22,3.36,3.6,Animal with Collar 40922
40922,10/18/2022 2:00,10/17/2022 20:00,10/18/2022 4:01,2022-10-17 22:01:35-06:00,Iridium,46.74192,-113.90737,1583,2.6,3D Validated,Nothing Detected,19,3.36,3.6,Animal with Collar 40922
40922,10/18/2022 1:00,10/17/2022 19:00,10/18/2022 4:01,2022-10-17 22:01:35-06:00,Iridium,46.74207,-113.90909,1513,3,3D Validated,Nothing Detected,25,3.36,3.6,Animal with Collar 40922
40922,10/17/2022 21:00,10/17/2022 15:00,10/18/2022 4:01,2022-10-17 22:01:44-06:00,Iridium,46.74217,-113.909,1524,2.4,3D Validated,Nothing Detected,23,3.36,3.6,Animal with Collar 40922
40922,10/17/2022 20:00,10/17/2022 14:00,10/17/2022 20:01,2022-10-17 14:01:06-06:00,Iridium,46.74131,-113.91536,1372,3,3D Validated,Nothing Detected,23,3.36,3.6,Animal with Collar 40922
40922,10/17/2022 19:00,10/17/2022 13:00,10/17/2022 20:01,2022-10-17 14:01:06-06:00,Iridium,46.74136,-113.91536,1378,5,3D Validated,Nothing Detected,22,3.36,3.6,Animal with Collar 40922
40922,10/17/2022 18:00,10/17/2022 12:00,10/17/2022 20:01,2022-10-17 14:01:06-06:00,Iridium,46.74137,-113.9154,1385,3.4,3D Validated,Nothing Detected,21,3.36,3.6,Animal with Collar 40922
40922,10/17/2022 17:00,10/17/2022 11:00,10/17/2022 20:01,2022-10-17 14:01:06-06:00,Iridium,46.73498,-113.91286,1417,3.6,3D Validated,Nothing Detected,20,3.36,3.6,Animal with Collar 40922
40922,10/17/2022 16:00,10/17/2022 10:00,10/17/2022 20:01,2022-10-17 14:01:14-06:00,Iridium,46.73485,-113.91009,1559,3.8,3D Validated,Nothing Detected,20,3.36,3.6,Animal with Collar 40922
40922,10/17/2022 15:00,10/17/2022 9:00,10/17/2022 20:01,2022-10-17 14:01:14-06:00,Iridium,46.73466,-113.91022,1489,2,3D Validated,Nothing Detected,20,3.36,3.6,Animal with Collar 40922
40922,10/17/2022 14:00,10/17/2022 8:00,10/17/2022 20:01,2022-10-17 14:01:14-06:00,Iridium,46.73322,-113.91002,1499,3,3D Validated,Nothing Detected,18,3.36,3.6,Animal with Collar 40922
40922,10/17/2022 13:02,10/17/2022 7:02,10/17/2022 20:01,2022-10-17 14:01:14-06:00,Iridium,46.72927,-113.90953,1402,2.2,3D Validated,Nothing Detected,17,3.28,3.6,Animal with Collar 40922
40922,10/17/2022 12:00,10/17/2022 6:00,10/17/2022 20:01,2022-10-17 14:01:30-06:00,Iridium,46.72921,-113.90949,1411,3.2,3D Validated,Nothing Detected,18,3.36,3.6,Animal with Collar 40922
40922,10/17/2022 11:00,10/17/2022 5:00,10/17/2022 20:01,2022-10-17 14:01:30-06:00,Iridium,46.72937,-113.90879,1441,2.6,3D Validated,Nothing Detected,18,3.28,3.6,Animal with Collar 40922
40922,10/17/2022 10:00,10/17/2022 4:00,10/17/2022 20:01,2022-10-17 14:01:30-06:00,Iridium,46.72696,-113.90557,1434,4.6,3D Validated,Nothing Detected,19,3.36,3.6,Animal with Collar 40922
40922,10/17/2022 9:00,10/17/2022 3:00,10/17/2022 20:01,2022-10-17 14:01:30-06:00,Iridium,46.72923,-113.90977,1428,2.8,3D Validated,Nothing Detected,19,3.36,3.6,Animal with Collar 40922
40922,10/17/2022 8:00,10/17/2022 2:00,10/17/2022 20:01,2022-10-17 14:01:40-06:00,Iridium,46.72924,-113.90961,1421,3.6,3D Validated,Nothing Detected,20,3.36,3.6,Animal with Collar 40922
40922,10/17/2022 7:01,10/17/2022 1:01,10/17/2022 20:01,2022-10-17 14:01:40-06:00,Iridium,46.72935,-113.90951,1416,3,3D Validated,Nothing Detected,18,3.36,3.6,Animal with Collar 40922
40922,10/17/2022 6:00,10/17/2022 0:00,10/17/2022 20:01,2022-10-17 14:01:40-06:00,Iridium,46.72939,-113.90974,1449,4.6,3D Validated,Nothing Detected,20,3.36,3.6,Animal with Collar 40922
40922,10/17/2022 5:00,10/16/2022 23:00,10/17/2022 20:01,2022-10-17 14:01:40-06:00,Iridium,46.72927,-113.90949,1399,5,3D Validated,Nothing Detected,20,3.36,3.6,Animal with Collar 40922
40922,10/17/2022 3:00,10/16/2022 21:00,10/17/2022 20:01,2022-10-17 14:01:48-06:00,Iridium,46.72923,-113.90959,1403,2.6,3D Validated,Nothing Detected,20,3.36,3.6,Animal with Collar 40922
40922,10/17/2022 2:00,10/16/2022 20:00,10/17/2022 20:01,2022-10-17 14:01:48-06:00,Iridium,46.72868,-113.90185,1463,4,3D Validated,Nothing Detected,21,3.36,3.6,Animal with Collar 40922
40922,10/17/2022 1:00,10/16/2022 19:00,10/17/2022 20:01,2022-10-17 14:01:48-06:00,Iridium,46.72934,-113.90954,1422,3.2,3D Validated,Nothing Detected,22,3.36,3.6,Animal with Collar 40922
40922,10/17/2022 0:00,10/16/2022 18:00,10/17/2022 20:01,2022-10-17 14:01:58-06:00,Iridium,46.72921,-113.90959,1422,3.6,3D Validated,Nothing Detected,25,3.36,3.6,Animal with Collar 40922
40922,10/16/2022 23:00,10/16/2022 17:00,10/17/2022 20:01,2022-10-17 14:01:58-06:00,Iridium,46.72925,-113.90949,1410,6.4,3D Validated,Nothing Detected,26,3.36,3.6,Animal with Collar 40922
40922,10/16/2022 22:01,10/16/2022 16:01,10/17/2022 20:01,2022-10-17 14:01:58-06:00,Iridium,46.72924,-113.90955,1415,2,3D Validated,Nothing Detected,27,3.36,3.6,Animal with Collar 40922
40922,10/16/2022 21:00,10/16/2022 15:00,10/17/2022 20:01,2022-10-17 14:01:58-06:00,Iridium,46.7292,-113.90945,1412,6.6,3D Validated,Nothing Detected,23,3.36,3.6,Animal with Collar 40922
40922,10/16/2022 20:00,10/16/2022 14:00,10/17/2022 20:02,2022-10-17 14:02:09-06:00,Iridium,46.72926,-113.90957,1411,3,3D Validated,Nothing Detected,22,3.36,3.6,Animal with Collar 40922
40922,10/16/2022 19:00,10/16/2022 13:00,10/17/2022 20:02,2022-10-17 14:02:09-06:00,Iridium,46.72928,-113.90954,1415,2.6,3D Validated,Nothing Detected,20,3.36,3.6,Animal with Collar 40922
40922,10/16/2022 18:00,10/16/2022 12:00,10/17/2022 20:02,2022-10-17 14:02:09-06:00,Iridium,46.72926,-113.90958,1422,2.8,3D Validated,Nothing Detected,21,3.36,3.6,Animal with Collar 40922
40922,10/16/2022 17:00,10/16/2022 11:00,10/17/2022 20:02,2022-10-17 14:02:09-06:00,Iridium,46.72922,-113.90962,1416,4.6,3D Validated,Nothing Detected,19,3.36,3.6,Animal with Collar 40922
40922,10/16/2022 16:00,10/16/2022 10:00,10/16/2022 16:01,2022-10-16 10:01:12-06:00,Iridium,46.72922,-113.90953,1418,2.2,3D Validated,Nothing Detected,14,3.36,3.6,Animal with Collar 40922
40922,10/16/2022 15:00,10/16/2022 9:00,10/16/2022 16:01,2022-10-16 10:01:12-06:00,Iridium,46.72909,-113.90956,1423,3.2,3D Validated,Nothing Detected,15,3.36,3.6,Animal with Collar 40922
40922,10/16/2022 14:00,10/16/2022 8:00,10/16/2022 16:01,2022-10-16 10:01:12-06:00,Iridium,46.72923,-113.90955,1414,2.2,3D Validated,Nothing Detected,15,3.36,3.6,Animal with Collar 40922
40922,10/16/2022 13:01,10/16/2022 7:01,10/16/2022 16:01,2022-10-16 10:01:12-06:00,Iridium,46.72928,-113.90911,1349,9.8,3D,Nothing Detected,17,3.28,3.6,Animal with Collar 40922
40922,10/16/2022 12:00,10/16/2022 6:00,10/16/2022 12:00,2022-10-16 06:00:54-06:00,Iridium,46.7293,-113.90969,1401,4.2,3D Validated,Nothing Detected,17,3.36,3.6,Animal with Collar 40922
40922,10/16/2022 11:00,10/16/2022 5:00,10/16/2022 12:00,2022-10-16 06:00:54-06:00,Iridium,46.72922,-113.90955,1412,8.8,3D Validated,Nothing Detected,18,3.36,3.6,Animal with Collar 40922
40922,10/16/2022 9:00,10/16/2022 3:00,10/16/2022 12:00,2022-10-16 06:00:54-06:00,Iridium,46.7292,-113.9096,1425,3.4,3D Validated,Nothing Detected,16,3.36,3.6,Animal with Collar 40922
40922,10/16/2022 8:00,10/16/2022 2:00,10/18/2022 4:01,2022-10-17 22:01:52-06:00,Iridium,46.72923,-113.90953,1419,3,3D Validated,Nothing Detected,18,3.36,3.6,Animal with Collar 40922
40922,10/16/2022 7:02,10/16/2022 1:02,10/18/2022 4:01,2022-10-17 22:01:52-06:00,Iridium,46.72919,-113.90956,1407,2.8,3D Validated,Nothing Detected,17,3.36,3.6,Animal with Collar 40922
40922,10/16/2022 6:00,10/16/2022 0:00,10/18/2022 4:01,2022-10-17 22:01:52-06:00,Iridium,46.72909,-113.90936,1401,5,3D Validated,Nothing Detected,19,3.36,3.6,Animal with Collar 40922
40922,10/16/2022 5:00,10/15/2022 23:00,10/18/2022 4:01,2022-10-17 22:01:52-06:00,Iridium,46.72689,-113.9055,1436,2.4,3D Validated,Nothing Detected,20,3.36,3.6,Animal with Collar 40922
40922,10/16/2022 4:00,10/15/2022 22:00,10/18/2022 4:02,2022-10-17 22:02:01-06:00,Iridium,46.72837,-113.90285,1450,2.8,3D Validated,Nothing Detected,23,3.36,3.6,Animal with Collar 40922
40922,10/16/2022 3:00,10/15/2022 21:00,10/18/2022 4:02,2022-10-17 22:02:01-06:00,Iridium,46.72833,-113.90279,1461,2.4,3D Validated,Nothing Detected,21,3.36,3.6,Animal with Collar 40922
40922,10/16/2022 2:01,10/15/2022 20:01,10/18/2022 4:02,2022-10-17 22:02:01-06:00,Iridium,46.72832,-113.90275,1462,2.8,3D Validated,Nothing Detected,20,3.36,3.6,Animal with Collar 40922
40922,10/16/2022 1:01,10/15/2022 19:01,10/18/2022 4:02,2022-10-17 22:02:01-06:00,Iridium,46.72829,-113.90282,1455,4.6,3D Validated,Nothing Detected,21,3.36,3.6,Animal with Collar 40922
40922,10/16/2022 0:00,10/15/2022 18:00,10/18/2022 4:02,2022-10-17 22:02:10-06:00,Iridium,46.72834,-113.90277,1452,3,3D Validated,Nothing Detected,20,3.36,3.6,Animal with Collar 40922
40922,10/15/2022 23:00,10/15/2022 17:00,10/18/2022 4:02,2022-10-17 22:02:10-06:00,Iridium,46.72836,-113.90276,1456,3.2,3D Validated,Nothing Detected,25,3.36,3.6,Animal with Collar 40922
40922,10/15/2022 22:00,10/15/2022 16:00,10/18/2022 4:02,2022-10-17 22:02:10-06:00,Iridium,46.72924,-113.90959,1410,3.2,3D Validated,Nothing Detected,31,3.36,3.6,Animal with Collar 40922
40922,10/15/2022 21:00,10/15/2022 15:00,10/18/2022 4:02,2022-10-17 22:02:10-06:00,Iridium,46.72903,-113.90968,1460,4,3D Validated,Nothing Detected,23,3.36,3.6,Animal with Collar 40922
40922,10/15/2022 20:00,10/15/2022 14:00,10/18/2022 4:02,2022-10-17 22:02:19-06:00,Iridium,46.72915,-113.90951,1415,3,3D Validated,Nothing Detected,22,3.36,3.6,Animal with Collar 40922
40922,10/15/2022 19:00,10/15/2022 13:00,10/18/2022 4:02,2022-10-17 22:02:19-06:00,Iridium,46.72918,-113.90949,1414,2.6,3D Validated,Nothing Detected,21,3.36,3.6,Animal with Collar 40922
40922,10/15/2022 18:00,10/15/2022 12:00,10/18/2022 4:02,2022-10-17 22:02:19-06:00,Iridium,46.72921,-113.90948,1408,2,3D Validated,Nothing Detected,21,3.36,3.6,Animal with Collar 40922
40922,10/15/2022 17:00,10/15/2022 11:00,10/18/2022 4:02,2022-10-17 22:02:19-06:00,Iridium,46.72927,-113.90928,1380,4.8,3D Validated,Nothing Detected,19,3.36,3.6,Animal with Collar 40922
40922,10/15/2022 16:00,10/15/2022 10:00,10/18/2022 4:02,2022-10-17 22:02:27-06:00,Iridium,46.72921,-113.90955,1418,1.6,3D Validated,Nothing Detected,18,3.36,3.6,Animal with Collar 40922
40922,10/15/2022 15:00,10/15/2022 9:00,10/18/2022 4:02,2022-10-17 22:02:27-06:00,Iridium,46.72922,-113.90961,1418,9,3D Validated,Nothing Detected,17,3.36,3.6,Animal with Collar 40922
40922,10/15/2022 14:00,10/15/2022 8:00,10/18/2022 4:02,2022-10-17 22:02:27-06:00,Iridium,46.72929,-113.9096,1408,7.8,3D Validated,Nothing Detected,19,3.36,3.6,Animal with Collar 40922
40922,10/15/2022 13:00,10/15/2022 7:00,10/18/2022 4:02,2022-10-17 22:02:27-06:00,Iridium,46.72931,-113.90958,1422,1.8,3D Validated,Nothing Detected,20,3.36,3.6,Animal with Collar 40922
40922,10/15/2022 12:00,10/15/2022 6:00,10/15/2022 12:00,2022-10-15 06:00:33-06:00,Iridium,46.72922,-113.90961,1412,2,3D Validated,Nothing Detected,20,3.36,3.6,Animal with Collar 40922
40922,10/15/2022 11:00,10/15/2022 5:00,10/15/2022 12:00,2022-10-15 06:00:33-06:00,Iridium,46.72924,-113.90956,1413,3.2,3D Validated,Nothing Detected,19,3.36,3.6,Animal with Collar 40922
40922,10/15/2022 10:00,10/15/2022 4:00,10/15/2022 12:00,2022-10-15 06:00:33-06:00,Iridium,46.72928,-113.90958,1418,2,3D Validated,Nothing Detected,19,3.36,3.6,Animal with Collar 40922
40922,10/15/2022 9:00,10/15/2022 3:00,10/15/2022 12:00,2022-10-15 06:00:33-06:00,Iridium,46.72751,-113.91194,1300,3.4,3D Validated,Nothing Detected,19,3.36,3.6,Animal with Collar 40922
40922,10/15/2022 8:00,10/15/2022 2:00,10/15/2022 8:01,2022-10-15 02:01:18-06:00,Iridium,46.7146,-113.92651,1638,3,3D Validated,Nothing Detected,19,3.28,3.6,Animal with Collar 40922
40922,10/15/2022 7:00,10/15/2022 1:00,10/15/2022 8:01,2022-10-15 02:01:18-06:00,Iridium,46.69931,-113.94377,1663,3.4,3D Validated,Nothing Detected,21,3.28,3.6,Animal with Collar 40922
40922,10/15/2022 6:00,10/15/2022 0:00,10/15/2022 8:01,2022-10-15 02:01:18-06:00,Iridium,46.68627,-113.95564,1455,3,3D Validated,Nothing Detected,22,3.36,3.6,Animal with Collar 40922
40922,10/15/2022 5:00,10/14/2022 23:00,10/15/2022 8:01,2022-10-15 02:01:18-06:00,Iridium,46.67565,-113.96281,1405,2.4,3D Validated,Nothing Detected,22,3.36,3.6,Animal with Collar 40922
40922,10/15/2022 4:00,10/14/2022 22:00,10/15/2022 8:01,2022-10-15 02:01:27-06:00,Iridium,46.67576,-113.96291,1413,5.2,3D Validated,Nothing Detected,22,3.36,3.6,Animal with Collar 40922
40922,10/15/2022 3:00,10/14/2022 21:00,10/15/2022 8:01,2022-10-15 02:01:27-06:00,Iridium,46.67567,-113.96248,1403,1.6,3D Validated,Nothing Detected,21,3.36,3.6,Animal with Collar 40922
40922,10/15/2022 2:00,10/14/2022 20:00,10/15/2022 8:01,2022-10-15 02:01:27-06:00,Iridium,46.67555,-113.96259,1397,4.8,3D Validated,Nothing Detected,21,3.36,3.6,Animal with Collar 40922
40922,10/15/2022 1:00,10/14/2022 19:00,10/15/2022 8:01,2022-10-15 02:01:27-06:00,Iridium,46.68325,-113.95014,1430,3.4,3D Validated,Nothing Detected,22,3.36,3.6,Animal with Collar 40922
40922,10/15/2022 0:00,10/14/2022 18:00,10/15/2022 8:01,2022-10-15 02:01:35-06:00,Iridium,46.6832,-113.95002,1463,2.2,3D Validated,Nothing Detected,23,3.36,3.6,Animal with Collar 40922
40922,10/14/2022 23:00,10/14/2022 17:00,10/15/2022 8:01,2022-10-15 02:01:35-06:00,Iridium,46.68324,-113.95014,1445,2.6,3D Validated,Nothing Detected,23,3.36,3.6,Animal with Collar 40922
40922,10/14/2022 22:00,10/14/2022 16:00,10/15/2022 8:01,2022-10-15 02:01:35-06:00,Iridium,46.68325,-113.95004,1463,1.8,3D Validated,Nothing Detected,25,3.36,3.6,Animal with Collar 40922
40922,10/14/2022 21:00,10/14/2022 15:00,10/15/2022 8:01,2022-10-15 02:01:35-06:00,Iridium,46.68332,-113.95035,1458,3.2,3D Validated,Nothing Detected,24,3.36,3.6,Animal with Collar 40922
40922,10/14/2022 20:00,10/14/2022 14:00,10/14/2022 20:01,2022-10-14 14:01:42-06:00,Iridium,46.68322,-113.95037,1463,2.4,3D Validated,Nothing Detected,25,3.36,3.6,Animal with Collar 40922
40922,10/14/2022 19:00,10/14/2022 13:00,10/14/2022 20:01,2022-10-14 14:01:42-06:00,Iridium,46.68334,-113.95038,1468,4.4,3D Validated,Nothing Detected,23,3.36,3.6,Animal with Collar 40922
40922,10/14/2022 18:00,10/14/2022 12:00,10/14/2022 20:01,2022-10-14 14:01:42-06:00,Iridium,46.68331,-113.95036,1463,2.4,3D Validated,Nothing Detected,22,3.36,3.6,Animal with Collar 40922
40922,10/14/2022 17:00,10/14/2022 11:00,10/14/2022 20:01,2022-10-14 14:01:42-06:00,Iridium,46.68359,-113.94993,1453,3.8,3D Validated,Nothing Detected,23,3.36,3.6,Animal with Collar 40922
40922,10/14/2022 16:00,10/14/2022 10:00,10/15/2022 8:01,2022-10-15 02:01:54-06:00,Iridium,46.68439,-113.95075,1454,3.4,3D Validated,Nothing Detected,22,3.36,3.6,Animal with Collar 40922
40922,10/14/2022 15:00,10/14/2022 9:00,10/15/2022 8:01,2022-10-15 02:01:54-06:00,Iridium,46.68485,-113.95328,1505,1.8,3D Validated,Nothing Detected,19,3.36,3.6,Animal with Collar 40922
40922,10/14/2022 14:00,10/14/2022 8:00,10/15/2022 8:01,2022-10-15 02:01:54-06:00,Iridium,46.6849,-113.95319,1507,2,3D Validated,Nothing Detected,19,3.36,3.6,Animal with Collar 40922
40922,10/14/2022 13:01,10/14/2022 7:01,10/15/2022 8:01,2022-10-15 02:01:54-06:00,Iridium,46.68499,-113.95431,1507,9.2,3D Validated,Nothing Detected,19,3.28,3.6,Animal with Collar 40922
40922,10/14/2022 12:00,10/14/2022 6:00,10/14/2022 12:00,2022-10-14 06:00:33-06:00,Iridium,46.6851,-113.95444,1503,1.4,3D Validated,Nothing Detected,18,3.36,3.6,Animal with Collar 40922
40922,10/14/2022 11:00,10/14/2022 5:00,10/14/2022 12:00,2022-10-14 06:00:33-06:00,Iridium,46.67633,-113.96431,1408,1.8,3D Validated,Nothing Detected,20,3.36,3.6,Animal with Collar 40922
40922,10/14/2022 10:00,10/14/2022 4:00,10/14/2022 12:00,2022-10-14 06:00:33-06:00,Iridium,46.67583,-113.96267,1403,4.8,3D Validated,Nothing Detected,20,3.36,3.6,Animal with Collar 40922
40922,10/14/2022 9:00,10/14/2022 3:00,10/14/2022 12:00,2022-10-14 06:00:33-06:00,Iridium,46.67594,-113.96273,1416,2.4,3D Validated,Nothing Detected,19,3.36,3.6,Animal with Collar 40922
40922,10/14/2022 8:00,10/14/2022 2:00,10/14/2022 8:01,2022-10-14 02:01:34-06:00,Iridium,46.67545,-113.96287,1413,2,3D Validated,Nothing Detected,19,3.36,3.6,Animal with Collar 40922
40922,10/14/2022 7:00,10/14/2022 1:00,10/14/2022 8:01,2022-10-14 02:01:34-06:00,Iridium,46.67592,-113.9623,1341,6.4,3D Validated,Nothing Detected,20,3.36,3.6,Animal with Collar 40922
40922,10/14/2022 6:01,10/14/2022 0:01,10/14/2022 8:01,2022-10-14 02:01:34-06:00,Iridium,46.67572,-113.96275,1406,3.8,3D Validated,Nothing Detected,22,3.28,3.6,Animal with Collar 40922
40922,10/14/2022 5:00,10/13/2022 23:00,10/14/2022 8:01,2022-10-14 02:01:34-06:00,Iridium,46.67589,-113.96234,1413,3.8,3D Validated,Nothing Detected,22,3.36,3.6,Animal with Collar 40922
40922,10/14/2022 4:00,10/13/2022 22:00,10/14/2022 4:01,2022-10-13 22:01:11-06:00,Iridium,46.67573,-113.96289,1408,2.2,3D Validated,Nothing Detected,22,3.36,3.6,Animal with Collar 40922
40922,10/14/2022 3:00,10/13/2022 21:00,10/14/2022 4:01,2022-10-13 22:01:11-06:00,Iridium,46.6755,-113.96329,1394,3.6,3D Validated,Nothing Detected,22,3.36,3.6,Animal with Collar 40922
40922,10/14/2022 2:00,10/13/2022 20:00,10/14/2022 4:01,2022-10-13 22:01:11-06:00,Iridium,46.67947,-113.96585,1434,2,3D Validated,Nothing Detected,24,3.36,3.6,Animal with Collar 40922
40922,10/14/2022 1:00,10/13/2022 19:00,10/14/2022 4:01,2022-10-13 22:01:11-06:00,Iridium,46.68098,-113.96622,1325,3.8,3D Validated,Nothing Detected,30,3.36,3.6,Animal with Collar 40922
40922,10/13/2022 21:00,10/13/2022 15:00,10/14/2022 4:01,2022-10-13 22:01:48-06:00,Iridium,46.68106,-113.96634,1429,6.2,3D Validated,Nothing Detected,25,3.36,3.6,Animal with Collar 40922
40922,10/13/2022 20:00,10/13/2022 14:00,10/14/2022 8:01,2022-10-14 02:01:46-06:00,Iridium,46.68119,-113.96599,1338,2.8,3D Validated,Nothing Detected,24,3.36,3.6,Animal with Collar 40922
40922,10/13/2022 19:01,10/13/2022 13:01,10/14/2022 8:01,2022-10-14 02:01:46-06:00,Iridium,46.68123,-113.96625,1364,3.2,3D Validated,Nothing Detected,24,3.28,3.6,Animal with Collar 40922
40922,10/13/2022 18:00,10/13/2022 12:00,10/14/2022 8:01,2022-10-14 02:01:46-06:00,Iridium,46.6813,-113.96621,1368,2.4,3D Validated,Nothing Detected,26,3.36,3.6,Animal with Collar 40922
40922,10/13/2022 17:00,10/13/2022 11:00,10/14/2022 8:01,2022-10-14 02:01:46-06:00,Iridium,46.68113,-113.96633,1373,2,3D Validated,Nothing Detected,21,3.36,3.6,Animal with Collar 40922
40922,10/13/2022 16:00,10/13/2022 10:00,10/14/2022 8:01,2022-10-14 02:01:56-06:00,Iridium,46.68121,-113.96684,1372,4.2,3D Validated,Nothing Detected,22,3.36,3.6,Animal with Collar 40922
40922,10/13/2022 15:00,10/13/2022 9:00,10/14/2022 8:01,2022-10-14 02:01:56-06:00,Iridium,46.68126,-113.96636,1367,7.8,3D Validated,Nothing Detected,21,3.36,3.6,Animal with Collar 40922
40922,10/13/2022 14:00,10/13/2022 8:00,10/14/2022 8:01,2022-10-14 02:01:56-06:00,Iridium,46.68119,-113.96669,1341,8.6,3D Validated,Nothing Detected,19,3.28,3.6,Animal with Collar 40922
40922,10/13/2022 13:02,10/13/2022 7:02,10/14/2022 8:01,2022-10-14 02:01:56-06:00,Iridium,46.67776,-113.97894,1234,2.4,3D Validated,Nothing Detected,17,3.28,3.6,Animal with Collar 40922
40922,10/13/2022 12:00,10/13/2022 6:00,10/13/2022 12:01,2022-10-13 06:01:02-06:00,Iridium,46.66895,-114.00757,1080,2,3D Validated,Nothing Detected,16,3.28,3.6,Animal with Collar 40922
40922,10/13/2022 11:00,10/13/2022 5:00,10/13/2022 12:01,2022-10-13 06:01:02-06:00,Iridium,46.65987,-114.03497,990,7.4,3D Validated,Nothing Detected,15,3.28,3.6,Animal with Collar 40922
40922,10/13/2022 10:00,10/13/2022 4:00,10/13/2022 12:01,2022-10-13 06:01:02-06:00,Iridium,46.65027,-114.05587,980,2,3D Validated,Nothing Detected,17,3.28,3.6,Animal with Collar 40922
40922,10/13/2022 9:00,10/13/2022 3:00,10/13/2022 12:01,2022-10-13 06:01:02-06:00,Iridium,46.64091,-114.05243,988,3,3D Validated,Nothing Detected,18,3.36,3.6,Animal with Collar 40922
40922,10/13/2022 8:00,10/13/2022 2:00,10/13/2022 8:01,2022-10-13 02:01:19-06:00,Iridium,46.63686,-114.04945,985,2.2,3D Validated,Nothing Detected,19,3.36,3.6,Animal with Collar 40922
40922,10/13/2022 7:00,10/13/2022 1:00,10/13/2022 8:01,2022-10-13 02:01:19-06:00,Iridium,46.6369,-114.04902,981,2.6,3D Validated,Nothing Detected,20,3.36,3.6,Animal with Collar 40922
40922,10/13/2022 6:00,10/13/2022 0:00,10/13/2022 8:01,2022-10-13 02:01:19-06:00,Iridium,46.63779,-114.04925,979,2,3D Validated,Nothing Detected,20,3.36,3.6,Animal with Collar 40922
40922,10/13/2022 5:00,10/12/2022 23:00,10/13/2022 8:01,2022-10-13 02:01:19-06:00,Iridium,46.63685,-114.04949,992,2.4,3D Validated,Nothing Detected,20,3.28,3.6,Animal with Collar 40922
40922,10/13/2022 4:00,10/12/2022 22:00,10/13/2022 8:01,2022-10-13 02:01:40-06:00,Iridium,46.63612,-114.04918,993,1.8,3D Validated,Nothing Detected,20,3.36,3.6,Animal with Collar 40922
40922,10/13/2022 3:00,10/12/2022 21:00,10/13/2022 8:01,2022-10-13 02:01:40-06:00,Iridium,46.62898,-114.04524,987,1.8,3D Validated,Nothing Detected,20,3.36,3.6,Animal with Collar 40922
40922,10/13/2022 2:00,10/12/2022 20:00,10/13/2022 8:01,2022-10-13 02:01:40-06:00,Iridium,46.62936,-114.04981,978,2,3D Validated,Nothing Detected,22,3.36,3.6,Animal with Collar 40922
40922,10/13/2022 1:01,10/12/2022 19:01,10/13/2022 8:01,2022-10-13 02:01:40-06:00,Iridium,46.62823,-114.05817,911,4,3D Validated,Nothing Detected,26,3.36,3.6,Animal with Collar 40922
40922,10/13/2022 0:00,10/12/2022 18:00,10/13/2022 8:01,2022-10-13 02:01:50-06:00,Iridium,46.62873,-114.05833,996,2,3D Validated,Nothing Detected,28,3.36,3.6,Animal with Collar 40922
40922,10/12/2022 23:00,10/12/2022 17:00,10/13/2022 8:01,2022-10-13 02:01:50-06:00,Iridium,46.62851,-114.05765,987,2.4,3D Validated,Nothing Detected,27,3.36,3.6,Animal with Collar 40922
40922,10/12/2022 22:00,10/12/2022 16:00,10/13/2022 8:01,2022-10-13 02:01:50-06:00,Iridium,46.62852,-114.0581,986,1.6,3D Validated,Nothing Detected,28,3.36,3.6,Animal with Collar 40922
40922,10/12/2022 21:00,10/12/2022 15:00,10/13/2022 8:01,2022-10-13 02:01:50-06:00,Iridium,46.62873,-114.05782,1002,2.4,3D Validated,Nothing Detected,27,3.36,3.6,Animal with Collar 40922
40922,10/12/2022 20:00,10/12/2022 14:00,10/13/2022 12:01,2022-10-13 06:01:12-06:00,Iridium,46.62864,-114.05787,992,1.8,3D Validated,Nothing Detected,27,3.36,3.6,Animal with Collar 40922
40922,10/12/2022 19:00,10/12/2022 13:00,10/13/2022 12:01,2022-10-13 06:01:12-06:00,Iridium,46.62878,-114.05763,989,2,3D Validated,Nothing Detected,24,3.36,3.6,Animal with Collar 40922
40922,10/12/2022 18:00,10/12/2022 12:00,10/13/2022 12:01,2022-10-13 06:01:12-06:00,Iridium,46.6288,-114.05794,979,2.6,3D Validated,Nothing Detected,23,3.36,3.6,Animal with Collar 40922
40922,10/12/2022 17:00,10/12/2022 11:00,10/13/2022 12:01,2022-10-13 06:01:12-06:00,Iridium,46.62874,-114.05795,976,2,3D Validated,Nothing Detected,23,3.36,3.6,Animal with Collar 40922
40922,10/12/2022 16:00,10/12/2022 10:00,10/13/2022 12:01,2022-10-13 06:01:21-06:00,Iridium,46.62867,-114.05794,979,3.6,3D Validated,Nothing Detected,20,3.36,3.6,Animal with Collar 40922
40922,10/12/2022 15:00,10/12/2022 9:00,10/13/2022 12:01,2022-10-13 06:01:21-06:00,Iridium,46.62855,-114.05791,993,1.8,3D Validated,Nothing Detected,16,3.36,3.6,Animal with Collar 40922
40922,10/12/2022 14:00,10/12/2022 8:00,10/13/2022 12:01,2022-10-13 06:01:21-06:00,Iridium,46.62862,-114.05794,980,1.8,3D Validated,Nothing Detected,16,3.36,3.6,Animal with Collar 40922
40922,10/12/2022 13:00,10/12/2022 7:00,10/13/2022 12:01,2022-10-13 06:01:21-06:00,Iridium,46.62936,-114.05796,975,4,3D Validated,Nothing Detected,16,3.36,3.6,Animal with Collar 40922
40922,10/12/2022 12:00,10/12/2022 6:00,10/13/2022 12:01,2022-10-13 06:01:29-06:00,Iridium,46.62885,-114.058,962,2.6,3D Validated,Nothing Detected,15,3.36,3.6,Animal with Collar 40922
40922,10/12/2022 11:00,10/12/2022 5:00,10/13/2022 12:01,2022-10-13 06:01:29-06:00,Iridium,46.62855,-114.05938,983,4,3D Validated,Nothing Detected,17,3.28,3.6,Animal with Collar 40922
40922,10/12/2022 10:02,10/12/2022 4:02,10/13/2022 12:01,2022-10-13 06:01:29-06:00,Iridium,46.62688,-114.06295,980,6,3D Validated,Nothing Detected,17,3.28,3.6,Animal with Collar 40922
40922,10/12/2022 9:00,10/12/2022 3:00,10/13/2022 12:01,2022-10-13 06:01:29-06:00,Iridium,46.63084,-114.05543,989,3,3D Validated,Nothing Detected,19,3.28,3.6,Animal with Collar 40922
40922,10/12/2022 8:00,10/12/2022 2:00,10/13/2022 12:01,2022-10-13 06:01:40-06:00,Iridium,46.62936,-114.04979,980,2.8,3D Validated,Nothing Detected,19,3.36,3.6,Animal with Collar 40922
40922,10/12/2022 7:00,10/12/2022 1:00,10/13/2022 12:01,2022-10-13 06:01:40-06:00,Iridium,46.62934,-114.04994,982,1.4,3D Validated,Nothing Detected,19,3.36,3.6,Animal with Collar 40922
40922,10/12/2022 6:00,10/12/2022 0:00,10/13/2022 12:01,2022-10-13 06:01:40-06:00,Iridium,46.62943,-114.0498,967,2.8,3D Validated,Nothing Detected,20,3.36,3.6,Animal with Collar 40922
40922,10/12/2022 5:00,10/11/2022 23:00,10/13/2022 12:01,2022-10-13 06:01:40-06:00,Iridium,46.6293,-114.04982,981,2.4,3D Validated,Nothing Detected,20,3.36,3.6,Animal with Collar 40922
40922,10/12/2022 4:00,10/11/2022 22:00,10/12/2022 4:01,2022-10-11 22:01:09-06:00,Iridium,46.62935,-114.04977,978,1.6,3D Validated,Nothing Detected,20,3.36,3.6,Animal with Collar 40922
40922,10/12/2022 3:01,10/11/2022 21:01,10/12/2022 4:01,2022-10-11 22:01:09-06:00,Iridium,46.62986,-114.05488,983,3,3D Validated,Nothing Detected,22,3.36,3.6,Animal with Collar 40922
40922,10/12/2022 2:00,10/11/2022 20:00,10/12/2022 4:01,2022-10-11 22:01:09-06:00,Iridium,46.62865,-114.05787,1016,2.8,3D Validated,Nothing Detected,23,3.36,3.6,Animal with Collar 40922
40922,10/12/2022 1:00,10/11/2022 19:00,10/12/2022 4:01,2022-10-11 22:01:09-06:00,Iridium,46.62857,-114.05764,991,2.4,3D Validated,Nothing Detected,25,3.36,3.6,Animal with Collar 40922
40922,10/12/2022 0:00,10/11/2022 18:00,10/13/2022 12:02,2022-10-13 06:02:00-06:00,Iridium,46.62863,-114.0575,977,1.8,3D Validated,Nothing Detected,26,3.36,3.6,Animal with Collar 40922
40922,10/11/2022 23:01,10/11/2022 17:01,10/13/2022 12:02,2022-10-13 06:02:00-06:00,Iridium,46.6286,-114.05788,978,2.6,3D Validated,Nothing Detected,27,3.36,3.6,Animal with Collar 40922
40922,10/11/2022 22:00,10/11/2022 16:00,10/13/2022 12:02,2022-10-13 06:02:00-06:00,Iridium,46.62859,-114.05807,1014,2.2,3D Validated,Nothing Detected,27,3.36,3.6,Animal with Collar 40922
40922,10/11/2022 21:00,10/11/2022 15:00,10/13/2022 12:02,2022-10-13 06:02:00-06:00,Iridium,46.62882,-114.05804,985,4.2,3D Validated,Nothing Detected,27,3.36,3.6,Animal with Collar 40922
40922,10/11/2022 20:00,10/11/2022 14:00,10/13/2022 12:02,2022-10-13 06:02:07-06:00,Iridium,46.62868,-114.05796,982,3.4,3D Validated,Nothing Detected,30,3.36,3.6,Animal with Collar 40922
40922,10/11/2022 19:00,10/11/2022 13:00,10/13/2022 12:02,2022-10-13 06:02:07-06:00,Iridium,46.62857,-114.05794,981,1.8,3D Validated,Nothing Detected,29,3.36,3.6,Animal with Collar 40922
40922,10/11/2022 18:00,10/11/2022 12:00,10/13/2022 12:02,2022-10-13 06:02:07-06:00,Iridium,46.62862,-114.05791,1000,2.6,3D Validated,Nothing Detected,26,3.36,3.6,Animal with Collar 40922
40922,10/11/2022 17:00,10/11/2022 11:00,10/13/2022 12:02,2022-10-13 06:02:07-06:00,Iridium,46.62854,-114.05788,964,2,3D Validated,Nothing Detected,25,3.36,3.6,Animal with Collar 40922
40922,10/11/2022 16:00,10/11/2022 10:00,10/11/2022 16:00,2022-10-11 10:00:59-06:00,Iridium,46.62847,-114.05795,988,1.4,3D Validated,Nothing Detected,24,3.36,3.6,Animal with Collar 40922
40922,10/11/2022 15:00,10/11/2022 9:00,10/11/2022 16:00,2022-10-11 10:00:59-06:00,Iridium,46.62862,-114.05804,969,4,3D Validated,Nothing Detected,20,3.36,3.6,Animal with Collar 40922
40922,10/11/2022 14:00,10/11/2022 8:00,10/11/2022 16:00,2022-10-11 10:00:59-06:00,Iridium,46.62936,-114.04978,989,3.4,3D Validated,Nothing Detected,22,3.36,3.6,Animal with Collar 40922
40922,10/11/2022 13:00,10/11/2022 7:00,10/11/2022 16:00,2022-10-11 10:00:59-06:00,Iridium,46.62935,-114.05006,967,7,3D Validated,Nothing Detected,22,3.36,3.6,Animal with Collar 40922
40922,10/11/2022 12:00,10/11/2022 6:00,10/11/2022 12:00,2022-10-11 06:00:41-06:00,Iridium,46.62935,-114.04972,982,3.4,3D Validated,Nothing Detected,23,3.36,3.6,Animal with Collar 40922
40922,10/11/2022 11:00,10/11/2022 5:00,10/11/2022 12:00,2022-10-11 06:00:41-06:00,Iridium,46.62937,-114.04977,974,2.4,3D Validated,Nothing Detected,23,3.36,3.6,Animal with Collar 40922
40922,10/11/2022 10:01,10/11/2022 4:01,10/11/2022 12:00,2022-10-11 06:00:41-06:00,Iridium,46.62354,-114.052,986,7.4,3D Validated,Nothing Detected,23,3.28,3.6,Animal with Collar 40922
40922,10/11/2022 9:00,10/11/2022 3:00,10/11/2022 12:00,2022-10-11 06:00:41-06:00,Iridium,46.61064,-114.0724,982,3.4,3D Validated,Nothing Detected,25,3.36,3.6,Animal with Collar 40922
40922,10/11/2022 8:01,10/11/2022 2:01,10/11/2022 8:02,2022-10-11 02:02:32-06:00,Iridium,46.60907,-114.0861,1001,2.4,3D Validated,Nothing Detected,24,3.28,3.6,Animal with Collar 40922
40922,10/11/2022 7:00,10/11/2022 1:00,10/11/2022 8:02,2022-10-11 02:02:32-06:00,Iridium,46.60871,-114.07832,989,1.8,3D Validated,Nothing Detected,24,3.36,3.6,Animal with Collar 40922
40922,10/11/2022 6:01,10/11/2022 0:01,10/11/2022 8:02,2022-10-11 02:02:32-06:00,Iridium,46.61237,-114.0734,993,2.2,3D Validated,Nothing Detected,24,3.28,3.6,Animal with Collar 40922
40922,10/11/2022 5:00,10/10/2022 23:00,10/11/2022 8:02,2022-10-11 02:02:32-06:00,Iridium,46.62711,-114.06377,988,2.8,3D Validated,Nothing Detected,26,3.36,3.6,Animal with Collar 40922
40922,10/11/2022 4:00,10/10/2022 22:00,10/11/2022 8:02,2022-10-11 02:02:40-06:00,Iridium,46.62716,-114.06368,1002,2,3D Validated,Nothing Detected,25,3.36,3.6,Animal with Collar 40922
40922,10/11/2022 3:01,10/10/2022 21:01,10/11/2022 8:02,2022-10-11 02:02:40-06:00,Iridium,46.62707,-114.06406,981,1.6,3D Validated,Nothing Detected,25,3.36,3.6,Animal with Collar 40922
40922,10/11/2022 2:00,10/10/2022 20:00,10/11/2022 8:02,2022-10-11 02:02:40-06:00,Iridium,46.62787,-114.06348,980,6.2,3D Validated,Nothing Detected,24,3.36,3.6,Animal with Collar 40922
40922,10/11/2022 1:00,10/10/2022 19:00,10/11/2022 8:02,2022-10-11 02:02:40-06:00,Iridium,46.62905,-114.05827,983,1.8,3D Validated,Nothing Detected,26,3.36,3.6,Animal with Collar 40922
40922,10/11/2022 0:00,10/10/2022 18:00,10/11/2022 12:00,2022-10-11 06:00:50-06:00,Iridium,46.62909,-114.0583,964,1.8,3D Validated,Nothing Detected,28,3.36,3.6,Animal with Collar 40922
40922,10/10/2022 23:00,10/10/2022 17:00,10/11/2022 12:00,2022-10-11 06:00:50-06:00,Iridium,46.62906,-114.05841,979,2.4,3D Validated,Nothing Detected,28,3.36,3.6,Animal with Collar 40922
40922,10/10/2022 22:00,10/10/2022 16:00,10/11/2022 12:00,2022-10-11 06:00:50-06:00,Iridium,46.62921,-114.05791,1007,1.8,3D Validated,Nothing Detected,26,3.36,3.6,Animal with Collar 40922
40922,10/10/2022 21:00,10/10/2022 15:00,10/11/2022 12:00,2022-10-11 06:00:50-06:00,Iridium,46.62919,-114.0581,979,2.4,3D Validated,Nothing Detected,26,3.36,3.6,Animal with Collar 40922
40922,10/10/2022 20:00,10/10/2022 14:00,10/11/2022 12:01,2022-10-11 06:01:00-06:00,Iridium,46.62915,-114.05809,989,2.2,3D Validated,Nothing Detected,25,3.36,3.6,Animal with Collar 40922
40922,10/10/2022 19:00,10/10/2022 13:00,10/11/2022 12:01,2022-10-11 06:01:00-06:00,Iridium,46.62916,-114.05808,987,2,3D Validated,Nothing Detected,25,3.36,3.6,Animal with Collar 40922
40922,10/10/2022 18:00,10/10/2022 12:00,10/11/2022 12:01,2022-10-11 06:01:00-06:00,Iridium,46.62927,-114.05821,990,2.4,3D Validated,Nothing Detected,22,3.36,3.6,Animal with Collar 40922
40922,10/10/2022 17:00,10/10/2022 11:00,10/11/2022 12:01,2022-10-11 06:01:00-06:00,Iridium,46.62917,-114.05818,984,1.6,3D Validated,Nothing Detected,22,3.36,3.6,Animal with Collar 40922
40922,10/10/2022 16:01,10/10/2022 10:01,10/10/2022 16:03,2022-10-10 10:03:10-06:00,Iridium,46.62916,-114.05836,1001,6.4,3D Validated,Nothing Detected,18,3.36,3.6,Animal with Collar 40922
40922,10/10/2022 15:00,10/10/2022 9:00,10/10/2022 16:03,2022-10-10 10:03:10-06:00,Iridium,46.629,-114.05838,993,2,3D Validated,Nothing Detected,16,3.36,3.6,Animal with Collar 40922
40922,10/10/2022 14:00,10/10/2022 8:00,10/10/2022 16:03,2022-10-10 10:03:10-06:00,Iridium,46.62912,-114.05836,983,2.2,3D Validated,Nothing Detected,15,3.36,3.6,Animal with Collar 40922
40922,10/10/2022 13:00,10/10/2022 7:00,10/10/2022 16:03,2022-10-10 10:03:10-06:00,Iridium,46.62904,-114.05842,980,1.4,3D Validated,Nothing Detected,15,3.36,3.6,Animal with Collar 40922
40922,10/10/2022 12:00,10/10/2022 6:00,10/11/2022 12:01,2022-10-11 06:01:16-06:00,Iridium,46.62897,-114.05827,980,4.4,3D Validated,Nothing Detected,15,3.36,3.6,Animal with Collar 40922
40922,10/10/2022 11:00,10/10/2022 5:00,10/11/2022 12:01,2022-10-11 06:01:16-06:00,Iridium,46.62893,-114.0581,1018,4.8,3D Validated,Nothing Detected,15,3.36,3.6,Animal with Collar 40922
40922,10/10/2022 10:00,10/10/2022 4:00,10/11/2022 12:01,2022-10-11 06:01:16-06:00,Iridium,46.62906,-114.05837,973,2.6,3D Validated,Nothing Detected,17,3.36,3.6,Animal with Collar 40922
40922,10/10/2022 9:00,10/10/2022 3:00,10/11/2022 12:01,2022-10-11 06:01:16-06:00,Iridium,46.62948,-114.05923,973,3.6,3D Validated,Nothing Detected,18,3.36,3.6,Animal with Collar 40922
40922,10/10/2022 8:00,10/10/2022 2:00,10/10/2022 8:02,2022-10-10 02:02:23-06:00,Iridium,46.62713,-114.06376,986,2.8,3D Validated,Nothing Detected,18,3.36,3.6,Animal with Collar 40922
40922,10/10/2022 7:00,10/10/2022 1:00,10/10/2022 8:02,2022-10-10 02:02:23-06:00,Iridium,46.62808,-114.06416,971,2.4,3D Validated,Nothing Detected,20,3.36,3.6,Animal with Collar 40922
40922,10/10/2022 6:00,10/10/2022 0:00,10/10/2022 8:02,2022-10-10 02:02:23-06:00,Iridium,46.62815,-114.0642,1003,2.2,3D Validated,Nothing Detected,20,3.36,3.6,Animal with Collar 40922
40922,10/10/2022 5:00,10/9/2022 23:00,10/10/2022 8:02,2022-10-10 02:02:23-06:00,Iridium,46.62716,-114.06373,991,3,3D Validated,Nothing Detected,20,3.36,3.6,Animal with Collar 40922
40922,10/10/2022 4:00,10/9/2022 22:00,10/10/2022 4:00,2022-10-09 22:00:42-06:00,Iridium,46.62653,-114.06401,983,1.6,3D Validated,Nothing Detected,21,3.36,3.6,Animal with Collar 40922
40922,10/10/2022 3:00,10/9/2022 21:00,10/10/2022 4:00,2022-10-09 22:00:42-06:00,Iridium,46.62707,-114.06381,975,1.4,3D Validated,Nothing Detected,21,3.36,3.6,Animal with Collar 40922
40922,10/10/2022 2:01,10/9/2022 20:01,10/10/2022 4:00,2022-10-09 22:00:42-06:00,Iridium,46.62816,-114.06038,980,7.4,3D Validated,Nothing Detected,24,3.36,3.6,Animal with Collar 40922
40922,10/10/2022 1:00,10/9/2022 19:00,10/10/2022 4:00,2022-10-09 22:00:42-06:00,Iridium,46.62939,-114.0582,977,4.2,3D Validated,Nothing Detected,25,3.36,3.6,Animal with Collar 40922
40922,10/10/2022 0:00,10/9/2022 18:00,10/10/2022 0:00,2022-10-09 18:00:44-06:00,Iridium,46.62941,-114.05832,977,2.2,3D Validated,Nothing Detected,27,3.36,3.6,Animal with Collar 40922
40922,10/9/2022 23:00,10/9/2022 17:00,10/10/2022 0:00,2022-10-09 18:00:44-06:00,Iridium,46.62951,-114.0584,976,2.2,3D Validated,Nothing Detected,30,3.36,3.6,Animal with Collar 40922
40922,10/9/2022 22:00,10/9/2022 16:00,10/10/2022 0:00,2022-10-09 18:00:44-06:00,Iridium,46.62946,-114.05833,980,2.2,3D Validated,Nothing Detected,26,3.36,3.6,Animal with Collar 40922
40922,10/9/2022 21:00,10/9/2022 15:00,10/10/2022 0:00,2022-10-09 18:00:44-06:00,Iridium,46.62953,-114.05826,979,3.6,3D Validated,Nothing Detected,25,3.36,3.6,Animal with Collar 40922
40922,10/9/2022 20:00,10/9/2022 14:00,10/9/2022 20:01,2022-10-09 14:01:13-06:00,Iridium,46.62951,-114.0583,984,2.6,3D Validated,Nothing Detected,25,3.36,3.6,Animal with Collar 40922
40922,10/9/2022 19:00,10/9/2022 13:00,10/9/2022 20:01,2022-10-09 14:01:13-06:00,Iridium,46.62951,-114.05845,979,2,3D Validated,Nothing Detected,26,3.36,3.6,Animal with Collar 40922
40922,10/9/2022 18:00,10/9/2022 12:00,10/9/2022 20:01,2022-10-09 14:01:13-06:00,Iridium,46.62863,-114.0586,1008,2.4,3D Validated,Nothing Detected,22,3.36,3.6,Animal with Collar 40922
40922,10/9/2022 17:00,10/9/2022 11:00,10/9/2022 20:01,2022-10-09 14:01:13-06:00,Iridium,46.62853,-114.05846,979,2,3D Validated,Nothing Detected,22,3.36,3.6,Animal with Collar 40922
40922,10/9/2022 16:00,10/9/2022 10:00,10/9/2022 20:01,2022-10-09 14:01:31-06:00,Iridium,46.62904,-114.05823,1006,2.8,3D Validated,Nothing Detected,18,3.36,3.6,Animal with Collar 40922
40922,10/9/2022 15:00,10/9/2022 9:00,10/9/2022 20:01,2022-10-09 14:01:31-06:00,Iridium,46.62902,-114.0582,999,2,3D Validated,Nothing Detected,18,3.36,3.6,Animal with Collar 40922
40922,10/9/2022 14:00,10/9/2022 8:00,10/9/2022 20:01,2022-10-09 14:01:31-06:00,Iridium,46.629,-114.05836,985,1.8,3D Validated,Nothing Detected,17,3.36,3.6,Animal with Collar 40922
40922,10/9/2022 13:00,10/9/2022 7:00,10/9/2022 20:01,2022-10-09 14:01:31-06:00,Iridium,46.62901,-114.0585,984,2,3D Validated,Nothing Detected,16,3.36,3.6,Animal with Collar 40922
40922,10/9/2022 12:00,10/9/2022 6:00,10/9/2022 12:01,2022-10-09 06:01:25-06:00,Iridium,46.62913,-114.0584,980,1.8,3D Validated,Nothing Detected,16,3.28,3.6,Animal with Collar 40922
40922,10/9/2022 11:00,10/9/2022 5:00,10/9/2022 12:01,2022-10-09 06:01:25-06:00,Iridium,46.62239,-114.06649,983,4,3D Validated,Nothing Detected,16,3.36,3.6,Animal with Collar 40922
40922,10/9/2022 10:00,10/9/2022 4:00,10/9/2022 12:01,2022-10-09 06:01:25-06:00,Iridium,46.62002,-114.06669,981,4.4,3D Validated,Nothing Detected,16,3.36,3.6,Animal with Collar 40922
40922,10/9/2022 9:00,10/9/2022 3:00,10/9/2022 12:01,2022-10-09 06:01:25-06:00,Iridium,46.61986,-114.06702,966,3.6,3D Validated,Nothing Detected,16,3.36,3.6,Animal with Collar 40922
40922,10/9/2022 8:01,10/9/2022 2:01,10/9/2022 12:01,2022-10-09 06:01:33-06:00,Iridium,46.62005,-114.06635,984,2.4,3D Validated,Nothing Detected,16,3.28,3.6,Animal with Collar 40922
40922,10/9/2022 7:00,10/9/2022 1:00,10/9/2022 12:01,2022-10-09 06:01:33-06:00,Iridium,46.61062,-114.05643,981,4.6,3D Validated,Nothing Detected,18,3.36,3.6,Animal with Collar 40922
40922,10/9/2022 6:00,10/9/2022 0:00,10/9/2022 12:01,2022-10-09 06:01:33-06:00,Iridium,46.61199,-114.04068,986,2,3D Validated,Nothing Detected,18,3.36,3.6,Animal with Collar 40922
40922,10/9/2022 5:00,10/8/2022 23:00,10/9/2022 12:01,2022-10-09 06:01:33-06:00,Iridium,46.6203,-114.04594,983,2.6,3D Validated,Nothing Detected,19,3.28,3.6,Animal with Collar 40922
40922,10/9/2022 4:00,10/8/2022 22:00,10/9/2022 12:01,2022-10-09 06:01:46-06:00,Iridium,46.63089,-114.06138,982,2.6,3D Validated,Nothing Detected,20,3.36,3.6,Animal with Collar 40922
40922,10/9/2022 3:00,10/8/2022 21:00,10/9/2022 12:01,2022-10-09 06:01:46-06:00,Iridium,46.62715,-114.06381,981,3.4,3D Validated,Nothing Detected,22,3.36,3.6,Animal with Collar 40922
40922,10/9/2022 2:00,10/8/2022 20:00,10/9/2022 12:01,2022-10-09 06:01:46-06:00,Iridium,46.62711,-114.0637,997,5.8,3D Validated,Nothing Detected,22,3.36,3.6,Animal with Collar 40922
40922,10/9/2022 1:00,10/8/2022 19:00,10/9/2022 12:01,2022-10-09 06:01:46-06:00,Iridium,46.62919,-114.05833,990,2.2,3D Validated,Nothing Detected,25,3.36,3.6,Animal with Collar 40922
40922,10/9/2022 0:00,10/8/2022 18:00,10/9/2022 0:01,2022-10-08 18:01:00-06:00,Iridium,46.6291,-114.05848,980,1.6,3D Validated,Nothing Detected,26,3.36,3.6,Animal with Collar 40922
40922,10/8/2022 23:00,10/8/2022 17:00,10/9/2022 0:01,2022-10-08 18:01:00-06:00,Iridium,46.62923,-114.05853,991,3.8,3D Validated,Nothing Detected,27,3.36,3.6,Animal with Collar 40922
40922,10/8/2022 22:00,10/8/2022 16:00,10/9/2022 0:01,2022-10-08 18:01:00-06:00,Iridium,46.62913,-114.05837,960,2.2,3D Validated,Nothing Detected,28,3.36,3.6,Animal with Collar 40922
40922,10/8/2022 21:00,10/8/2022 15:00,10/9/2022 0:01,2022-10-08 18:01:00-06:00,Iridium,46.62907,-114.05805,997,2,3D Validated,Nothing Detected,28,3.36,3.6,Animal with Collar 40922
40922,10/8/2022 20:00,10/8/2022 14:00,10/9/2022 0:01,2022-10-08 18:01:17-06:00,Iridium,46.62903,-114.05843,976,2.2,3D Validated,Nothing Detected,27,3.36,3.6,Animal with Collar 40922
40922,10/8/2022 19:00,10/8/2022 13:00,10/9/2022 0:01,2022-10-08 18:01:17-06:00,Iridium,46.62908,-114.05833,993,1.6,3D Validated,Nothing Detected,26,3.36,3.6,Animal with Collar 40922
40922,10/8/2022 18:00,10/8/2022 12:00,10/9/2022 0:01,2022-10-08 18:01:17-06:00,Iridium,46.62928,-114.0587,981,4,3D Validated,Nothing Detected,25,3.36,3.6,Animal with Collar 40922
40922,10/8/2022 17:00,10/8/2022 11:00,10/9/2022 0:01,2022-10-08 18:01:17-06:00,Iridium,46.62939,-114.05877,991,3.4,3D Validated,Nothing Detected,21,3.36,3.6,Animal with Collar 40922
40922,10/8/2022 16:00,10/8/2022 10:00,10/8/2022 16:01,2022-10-08 10:01:10-06:00,Iridium,46.62937,-114.05868,987,2.8,3D Validated,Nothing Detected,19,3.36,3.6,Animal with Collar 40922
40922,10/8/2022 15:01,10/8/2022 9:01,10/8/2022 16:01,2022-10-08 10:01:10-06:00,Iridium,46.62921,-114.05821,980,2.4,3D Validated,Nothing Detected,18,3.36,3.6,Animal with Collar 40922
40922,10/8/2022 14:00,10/8/2022 8:00,10/8/2022 16:01,2022-10-08 10:01:10-06:00,Iridium,46.62919,-114.05843,995,4.2,3D Validated,Nothing Detected,18,3.36,3.6,Animal with Collar 40922
40922,10/8/2022 13:00,10/8/2022 7:00,10/8/2022 16:01,2022-10-08 10:01:10-06:00,Iridium,46.62895,-114.05853,963,2.2,3D Validated,Nothing Detected,17,3.36,3.6,Animal with Collar 40922
40922,10/8/2022 12:00,10/8/2022 6:00,10/8/2022 12:00,2022-10-08 06:00:58-06:00,Iridium,46.62911,-114.05838,976,1.4,3D Validated,Nothing Detected,17,3.36,3.6,Animal with Collar 40922
40922,10/8/2022 11:00,10/8/2022 5:00,10/8/2022 12:00,2022-10-08 06:00:58-06:00,Iridium,46.62919,-114.05846,987,3.4,3D Validated,Nothing Detected,18,3.36,3.6,Animal with Collar 40922
40922,10/8/2022 10:01,10/8/2022 4:01,10/8/2022 12:00,2022-10-08 06:00:58-06:00,Iridium,46.62711,-114.06381,980,4.8,3D Validated,Nothing Detected,19,3.28,3.6,Animal with Collar 40922
40922,10/8/2022 9:00,10/8/2022 3:00,10/8/2022 12:00,2022-10-08 06:00:58-06:00,Iridium,46.6271,-114.06387,975,4,3D Validated,Nothing Detected,20,3.36,3.6,Animal with Collar 40922
40922,10/8/2022 8:00,10/8/2022 2:00,10/8/2022 8:01,2022-10-08 02:01:02-06:00,Iridium,46.62705,-114.06364,1006,2.4,3D Validated,Nothing Detected,19,3.36,3.6,Animal with Collar 40922
40922,10/8/2022 7:00,10/8/2022 1:00,10/8/2022 8:01,2022-10-08 02:01:02-06:00,Iridium,46.62662,-114.06393,982,1.6,3D Validated,Nothing Detected,18,3.28,3.6,Animal with Collar 40922
40922,10/8/2022 6:00,10/8/2022 0:00,10/8/2022 8:01,2022-10-08 02:01:02-06:00,Iridium,46.61993,-114.06673,989,2.8,3D Validated,Nothing Detected,19,3.36,3.6,Animal with Collar 40922
40922,10/8/2022 5:00,10/7/2022 23:00,10/8/2022 8:01,2022-10-08 02:01:02-06:00,Iridium,46.61994,-114.06715,985,3.6,3D Validated,Nothing Detected,20,3.28,3.6,Animal with Collar 40922
40922,10/8/2022 4:00,10/7/2022 22:00,10/8/2022 4:00,2022-10-07 22:00:58-06:00,Iridium,46.62001,-114.06678,994,2.6,3D Validated,Nothing Detected,21,3.36,3.6,Animal with Collar 40922
40922,10/8/2022 3:00,10/7/2022 21:00,10/8/2022 4:00,2022-10-07 22:00:58-06:00,Iridium,46.6218,-114.06656,980,2.4,3D Validated,Nothing Detected,21,3.36,3.6,Animal with Collar 40922
40922,10/8/2022 2:00,10/7/2022 20:00,10/8/2022 4:00,2022-10-07 22:00:58-06:00,Iridium,46.62008,-114.06634,990,6.2,3D Validated,Nothing Detected,21,3.36,3.6,Animal with Collar 40922
40922,10/8/2022 1:00,10/7/2022 19:00,10/8/2022 4:00,2022-10-07 22:00:58-06:00,Iridium,46.61308,-114.06206,979,4.2,3D Validated,Nothing Detected,24,3.36,3.6,Animal with Collar 40922
40922,10/7/2022 21:00,10/7/2022 15:00,10/8/2022 16:01,2022-10-08 10:01:18-06:00,Iridium,46.61308,-114.06214,987,2.4,3D Validated,Nothing Detected,27,3.36,3.6,Animal with Collar 40922
40922,10/7/2022 20:02,10/7/2022 14:02,10/8/2022 16:01,2022-10-08 10:01:27-06:00,Iridium,46.61306,-114.06206,978,4.8,3D Validated,Nothing Detected,26,3.36,3.6,Animal with Collar 40922
40922,10/7/2022 19:01,10/7/2022 13:01,10/8/2022 16:01,2022-10-08 10:01:27-06:00,Iridium,46.61297,-114.06206,980,1.8,3D Validated,Nothing Detected,25,3.36,3.6,Animal with Collar 40922
40922,10/7/2022 18:00,10/7/2022 12:00,10/8/2022 16:01,2022-10-08 10:01:27-06:00,Iridium,46.61309,-114.06213,991,2,3D Validated,Nothing Detected,24,3.36,3.6,Animal with Collar 40922
40922,10/7/2022 17:00,10/7/2022 11:00,10/8/2022 16:01,2022-10-08 10:01:27-06:00,Iridium,46.61308,-114.06208,981,2,3D Validated,Nothing Detected,22,3.36,3.6,Animal with Collar 40922
40922,10/7/2022 16:00,10/7/2022 10:00,10/8/2022 16:01,2022-10-08 10:01:35-06:00,Iridium,46.61312,-114.06201,989,2.2,3D Validated,Nothing Detected,19,3.36,3.6,Animal with Collar 40922
40922,10/7/2022 15:00,10/7/2022 9:00,10/8/2022 16:01,2022-10-08 10:01:35-06:00,Iridium,46.61306,-114.06204,973,2.2,3D Validated,Nothing Detected,17,3.36,3.6,Animal with Collar 40922
40922,10/7/2022 14:00,10/7/2022 8:00,10/8/2022 16:01,2022-10-08 10:01:35-06:00,Iridium,46.61309,-114.06204,984,1.6,3D Validated,Nothing Detected,16,3.36,3.6,Animal with Collar 40922
40922,10/7/2022 13:00,10/7/2022 7:00,10/8/2022 16:01,2022-10-08 10:01:35-06:00,Iridium,46.61311,-114.06219,987,1.4,3D Validated,Nothing Detected,17,3.36,3.6,Animal with Collar 40922
40922,10/7/2022 12:00,10/7/2022 6:00,10/8/2022 16:01,2022-10-08 10:01:44-06:00,Iridium,46.61303,-114.06216,998,3.2,3D Validated,Nothing Detected,16,3.36,3.6,Animal with Collar 40922
40922,10/7/2022 11:00,10/7/2022 5:00,10/8/2022 16:01,2022-10-08 10:01:44-06:00,Iridium,46.61144,-114.07311,981,6.4,3D Validated,Nothing Detected,18,3.36,3.6,Animal with Collar 40922
40922,10/7/2022 10:00,10/7/2022 4:00,10/8/2022 16:01,2022-10-08 10:01:44-06:00,Iridium,46.6093,-114.08713,1000,2.6,3D Validated,Nothing Detected,19,3.28,3.6,Animal with Collar 40922
40922,10/7/2022 9:00,10/7/2022 3:00,10/8/2022 16:01,2022-10-08 10:01:44-06:00,Iridium,46.61077,-114.09556,1010,3.2,3D Validated,Nothing Detected,20,3.36,3.6,Animal with Collar 40922
40922,10/7/2022 8:00,10/7/2022 2:00,10/7/2022 8:01,2022-10-07 02:01:05-06:00,Iridium,46.61089,-114.09472,998,1.8,3D Validated,Nothing Detected,21,3.36,3.6,Animal with Collar 40922
40922,10/7/2022 7:00,10/7/2022 1:00,10/7/2022 8:01,2022-10-07 02:01:05-06:00,Iridium,46.61029,-114.09888,1017,2.2,3D Validated,Nothing Detected,20,3.36,3.6,Animal with Collar 40922
40922,10/7/2022 6:00,10/7/2022 0:00,10/7/2022 8:01,2022-10-07 02:01:05-06:00,Iridium,46.60817,-114.10008,1022,2,3D Validated,Nothing Detected,21,3.36,3.6,Animal with Collar 40922
40922,10/7/2022 5:00,10/6/2022 23:00,10/7/2022 8:01,2022-10-07 02:01:05-06:00,Iridium,46.61089,-114.11072,1044,3.6,3D Validated,Nothing Detected,22,3.36,3.6,Animal with Collar 40922
40922,10/7/2022 4:01,10/6/2022 22:01,10/7/2022 8:01,2022-10-07 02:01:15-06:00,Iridium,46.61196,-114.10903,1063,2.8,3D Validated,Nothing Detected,22,3.28,3.6,Animal with Collar 40922
40922,10/7/2022 3:00,10/6/2022 21:00,10/7/2022 8:01,2022-10-07 02:01:15-06:00,Iridium,46.60958,-114.10422,1034,4,3D Validated,Nothing Detected,23,3.36,3.6,Animal with Collar 40922
40922,10/7/2022 2:01,10/6/2022 20:01,10/7/2022 8:01,2022-10-07 02:01:15-06:00,Iridium,46.60812,-114.10024,1005,9.2,3D Validated,Nothing Detected,23,3.36,3.6,Animal with Collar 40922
40922,10/7/2022 0:00,10/6/2022 18:00,10/7/2022 0:01,2022-10-06 18:01:00-06:00,Iridium,46.60894,-114.09874,1014,2.2,3D Validated,Nothing Detected,26,3.36,3.6,Animal with Collar 40922
40922,10/6/2022 23:00,10/6/2022 17:00,10/7/2022 0:01,2022-10-06 18:01:00-06:00,Iridium,46.60884,-114.09899,1031,2.2,3D Validated,Nothing Detected,27,3.36,3.6,Animal with Collar 40922
