Collar ID,Acq. Time [UTC],Acq. Time [LMT],SCTS [UTC],SCTS [LMT],Origin,Latitude[deg],Longitude[deg],Altitude[m],DOP,Fix Type,Mortality Status,Temp[°C],Main[V],Beacon [V],Animal
46030,12/6/2024 20:00,2024-12-06 13:00:11-07:00,12/6/2024 20:01,2024-12-06 13:01:13-07:00,Iridium,46.74245,-113.9537,1511,7.2,3D Valid,Nothing Detected,14,3.28,3.6,
46030,12/6/2024 19:01,2024-12-06 12:01:09-07:00,12/6/2024 20:01,2024-12-06 13:01:13-07:00,Iridium,46.7425,-113.95364,1525,3.4,3D Valid,Nothing Detected,13,3.28,3.6,
46030,12/1/2024 20:00,2024-12-01 13:00:38-07:00,12/1/2024 20:01,2024-12-01 13:01:06-07:00,Iridium,46.74242,-113.9537,1531,7.8,3D Valid,Nothing Detected,15,3.28,3.6,
46030,12/1/2024 19:01,2024-12-01 12:01:02-07:00,12/1/2024 20:01,2024-12-01 13:01:06-07:00,Iridium,46.7425,-113.95374,1536,3.2,3D Valid,Nothing Detected,15,3.28,3.6,
46030,11/17/2024 0:00,2024-11-16 17:00:10-07:00,11/17/2024 0:00,2024-11-16 17:00:49-07:00,Iridium,46.74244,-113.95354,1515,4.4,3D Valid,Nothing Detected,11,3.28,3.6,
46030,11/16/2024 23:00,2024-11-16 16:00:35-07:00,11/17/2024 0:00,2024-11-16 17:00:49-07:00,Iridium,46.7433,-113.95264,1534,1.8,3D Valid,Nothing Detected,10,3.36,3.6,
46030,11/16/2024 22:00,2024-11-16 15:00:36-07:00,11/17/2024 0:00,2024-11-16 17:00:49-07:00,Iridium,46.74302,-113.95274,1490,2.8,3D Valid,Nothing Detected,10,3.28,3.6,
46030,11/16/2024 21:00,2024-11-16 14:00:37-07:00,11/17/2024 0:00,2024-11-16 17:00:49-07:00,Iridium,46.74298,-113.95275,1474,3,3D Valid,Nothing Detected,12,3.28,3.6,
46030,11/16/2024 20:00,2024-11-16 13:00:21-07:00,11/17/2024 0:00,2024-11-16 17:00:59-07:00,Iridium,46.74309,-113.95398,1502,5.2,3D Valid,Nothing Detected,10,3.36,3.6,
46030,11/16/2024 19:00,2024-11-16 12:00:10-07:00,11/17/2024 0:00,2024-11-16 17:00:59-07:00,Iridium,46.74301,-113.95399,1485,3,3D Valid,Nothing Detected,11,3.36,3.6,
46030,11/16/2024 18:00,2024-11-16 11:00:36-07:00,11/17/2024 0:00,2024-11-16 17:00:59-07:00,Iridium,46.74305,-113.95388,1515,2.8,3D Valid,Nothing Detected,11,3.36,3.6,
46030,11/16/2024 17:00,2024-11-16 10:00:11-07:00,11/17/2024 0:00,2024-11-16 17:00:59-07:00,Iridium,46.74316,-113.95363,1513,3.2,3D Valid,Nothing Detected,10,3.36,3.6,
46030,11/16/2024 16:00,2024-11-16 09:00:10-07:00,11/17/2024 0:01,2024-11-16 17:01:21-07:00,Iridium,46.74306,-113.95391,1508,2.8,3D Valid,Nothing Detected,9,3.36,3.6,
46030,11/16/2024 15:00,2024-11-16 08:00:38-07:00,11/17/2024 0:01,2024-11-16 17:01:21-07:00,Iridium,46.74296,-113.95394,1504,2.2,3D Valid,Nothing Detected,8,3.36,3.6,
46030,11/16/2024 14:00,2024-11-16 07:00:13-07:00,11/17/2024 0:01,2024-11-16 17:01:21-07:00,Iridium,46.74316,-113.95408,1500,2.2,3D Valid,Nothing Detected,9,3.36,3.6,
46030,11/16/2024 13:00,2024-11-16 06:00:36-07:00,11/17/2024 0:01,2024-11-16 17:01:21-07:00,Iridium,46.74308,-113.95393,1508,2.4,3D Valid,Nothing Detected,9,3.36,3.6,
46030,11/16/2024 12:00,2024-11-16 05:00:10-07:00,11/17/2024 0:01,2024-11-16 17:01:29-07:00,Iridium,46.74311,-113.95389,1507,3.8,3D Valid,Nothing Detected,4,3.36,3.6,
46030,11/16/2024 11:00,2024-11-16 04:00:36-07:00,11/17/2024 0:01,2024-11-16 17:01:29-07:00,Iridium,46.74316,-113.95389,1513,1.8,3D Valid,Nothing Detected,4,3.36,3.6,
46030,11/16/2024 10:00,2024-11-16 03:00:10-07:00,11/17/2024 0:01,2024-11-16 17:01:29-07:00,Iridium,46.74302,-113.95377,1539,7.4,3D Valid,Nothing Detected,5,3.36,3.6,
46030,11/16/2024 9:00,2024-11-16 02:00:32-07:00,11/17/2024 0:01,2024-11-16 17:01:29-07:00,Iridium,46.74309,-113.95382,1521,2.8,3D Valid,Nothing Detected,7,3.28,3.6,
46030,11/16/2024 8:00,2024-11-16 01:00:36-07:00,11/16/2024 8:01,2024-11-16 01:01:04-07:00,Iridium,46.7435,-113.95422,1521,3.4,3D Valid,Nothing Detected,11,3.28,3.6,
46030,11/16/2024 7:00,2024-11-16 00:00:10-07:00,11/16/2024 8:01,2024-11-16 01:01:04-07:00,Iridium,46.74459,-113.95423,1501,3,3D Valid,Nothing Detected,12,3.28,3.52,
46030,11/16/2024 6:00,2024-11-15 23:00:56-07:00,11/16/2024 8:01,2024-11-16 01:01:04-07:00,Iridium,46.74416,-113.95358,1513,4.2,3D Valid,Nothing Detected,12,3.28,3.6,
46030,11/16/2024 5:00,2024-11-15 22:00:15-07:00,11/16/2024 8:01,2024-11-16 01:01:04-07:00,Iridium,46.74382,-113.95395,1459,3.6,3D Valid,Nothing Detected,12,3.28,3.6,
46030,11/16/2024 4:00,2024-11-15 21:00:11-07:00,11/16/2024 8:01,2024-11-16 01:01:12-07:00,Iridium,46.74233,-113.95348,1518,3.4,3D Valid,Nothing Detected,11,3.36,3.6,
46030,11/16/2024 3:00,2024-11-15 20:00:38-07:00,11/16/2024 8:01,2024-11-16 01:01:12-07:00,Iridium,46.7423,-113.95339,1527,2.2,3D Valid,Nothing Detected,8,3.36,3.6,
46030,11/16/2024 2:00,2024-11-15 19:00:18-07:00,11/16/2024 8:01,2024-11-16 01:01:12-07:00,Iridium,46.74235,-113.95325,1535,4,3D Valid,Nothing Detected,10,3.36,3.6,
46030,11/16/2024 1:00,2024-11-15 18:00:08-07:00,11/16/2024 8:01,2024-11-16 01:01:12-07:00,Iridium,46.74236,-113.95347,1515,3,3D Valid,Nothing Detected,10,3.36,3.6,
46030,11/16/2024 0:00,2024-11-15 17:00:36-07:00,11/16/2024 0:00,2024-11-15 17:00:59-07:00,Iridium,46.74235,-113.95347,1508,2.8,3D Valid,Nothing Detected,10,3.28,3.6,
46030,11/15/2024 23:02,2024-11-15 16:02:52-07:00,11/16/2024 0:00,2024-11-15 17:00:59-07:00,Iridium,46.74251,-113.9537,1519,10,3D Valid,Nothing Detected,14,3.28,3.6,
46030,11/15/2024 21:00,2024-11-15 14:00:36-07:00,11/16/2024 0:00,2024-11-15 17:00:59-07:00,Iridium,46.7424,-113.95232,1505,4.2,3D Valid,Nothing Detected,6,3.36,3.6,
46030,11/15/2024 20:00,2024-11-15 13:00:36-07:00,11/15/2024 20:01,2024-11-15 13:01:48-07:00,Iridium,46.74242,-113.95232,1517,4.4,3D Valid,Nothing Detected,8,3.36,3.6,
46030,11/15/2024 19:00,2024-11-15 12:00:12-07:00,11/15/2024 20:01,2024-11-15 13:01:48-07:00,Iridium,46.74251,-113.95239,1524,3,3D Valid,Nothing Detected,8,3.36,3.6,
46030,11/15/2024 18:00,2024-11-15 11:00:38-07:00,11/15/2024 20:01,2024-11-15 13:01:48-07:00,Iridium,46.74244,-113.95232,1512,1.8,3D Valid,Nothing Detected,6,3.36,3.6,
46030,11/15/2024 17:00,2024-11-15 10:00:36-07:00,11/15/2024 20:01,2024-11-15 13:01:48-07:00,Iridium,46.7425,-113.9523,1516,2.4,3D Valid,Nothing Detected,6,3.36,3.6,
46030,11/15/2024 16:00,2024-11-15 09:00:11-07:00,11/15/2024 20:01,2024-11-15 13:01:56-07:00,Iridium,46.74247,-113.95233,1520,2.2,3D Valid,Nothing Detected,7,3.36,3.6,
46030,11/15/2024 15:00,2024-11-15 08:00:38-07:00,11/15/2024 20:01,2024-11-15 13:01:56-07:00,Iridium,46.74248,-113.95235,1516,5.2,3D Valid,Nothing Detected,8,3.36,3.6,
46030,11/15/2024 14:00,2024-11-15 07:00:36-07:00,11/15/2024 20:01,2024-11-15 13:01:56-07:00,Iridium,46.7425,-113.95232,1517,2.4,3D Valid,Nothing Detected,9,3.36,3.6,
46030,11/15/2024 13:00,2024-11-15 06:00:09-07:00,11/15/2024 20:01,2024-11-15 13:01:56-07:00,Iridium,46.74249,-113.95229,1517,2,3D Valid,Nothing Detected,7,3.36,3.6,
46030,11/15/2024 12:00,2024-11-15 05:00:38-07:00,11/15/2024 12:01,2024-11-15 05:01:43-07:00,Iridium,46.74243,-113.95233,1515,2.4,3D Valid,Nothing Detected,7,3.36,3.6,
46030,11/15/2024 11:00,2024-11-15 04:00:10-07:00,11/15/2024 12:01,2024-11-15 05:01:43-07:00,Iridium,46.74256,-113.95232,1533,2.8,3D Valid,Nothing Detected,7,3.36,3.6,
46030,11/15/2024 10:00,2024-11-15 03:00:36-07:00,11/15/2024 12:01,2024-11-15 05:01:43-07:00,Iridium,46.74247,-113.95233,1526,2.4,3D Valid,Nothing Detected,7,3.36,3.6,
46030,11/15/2024 9:00,2024-11-15 02:00:11-07:00,11/15/2024 12:01,2024-11-15 05:01:43-07:00,Iridium,46.74248,-113.95235,1516,2,3D Valid,Nothing Detected,7,3.36,3.6,
46030,11/15/2024 8:00,2024-11-15 01:00:38-07:00,11/15/2024 12:01,2024-11-15 05:01:59-07:00,Iridium,46.74245,-113.95231,1516,2.4,3D Valid,Nothing Detected,6,3.36,3.6,
46030,11/15/2024 7:00,2024-11-15 00:00:09-07:00,11/15/2024 12:01,2024-11-15 05:01:59-07:00,Iridium,46.74247,-113.95235,1531,2.2,3D Valid,Nothing Detected,7,3.36,3.6,
46030,11/15/2024 6:00,2024-11-14 23:00:38-07:00,11/15/2024 12:01,2024-11-15 05:01:59-07:00,Iridium,46.74258,-113.95238,1536,4,3D Valid,Nothing Detected,10,3.28,3.6,
46030,11/15/2024 5:00,2024-11-14 22:00:14-07:00,11/15/2024 12:01,2024-11-15 05:01:59-07:00,Iridium,46.7425,-113.95237,1500,3.4,3D Valid,Nothing Detected,12,3.28,3.6,
46030,11/15/2024 4:00,2024-11-14 21:00:37-07:00,11/15/2024 4:02,2024-11-14 21:02:58-07:00,Iridium,46.74146,-113.95438,1554,4,3D Valid,Nothing Detected,13,3.28,3.6,
46030,11/15/2024 3:00,2024-11-14 20:00:12-07:00,11/15/2024 4:02,2024-11-14 21:02:58-07:00,Iridium,46.73761,-113.95528,1533,2.4,3D Valid,Nothing Detected,11,3.28,3.6,
46030,11/15/2024 2:00,2024-11-14 19:00:10-07:00,11/15/2024 4:02,2024-11-14 21:02:58-07:00,Iridium,46.74316,-113.95679,1566,1.8,3D Valid,Nothing Detected,11,3.28,3.6,
46030,11/15/2024 1:00,2024-11-14 18:00:10-07:00,11/15/2024 4:02,2024-11-14 21:02:58-07:00,Iridium,46.74703,-113.95984,1633,2.4,3D Valid,Nothing Detected,11,3.28,3.52,
46030,11/15/2024 0:00,2024-11-14 17:00:37-07:00,11/15/2024 0:01,2024-11-14 17:01:30-07:00,Iridium,46.74662,-113.95774,1572,2,3D Valid,Nothing Detected,11,3.28,3.6,
46030,11/14/2024 23:00,2024-11-14 16:00:10-07:00,11/15/2024 0:01,2024-11-14 17:01:30-07:00,Iridium,46.7467,-113.95722,1547,2.8,3D Valid,Nothing Detected,13,3.28,3.6,
46030,11/14/2024 22:00,2024-11-14 15:00:34-07:00,11/15/2024 0:01,2024-11-14 17:01:30-07:00,Iridium,46.74639,-113.95592,1513,2.4,3D Valid,Nothing Detected,14,3.28,3.6,
46030,11/14/2024 21:00,2024-11-14 14:00:38-07:00,11/15/2024 0:01,2024-11-14 17:01:30-07:00,Iridium,46.74567,-113.95441,1474,2.8,3D Valid,Nothing Detected,13,3.28,3.6,
46030,11/14/2024 20:00,2024-11-14 13:00:12-07:00,11/15/2024 0:01,2024-11-14 17:01:40-07:00,Iridium,46.74591,-113.95382,1445,5.2,3D Valid,Nothing Detected,12,3.28,3.6,
46030,11/14/2024 19:00,2024-11-14 12:00:10-07:00,11/15/2024 0:01,2024-11-14 17:01:40-07:00,Iridium,46.74581,-113.95303,1415,3.2,3D Valid,Nothing Detected,12,3.36,3.6,
46030,11/14/2024 18:00,2024-11-14 11:00:38-07:00,11/15/2024 0:01,2024-11-14 17:01:40-07:00,Iridium,46.74538,-113.95217,1421,2.8,3D Valid,Nothing Detected,9,3.36,3.6,
46030,11/14/2024 17:00,2024-11-14 10:00:10-07:00,11/15/2024 0:01,2024-11-14 17:01:40-07:00,Iridium,46.74535,-113.9521,1427,4.8,3D Valid,Nothing Detected,10,3.36,3.6,
46030,11/14/2024 16:00,2024-11-14 09:00:36-07:00,11/14/2024 16:01,2024-11-14 09:01:02-07:00,Iridium,46.74539,-113.95214,1431,2.2,3D Valid,Nothing Detected,9,3.36,3.6,
46030,11/14/2024 15:00,2024-11-14 08:00:38-07:00,11/14/2024 16:01,2024-11-14 09:01:02-07:00,Iridium,46.74538,-113.95214,1424,2.6,3D Valid,Nothing Detected,11,3.36,3.6,
46030,11/14/2024 14:00,2024-11-14 07:00:15-07:00,11/14/2024 16:01,2024-11-14 09:01:02-07:00,Iridium,46.74544,-113.95215,1434,3,3D Valid,Nothing Detected,11,3.36,3.6,
46030,11/14/2024 13:00,2024-11-14 06:00:36-07:00,11/14/2024 16:01,2024-11-14 09:01:02-07:00,Iridium,46.74538,-113.9522,1429,1.8,3D Valid,Nothing Detected,13,3.36,3.6,
46030,11/14/2024 12:00,2024-11-14 05:00:11-07:00,11/14/2024 16:01,2024-11-14 09:01:23-07:00,Iridium,46.74535,-113.95215,1424,3.4,3D Valid,Nothing Detected,12,3.36,3.6,
46030,11/14/2024 11:00,2024-11-14 04:00:38-07:00,11/14/2024 16:01,2024-11-14 09:01:23-07:00,Iridium,46.74548,-113.95214,1435,1.8,3D Valid,Nothing Detected,11,3.36,3.6,
46030,11/14/2024 10:00,2024-11-14 03:00:14-07:00,11/14/2024 16:01,2024-11-14 09:01:23-07:00,Iridium,46.74539,-113.95213,1434,2.6,3D Valid,Nothing Detected,12,3.36,3.6,
46030,11/14/2024 9:00,2024-11-14 02:00:36-07:00,11/14/2024 16:01,2024-11-14 09:01:23-07:00,Iridium,46.74536,-113.95216,1431,2.2,3D Valid,Nothing Detected,11,3.36,3.6,
46030,11/14/2024 8:00,2024-11-14 01:00:11-07:00,11/14/2024 16:01,2024-11-14 09:01:37-07:00,Iridium,46.74533,-113.95223,1416,3.2,3D Valid,Nothing Detected,11,3.36,3.6,
46030,11/14/2024 7:00,2024-11-14 00:00:36-07:00,11/14/2024 16:01,2024-11-14 09:01:37-07:00,Iridium,46.74538,-113.95219,1423,2.2,3D Valid,Nothing Detected,12,3.28,3.6,
46030,11/14/2024 6:01,2024-11-13 23:01:06-07:00,11/14/2024 16:01,2024-11-14 09:01:37-07:00,Iridium,46.74538,-113.9522,1429,3.8,3D Valid,Nothing Detected,13,3.28,3.52,
46030,11/14/2024 5:00,2024-11-13 22:00:12-07:00,11/14/2024 16:01,2024-11-14 09:01:37-07:00,Iridium,46.74453,-113.95383,1496,3.4,3D Valid,Nothing Detected,12,3.28,3.52,
46030,11/14/2024 4:00,2024-11-13 21:00:11-07:00,11/14/2024 4:00,2024-11-13 21:00:33-07:00,Iridium,46.74459,-113.95592,1545,5.4,3D Valid,Nothing Detected,11,3.28,3.6,
46030,11/14/2024 3:00,2024-11-13 20:00:36-07:00,11/14/2024 4:00,2024-11-13 21:00:33-07:00,Iridium,46.74556,-113.9574,1584,3.4,3D Valid,Nothing Detected,12,3.28,3.52,
46030,11/14/2024 2:00,2024-11-13 19:00:36-07:00,11/14/2024 4:00,2024-11-13 21:00:33-07:00,Iridium,46.74788,-113.95539,1541,1.6,3D Valid,Nothing Detected,15,3.28,3.6,
46030,11/14/2024 1:00,2024-11-13 18:00:09-07:00,11/14/2024 4:00,2024-11-13 21:00:33-07:00,Iridium,46.7512,-113.95512,1521,3,3D Valid,Nothing Detected,15,3.28,3.6,
46030,11/14/2024 0:01,2024-11-13 17:01:08-07:00,11/14/2024 0:01,2024-11-13 17:01:29-07:00,Iridium,46.75054,-113.95702,1563,3,3D Valid,Nothing Detected,15,3.28,3.6,
46030,11/13/2024 23:00,2024-11-13 16:00:16-07:00,11/14/2024 0:01,2024-11-13 17:01:29-07:00,Iridium,46.74985,-113.95719,1596,1.8,3D Valid,Nothing Detected,15,3.28,3.6,
46030,11/13/2024 22:00,2024-11-13 15:00:36-07:00,11/14/2024 0:01,2024-11-13 17:01:29-07:00,Iridium,46.74933,-113.9583,1615,2.6,3D Valid,Nothing Detected,16,3.28,3.6,
46030,11/13/2024 21:00,2024-11-13 14:00:38-07:00,11/14/2024 0:01,2024-11-13 17:01:29-07:00,Iridium,46.7488,-113.95968,1651,3.6,3D Valid,Nothing Detected,15,3.28,3.6,
46030,11/13/2024 20:00,2024-11-13 13:00:14-07:00,11/13/2024 20:01,2024-11-13 13:01:47-07:00,Iridium,46.74913,-113.95952,1631,1.6,3D Valid,Nothing Detected,14,3.36,3.6,
46030,11/13/2024 19:00,2024-11-13 12:00:09-07:00,11/13/2024 20:01,2024-11-13 13:01:47-07:00,Iridium,46.74911,-113.95946,1630,2.2,3D Valid,Nothing Detected,13,3.28,3.6,
46030,11/13/2024 18:00,2024-11-13 11:00:36-07:00,11/13/2024 20:01,2024-11-13 13:01:47-07:00,Iridium,46.74935,-113.95958,1648,1.6,3D Valid,Nothing Detected,13,3.28,3.6,
46030,11/13/2024 17:00,2024-11-13 10:00:10-07:00,11/13/2024 20:01,2024-11-13 13:01:47-07:00,Iridium,46.74929,-113.96025,1639,2.6,3D Valid,Nothing Detected,13,3.28,3.6,
46030,11/13/2024 16:00,2024-11-13 09:00:38-07:00,11/13/2024 20:01,2024-11-13 13:01:55-07:00,Iridium,46.75044,-113.96036,1579,2.6,3D Valid,Nothing Detected,9,3.28,3.52,
46030,11/13/2024 15:00,2024-11-13 08:00:10-07:00,11/13/2024 20:01,2024-11-13 13:01:55-07:00,Iridium,46.75381,-113.96393,1550,4.8,3D Valid,Nothing Detected,11,3.28,3.6,
46030,11/13/2024 14:00,2024-11-13 07:00:36-07:00,11/13/2024 20:01,2024-11-13 13:01:55-07:00,Iridium,46.75472,-113.96445,1521,2,3D Valid,Nothing Detected,13,3.28,3.6,
46030,11/13/2024 13:00,2024-11-13 06:00:10-07:00,11/13/2024 20:01,2024-11-13 13:01:55-07:00,Iridium,46.75469,-113.9645,1533,2,3D Valid,Nothing Detected,15,3.28,3.6,
46030,11/13/2024 12:00,2024-11-13 05:00:37-07:00,11/13/2024 20:02,2024-11-13 13:02:06-07:00,Iridium,46.75473,-113.96452,1520,3.6,3D Valid,Nothing Detected,9,3.28,3.6,
46030,11/13/2024 11:00,2024-11-13 04:00:15-07:00,11/13/2024 20:02,2024-11-13 13:02:06-07:00,Iridium,46.75468,-113.96444,1525,1.8,3D Valid,Nothing Detected,10,3.36,3.6,
46030,11/13/2024 10:00,2024-11-13 03:00:36-07:00,11/13/2024 20:02,2024-11-13 13:02:06-07:00,Iridium,46.75461,-113.96448,1513,2.8,3D Valid,Nothing Detected,10,3.28,3.6,
46030,11/13/2024 9:00,2024-11-13 02:00:10-07:00,11/13/2024 20:02,2024-11-13 13:02:06-07:00,Iridium,46.75478,-113.96446,1531,1.8,3D Valid,Nothing Detected,11,3.36,3.6,
46030,11/13/2024 8:00,2024-11-13 01:00:36-07:00,11/13/2024 20:02,2024-11-13 13:02:22-07:00,Iridium,46.75467,-113.96443,1521,2.4,3D Valid,Nothing Detected,13,3.28,3.6,
46030,11/13/2024 7:00,2024-11-13 00:00:36-07:00,11/13/2024 20:02,2024-11-13 13:02:22-07:00,Iridium,46.75462,-113.96446,1515,2.4,3D Valid,Nothing Detected,11,3.28,3.6,
46030,11/13/2024 6:00,2024-11-12 23:00:17-07:00,11/13/2024 20:02,2024-11-13 13:02:22-07:00,Iridium,46.75472,-113.96437,1549,4,3D Valid,Nothing Detected,12,3.28,3.6,
46030,11/13/2024 5:00,2024-11-12 22:00:38-07:00,11/13/2024 20:02,2024-11-13 13:02:22-07:00,Iridium,46.75463,-113.96442,1511,1.8,3D Valid,Nothing Detected,13,3.28,3.6,
46030,11/13/2024 4:00,2024-11-12 21:00:09-07:00,11/13/2024 20:02,2024-11-13 13:02:30-07:00,Iridium,46.75563,-113.96483,1491,4.2,3D Valid,Nothing Detected,13,3.28,3.52,
46030,11/13/2024 3:00,2024-11-12 20:00:38-07:00,11/13/2024 20:02,2024-11-13 13:02:30-07:00,Iridium,46.75494,-113.96643,1547,3.6,3D Valid,Nothing Detected,14,3.28,3.6,
46030,11/13/2024 2:00,2024-11-12 19:00:09-07:00,11/13/2024 20:02,2024-11-13 13:02:30-07:00,Iridium,46.75442,-113.96721,1585,2,3D Valid,Nothing Detected,15,3.28,3.6,
46030,11/13/2024 1:00,2024-11-12 18:00:36-07:00,11/13/2024 20:02,2024-11-13 13:02:30-07:00,Iridium,46.75619,-113.96746,1579,2.6,3D Valid,Nothing Detected,13,3.28,3.52,
46030,11/13/2024 0:01,2024-11-12 17:01:54-07:00,11/13/2024 20:02,2024-11-13 13:02:39-07:00,Iridium,46.75925,-113.96763,1582,2.8,3D Valid,Nothing Detected,14,3.2,3.52,
46030,11/12/2024 23:00,2024-11-12 16:00:10-07:00,11/13/2024 20:02,2024-11-13 13:02:39-07:00,Iridium,46.76082,-113.96195,1504,2.8,3D Valid,Nothing Detected,14,3.28,3.6,
46030,11/12/2024 22:00,2024-11-12 15:00:10-07:00,11/13/2024 20:02,2024-11-13 13:02:39-07:00,Iridium,46.76087,-113.95965,1470,2.6,3D Valid,Nothing Detected,12,3.28,3.6,
46030,11/12/2024 21:00,2024-11-12 14:00:36-07:00,11/13/2024 20:02,2024-11-13 13:02:39-07:00,Iridium,46.76094,-113.95976,1485,1.6,3D Valid,Nothing Detected,13,3.28,3.6,
46030,11/12/2024 20:00,2024-11-12 13:00:36-07:00,11/12/2024 20:00,2024-11-12 13:00:58-07:00,Iridium,46.76093,-113.95949,1473,3.2,3D Valid,Nothing Detected,15,3.28,3.52,
46030,11/12/2024 19:01,2024-11-12 12:01:00-07:00,11/12/2024 20:00,2024-11-12 13:00:58-07:00,Iridium,46.7603,-113.9589,1481,3.6,3D Valid,Nothing Detected,14,3.28,3.6,
46030,11/12/2024 18:00,2024-11-12 11:00:11-07:00,11/12/2024 20:00,2024-11-12 13:00:58-07:00,Iridium,46.76045,-113.95824,1465,3.8,3D Valid,Nothing Detected,12,3.28,3.6,
46030,11/12/2024 17:00,2024-11-12 10:00:38-07:00,11/12/2024 20:00,2024-11-12 13:00:58-07:00,Iridium,46.75972,-113.95332,1353,2.8,3D Valid,Nothing Detected,11,3.28,3.6,
46030,11/12/2024 16:00,2024-11-12 09:00:10-07:00,11/12/2024 16:00,2024-11-12 09:00:52-07:00,Iridium,46.75961,-113.95316,1339,4,3D Valid,Nothing Detected,12,3.28,3.52,
46030,11/12/2024 15:00,2024-11-12 08:00:38-07:00,11/12/2024 16:00,2024-11-12 09:00:52-07:00,Iridium,46.75962,-113.95416,1376,2.4,3D Valid,Nothing Detected,14,3.28,3.6,
46030,11/12/2024 14:00,2024-11-12 07:00:37-07:00,11/12/2024 16:00,2024-11-12 09:00:52-07:00,Iridium,46.76028,-113.9548,1381,4,3D Valid,Nothing Detected,14,3.28,3.6,
46030,11/12/2024 13:00,2024-11-12 06:00:25-07:00,11/12/2024 16:00,2024-11-12 09:00:52-07:00,Iridium,46.75982,-113.95457,1391,2.6,3D Valid,Nothing Detected,14,3.36,3.6,
46030,11/12/2024 12:00,2024-11-12 05:00:38-07:00,11/12/2024 16:01,2024-11-12 09:01:24-07:00,Iridium,46.7599,-113.95463,1400,3,3D Valid,Nothing Detected,13,3.36,3.6,
46030,11/12/2024 11:00,2024-11-12 04:00:10-07:00,11/12/2024 16:01,2024-11-12 09:01:24-07:00,Iridium,46.75985,-113.95469,1385,3,3D Valid,Nothing Detected,13,3.36,3.6,
46030,11/12/2024 10:00,2024-11-12 03:00:41-07:00,11/12/2024 16:01,2024-11-12 09:01:24-07:00,Iridium,46.75985,-113.95462,1388,3.8,3D Valid,Nothing Detected,13,3.36,3.6,
46030,11/12/2024 9:00,2024-11-12 02:00:36-07:00,11/12/2024 16:01,2024-11-12 09:01:24-07:00,Iridium,46.75984,-113.95467,1389,2.6,3D Valid,Nothing Detected,15,3.28,3.6,
46030,11/12/2024 8:00,2024-11-12 01:00:36-07:00,11/12/2024 16:01,2024-11-12 09:01:31-07:00,Iridium,46.75985,-113.9547,1382,3.2,3D Valid,Nothing Detected,16,3.28,3.6,
46030,11/12/2024 7:00,2024-11-12 00:00:10-07:00,11/12/2024 16:01,2024-11-12 09:01:31-07:00,Iridium,46.75988,-113.95463,1398,3.4,3D Valid,Nothing Detected,14,3.28,3.6,
46030,11/12/2024 6:00,2024-11-11 23:00:36-07:00,11/12/2024 16:01,2024-11-12 09:01:31-07:00,Iridium,46.75986,-113.95468,1395,3,3D Valid,Nothing Detected,14,3.28,3.6,
46030,11/12/2024 5:00,2024-11-11 22:00:38-07:00,11/12/2024 16:01,2024-11-12 09:01:31-07:00,Iridium,46.75981,-113.95465,1398,3.4,3D Valid,Nothing Detected,13,3.28,3.6,
46030,11/12/2024 4:00,2024-11-11 21:00:10-07:00,11/12/2024 4:02,2024-11-11 21:02:08-07:00,Iridium,46.75966,-113.95564,1425,4.2,3D Valid,Nothing Detected,17,3.28,3.6,
46030,11/12/2024 3:01,2024-11-11 20:01:24-07:00,11/12/2024 4:02,2024-11-11 21:02:08-07:00,Iridium,46.7594,-113.95565,1443,4.4,3D Valid,Nothing Detected,17,3.28,3.6,
46030,11/12/2024 2:00,2024-11-11 19:00:09-07:00,11/12/2024 4:02,2024-11-11 21:02:08-07:00,Iridium,46.75902,-113.95612,1467,4.6,3D Valid,Nothing Detected,17,3.28,3.6,
46030,11/12/2024 1:00,2024-11-11 18:00:36-07:00,11/12/2024 4:02,2024-11-11 21:02:08-07:00,Iridium,46.7575,-113.96032,1398,3.6,3D Valid,Nothing Detected,18,3.28,3.6,
46030,11/12/2024 0:00,2024-11-11 17:00:38-07:00,11/12/2024 4:02,2024-11-11 21:02:18-07:00,Iridium,46.75446,-113.95628,1411,5.2,3D Valid,Nothing Detected,19,3.28,3.6,
46030,11/11/2024 23:00,2024-11-11 16:00:12-07:00,11/12/2024 4:02,2024-11-11 21:02:18-07:00,Iridium,46.75341,-113.95356,1405,1.8,3D Valid,Nothing Detected,21,3.28,3.6,
46030,11/11/2024 22:00,2024-11-11 15:00:37-07:00,11/12/2024 4:02,2024-11-11 21:02:18-07:00,Iridium,46.75395,-113.95218,1390,1.8,3D Valid,Nothing Detected,22,3.28,3.6,
46030,11/11/2024 21:00,2024-11-11 14:00:36-07:00,11/12/2024 4:02,2024-11-11 21:02:18-07:00,Iridium,46.75438,-113.94934,1370,4.2,3D Valid,Nothing Detected,22,3.28,3.6,
46030,11/11/2024 20:00,2024-11-11 13:00:10-07:00,11/11/2024 20:00,2024-11-11 13:00:44-07:00,Iridium,46.75402,-113.95044,1383,1.8,3D Valid,Nothing Detected,20,3.28,3.6,
46030,11/11/2024 19:00,2024-11-11 12:00:11-07:00,11/11/2024 20:00,2024-11-11 13:00:44-07:00,Iridium,46.7538,-113.95129,1408,2,3D Valid,Nothing Detected,17,3.36,3.6,
46030,11/11/2024 18:00,2024-11-11 11:00:38-07:00,11/11/2024 20:00,2024-11-11 13:00:44-07:00,Iridium,46.75382,-113.95117,1398,1.4,3D Valid,Nothing Detected,17,3.28,3.6,
46030,11/11/2024 17:00,2024-11-11 10:00:09-07:00,11/11/2024 20:00,2024-11-11 13:00:44-07:00,Iridium,46.75382,-113.95101,1409,2,3D Valid,Nothing Detected,18,3.28,3.6,
46030,11/11/2024 16:00,2024-11-11 09:00:36-07:00,11/11/2024 16:01,2024-11-11 09:01:01-07:00,Iridium,46.75343,-113.95194,1425,2.6,3D Valid,Nothing Detected,16,3.28,3.6,
46030,11/11/2024 15:00,2024-11-11 08:00:10-07:00,11/11/2024 16:01,2024-11-11 09:01:01-07:00,Iridium,46.75283,-113.95276,1450,2.6,3D Valid,Nothing Detected,15,3.28,3.6,
46030,11/11/2024 14:00,2024-11-11 07:00:37-07:00,11/11/2024 16:01,2024-11-11 09:01:01-07:00,Iridium,46.75239,-113.95493,1479,3.6,3D Valid,Nothing Detected,14,3.36,3.6,
46030,11/11/2024 13:00,2024-11-11 06:00:13-07:00,11/11/2024 16:01,2024-11-11 09:01:01-07:00,Iridium,46.7523,-113.95495,1470,2.4,3D Valid,Nothing Detected,14,3.36,3.6,
46030,11/11/2024 12:00,2024-11-11 05:00:37-07:00,11/11/2024 16:01,2024-11-11 09:01:12-07:00,Iridium,46.75211,-113.95496,1439,4.4,3D Valid,Nothing Detected,12,3.36,3.6,
46030,11/11/2024 11:00,2024-11-11 04:00:14-07:00,11/11/2024 16:01,2024-11-11 09:01:12-07:00,Iridium,46.75225,-113.9549,1469,2,3D Valid,Nothing Detected,13,3.36,3.6,
46030,11/11/2024 10:00,2024-11-11 03:00:11-07:00,11/11/2024 16:01,2024-11-11 09:01:12-07:00,Iridium,46.7522,-113.95483,1488,2.6,3D Valid,Nothing Detected,13,3.36,3.6,
46030,11/11/2024 9:00,2024-11-11 02:00:36-07:00,11/11/2024 16:01,2024-11-11 09:01:12-07:00,Iridium,46.75227,-113.95494,1469,1.8,3D Valid,Nothing Detected,12,3.36,3.6,
46030,11/11/2024 8:00,2024-11-11 01:00:37-07:00,11/11/2024 8:01,2024-11-11 01:01:03-07:00,Iridium,46.75222,-113.95493,1488,4.6,3D Valid,Nothing Detected,12,3.36,3.6,
46030,11/11/2024 7:00,2024-11-11 00:00:10-07:00,11/11/2024 8:01,2024-11-11 01:01:03-07:00,Iridium,46.75223,-113.95498,1470,2.6,3D Valid,Nothing Detected,10,3.36,3.6,
46030,11/11/2024 6:00,2024-11-10 23:00:36-07:00,11/11/2024 8:01,2024-11-11 01:01:03-07:00,Iridium,46.75225,-113.95493,1469,2.2,3D Valid,Nothing Detected,12,3.28,3.6,
46030,11/11/2024 5:00,2024-11-10 22:00:37-07:00,11/11/2024 8:01,2024-11-11 01:01:03-07:00,Iridium,46.75225,-113.95496,1468,1.8,3D Valid,Nothing Detected,12,3.36,3.6,
46030,11/11/2024 4:00,2024-11-10 21:00:09-07:00,11/11/2024 8:01,2024-11-11 01:01:11-07:00,Iridium,46.75222,-113.95494,1464,4.2,3D Valid,Nothing Detected,11,3.36,3.6,
46030,11/11/2024 3:00,2024-11-10 20:00:11-07:00,11/11/2024 8:01,2024-11-11 01:01:11-07:00,Iridium,46.75239,-113.95497,1476,3.8,3D Valid,Nothing Detected,12,3.36,3.6,
46030,11/11/2024 2:00,2024-11-10 19:00:36-07:00,11/11/2024 8:01,2024-11-11 01:01:11-07:00,Iridium,46.75223,-113.95495,1462,1.6,3D Valid,Nothing Detected,12,3.36,3.6,
46030,11/11/2024 1:00,2024-11-10 18:00:11-07:00,11/11/2024 8:01,2024-11-11 01:01:11-07:00,Iridium,46.75223,-113.95484,1482,3,3D Valid,Nothing Detected,14,3.28,3.6,
46030,11/11/2024 0:00,2024-11-10 17:00:54-07:00,11/11/2024 0:01,2024-11-10 17:01:19-07:00,Iridium,46.75248,-113.95544,1461,4.8,3D Valid,Nothing Detected,16,3.28,3.6,
46030,11/10/2024 23:00,2024-11-10 16:00:10-07:00,11/11/2024 0:01,2024-11-10 17:01:19-07:00,Iridium,46.75317,-113.9569,1449,2,3D Valid,Nothing Detected,16,3.28,3.6,
46030,11/10/2024 22:00,2024-11-10 15:00:37-07:00,11/11/2024 0:01,2024-11-10 17:01:19-07:00,Iridium,46.75054,-113.95708,1562,3,3D Valid,Nothing Detected,16,3.28,3.6,
46030,11/10/2024 21:00,2024-11-10 14:00:17-07:00,11/11/2024 0:01,2024-11-10 17:01:19-07:00,Iridium,46.74933,-113.95738,1629,3,3D Valid,Nothing Detected,19,3.28,3.6,
46030,11/10/2024 20:00,2024-11-10 13:00:38-07:00,11/11/2024 0:01,2024-11-10 17:01:26-07:00,Iridium,46.74925,-113.95765,1626,2.8,3D Valid,Nothing Detected,19,3.28,3.6,
46030,11/10/2024 19:00,2024-11-10 12:00:10-07:00,11/11/2024 0:01,2024-11-10 17:01:26-07:00,Iridium,46.74961,-113.95828,1605,4,3D Valid,Nothing Detected,16,3.28,3.6,
46030,11/10/2024 18:00,2024-11-10 11:00:38-07:00,11/11/2024 0:01,2024-11-10 17:01:26-07:00,Iridium,46.74932,-113.95873,1635,2,3D Valid,Nothing Detected,11,3.28,3.6,
46030,11/10/2024 17:00,2024-11-10 10:00:36-07:00,11/11/2024 0:01,2024-11-10 17:01:26-07:00,Iridium,46.74918,-113.959,1631,3.2,3D Valid,Nothing Detected,16,3.28,3.6,
46030,11/10/2024 16:00,2024-11-10 09:00:38-07:00,11/11/2024 0:01,2024-11-10 17:01:36-07:00,Iridium,46.74899,-113.95997,1631,2.6,3D Valid,Nothing Detected,16,3.28,3.6,
46030,11/10/2024 15:00,2024-11-10 08:00:38-07:00,11/11/2024 0:01,2024-11-10 17:01:36-07:00,Iridium,46.74942,-113.96178,1608,1.8,3D Valid,Nothing Detected,15,3.28,3.6,
46030,11/10/2024 14:00,2024-11-10 07:00:08-07:00,11/11/2024 0:01,2024-11-10 17:01:36-07:00,Iridium,46.74998,-113.96091,1597,3,3D Valid,Nothing Detected,13,3.36,3.6,
46030,11/10/2024 13:00,2024-11-10 06:00:38-07:00,11/11/2024 0:01,2024-11-10 17:01:36-07:00,Iridium,46.75009,-113.96096,1590,2,3D Valid,Nothing Detected,11,3.36,3.6,
46030,11/10/2024 12:00,2024-11-10 05:00:11-07:00,11/10/2024 12:00,2024-11-10 05:00:43-07:00,Iridium,46.74994,-113.96089,1590,2.8,3D Valid,Nothing Detected,12,3.36,3.6,
46030,11/10/2024 11:00,2024-11-10 04:00:09-07:00,11/10/2024 12:00,2024-11-10 05:00:43-07:00,Iridium,46.75005,-113.96096,1600,1.6,3D Valid,Nothing Detected,10,3.36,3.6,
46030,11/10/2024 10:00,2024-11-10 03:00:36-07:00,11/10/2024 12:00,2024-11-10 05:00:43-07:00,Iridium,46.75005,-113.96098,1603,2,3D Valid,Nothing Detected,12,3.36,3.6,
46030,11/10/2024 9:00,2024-11-10 02:00:36-07:00,11/10/2024 12:00,2024-11-10 05:00:43-07:00,Iridium,46.74991,-113.96098,1601,2.4,3D Valid,Nothing Detected,10,3.36,3.6,
46030,11/10/2024 8:00,2024-11-10 01:00:09-07:00,11/10/2024 8:00,2024-11-10 01:00:30-07:00,Iridium,46.75001,-113.96096,1596,2.8,3D Valid,Nothing Detected,10,3.36,3.6,
46030,11/10/2024 7:00,2024-11-10 00:00:09-07:00,11/10/2024 8:00,2024-11-10 01:00:30-07:00,Iridium,46.75003,-113.961,1604,2.6,3D Valid,Nothing Detected,11,3.36,3.6,
46030,11/10/2024 6:00,2024-11-09 23:00:38-07:00,11/10/2024 8:00,2024-11-10 01:00:30-07:00,Iridium,46.75001,-113.96094,1596,1.8,3D Valid,Nothing Detected,12,3.28,3.6,
46030,11/10/2024 5:00,2024-11-09 22:00:36-07:00,11/10/2024 8:00,2024-11-10 01:00:30-07:00,Iridium,46.74947,-113.9604,1623,2.2,3D Valid,Nothing Detected,17,3.28,3.6,
46030,11/10/2024 4:00,2024-11-09 21:00:09-07:00,11/10/2024 4:00,2024-11-09 21:00:33-07:00,Iridium,46.74904,-113.96081,1634,4.4,3D Valid,Nothing Detected,18,3.28,3.6,
46030,11/10/2024 3:00,2024-11-09 20:00:55-07:00,11/10/2024 4:00,2024-11-09 21:00:33-07:00,Iridium,46.74853,-113.95956,1649,2.8,3D Valid,Nothing Detected,17,3.28,3.6,
46030,11/10/2024 2:00,2024-11-09 19:00:38-07:00,11/10/2024 4:00,2024-11-09 21:00:33-07:00,Iridium,46.74981,-113.9572,1597,7.8,3D Valid,Nothing Detected,18,3.28,3.6,
46030,11/10/2024 1:00,2024-11-09 18:00:42-07:00,11/10/2024 4:00,2024-11-09 21:00:33-07:00,Iridium,46.74889,-113.95719,1619,3.8,3D Valid,Nothing Detected,17,3.28,3.6,
46030,11/10/2024 0:00,2024-11-09 17:00:10-07:00,11/10/2024 8:00,2024-11-10 01:00:40-07:00,Iridium,46.74707,-113.95646,1552,2.8,3D Valid,Nothing Detected,17,3.28,3.6,
46030,11/9/2024 23:00,2024-11-09 16:00:38-07:00,11/10/2024 8:00,2024-11-10 01:00:40-07:00,Iridium,46.74694,-113.9556,1524,2.2,3D Valid,Nothing Detected,17,3.28,3.6,
46030,11/9/2024 22:00,2024-11-09 15:00:11-07:00,11/10/2024 8:00,2024-11-10 01:00:40-07:00,Iridium,46.74585,-113.95433,1460,5.8,3D Valid,Nothing Detected,14,3.28,3.6,
46030,11/9/2024 21:00,2024-11-09 14:00:38-07:00,11/10/2024 8:00,2024-11-10 01:00:40-07:00,Iridium,46.74548,-113.95331,1422,2.8,3D Valid,Nothing Detected,13,3.28,3.6,
46030,11/9/2024 20:00,2024-11-09 13:00:14-07:00,11/9/2024 20:00,2024-11-09 13:00:39-07:00,Iridium,46.74588,-113.95341,1459,4.2,3D Valid,Nothing Detected,18,3.28,3.6,
46030,11/9/2024 19:00,2024-11-09 12:00:38-07:00,11/9/2024 20:00,2024-11-09 13:00:39-07:00,Iridium,46.74578,-113.95386,1440,3.6,3D Valid,Nothing Detected,16,3.28,3.6,
46030,11/9/2024 18:00,2024-11-09 11:00:10-07:00,11/9/2024 20:00,2024-11-09 13:00:39-07:00,Iridium,46.74429,-113.95318,1486,3.4,3D Valid,Nothing Detected,13,3.36,3.6,
46030,11/9/2024 17:00,2024-11-09 10:00:11-07:00,11/9/2024 20:00,2024-11-09 13:00:39-07:00,Iridium,46.74231,-113.95471,1536,1.8,3D Valid,Nothing Detected,10,3.36,3.6,
46030,11/9/2024 16:00,2024-11-09 09:00:35-07:00,11/9/2024 16:01,2024-11-09 09:01:18-07:00,Iridium,46.74238,-113.95481,1540,1.8,3D Valid,Nothing Detected,9,3.36,3.6,
46030,11/9/2024 15:00,2024-11-09 08:00:12-07:00,11/9/2024 16:01,2024-11-09 09:01:18-07:00,Iridium,46.74226,-113.95486,1544,2.2,3D Valid,Nothing Detected,9,3.36,3.6,
46030,11/9/2024 14:00,2024-11-09 07:00:38-07:00,11/9/2024 16:01,2024-11-09 09:01:18-07:00,Iridium,46.74241,-113.95489,1553,2.2,3D Valid,Nothing Detected,9,3.36,3.6,
46030,11/9/2024 13:00,2024-11-09 06:00:13-07:00,11/9/2024 16:01,2024-11-09 09:01:18-07:00,Iridium,46.74234,-113.95475,1586,2.6,3D Valid,Nothing Detected,9,3.36,3.6,
46030,11/9/2024 12:00,2024-11-09 05:00:36-07:00,11/9/2024 16:01,2024-11-09 09:01:27-07:00,Iridium,46.74224,-113.95484,1538,3.6,3D Valid,Nothing Detected,11,3.36,3.6,
46030,11/9/2024 11:00,2024-11-09 04:00:16-07:00,11/9/2024 16:01,2024-11-09 09:01:27-07:00,Iridium,46.74247,-113.95489,1589,2,3D Valid,Nothing Detected,11,3.36,3.6,
46030,11/9/2024 10:00,2024-11-09 03:00:36-07:00,11/9/2024 16:01,2024-11-09 09:01:27-07:00,Iridium,46.74234,-113.95493,1541,2,3D Valid,Nothing Detected,10,3.36,3.6,
46030,11/9/2024 9:00,2024-11-09 02:00:11-07:00,11/9/2024 16:01,2024-11-09 09:01:27-07:00,Iridium,46.74232,-113.95473,1547,2.4,3D Valid,Nothing Detected,11,3.36,3.6,
46030,11/9/2024 8:00,2024-11-09 01:00:36-07:00,11/9/2024 16:01,2024-11-09 09:01:36-07:00,Iridium,46.74233,-113.95486,1559,2.4,3D Valid,Nothing Detected,11,3.36,3.6,
46030,11/9/2024 7:00,2024-11-09 00:00:38-07:00,11/9/2024 16:01,2024-11-09 09:01:36-07:00,Iridium,46.74248,-113.95472,1547,2.2,3D Valid,Nothing Detected,10,3.36,3.6,
46030,11/9/2024 6:00,2024-11-08 23:00:18-07:00,11/9/2024 16:01,2024-11-09 09:01:36-07:00,Iridium,46.74243,-113.95454,1609,4.4,3D Valid,Nothing Detected,12,3.36,3.6,
46030,11/9/2024 5:00,2024-11-08 22:00:36-07:00,11/9/2024 16:01,2024-11-09 09:01:36-07:00,Iridium,46.74241,-113.95486,1545,1.8,3D Valid,Nothing Detected,10,3.28,3.6,
46030,11/9/2024 4:00,2024-11-08 21:00:36-07:00,11/9/2024 20:00,2024-11-09 13:00:47-07:00,Iridium,46.74244,-113.95616,1569,4.4,3D Valid,Nothing Detected,16,3.28,3.6,
46030,11/9/2024 3:00,2024-11-08 20:00:10-07:00,11/9/2024 20:00,2024-11-09 13:00:47-07:00,Iridium,46.74357,-113.95816,1559,2.8,3D Valid,Nothing Detected,16,3.28,3.6,
46030,11/9/2024 2:00,2024-11-08 19:00:38-07:00,11/9/2024 20:00,2024-11-09 13:00:47-07:00,Iridium,46.74439,-113.95902,1547,3,3D Valid,Nothing Detected,17,3.28,3.6,
46030,11/9/2024 1:00,2024-11-08 18:00:10-07:00,11/9/2024 20:00,2024-11-09 13:00:47-07:00,Iridium,46.74562,-113.95737,1577,3.8,3D Valid,Nothing Detected,16,3.28,3.6,
46030,11/9/2024 0:01,2024-11-08 17:01:08-07:00,11/10/2024 8:00,2024-11-10 01:00:58-07:00,Iridium,46.74234,-113.95466,1531,3.2,3D Valid,Nothing Detected,17,3.28,3.6,
46030,11/8/2024 23:00,2024-11-08 16:00:11-07:00,11/10/2024 8:00,2024-11-10 01:00:58-07:00,Iridium,46.74358,-113.95403,1521,4.4,3D Valid,Nothing Detected,17,3.28,3.6,
46030,11/8/2024 22:00,2024-11-08 15:00:36-07:00,11/10/2024 8:00,2024-11-10 01:00:58-07:00,Iridium,46.74629,-113.95589,1502,6,3D Valid,Nothing Detected,18,3.28,3.6,
46030,11/8/2024 21:00,2024-11-08 14:00:36-07:00,11/10/2024 8:00,2024-11-10 01:00:58-07:00,Iridium,46.74849,-113.9518,1494,2,3D Valid,Nothing Detected,15,3.28,3.6,
46030,11/8/2024 20:00,2024-11-08 13:00:38-07:00,11/10/2024 12:01,2024-11-10 05:01:15-07:00,Iridium,46.75051,-113.95264,1428,3.6,3D Valid,Nothing Detected,14,3.28,3.6,
46030,11/8/2024 19:00,2024-11-08 12:00:14-07:00,11/10/2024 12:01,2024-11-10 05:01:15-07:00,Iridium,46.75013,-113.95197,1436,4.6,3D Valid,Nothing Detected,11,3.36,3.6,
46030,11/8/2024 18:00,2024-11-08 11:00:36-07:00,11/10/2024 12:01,2024-11-10 05:01:15-07:00,Iridium,46.75008,-113.95209,1416,2,3D Valid,Nothing Detected,10,3.36,3.6,
46030,11/8/2024 17:00,2024-11-08 10:00:10-07:00,11/10/2024 12:01,2024-11-10 05:01:15-07:00,Iridium,46.75012,-113.95207,1417,3.8,3D Valid,Nothing Detected,11,3.36,3.6,
46030,11/8/2024 16:00,2024-11-08 09:00:38-07:00,11/11/2024 0:01,2024-11-10 17:01:43-07:00,Iridium,46.7501,-113.95207,1431,2,3D Valid,Nothing Detected,8,3.36,3.6,
46030,11/8/2024 15:00,2024-11-08 08:00:12-07:00,11/11/2024 0:01,2024-11-10 17:01:43-07:00,Iridium,46.74983,-113.95214,1409,3,3D Valid,Nothing Detected,7,3.36,3.6,
46030,11/8/2024 14:01,2024-11-08 07:01:00-07:00,11/11/2024 0:01,2024-11-10 17:01:43-07:00,Iridium,46.75013,-113.95206,1422,3.8,3D Valid,Nothing Detected,6,3.36,3.6,
46030,11/8/2024 13:00,2024-11-08 06:00:09-07:00,11/11/2024 0:01,2024-11-10 17:01:43-07:00,Iridium,46.75002,-113.95213,1419,2.8,3D Valid,Nothing Detected,8,3.36,3.6,
46030,11/8/2024 12:00,2024-11-08 05:00:38-07:00,11/8/2024 12:01,2024-11-08 05:01:00-07:00,Iridium,46.75009,-113.95213,1436,2,3D Valid,Nothing Detected,8,3.36,3.6,
46030,11/8/2024 11:00,2024-11-08 04:00:12-07:00,11/8/2024 12:01,2024-11-08 05:01:00-07:00,Iridium,46.75014,-113.95208,1440,4.4,3D Valid,Nothing Detected,7,3.36,3.6,
46030,11/8/2024 10:00,2024-11-08 03:00:38-07:00,11/8/2024 12:01,2024-11-08 05:01:00-07:00,Iridium,46.74995,-113.9522,1401,2.2,3D Valid,Nothing Detected,7,3.36,3.6,
46030,11/8/2024 9:00,2024-11-08 02:00:15-07:00,11/8/2024 12:01,2024-11-08 05:01:00-07:00,Iridium,46.74969,-113.95161,1484,5.2,3D Valid,Nothing Detected,7,3.36,3.6,
46030,11/8/2024 8:00,2024-11-08 01:00:36-07:00,11/8/2024 12:01,2024-11-08 05:01:09-07:00,Iridium,46.75006,-113.95211,1415,3.8,3D Valid,Nothing Detected,9,3.36,3.6,
46030,11/8/2024 7:00,2024-11-08 00:00:10-07:00,11/8/2024 12:01,2024-11-08 05:01:09-07:00,Iridium,46.74997,-113.952,1432,2.8,3D Valid,Nothing Detected,7,3.36,3.6,
46030,11/8/2024 6:00,2024-11-07 23:00:38-07:00,11/8/2024 12:01,2024-11-08 05:01:09-07:00,Iridium,46.75001,-113.95208,1431,2.6,3D Valid,Nothing Detected,10,3.36,3.6,
46030,11/8/2024 5:00,2024-11-07 22:00:11-07:00,11/8/2024 12:01,2024-11-08 05:01:09-07:00,Iridium,46.74995,-113.95221,1427,2.8,3D Valid,Nothing Detected,9,3.36,3.6,
46030,11/8/2024 4:00,2024-11-07 21:00:35-07:00,11/8/2024 12:01,2024-11-08 05:01:16-07:00,Iridium,46.75011,-113.95213,1423,2.4,3D Valid,Nothing Detected,5,3.36,3.6,
46030,11/8/2024 3:00,2024-11-07 20:00:38-07:00,11/8/2024 12:01,2024-11-08 05:01:16-07:00,Iridium,46.74989,-113.95222,1411,5.2,3D Valid,Nothing Detected,8,3.28,3.6,
46030,11/8/2024 2:00,2024-11-07 19:00:11-07:00,11/8/2024 12:01,2024-11-08 05:01:16-07:00,Iridium,46.75006,-113.9519,1431,4.8,3D Valid,Nothing Detected,8,3.28,3.6,
46030,11/8/2024 1:00,2024-11-07 18:00:38-07:00,11/8/2024 12:01,2024-11-08 05:01:16-07:00,Iridium,46.75003,-113.95218,1410,3.6,3D Valid,Nothing Detected,13,3.28,3.6,
46030,11/8/2024 0:00,2024-11-07 17:00:14-07:00,11/8/2024 0:00,2024-11-07 17:00:50-07:00,Iridium,46.75331,-113.95236,1426,3.6,3D Valid,Nothing Detected,14,3.28,3.6,
46030,11/7/2024 23:00,2024-11-07 16:00:10-07:00,11/8/2024 0:00,2024-11-07 17:00:50-07:00,Iridium,46.75374,-113.95515,1404,2.2,3D Valid,Nothing Detected,13,3.28,3.6,
46030,11/7/2024 22:00,2024-11-07 15:00:36-07:00,11/8/2024 0:00,2024-11-07 17:00:50-07:00,Iridium,46.75375,-113.95672,1435,2.2,3D Valid,Nothing Detected,14,3.28,3.6,
46030,11/7/2024 21:01,2024-11-07 14:01:00-07:00,11/8/2024 0:00,2024-11-07 17:00:50-07:00,Iridium,46.75471,-113.95479,1379,5,3D Valid,Nothing Detected,14,3.28,3.6,
46030,11/7/2024 20:00,2024-11-07 13:00:11-07:00,11/8/2024 0:01,2024-11-07 17:01:01-07:00,Iridium,46.75511,-113.95189,1334,4,3D Valid,Nothing Detected,17,3.28,3.6,
46030,11/7/2024 19:00,2024-11-07 12:00:36-07:00,11/8/2024 0:01,2024-11-07 17:01:01-07:00,Iridium,46.75633,-113.9507,1295,3.4,3D Valid,Nothing Detected,19,3.28,3.6,
46030,11/7/2024 18:01,2024-11-07 11:01:00-07:00,11/8/2024 0:01,2024-11-07 17:01:01-07:00,Iridium,46.757,-113.95116,1346,3,3D Valid,Nothing Detected,11,3.28,3.6,
46030,11/7/2024 17:00,2024-11-07 10:00:10-07:00,11/8/2024 0:01,2024-11-07 17:01:01-07:00,Iridium,46.75742,-113.95173,1354,4.2,3D Valid,Nothing Detected,9,3.36,3.6,
46030,11/7/2024 16:00,2024-11-07 09:00:10-07:00,11/8/2024 0:01,2024-11-07 17:01:13-07:00,Iridium,46.75732,-113.95161,1384,5.2,3D Valid,Nothing Detected,7,3.36,3.6,
46030,11/7/2024 15:00,2024-11-07 08:00:36-07:00,11/8/2024 0:01,2024-11-07 17:01:13-07:00,Iridium,46.75733,-113.95164,1358,1.8,3D Valid,Nothing Detected,7,3.36,3.6,
46030,11/7/2024 14:00,2024-11-07 07:00:12-07:00,11/8/2024 0:01,2024-11-07 17:01:13-07:00,Iridium,46.75718,-113.95144,1368,2.6,3D Valid,Nothing Detected,8,3.36,3.6,
46030,11/7/2024 13:00,2024-11-07 06:00:36-07:00,11/8/2024 0:01,2024-11-07 17:01:13-07:00,Iridium,46.75729,-113.95166,1348,2.4,3D Valid,Nothing Detected,8,3.36,3.6,
46030,11/7/2024 12:00,2024-11-07 05:00:12-07:00,11/8/2024 0:01,2024-11-07 17:01:35-07:00,Iridium,46.75741,-113.95159,1358,7.6,3D Valid,Nothing Detected,6,3.36,3.6,
46030,11/7/2024 11:00,2024-11-07 04:00:36-07:00,11/8/2024 0:01,2024-11-07 17:01:35-07:00,Iridium,46.75728,-113.95161,1344,2,3D Valid,Nothing Detected,7,3.36,3.6,
46030,11/7/2024 10:00,2024-11-07 03:00:13-07:00,11/8/2024 0:01,2024-11-07 17:01:35-07:00,Iridium,46.75726,-113.95166,1343,3,3D Valid,Nothing Detected,9,3.36,3.6,
46030,11/7/2024 9:00,2024-11-07 02:00:36-07:00,11/8/2024 0:01,2024-11-07 17:01:35-07:00,Iridium,46.75727,-113.95165,1361,1.6,3D Valid,Nothing Detected,9,3.36,3.6,
46030,11/7/2024 8:00,2024-11-07 01:00:10-07:00,11/7/2024 8:00,2024-11-07 01:00:32-07:00,Iridium,46.75732,-113.95169,1337,5.6,3D Valid,Nothing Detected,9,3.36,3.6,
46030,11/7/2024 7:00,2024-11-07 00:00:38-07:00,11/7/2024 8:00,2024-11-07 01:00:32-07:00,Iridium,46.75726,-113.95171,1346,2.2,3D Valid,Nothing Detected,10,3.36,3.6,
46030,11/7/2024 6:00,2024-11-06 23:00:19-07:00,11/7/2024 8:00,2024-11-07 01:00:32-07:00,Iridium,46.75742,-113.95181,1332,4.2,3D Valid,Nothing Detected,8,3.36,3.6,
46030,11/7/2024 5:00,2024-11-06 22:00:36-07:00,11/7/2024 8:00,2024-11-07 01:00:32-07:00,Iridium,46.75727,-113.95167,1350,2,3D Valid,Nothing Detected,11,3.36,3.6,
46030,11/7/2024 4:00,2024-11-06 21:00:10-07:00,11/7/2024 8:01,2024-11-07 01:01:06-07:00,Iridium,46.75733,-113.95167,1336,4.4,3D Valid,Nothing Detected,8,3.36,3.6,
46030,11/7/2024 3:00,2024-11-06 20:00:38-07:00,11/7/2024 8:01,2024-11-07 01:01:06-07:00,Iridium,46.75727,-113.95167,1342,1.8,3D Valid,Nothing Detected,9,3.36,3.6,
46030,11/7/2024 2:00,2024-11-06 19:00:10-07:00,11/7/2024 8:01,2024-11-07 01:01:06-07:00,Iridium,46.7573,-113.95164,1345,2.2,3D Valid,Nothing Detected,9,3.36,3.6,
46030,11/7/2024 1:00,2024-11-06 18:00:10-07:00,11/7/2024 8:01,2024-11-07 01:01:06-07:00,Iridium,46.75727,-113.95166,1345,3.2,3D Valid,Nothing Detected,9,3.28,3.6,
46030,11/7/2024 0:00,2024-11-06 17:00:37-07:00,11/8/2024 0:01,2024-11-07 17:01:42-07:00,Iridium,46.75861,-113.9533,1364,2,3D Valid,Nothing Detected,8,3.28,3.6,
46030,11/6/2024 23:00,2024-11-06 16:00:12-07:00,11/8/2024 0:01,2024-11-07 17:01:42-07:00,Iridium,46.75927,-113.95418,1394,4.4,3D Valid,Nothing Detected,12,3.28,3.6,
46030,11/6/2024 22:00,2024-11-06 15:00:36-07:00,11/8/2024 0:01,2024-11-07 17:01:42-07:00,Iridium,46.75907,-113.95353,1376,7,3D Valid,Nothing Detected,10,3.28,3.6,
46030,11/6/2024 21:00,2024-11-06 14:00:38-07:00,11/8/2024 0:01,2024-11-07 17:01:42-07:00,Iridium,46.75936,-113.95256,1381,2,3D Valid,Nothing Detected,10,3.28,3.6,
46030,11/6/2024 20:00,2024-11-06 13:00:36-07:00,11/6/2024 20:01,2024-11-06 13:01:30-07:00,Iridium,46.75747,-113.95013,1271,4.2,3D Valid,Nothing Detected,12,3.28,3.6,
46030,11/6/2024 19:00,2024-11-06 12:00:11-07:00,11/6/2024 20:01,2024-11-06 13:01:30-07:00,Iridium,46.75681,-113.95024,1316,5,3D Valid,Nothing Detected,13,3.28,3.6,
46030,11/6/2024 18:00,2024-11-06 11:00:38-07:00,11/6/2024 20:01,2024-11-06 13:01:30-07:00,Iridium,46.75683,-113.9502,1314,1.6,3D Valid,Nothing Detected,12,3.28,3.6,
46030,11/6/2024 17:00,2024-11-06 10:00:10-07:00,11/6/2024 20:01,2024-11-06 13:01:30-07:00,Iridium,46.75709,-113.9505,1305,2.8,3D Valid,Nothing Detected,7,3.28,3.6,
46030,11/6/2024 16:00,2024-11-06 09:00:36-07:00,11/6/2024 16:01,2024-11-06 09:01:02-07:00,Iridium,46.75727,-113.95146,1345,3.2,3D Valid,Nothing Detected,8,3.28,3.6,
46030,11/6/2024 15:00,2024-11-06 08:00:36-07:00,11/6/2024 16:01,2024-11-06 09:01:02-07:00,Iridium,46.75812,-113.95174,1319,2.8,3D Valid,Nothing Detected,10,3.36,3.6,
46030,11/6/2024 14:00,2024-11-06 07:00:36-07:00,11/6/2024 16:01,2024-11-06 09:01:02-07:00,Iridium,46.75818,-113.95176,1321,2,3D Valid,Nothing Detected,8,3.36,3.6,
46030,11/6/2024 13:00,2024-11-06 06:00:11-07:00,11/6/2024 16:01,2024-11-06 09:01:02-07:00,Iridium,46.75816,-113.95172,1320,2.8,3D Valid,Nothing Detected,9,3.36,3.6,
46030,11/6/2024 12:00,2024-11-06 05:00:34-07:00,11/6/2024 12:01,2024-11-06 05:01:07-07:00,Iridium,46.75824,-113.95174,1326,2.2,3D Valid,Nothing Detected,10,3.36,3.6,
46030,11/6/2024 11:00,2024-11-06 04:00:25-07:00,11/6/2024 12:01,2024-11-06 05:01:07-07:00,Iridium,46.75821,-113.9519,1315,2.2,3D Valid,Nothing Detected,9,3.36,3.6,
46030,11/6/2024 10:00,2024-11-06 03:00:37-07:00,11/6/2024 12:01,2024-11-06 05:01:07-07:00,Iridium,46.75824,-113.9517,1321,2.8,3D Valid,Nothing Detected,9,3.36,3.6,
46030,11/6/2024 9:00,2024-11-06 02:00:14-07:00,11/6/2024 12:01,2024-11-06 05:01:07-07:00,Iridium,46.75785,-113.95104,1377,4.6,3D Valid,Nothing Detected,10,3.36,3.6,
46030,11/6/2024 8:00,2024-11-06 01:00:36-07:00,11/6/2024 8:01,2024-11-06 01:01:44-07:00,Iridium,46.7582,-113.95174,1319,4.4,3D Valid,Nothing Detected,10,3.36,3.6,
46030,11/6/2024 7:00,2024-11-06 00:00:13-07:00,11/6/2024 8:01,2024-11-06 01:01:44-07:00,Iridium,46.75822,-113.95169,1328,3,3D Valid,Nothing Detected,10,3.36,3.6,
46030,11/6/2024 6:00,2024-11-05 23:00:36-07:00,11/6/2024 8:01,2024-11-06 01:01:44-07:00,Iridium,46.75819,-113.95172,1323,2.4,3D Valid,Nothing Detected,9,3.36,3.6,
46030,11/6/2024 5:00,2024-11-05 22:00:38-07:00,11/6/2024 8:01,2024-11-06 01:01:44-07:00,Iridium,46.75815,-113.95169,1327,3,3D Valid,Nothing Detected,10,3.36,3.6,
46030,11/6/2024 4:00,2024-11-05 21:00:09-07:00,11/6/2024 8:01,2024-11-06 01:01:56-07:00,Iridium,46.75815,-113.95158,1324,9.2,3D Valid,Nothing Detected,10,3.36,3.6,
46030,11/6/2024 3:00,2024-11-05 20:00:38-07:00,11/6/2024 8:01,2024-11-06 01:01:56-07:00,Iridium,46.75822,-113.95193,1305,2.6,3D Valid,Nothing Detected,9,3.28,3.6,
46030,11/6/2024 2:00,2024-11-05 19:00:12-07:00,11/6/2024 8:01,2024-11-06 01:01:56-07:00,Iridium,46.75817,-113.95158,1320,2.2,3D Valid,Nothing Detected,8,3.28,3.6,
46030,11/6/2024 1:00,2024-11-05 18:00:09-07:00,11/6/2024 8:01,2024-11-06 01:01:56-07:00,Iridium,46.75861,-113.95274,1340,3.6,3D Valid,Nothing Detected,6,3.28,3.6,
46030,11/6/2024 0:00,2024-11-05 17:00:31-07:00,11/6/2024 8:02,2024-11-06 01:02:25-07:00,Iridium,46.75707,-113.95432,1703,1.8,3D Valid,Nothing Detected,7,3.28,3.6,
46030,11/5/2024 23:00,2024-11-05 16:00:38-07:00,11/6/2024 8:02,2024-11-06 01:02:25-07:00,Iridium,46.75935,-113.95303,1320,3.2,3D Valid,Nothing Detected,9,3.28,3.6,
46030,11/5/2024 22:00,2024-11-05 15:00:39-07:00,11/6/2024 8:02,2024-11-06 01:02:25-07:00,Iridium,46.75892,-113.95325,1343,8,3D Valid,Nothing Detected,10,3.36,3.6,
46030,11/5/2024 21:00,2024-11-05 14:00:38-07:00,11/6/2024 8:02,2024-11-06 01:02:25-07:00,Iridium,46.75901,-113.95313,1374,4.4,3D Valid,Nothing Detected,9,3.28,3.6,
46030,11/5/2024 20:00,2024-11-05 13:00:10-07:00,11/6/2024 8:02,2024-11-06 01:02:34-07:00,Iridium,46.75896,-113.95322,1363,4.4,3D Valid,Nothing Detected,7,3.28,3.6,
46030,11/5/2024 19:00,2024-11-05 12:00:36-07:00,11/6/2024 8:02,2024-11-06 01:02:34-07:00,Iridium,46.75935,-113.95385,1380,3.2,3D Valid,Nothing Detected,5,3.28,3.6,
46030,11/5/2024 18:00,2024-11-05 11:00:37-07:00,11/6/2024 8:02,2024-11-06 01:02:34-07:00,Iridium,46.76007,-113.95464,1387,3.8,3D Valid,Nothing Detected,5,3.28,3.6,
46030,11/5/2024 17:00,2024-11-05 10:00:10-07:00,11/6/2024 8:02,2024-11-06 01:02:34-07:00,Iridium,46.76076,-113.9576,1446,4,3D Valid,Nothing Detected,9,3.36,3.6,
46030,11/5/2024 16:00,2024-11-05 09:00:39-07:00,11/6/2024 12:01,2024-11-06 05:01:18-07:00,Iridium,46.76069,-113.95761,1457,5.6,3D Valid,Nothing Detected,7,3.36,3.6,
46030,11/5/2024 15:00,2024-11-05 08:00:13-07:00,11/6/2024 12:01,2024-11-06 05:01:18-07:00,Iridium,46.76074,-113.95755,1463,3.4,3D Valid,Nothing Detected,9,3.36,3.6,
46030,11/5/2024 14:00,2024-11-05 07:00:38-07:00,11/6/2024 12:01,2024-11-06 05:01:18-07:00,Iridium,46.76068,-113.95757,1450,1.8,3D Valid,Nothing Detected,8,3.36,3.6,
46030,11/5/2024 13:00,2024-11-05 06:00:12-07:00,11/6/2024 12:01,2024-11-06 05:01:18-07:00,Iridium,46.76071,-113.95763,1441,3.2,3D Valid,Nothing Detected,8,3.36,3.6,
46030,11/5/2024 12:01,2024-11-05 05:01:54-07:00,11/6/2024 12:01,2024-11-06 05:01:46-07:00,Iridium,46.76072,-113.9576,1454,3.4,3D Valid,Nothing Detected,10,3.28,3.6,
46030,11/5/2024 11:00,2024-11-05 04:00:17-07:00,11/6/2024 12:01,2024-11-06 05:01:46-07:00,Iridium,46.76074,-113.95737,1473,4.6,3D Valid,Nothing Detected,10,3.36,3.6,
46030,11/5/2024 10:00,2024-11-05 03:00:38-07:00,11/6/2024 12:01,2024-11-06 05:01:46-07:00,Iridium,46.76067,-113.95769,1442,2.2,3D Valid,Nothing Detected,8,3.36,3.6,
46030,11/5/2024 9:00,2024-11-05 02:00:10-07:00,11/6/2024 12:01,2024-11-06 05:01:46-07:00,Iridium,46.76058,-113.95757,1438,4.4,3D Valid,Nothing Detected,10,3.36,3.6,
46030,11/5/2024 8:00,2024-11-05 01:00:38-07:00,11/5/2024 8:01,2024-11-05 01:01:06-07:00,Iridium,46.76067,-113.95758,1440,5,3D Valid,Nothing Detected,9,3.36,3.6,
46030,11/5/2024 7:00,2024-11-05 00:00:08-07:00,11/5/2024 8:01,2024-11-05 01:01:06-07:00,Iridium,46.76069,-113.95762,1440,3.4,3D Valid,Nothing Detected,9,3.36,3.6,
46030,11/5/2024 6:00,2024-11-04 23:00:36-07:00,11/5/2024 8:01,2024-11-05 01:01:06-07:00,Iridium,46.76063,-113.95757,1447,3,3D Valid,Nothing Detected,9,3.36,3.6,
46030,11/5/2024 5:00,2024-11-04 22:00:10-07:00,11/5/2024 8:01,2024-11-05 01:01:06-07:00,Iridium,46.76064,-113.95762,1448,4,3D Valid,Nothing Detected,8,3.36,3.6,
46030,11/5/2024 4:00,2024-11-04 21:00:38-07:00,11/5/2024 8:01,2024-11-05 01:01:16-07:00,Iridium,46.76069,-113.9576,1443,2.4,3D Valid,Nothing Detected,13,3.36,3.6,
46030,11/5/2024 3:00,2024-11-04 20:00:26-07:00,11/5/2024 8:01,2024-11-05 01:01:16-07:00,Iridium,46.76044,-113.95788,1403,10,3D Valid,Nothing Detected,12,3.28,3.6,
46030,11/5/2024 2:00,2024-11-04 19:00:38-07:00,11/5/2024 8:01,2024-11-05 01:01:16-07:00,Iridium,46.76072,-113.95753,1450,2,3D Valid,Nothing Detected,15,3.28,3.6,
46030,11/5/2024 1:00,2024-11-04 18:00:36-07:00,11/5/2024 8:01,2024-11-05 01:01:16-07:00,Iridium,46.7603,-113.95749,1484,4.4,3D Valid,Nothing Detected,16,3.28,3.6,
46030,11/5/2024 0:00,2024-11-04 17:00:45-07:00,11/5/2024 8:01,2024-11-05 01:01:30-07:00,Iridium,46.76019,-113.95839,1503,2.4,3D Valid,Nothing Detected,16,3.28,3.6,
46030,11/4/2024 23:01,2024-11-04 16:01:15-07:00,11/5/2024 8:01,2024-11-05 01:01:30-07:00,Iridium,46.76099,-113.96233,1502,4,3D Valid,Nothing Detected,17,3.28,3.6,
46030,11/4/2024 22:01,2024-11-04 15:01:36-07:00,11/5/2024 8:01,2024-11-05 01:01:30-07:00,Iridium,46.75567,-113.96394,1458,7.2,3D Valid,Nothing Detected,17,3.28,3.6,
46030,11/4/2024 21:00,2024-11-04 14:00:36-07:00,11/5/2024 8:01,2024-11-05 01:01:30-07:00,Iridium,46.75605,-113.96018,1415,4.6,3D Valid,Nothing Detected,18,3.28,3.6,
46030,11/4/2024 20:00,2024-11-04 13:00:36-07:00,11/4/2024 20:01,2024-11-04 13:01:04-07:00,Iridium,46.75542,-113.96013,1444,4.8,3D Valid,Nothing Detected,16,3.28,3.6,
46030,11/4/2024 19:00,2024-11-04 12:00:38-07:00,11/4/2024 20:01,2024-11-04 13:01:04-07:00,Iridium,46.75303,-113.96049,1453,3.2,3D Valid,Nothing Detected,16,3.28,3.6,
46030,11/4/2024 18:00,2024-11-04 11:00:12-07:00,11/4/2024 20:01,2024-11-04 13:01:04-07:00,Iridium,46.75205,-113.95813,1506,3,3D Valid,Nothing Detected,13,3.28,3.6,
46030,11/4/2024 17:00,2024-11-04 10:00:36-07:00,11/4/2024 20:01,2024-11-04 13:01:04-07:00,Iridium,46.75192,-113.95793,1468,5,3D Valid,Nothing Detected,14,3.28,3.6,
46030,11/4/2024 16:00,2024-11-04 09:00:36-07:00,11/5/2024 8:01,2024-11-05 01:01:38-07:00,Iridium,46.75142,-113.95805,1509,5.6,3D Valid,Nothing Detected,14,3.28,3.6,
46030,11/4/2024 15:00,2024-11-04 08:00:45-07:00,11/5/2024 8:01,2024-11-05 01:01:38-07:00,Iridium,46.74976,-113.95757,1606,3.2,3D Valid,Nothing Detected,13,3.28,3.6,
46030,11/4/2024 14:00,2024-11-04 07:00:10-07:00,11/5/2024 8:01,2024-11-05 01:01:38-07:00,Iridium,46.74681,-113.95719,1546,3.6,3D Valid,Nothing Detected,13,3.28,3.6,
46030,11/4/2024 13:00,2024-11-04 06:00:10-07:00,11/5/2024 8:01,2024-11-05 01:01:38-07:00,Iridium,46.74514,-113.95721,1589,3,3D Valid,Nothing Detected,13,3.28,3.52,
46030,11/4/2024 12:00,2024-11-04 05:00:36-07:00,11/5/2024 8:01,2024-11-05 01:01:49-07:00,Iridium,46.7449,-113.95687,1587,1.6,3D Valid,Nothing Detected,12,3.28,3.6,
46030,11/4/2024 11:00,2024-11-04 04:00:10-07:00,11/5/2024 8:01,2024-11-05 01:01:49-07:00,Iridium,46.74713,-113.95824,1587,5,3D Valid,Nothing Detected,13,3.28,3.6,
46030,11/4/2024 10:00,2024-11-04 03:00:37-07:00,11/5/2024 8:01,2024-11-05 01:01:49-07:00,Iridium,46.74863,-113.96027,1658,4,3D Valid,Nothing Detected,12,3.28,3.6,
46030,11/4/2024 9:00,2024-11-04 02:00:10-07:00,11/5/2024 8:01,2024-11-05 01:01:49-07:00,Iridium,46.74894,-113.95985,1634,4.2,3D Valid,Nothing Detected,11,3.36,3.6,
46030,11/4/2024 8:00,2024-11-04 01:00:11-07:00,11/5/2024 8:01,2024-11-05 01:01:56-07:00,Iridium,46.74901,-113.96007,1629,5.4,3D Valid,Nothing Detected,8,3.36,3.6,
46030,11/4/2024 7:00,2024-11-04 00:00:36-07:00,11/5/2024 8:01,2024-11-05 01:01:56-07:00,Iridium,46.74903,-113.96007,1632,1.6,3D Valid,Nothing Detected,11,3.36,3.6,
46030,11/4/2024 6:00,2024-11-03 23:00:43-07:00,11/5/2024 8:01,2024-11-05 01:01:56-07:00,Iridium,46.74901,-113.95978,1679,4.8,3D Valid,Nothing Detected,10,3.36,3.6,
46030,11/4/2024 5:00,2024-11-03 22:00:10-07:00,11/5/2024 8:01,2024-11-05 01:01:56-07:00,Iridium,46.74901,-113.96005,1640,2.8,3D Valid,Nothing Detected,12,3.36,3.6,
46030,11/4/2024 4:00,2024-11-03 21:00:36-07:00,11/5/2024 8:02,2024-11-05 01:02:04-07:00,Iridium,46.74897,-113.96004,1617,2,3D Valid,Nothing Detected,12,3.28,3.6,
46030,11/4/2024 3:00,2024-11-03 20:00:10-07:00,11/5/2024 8:02,2024-11-05 01:02:04-07:00,Iridium,46.74904,-113.95994,1629,1.4,3D Valid,Nothing Detected,13,3.28,3.6,
46030,11/4/2024 2:00,2024-11-03 19:00:39-07:00,11/5/2024 8:02,2024-11-05 01:02:04-07:00,Iridium,46.74906,-113.96011,1627,1.6,3D Valid,Nothing Detected,14,3.28,3.6,
46030,11/4/2024 1:00,2024-11-03 18:00:11-07:00,11/5/2024 8:02,2024-11-05 01:02:04-07:00,Iridium,46.74942,-113.96028,1617,7.6,3D Valid,Nothing Detected,15,3.28,3.6,
46030,11/4/2024 0:01,2024-11-03 17:01:36-07:00,11/4/2024 0:02,2024-11-03 17:02:59-07:00,Iridium,46.74948,-113.9569,1610,3.8,3D Valid,Nothing Detected,14,3.2,3.6,
46030,11/3/2024 23:00,2024-11-03 16:00:21-07:00,11/4/2024 0:02,2024-11-03 17:02:59-07:00,Iridium,46.74927,-113.95461,1520,5.6,3D Valid,Nothing Detected,14,3.28,3.6,
46030,11/3/2024 22:00,2024-11-03 15:00:11-07:00,11/4/2024 0:02,2024-11-03 17:02:59-07:00,Iridium,46.75011,-113.95325,1456,8.2,3D Valid,Nothing Detected,14,3.28,3.6,
46030,11/3/2024 21:00,2024-11-03 14:00:36-07:00,11/4/2024 0:02,2024-11-03 17:02:59-07:00,Iridium,46.74994,-113.95146,1405,2.2,3D Valid,Nothing Detected,12,3.28,3.6,
46030,11/3/2024 20:00,2024-11-03 13:00:10-07:00,11/5/2024 8:02,2024-11-05 01:02:23-07:00,Iridium,46.75053,-113.95266,1418,5.2,3D Valid,Nothing Detected,15,3.28,3.6,
46030,11/3/2024 19:00,2024-11-03 12:00:36-07:00,11/5/2024 8:02,2024-11-05 01:02:23-07:00,Iridium,46.75051,-113.95085,1368,3,3D Valid,Nothing Detected,15,3.28,3.6,
46030,11/3/2024 18:00,2024-11-03 11:00:36-07:00,11/5/2024 8:02,2024-11-05 01:02:23-07:00,Iridium,46.75078,-113.95089,1383,1.8,3D Valid,Nothing Detected,15,3.28,3.6,
46030,11/3/2024 17:00,2024-11-03 10:00:11-07:00,11/5/2024 8:02,2024-11-05 01:02:23-07:00,Iridium,46.75058,-113.95104,1364,2.6,3D Valid,Nothing Detected,14,3.28,3.6,
46030,11/3/2024 16:01,2024-11-03 09:01:00-07:00,11/5/2024 8:02,2024-11-05 01:02:30-07:00,Iridium,46.75073,-113.95094,1364,5.6,3D Valid,Nothing Detected,14,3.28,3.6,
46030,11/3/2024 15:00,2024-11-03 08:00:36-07:00,11/5/2024 8:02,2024-11-05 01:02:30-07:00,Iridium,46.75034,-113.95026,1367,3.4,3D Valid,Nothing Detected,12,3.28,3.6,
46030,11/3/2024 14:00,2024-11-03 07:00:37-07:00,11/5/2024 8:02,2024-11-05 01:02:30-07:00,Iridium,46.75044,-113.94905,1345,2,3D Valid,Nothing Detected,8,3.28,3.6,
46030,11/3/2024 13:00,2024-11-03 06:00:11-07:00,11/5/2024 8:02,2024-11-05 01:02:30-07:00,Iridium,46.7508,-113.94918,1332,3.4,3D Valid,Nothing Detected,8,3.28,3.6,
46030,11/3/2024 12:00,2024-11-03 05:00:38-07:00,11/3/2024 12:01,2024-11-03 05:01:03-07:00,Iridium,46.75057,-113.94916,1337,3.2,3D Valid,Nothing Detected,10,3.28,3.6,
46030,11/3/2024 11:00,2024-11-03 04:00:36-07:00,11/3/2024 12:01,2024-11-03 05:01:03-07:00,Iridium,46.7505,-113.94918,1333,2.4,3D Valid,Nothing Detected,12,3.28,3.6,
46030,11/3/2024 10:01,2024-11-03 03:01:06-07:00,11/3/2024 12:01,2024-11-03 05:01:03-07:00,Iridium,46.75235,-113.94511,1209,3,3D Valid,Nothing Detected,11,3.28,3.6,
46030,11/3/2024 9:00,2024-11-03 02:00:10-07:00,11/3/2024 12:01,2024-11-03 05:01:03-07:00,Iridium,46.75377,-113.94769,1326,4,3D Valid,Nothing Detected,12,3.28,3.6,
46030,11/3/2024 8:00,2024-11-03 01:00:36-07:00,11/3/2024 12:01,2024-11-03 05:01:17-07:00,Iridium,46.75463,-113.94989,1354,1.6,3D Valid,Nothing Detected,10,3.36,3.6,
46030,11/3/2024 7:00,2024-11-03 01:00:09-06:00,11/3/2024 12:01,2024-11-03 05:01:17-07:00,Iridium,46.7548,-113.95002,1320,3.4,3D Valid,Nothing Detected,10,3.36,3.6,
46030,11/3/2024 6:00,2024-11-03 00:00:38-06:00,11/3/2024 12:01,2024-11-03 05:01:17-07:00,Iridium,46.75479,-113.9499,1357,2.8,3D Valid,Nothing Detected,10,3.36,3.6,
46030,11/3/2024 5:00,2024-11-02 23:00:09-06:00,11/3/2024 12:01,2024-11-03 05:01:17-07:00,Iridium,46.75495,-113.95013,1324,4.4,3D Valid,Nothing Detected,11,3.36,3.6,
46030,11/3/2024 4:00,2024-11-02 22:00:37-06:00,11/3/2024 12:01,2024-11-03 05:01:40-07:00,Iridium,46.75479,-113.95003,1338,2.4,3D Valid,Nothing Detected,11,3.36,3.6,
46030,11/3/2024 3:00,2024-11-02 21:00:22-06:00,11/3/2024 12:01,2024-11-03 05:01:40-07:00,Iridium,46.75494,-113.9499,1347,3.8,3D Valid,Nothing Detected,11,3.36,3.6,
46030,11/3/2024 2:00,2024-11-02 20:00:10-06:00,11/3/2024 12:01,2024-11-03 05:01:40-07:00,Iridium,46.75494,-113.95004,1331,4.6,3D Valid,Nothing Detected,10,3.28,3.6,
46030,11/3/2024 1:00,2024-11-02 19:00:38-06:00,11/3/2024 12:01,2024-11-03 05:01:40-07:00,Iridium,46.75488,-113.95,1351,3,3D Valid,Nothing Detected,13,3.28,3.6,
46030,11/3/2024 0:00,2024-11-02 18:00:11-06:00,11/3/2024 0:01,2024-11-02 18:01:13-06:00,Iridium,46.75513,-113.95063,1322,4.6,3D Valid,Nothing Detected,13,3.28,3.6,
46030,11/2/2024 23:00,2024-11-02 17:00:38-06:00,11/3/2024 0:01,2024-11-02 18:01:13-06:00,Iridium,46.75506,-113.95109,1343,2.2,3D Valid,Nothing Detected,12,3.28,3.6,
46030,11/2/2024 22:00,2024-11-02 16:00:36-06:00,11/3/2024 0:01,2024-11-02 18:01:13-06:00,Iridium,46.75483,-113.95219,1342,3.2,3D Valid,Nothing Detected,16,3.28,3.6,
46030,11/2/2024 21:00,2024-11-02 15:00:36-06:00,11/3/2024 0:01,2024-11-02 18:01:13-06:00,Iridium,46.75419,-113.95192,1419,3.2,3D Valid,Nothing Detected,17,3.28,3.6,
46030,11/2/2024 20:00,2024-11-02 14:00:09-06:00,11/3/2024 0:01,2024-11-02 18:01:33-06:00,Iridium,46.75412,-113.95188,1405,2.6,3D Valid,Nothing Detected,17,3.28,3.6,
46030,11/2/2024 19:00,2024-11-02 13:00:36-06:00,11/3/2024 0:01,2024-11-02 18:01:33-06:00,Iridium,46.75444,-113.95304,1383,2.6,3D Valid,Nothing Detected,15,3.28,3.6,
46030,11/2/2024 18:00,2024-11-02 12:00:38-06:00,11/3/2024 0:01,2024-11-02 18:01:33-06:00,Iridium,46.75354,-113.95374,1410,1.8,3D Valid,Nothing Detected,14,3.28,3.6,
46030,11/2/2024 17:00,2024-11-02 11:00:11-06:00,11/3/2024 0:01,2024-11-02 18:01:33-06:00,Iridium,46.75346,-113.95371,1392,2.2,3D Valid,Nothing Detected,14,3.28,3.6,
46030,11/2/2024 16:02,2024-11-02 10:02:06-06:00,11/3/2024 0:01,2024-11-02 18:01:43-06:00,Iridium,46.75354,-113.95483,1403,2.6,3D Valid,Nothing Detected,14,3.2,3.6,
46030,11/2/2024 15:00,2024-11-02 09:00:39-06:00,11/3/2024 0:01,2024-11-02 18:01:43-06:00,Iridium,46.75293,-113.95815,1467,2.4,3D Valid,Nothing Detected,16,3.28,3.6,
46030,11/2/2024 14:00,2024-11-02 08:00:12-06:00,11/3/2024 0:01,2024-11-02 18:01:43-06:00,Iridium,46.75238,-113.95954,1477,3.8,3D Valid,Nothing Detected,16,3.28,3.6,
46030,11/2/2024 13:00,2024-11-02 07:00:38-06:00,11/3/2024 0:01,2024-11-02 18:01:43-06:00,Iridium,46.75185,-113.95916,1505,3.2,3D Valid,Nothing Detected,16,3.28,3.6,
46030,11/2/2024 12:00,2024-11-02 06:00:20-06:00,11/2/2024 12:00,2024-11-02 06:00:41-06:00,Iridium,46.75471,-113.95911,1846,6.4,3D Valid,Nothing Detected,15,3.28,3.6,
46030,11/2/2024 11:00,2024-11-02 05:00:36-06:00,11/2/2024 12:00,2024-11-02 06:00:41-06:00,Iridium,46.75106,-113.96174,1539,2.2,3D Valid,Nothing Detected,15,3.28,3.6,
46030,11/2/2024 10:00,2024-11-02 04:00:36-06:00,11/2/2024 12:00,2024-11-02 06:00:41-06:00,Iridium,46.7518,-113.95499,1496,5.4,3D Valid,Nothing Detected,16,3.28,3.6,
46030,11/2/2024 9:00,2024-11-02 03:00:36-06:00,11/2/2024 12:00,2024-11-02 06:00:41-06:00,Iridium,46.75263,-113.95301,1457,1.6,3D Valid,Nothing Detected,16,3.28,3.6,
46030,11/2/2024 8:00,2024-11-02 02:00:36-06:00,11/2/2024 8:01,2024-11-02 02:01:01-06:00,Iridium,46.75252,-113.95055,1394,2.4,3D Valid,Nothing Detected,16,3.28,3.6,
46030,11/2/2024 7:00,2024-11-02 01:00:08-06:00,11/2/2024 8:01,2024-11-02 02:01:01-06:00,Iridium,46.75106,-113.95184,1399,3.6,3D Valid,Nothing Detected,16,3.28,3.6,
46030,11/2/2024 6:00,2024-11-02 00:00:38-06:00,11/2/2024 8:01,2024-11-02 02:01:01-06:00,Iridium,46.75019,-113.95159,1402,2.8,3D Valid,Nothing Detected,14,3.36,3.6,
46030,11/2/2024 5:00,2024-11-01 23:00:11-06:00,11/2/2024 8:01,2024-11-02 02:01:01-06:00,Iridium,46.75016,-113.95164,1402,2.8,3D Valid,Nothing Detected,13,3.36,3.6,
46030,11/2/2024 4:00,2024-11-01 22:00:37-06:00,11/2/2024 8:01,2024-11-02 02:01:21-06:00,Iridium,46.75014,-113.95163,1401,3.6,3D Valid,Nothing Detected,12,3.28,3.6,
46030,11/2/2024 3:00,2024-11-01 21:00:14-06:00,11/2/2024 8:01,2024-11-02 02:01:21-06:00,Iridium,46.74991,-113.9516,1360,9.8,3D Valid,Nothing Detected,12,3.28,3.6,
46030,11/2/2024 2:00,2024-11-01 20:00:09-06:00,11/2/2024 8:01,2024-11-02 02:01:21-06:00,Iridium,46.75016,-113.95151,1399,2.4,3D Valid,Nothing Detected,10,3.28,3.6,
46030,11/2/2024 1:00,2024-11-01 19:00:36-06:00,11/2/2024 8:01,2024-11-02 02:01:21-06:00,Iridium,46.75001,-113.95164,1406,2.4,3D Valid,Nothing Detected,11,3.28,3.6,
46030,11/2/2024 0:00,2024-11-01 18:00:35-06:00,11/2/2024 8:01,2024-11-02 02:01:29-06:00,Iridium,46.7508,-113.95189,1406,2.2,3D Valid,Nothing Detected,15,3.28,3.6,
46030,11/1/2024 23:00,2024-11-01 17:00:24-06:00,11/2/2024 8:01,2024-11-02 02:01:29-06:00,Iridium,46.74957,-113.94918,1389,3.2,3D Valid,Nothing Detected,14,3.28,3.6,
46030,11/1/2024 22:01,2024-11-01 16:01:06-06:00,11/2/2024 8:01,2024-11-02 02:01:29-06:00,Iridium,46.74976,-113.94881,1361,3.4,3D Valid,Nothing Detected,12,3.28,3.6,
46030,11/1/2024 21:00,2024-11-01 15:00:14-06:00,11/2/2024 8:01,2024-11-02 02:01:29-06:00,Iridium,46.74949,-113.94883,1381,5.2,3D Valid,Nothing Detected,15,3.28,3.6,
46030,11/1/2024 20:00,2024-11-01 14:00:12-06:00,11/1/2024 20:00,2024-11-01 14:00:38-06:00,Iridium,46.74958,-113.94878,1418,2,3D Valid,Nothing Detected,13,3.28,3.6,
46030,11/1/2024 19:00,2024-11-01 13:00:36-06:00,11/1/2024 20:00,2024-11-01 14:00:38-06:00,Iridium,46.74965,-113.94894,1392,2,3D Valid,Nothing Detected,12,3.28,3.6,
46030,11/1/2024 18:00,2024-11-01 12:00:38-06:00,11/1/2024 20:00,2024-11-01 14:00:38-06:00,Iridium,46.74949,-113.94903,1439,2,3D Valid,Nothing Detected,12,3.28,3.6,
46030,11/1/2024 17:00,2024-11-01 11:00:11-06:00,11/1/2024 20:00,2024-11-01 14:00:38-06:00,Iridium,46.7496,-113.94893,1376,3.8,3D Valid,Nothing Detected,12,3.28,3.6,
46030,11/1/2024 16:00,2024-11-01 10:00:36-06:00,11/1/2024 20:01,2024-11-01 14:01:19-06:00,Iridium,46.74964,-113.94894,1366,5.4,3D Valid,Nothing Detected,15,3.2,3.6,
46030,11/1/2024 15:00,2024-11-01 09:00:36-06:00,11/1/2024 20:01,2024-11-01 14:01:19-06:00,Iridium,46.74982,-113.94795,1360,3.6,3D Valid,Nothing Detected,14,3.28,3.52,
46030,11/1/2024 14:00,2024-11-01 08:00:10-06:00,11/1/2024 20:01,2024-11-01 14:01:19-06:00,Iridium,46.75099,-113.94545,1285,2.8,3D Valid,Nothing Detected,13,3.28,3.6,
46030,11/1/2024 13:00,2024-11-01 07:00:36-06:00,11/1/2024 20:01,2024-11-01 14:01:19-06:00,Iridium,46.75124,-113.94469,1267,2.4,3D Valid,Nothing Detected,13,3.28,3.6,
46030,11/1/2024 12:00,2024-11-01 06:00:36-06:00,11/2/2024 8:01,2024-11-02 02:01:37-06:00,Iridium,46.75102,-113.9434,1213,2,3D Valid,Nothing Detected,11,3.28,3.6,
46030,11/1/2024 11:00,2024-11-01 05:00:10-06:00,11/2/2024 8:01,2024-11-02 02:01:37-06:00,Iridium,46.75119,-113.94386,1234,7.8,3D Valid,Nothing Detected,13,3.28,3.6,
46030,11/1/2024 10:00,2024-11-01 04:00:37-06:00,11/2/2024 8:01,2024-11-02 02:01:37-06:00,Iridium,46.75122,-113.94395,1228,2.4,3D Valid,Nothing Detected,12,3.28,3.6,
46030,11/1/2024 9:01,2024-11-01 03:01:21-06:00,11/2/2024 8:01,2024-11-02 02:01:37-06:00,Iridium,46.7512,-113.94389,1233,3.4,3D Valid,Nothing Detected,13,3.28,3.6,
46030,11/1/2024 8:00,2024-11-01 02:00:38-06:00,11/2/2024 8:01,2024-11-02 02:01:45-06:00,Iridium,46.75119,-113.94387,1237,7.6,3D Valid,Nothing Detected,15,3.28,3.6,
46030,11/1/2024 7:00,2024-11-01 01:00:10-06:00,11/2/2024 8:01,2024-11-02 02:01:45-06:00,Iridium,46.7512,-113.9439,1230,3.6,3D Valid,Nothing Detected,9,3.28,3.6,
46030,11/1/2024 6:00,2024-11-01 00:00:36-06:00,11/2/2024 8:01,2024-11-02 02:01:45-06:00,Iridium,46.75116,-113.94392,1223,1.8,3D Valid,Nothing Detected,12,3.28,3.6,
46030,11/1/2024 5:00,2024-10-31 23:00:09-06:00,11/2/2024 8:01,2024-11-02 02:01:45-06:00,Iridium,46.75113,-113.94295,1197,3.6,3D Valid,Nothing Detected,12,3.28,3.6,
46030,11/1/2024 4:01,2024-10-31 22:01:24-06:00,11/1/2024 4:01,2024-10-31 22:01:53-06:00,Iridium,46.75139,-113.94424,1218,3.6,3D Valid,Nothing Detected,11,3.28,3.6,
46030,11/1/2024 3:00,2024-10-31 21:00:10-06:00,11/1/2024 4:01,2024-10-31 22:01:53-06:00,Iridium,46.75135,-113.94537,1253,4,3D Valid,Nothing Detected,13,3.28,3.6,
46030,11/1/2024 2:00,2024-10-31 20:00:13-06:00,11/1/2024 4:01,2024-10-31 22:01:53-06:00,Iridium,46.7514,-113.9453,1278,2.6,3D Valid,Nothing Detected,13,3.28,3.6,
46030,11/1/2024 1:00,2024-10-31 19:00:36-06:00,11/1/2024 4:01,2024-10-31 22:01:53-06:00,Iridium,46.75143,-113.94537,1269,2.8,3D Valid,Nothing Detected,12,3.28,3.6,
46030,11/1/2024 0:00,2024-10-31 18:00:36-06:00,11/1/2024 4:02,2024-10-31 22:02:03-06:00,Iridium,46.75152,-113.94532,1271,1.8,3D Valid,Nothing Detected,12,3.28,3.6,
46030,10/31/2024 23:00,2024-10-31 17:00:10-06:00,11/1/2024 4:02,2024-10-31 22:02:03-06:00,Iridium,46.75141,-113.94534,1263,2.8,3D Valid,Nothing Detected,12,3.28,3.6,
46030,10/31/2024 22:00,2024-10-31 16:00:34-06:00,11/1/2024 4:02,2024-10-31 22:02:03-06:00,Iridium,46.75141,-113.94511,1283,2.2,3D Valid,Nothing Detected,14,3.28,3.6,
46030,10/31/2024 21:00,2024-10-31 15:00:11-06:00,11/1/2024 4:02,2024-10-31 22:02:03-06:00,Iridium,46.75143,-113.94528,1272,2.6,3D Valid,Nothing Detected,13,3.28,3.6,
46030,10/31/2024 20:00,2024-10-31 14:00:32-06:00,11/1/2024 4:02,2024-10-31 22:02:12-06:00,Iridium,46.75135,-113.94533,1264,4.2,3D Valid,Nothing Detected,12,3.28,3.6,
46030,10/31/2024 19:00,2024-10-31 13:00:36-06:00,11/1/2024 4:02,2024-10-31 22:02:12-06:00,Iridium,46.75142,-113.94531,1265,2.8,3D Valid,Nothing Detected,13,3.28,3.6,
46030,10/31/2024 18:00,2024-10-31 12:00:37-06:00,11/1/2024 4:02,2024-10-31 22:02:12-06:00,Iridium,46.7514,-113.94531,1267,1.8,3D Valid,Nothing Detected,14,3.28,3.6,
46030,10/31/2024 17:00,2024-10-31 11:00:11-06:00,11/1/2024 4:02,2024-10-31 22:02:12-06:00,Iridium,46.75142,-113.94546,1327,3.8,3D Valid,Nothing Detected,12,3.28,3.6,
46030,10/31/2024 16:00,2024-10-31 10:00:38-06:00,11/1/2024 4:02,2024-10-31 22:02:25-06:00,Iridium,46.75139,-113.94531,1259,5.2,3D Valid,Nothing Detected,11,3.28,3.6,
46030,10/31/2024 15:00,2024-10-31 09:00:10-06:00,11/1/2024 4:02,2024-10-31 22:02:25-06:00,Iridium,46.75138,-113.94533,1261,2.8,3D Valid,Nothing Detected,14,3.28,3.6,
46030,10/31/2024 14:00,2024-10-31 08:00:36-06:00,11/1/2024 4:02,2024-10-31 22:02:25-06:00,Iridium,46.75123,-113.94472,1252,2.4,3D Valid,Nothing Detected,13,3.28,3.6,
46030,10/31/2024 13:00,2024-10-31 07:00:10-06:00,11/1/2024 4:02,2024-10-31 22:02:25-06:00,Iridium,46.75127,-113.94475,1258,4,3D Valid,Nothing Detected,14,3.28,3.6,
46030,10/31/2024 12:00,2024-10-31 06:00:36-06:00,11/1/2024 4:02,2024-10-31 22:02:46-06:00,Iridium,46.75111,-113.94286,1201,1.8,3D Valid,Nothing Detected,11,3.28,3.6,
46030,10/31/2024 11:00,2024-10-31 05:00:20-06:00,11/1/2024 4:02,2024-10-31 22:02:46-06:00,Iridium,46.75118,-113.9439,1227,10,3D Valid,Nothing Detected,7,3.28,3.6,
46030,10/31/2024 10:00,2024-10-31 04:00:37-06:00,11/1/2024 4:02,2024-10-31 22:02:46-06:00,Iridium,46.75114,-113.94391,1230,2.6,3D Valid,Nothing Detected,5,3.28,3.6,
46030,10/31/2024 9:00,2024-10-31 03:00:10-06:00,11/1/2024 4:02,2024-10-31 22:02:46-06:00,Iridium,46.75119,-113.9439,1229,3.4,3D Valid,Nothing Detected,5,3.28,3.6,
46030,10/31/2024 8:00,2024-10-31 02:00:38-06:00,11/1/2024 4:03,2024-10-31 22:03:12-06:00,Iridium,46.75116,-113.94392,1229,7,3D Valid,Nothing Detected,7,3.28,3.6,
46030,10/31/2024 7:00,2024-10-31 01:00:09-06:00,11/1/2024 4:03,2024-10-31 22:03:12-06:00,Iridium,46.75117,-113.94388,1225,3.8,3D Valid,Nothing Detected,8,3.28,3.52,
46030,10/31/2024 6:00,2024-10-31 00:00:37-06:00,11/1/2024 4:03,2024-10-31 22:03:12-06:00,Iridium,46.75113,-113.94289,1197,2.6,3D Valid,Nothing Detected,10,3.2,3.52,
46030,10/31/2024 5:00,2024-10-30 23:00:36-06:00,11/1/2024 4:03,2024-10-31 22:03:12-06:00,Iridium,46.74643,-113.94576,1295,5.4,3D Valid,Nothing Detected,12,3.28,3.6,
46030,10/31/2024 4:00,2024-10-30 22:00:11-06:00,11/1/2024 4:03,2024-10-31 22:03:27-06:00,Iridium,46.74531,-113.94796,1357,4.4,3D Valid,Nothing Detected,11,3.28,3.6,
46030,10/31/2024 3:00,2024-10-30 21:00:36-06:00,11/1/2024 4:03,2024-10-31 22:03:27-06:00,Iridium,46.74591,-113.94868,1341,4.2,3D Valid,Nothing Detected,11,3.28,3.6,
46030,10/31/2024 2:00,2024-10-30 20:00:11-06:00,11/1/2024 4:03,2024-10-31 22:03:27-06:00,Iridium,46.74593,-113.94878,1331,2.6,3D Valid,Nothing Detected,10,3.28,3.6,
46030,10/31/2024 1:00,2024-10-30 19:00:36-06:00,11/1/2024 4:03,2024-10-31 22:03:27-06:00,Iridium,46.74591,-113.94877,1325,3,3D Valid,Nothing Detected,7,3.28,3.6,
46030,10/31/2024 0:00,2024-10-30 18:00:37-06:00,10/31/2024 0:01,2024-10-30 18:01:16-06:00,Iridium,46.74588,-113.94876,1325,3.4,3D Valid,Nothing Detected,10,3.28,3.6,
46030,10/30/2024 23:00,2024-10-30 17:00:13-06:00,10/31/2024 0:01,2024-10-30 18:01:16-06:00,Iridium,46.746,-113.94825,1323,3,3D Valid,Nothing Detected,11,3.28,3.6,
46030,10/30/2024 22:00,2024-10-30 16:00:36-06:00,10/31/2024 0:01,2024-10-30 18:01:16-06:00,Iridium,46.74598,-113.94814,1340,2.6,3D Valid,Nothing Detected,12,3.28,3.6,
46030,10/30/2024 21:00,2024-10-30 15:00:36-06:00,10/31/2024 0:01,2024-10-30 18:01:16-06:00,Iridium,46.75023,-113.94862,1356,2.6,3D Valid,Nothing Detected,14,3.28,3.6,
46030,10/30/2024 20:00,2024-10-30 14:00:20-06:00,10/31/2024 0:01,2024-10-30 18:01:51-06:00,Iridium,46.75014,-113.94887,1354,2.4,3D Valid,Nothing Detected,14,3.28,3.6,
46030,10/30/2024 19:00,2024-10-30 13:00:38-06:00,10/31/2024 0:01,2024-10-30 18:01:51-06:00,Iridium,46.75011,-113.94884,1330,3,3D Valid,Nothing Detected,14,3.28,3.6,
46030,10/30/2024 18:01,2024-10-30 12:01:17-06:00,10/31/2024 0:01,2024-10-30 18:01:51-06:00,Iridium,46.75022,-113.949,1357,2.8,3D Valid,Nothing Detected,13,3.28,3.6,
46030,10/30/2024 17:00,2024-10-30 11:00:14-06:00,10/31/2024 0:01,2024-10-30 18:01:51-06:00,Iridium,46.75019,-113.94897,1343,3.8,3D Valid,Nothing Detected,11,3.28,3.6,
46030,10/30/2024 16:00,2024-10-30 10:00:38-06:00,10/30/2024 16:01,2024-10-30 10:01:04-06:00,Iridium,46.75032,-113.94885,1366,2.4,3D Valid,Nothing Detected,12,3.28,3.6,
46030,10/30/2024 15:00,2024-10-30 09:00:59-06:00,10/30/2024 16:01,2024-10-30 10:01:04-06:00,Iridium,46.75109,-113.94465,1239,2.4,3D Valid,Nothing Detected,10,3.28,3.6,
46030,10/30/2024 14:00,2024-10-30 08:00:12-06:00,10/30/2024 16:01,2024-10-30 10:01:04-06:00,Iridium,46.75123,-113.94443,1273,3.6,3D Valid,Nothing Detected,11,3.28,3.6,
46030,10/30/2024 13:00,2024-10-30 07:00:38-06:00,10/30/2024 16:01,2024-10-30 10:01:04-06:00,Iridium,46.75132,-113.94456,1239,3.4,3D Valid,Nothing Detected,11,3.28,3.6,
46030,10/30/2024 12:00,2024-10-30 06:00:38-06:00,10/30/2024 16:01,2024-10-30 10:01:37-06:00,Iridium,46.75121,-113.94389,1234,2.4,3D Valid,Nothing Detected,13,3.28,3.6,
46030,10/30/2024 11:00,2024-10-30 05:00:17-06:00,10/30/2024 16:01,2024-10-30 10:01:37-06:00,Iridium,46.75122,-113.94369,1266,2.6,3D Valid,Nothing Detected,10,3.28,3.6,
46030,10/30/2024 10:00,2024-10-30 04:00:37-06:00,10/30/2024 16:01,2024-10-30 10:01:37-06:00,Iridium,46.75114,-113.94387,1225,2.4,3D Valid,Nothing Detected,10,3.28,3.52,
46030,10/30/2024 9:00,2024-10-30 03:00:10-06:00,10/30/2024 16:01,2024-10-30 10:01:37-06:00,Iridium,46.75116,-113.94286,1199,3.4,3D Valid,Nothing Detected,8,3.28,3.6,
46030,10/30/2024 8:00,2024-10-30 02:00:39-06:00,10/30/2024 8:01,2024-10-30 02:01:08-06:00,Iridium,46.75111,-113.94406,1311,6.2,3D Valid,Nothing Detected,9,3.28,3.6,
46030,10/30/2024 7:00,2024-10-30 01:00:11-06:00,10/30/2024 8:01,2024-10-30 02:01:08-06:00,Iridium,46.75118,-113.94388,1221,3.8,3D Valid,Nothing Detected,10,3.28,3.6,
46030,10/30/2024 6:00,2024-10-30 00:00:38-06:00,10/30/2024 8:01,2024-10-30 02:01:08-06:00,Iridium,46.75121,-113.9439,1232,1.8,3D Valid,Nothing Detected,8,3.28,3.6,
46030,10/30/2024 5:00,2024-10-29 23:00:10-06:00,10/30/2024 8:01,2024-10-30 02:01:08-06:00,Iridium,46.75118,-113.94392,1225,2.8,3D Valid,Nothing Detected,11,3.28,3.6,
46030,10/30/2024 4:00,2024-10-29 22:00:37-06:00,10/30/2024 8:01,2024-10-30 02:01:20-06:00,Iridium,46.75111,-113.94396,1220,3.4,3D Valid,Nothing Detected,13,3.28,3.6,
46030,10/30/2024 3:00,2024-10-29 21:00:24-06:00,10/30/2024 8:01,2024-10-30 02:01:20-06:00,Iridium,46.75103,-113.94338,1207,4.2,3D Valid,Nothing Detected,12,3.28,3.52,
46030,10/30/2024 2:00,2024-10-29 20:00:09-06:00,10/30/2024 8:01,2024-10-30 02:01:20-06:00,Iridium,46.75116,-113.94325,1196,2.8,3D Valid,Nothing Detected,13,3.28,3.6,
46030,10/30/2024 1:00,2024-10-29 19:00:38-06:00,10/30/2024 8:01,2024-10-30 02:01:20-06:00,Iridium,46.75139,-113.94653,1265,2.4,3D Valid,Nothing Detected,13,3.28,3.6,
46030,10/30/2024 0:00,2024-10-29 18:00:55-06:00,10/30/2024 16:01,2024-10-30 10:01:45-06:00,Iridium,46.75336,-113.94574,1529,2.8,3D Valid,Nothing Detected,12,3.28,3.6,
46030,10/29/2024 23:00,2024-10-29 17:00:13-06:00,10/30/2024 16:01,2024-10-30 10:01:45-06:00,Iridium,46.75146,-113.94686,1238,6,3D Valid,Nothing Detected,13,3.28,3.6,
46030,10/29/2024 22:00,2024-10-29 16:00:36-06:00,10/30/2024 16:01,2024-10-30 10:01:45-06:00,Iridium,46.75139,-113.9465,1276,3.6,3D Valid,Nothing Detected,16,3.28,3.6,
46030,10/29/2024 21:02,2024-10-29 15:02:26-06:00,10/30/2024 16:01,2024-10-30 10:01:45-06:00,Iridium,46.75143,-113.94655,1277,6.6,3D Valid,Nothing Detected,16,3.28,3.6,
46030,10/29/2024 20:00,2024-10-29 14:00:27-06:00,10/29/2024 20:00,2024-10-29 14:00:56-06:00,Iridium,46.75145,-113.94669,1235,3.6,3D Valid,Nothing Detected,15,3.28,3.6,
46030,10/29/2024 19:00,2024-10-29 13:00:38-06:00,10/29/2024 20:00,2024-10-29 14:00:56-06:00,Iridium,46.75142,-113.9466,1268,3.6,3D Valid,Nothing Detected,16,3.28,3.6,
46030,10/29/2024 18:00,2024-10-29 12:00:38-06:00,10/29/2024 20:00,2024-10-29 14:00:56-06:00,Iridium,46.75132,-113.94664,1262,2.4,3D Valid,Nothing Detected,14,3.28,3.6,
46030,10/29/2024 17:00,2024-10-29 11:00:11-06:00,10/29/2024 20:00,2024-10-29 14:00:56-06:00,Iridium,46.75148,-113.94659,1294,4,3D Valid,Nothing Detected,12,3.28,3.6,
46030,10/29/2024 16:00,2024-10-29 10:00:38-06:00,10/29/2024 20:01,2024-10-29 14:01:07-06:00,Iridium,46.75153,-113.94666,1284,4.8,3D Valid,Nothing Detected,8,3.28,3.6,
46030,10/29/2024 15:00,2024-10-29 09:00:36-06:00,10/29/2024 20:01,2024-10-29 14:01:07-06:00,Iridium,46.75145,-113.94656,1267,2.6,3D Valid,Nothing Detected,11,3.28,3.6,
46030,10/29/2024 14:00,2024-10-29 08:00:38-06:00,10/29/2024 20:01,2024-10-29 14:01:07-06:00,Iridium,46.75138,-113.94467,1261,3.6,3D Valid,Nothing Detected,12,3.28,3.6,
46030,10/29/2024 13:00,2024-10-29 07:00:11-06:00,10/29/2024 20:01,2024-10-29 14:01:07-06:00,Iridium,46.75122,-113.9448,1252,3.6,3D Valid,Nothing Detected,10,3.28,3.6,
46030,10/29/2024 12:00,2024-10-29 06:00:36-06:00,10/29/2024 20:01,2024-10-29 14:01:14-06:00,Iridium,46.75118,-113.9439,1227,2,3D Valid,Nothing Detected,8,3.28,3.6,
46030,10/29/2024 11:00,2024-10-29 05:00:12-06:00,10/29/2024 20:01,2024-10-29 14:01:14-06:00,Iridium,46.75119,-113.94387,1237,2.6,3D Valid,Nothing Detected,10,3.28,3.6,
46030,10/29/2024 10:00,2024-10-29 04:00:38-06:00,10/29/2024 20:01,2024-10-29 14:01:14-06:00,Iridium,46.75123,-113.94396,1227,2,3D Valid,Nothing Detected,11,3.28,3.6,
46030,10/29/2024 9:00,2024-10-29 03:00:36-06:00,10/29/2024 20:01,2024-10-29 14:01:14-06:00,Iridium,46.7515,-113.94364,1202,3.4,3D Valid,Nothing Detected,13,3.2,3.52,
46030,10/29/2024 8:00,2024-10-29 02:00:09-06:00,10/30/2024 16:01,2024-10-30 10:01:53-06:00,Iridium,46.75708,-113.94988,1288,3.2,3D Valid,Nothing Detected,14,3.28,3.52,
46030,10/29/2024 7:00,2024-10-29 01:00:38-06:00,10/30/2024 16:01,2024-10-30 10:01:53-06:00,Iridium,46.75724,-113.95071,1320,3.2,3D Valid,Nothing Detected,14,3.28,3.6,
46030,10/29/2024 6:00,2024-10-29 00:00:38-06:00,10/30/2024 16:01,2024-10-30 10:01:53-06:00,Iridium,46.7578,-113.95221,1355,3.8,3D Valid,Nothing Detected,15,3.28,3.6,
46030,10/29/2024 5:00,2024-10-28 23:00:11-06:00,10/30/2024 16:01,2024-10-30 10:01:53-06:00,Iridium,46.75727,-113.95306,1389,2.2,3D Valid,Nothing Detected,15,3.36,3.6,
46030,10/29/2024 4:00,2024-10-28 22:00:37-06:00,10/29/2024 4:01,2024-10-28 22:01:01-06:00,Iridium,46.75735,-113.95297,1400,1.8,3D Valid,Nothing Detected,14,3.28,3.6,
46030,10/29/2024 3:00,2024-10-28 21:00:11-06:00,10/29/2024 4:01,2024-10-28 22:01:01-06:00,Iridium,46.75747,-113.95301,1410,2.4,3D Valid,Nothing Detected,12,3.28,3.6,
46030,10/29/2024 2:00,2024-10-28 20:00:09-06:00,10/29/2024 4:01,2024-10-28 22:01:01-06:00,Iridium,46.75731,-113.95299,1396,2.2,3D Valid,Nothing Detected,16,3.28,3.6,
46030,10/29/2024 1:00,2024-10-28 19:00:38-06:00,10/29/2024 4:01,2024-10-28 22:01:01-06:00,Iridium,46.75789,-113.95458,1442,2,3D Valid,Nothing Detected,14,3.28,3.6,
46030,10/29/2024 0:00,2024-10-28 18:00:36-06:00,10/29/2024 4:01,2024-10-28 22:01:08-06:00,Iridium,46.75938,-113.95519,1428,3,3D Valid,Nothing Detected,16,3.28,3.6,
46030,10/28/2024 23:00,2024-10-28 17:00:12-06:00,10/29/2024 4:01,2024-10-28 22:01:08-06:00,Iridium,46.75991,-113.95458,1387,4,3D Valid,Nothing Detected,17,3.28,3.6,
46030,10/28/2024 22:00,2024-10-28 16:00:38-06:00,10/29/2024 4:01,2024-10-28 22:01:08-06:00,Iridium,46.7598,-113.95315,1335,3.2,3D Valid,Nothing Detected,16,3.28,3.6,
46030,10/28/2024 21:00,2024-10-28 15:00:10-06:00,10/29/2024 4:01,2024-10-28 22:01:08-06:00,Iridium,46.76041,-113.95775,1469,2.6,3D Valid,Nothing Detected,12,3.28,3.6,
46030,10/28/2024 20:00,2024-10-28 14:00:38-06:00,10/29/2024 4:01,2024-10-28 22:01:18-06:00,Iridium,46.7606,-113.95798,1452,2.2,3D Valid,Nothing Detected,16,3.28,3.6,
46030,10/28/2024 19:00,2024-10-28 13:00:14-06:00,10/29/2024 4:01,2024-10-28 22:01:18-06:00,Iridium,46.76006,-113.9578,1500,3,3D Valid,Nothing Detected,18,3.28,3.6,
46030,10/28/2024 18:00,2024-10-28 12:00:35-06:00,10/29/2024 4:01,2024-10-28 22:01:18-06:00,Iridium,46.76051,-113.95815,1472,2.2,3D Valid,Nothing Detected,19,3.28,3.52,
46030,10/28/2024 17:00,2024-10-28 11:00:36-06:00,10/29/2024 4:01,2024-10-28 22:01:18-06:00,Iridium,46.75857,-113.96065,1442,4.2,3D Valid,Nothing Detected,17,3.28,3.52,
46030,10/28/2024 16:01,2024-10-28 10:01:08-06:00,10/29/2024 4:01,2024-10-28 22:01:27-06:00,Iridium,46.75561,-113.9648,1496,2.6,3D Valid,Nothing Detected,16,3.2,3.52,
46030,10/28/2024 15:01,2024-10-28 09:01:06-06:00,10/29/2024 4:01,2024-10-28 22:01:27-06:00,Iridium,46.75397,-113.96682,1579,3,3D Valid,Nothing Detected,15,3.28,3.6,
46030,10/28/2024 14:00,2024-10-28 08:00:09-06:00,10/29/2024 4:01,2024-10-28 22:01:27-06:00,Iridium,46.7561,-113.96627,1544,2.4,3D Valid,Nothing Detected,14,3.28,3.6,
46030,10/28/2024 13:00,2024-10-28 07:00:36-06:00,10/29/2024 4:01,2024-10-28 22:01:27-06:00,Iridium,46.75606,-113.96573,1532,3.4,3D Valid,Nothing Detected,13,3.28,3.6,
46030,10/28/2024 12:00,2024-10-28 06:00:09-06:00,10/29/2024 4:01,2024-10-28 22:01:44-06:00,Iridium,46.75538,-113.96619,1545,2.8,3D Valid,Nothing Detected,13,3.36,3.6,
46030,10/28/2024 11:00,2024-10-28 05:00:38-06:00,10/29/2024 4:01,2024-10-28 22:01:44-06:00,Iridium,46.75542,-113.96612,1552,3.8,3D Valid,Nothing Detected,14,3.28,3.6,
46030,10/28/2024 10:00,2024-10-28 04:00:11-06:00,10/29/2024 4:01,2024-10-28 22:01:44-06:00,Iridium,46.75539,-113.96629,1519,5.4,3D Valid,Nothing Detected,15,3.28,3.6,
46030,10/28/2024 9:00,2024-10-28 03:00:36-06:00,10/29/2024 4:01,2024-10-28 22:01:44-06:00,Iridium,46.75541,-113.96606,1542,3.4,3D Valid,Nothing Detected,15,3.28,3.52,
46030,10/28/2024 8:00,2024-10-28 02:00:10-06:00,10/29/2024 4:01,2024-10-28 22:01:53-06:00,Iridium,46.7552,-113.96523,1504,3.4,3D Valid,Nothing Detected,14,3.28,3.52,
46030,10/28/2024 7:00,2024-10-28 01:00:36-06:00,10/29/2024 4:01,2024-10-28 22:01:53-06:00,Iridium,46.7555,-113.96467,1486,3,3D Valid,Nothing Detected,14,3.28,3.6,
46030,10/28/2024 6:01,2024-10-28 00:01:04-06:00,10/29/2024 4:01,2024-10-28 22:01:53-06:00,Iridium,46.75623,-113.96182,1432,4.2,3D Valid,Nothing Detected,14,3.28,3.6,
46030,10/28/2024 5:00,2024-10-27 23:00:09-06:00,10/29/2024 4:01,2024-10-28 22:01:53-06:00,Iridium,46.75615,-113.95933,1401,4.4,3D Valid,Nothing Detected,15,3.28,3.6,
46030,10/28/2024 4:00,2024-10-27 22:00:09-06:00,10/28/2024 4:00,2024-10-27 22:00:33-06:00,Iridium,46.75425,-113.95576,1411,3.8,3D Valid,Nothing Detected,15,3.28,3.6,
46030,10/28/2024 3:00,2024-10-27 21:00:36-06:00,10/28/2024 4:00,2024-10-27 22:00:33-06:00,Iridium,46.75319,-113.95727,1451,1.6,3D Valid,Nothing Detected,18,3.28,3.6,
46030,10/28/2024 2:00,2024-10-27 20:00:14-06:00,10/28/2024 4:00,2024-10-27 22:00:33-06:00,Iridium,46.75312,-113.95729,1482,6.4,3D Valid,Nothing Detected,16,3.28,3.6,
46030,10/28/2024 1:00,2024-10-27 19:00:38-06:00,10/28/2024 4:00,2024-10-27 22:00:33-06:00,Iridium,46.75316,-113.95686,1459,4.2,3D Valid,Nothing Detected,13,3.28,3.6,
46030,10/28/2024 0:00,2024-10-27 18:00:38-06:00,10/28/2024 0:01,2024-10-27 18:01:10-06:00,Iridium,46.75197,-113.95757,1484,3.8,3D Valid,Nothing Detected,15,3.28,3.6,
46030,10/27/2024 23:00,2024-10-27 17:00:17-06:00,10/28/2024 0:01,2024-10-27 18:01:10-06:00,Iridium,46.75022,-113.95573,1569,2.2,3D Valid,Nothing Detected,16,3.28,3.6,
46030,10/27/2024 22:01,2024-10-27 16:01:08-06:00,10/28/2024 0:01,2024-10-27 18:01:10-06:00,Iridium,46.75031,-113.9565,1587,4.4,3D Valid,Nothing Detected,18,3.28,3.6,
46030,10/27/2024 21:00,2024-10-27 15:00:10-06:00,10/28/2024 0:01,2024-10-27 18:01:10-06:00,Iridium,46.74955,-113.95698,1614,2.8,3D Valid,Nothing Detected,19,3.28,3.6,
46030,10/27/2024 20:00,2024-10-27 14:00:09-06:00,10/27/2024 20:01,2024-10-27 14:01:05-06:00,Iridium,46.74946,-113.95695,1626,2,3D Valid,Nothing Detected,20,3.28,3.6,
46030,10/27/2024 19:00,2024-10-27 13:00:38-06:00,10/27/2024 20:01,2024-10-27 14:01:05-06:00,Iridium,46.7495,-113.95707,1622,1.2,3D Valid,Nothing Detected,20,3.28,3.6,
46030,10/27/2024 18:00,2024-10-27 12:00:42-06:00,10/27/2024 20:01,2024-10-27 14:01:05-06:00,Iridium,46.74953,-113.95718,1649,5.6,3D Valid,Nothing Detected,20,3.28,3.6,
46030,10/27/2024 17:00,2024-10-27 11:00:36-06:00,10/27/2024 20:01,2024-10-27 14:01:05-06:00,Iridium,46.74971,-113.9573,1660,2.4,3D Valid,Nothing Detected,18,3.28,3.6,
46030,10/27/2024 16:00,2024-10-27 10:00:13-06:00,10/27/2024 16:00,2024-10-27 10:00:44-06:00,Iridium,46.74947,-113.95705,1614,2.6,3D Valid,Nothing Detected,18,3.28,3.6,
46030,10/27/2024 15:01,2024-10-27 09:01:00-06:00,10/27/2024 16:00,2024-10-27 10:00:44-06:00,Iridium,46.74907,-113.95834,1634,4,3D Valid,Nothing Detected,19,3.28,3.6,
46030,10/27/2024 14:00,2024-10-27 08:00:11-06:00,10/27/2024 16:00,2024-10-27 10:00:44-06:00,Iridium,46.74714,-113.95926,1619,3.6,3D Valid,Nothing Detected,17,3.28,3.6,
46030,10/27/2024 13:00,2024-10-27 07:00:34-06:00,10/27/2024 16:00,2024-10-27 10:00:44-06:00,Iridium,46.74605,-113.95766,1582,2.2,3D Valid,Nothing Detected,17,3.28,3.6,
46030,10/27/2024 12:00,2024-10-27 06:00:36-06:00,10/27/2024 16:01,2024-10-27 10:01:02-06:00,Iridium,46.74575,-113.95753,1580,3,3D Valid,Nothing Detected,16,3.28,3.6,
46030,10/27/2024 11:00,2024-10-27 05:00:17-06:00,10/27/2024 16:01,2024-10-27 10:01:02-06:00,Iridium,46.74628,-113.95503,1500,4.6,3D Valid,Nothing Detected,15,3.28,3.52,
46030,10/27/2024 10:00,2024-10-27 04:00:36-06:00,10/27/2024 16:01,2024-10-27 10:01:02-06:00,Iridium,46.75012,-113.94534,1304,2.2,3D Valid,Nothing Detected,13,3.28,3.6,
46030,10/27/2024 9:00,2024-10-27 03:00:49-06:00,10/27/2024 16:01,2024-10-27 10:01:02-06:00,Iridium,46.75104,-113.94386,1274,6.8,3D Valid,Nothing Detected,13,3.28,3.6,
46030,10/27/2024 8:00,2024-10-27 02:00:36-06:00,10/27/2024 16:01,2024-10-27 10:01:39-06:00,Iridium,46.75116,-113.94393,1234,3.2,3D Valid,Nothing Detected,12,3.28,3.6,
46030,10/27/2024 7:00,2024-10-27 01:00:39-06:00,10/27/2024 16:01,2024-10-27 10:01:39-06:00,Iridium,46.75114,-113.94394,1215,4.4,3D Valid,Nothing Detected,14,3.28,3.6,
46030,10/27/2024 6:00,2024-10-27 00:00:11-06:00,10/27/2024 16:01,2024-10-27 10:01:39-06:00,Iridium,46.75114,-113.94392,1220,3.4,3D Valid,Nothing Detected,12,3.28,3.6,
46030,10/27/2024 5:00,2024-10-26 23:00:38-06:00,10/27/2024 16:01,2024-10-27 10:01:39-06:00,Iridium,46.75123,-113.94384,1221,2.6,3D Valid,Nothing Detected,13,3.28,3.6,
46030,10/27/2024 4:00,2024-10-26 22:00:36-06:00,10/27/2024 16:01,2024-10-27 10:01:49-06:00,Iridium,46.75122,-113.94395,1228,3.4,3D Valid,Nothing Detected,12,3.28,3.6,
46030,10/27/2024 3:00,2024-10-26 21:00:10-06:00,10/27/2024 16:01,2024-10-27 10:01:49-06:00,Iridium,46.75133,-113.94337,1230,4.8,3D Valid,Nothing Detected,16,3.28,3.6,
46030,10/27/2024 2:00,2024-10-26 20:00:36-06:00,10/27/2024 16:01,2024-10-27 10:01:49-06:00,Iridium,46.75445,-113.94909,1370,2.4,3D Valid,Nothing Detected,18,3.28,3.6,
46030,10/27/2024 1:00,2024-10-26 19:00:40-06:00,10/27/2024 16:01,2024-10-27 10:01:49-06:00,Iridium,46.75365,-113.94888,1383,2.2,3D Valid,Nothing Detected,18,3.28,3.6,
46030,10/27/2024 0:00,2024-10-26 18:00:13-06:00,10/27/2024 16:02,2024-10-27 10:02:11-06:00,Iridium,46.75169,-113.94957,1333,4.4,3D Valid,Nothing Detected,16,3.28,3.6,
46030,10/26/2024 23:01,2024-10-26 17:01:06-06:00,10/27/2024 16:02,2024-10-27 10:02:11-06:00,Iridium,46.75148,-113.94645,1294,4.8,3D Valid,Nothing Detected,16,3.28,3.6,
46030,10/26/2024 22:00,2024-10-26 16:00:38-06:00,10/27/2024 16:02,2024-10-27 10:02:11-06:00,Iridium,46.75136,-113.94652,1312,4.2,3D Valid,Nothing Detected,19,3.28,3.6,
46030,10/26/2024 21:00,2024-10-26 15:00:45-06:00,10/27/2024 16:02,2024-10-27 10:02:11-06:00,Iridium,46.75118,-113.9467,1245,7,3D Valid,Nothing Detected,17,3.28,3.6,
46030,10/26/2024 20:00,2024-10-26 14:00:11-06:00,10/27/2024 16:02,2024-10-27 10:02:38-06:00,Iridium,46.75142,-113.94656,1286,4,3D Valid,Nothing Detected,18,3.28,3.6,
46030,10/26/2024 19:00,2024-10-26 13:00:38-06:00,10/27/2024 16:02,2024-10-27 10:02:38-06:00,Iridium,46.7516,-113.94662,1278,2.4,3D Valid,Nothing Detected,16,3.28,3.6,
46030,10/26/2024 18:00,2024-10-26 12:00:38-06:00,10/27/2024 16:02,2024-10-27 10:02:38-06:00,Iridium,46.7516,-113.94667,1274,3.2,3D Valid,Nothing Detected,17,3.28,3.6,
46030,10/26/2024 17:00,2024-10-26 11:00:36-06:00,10/27/2024 16:02,2024-10-27 10:02:38-06:00,Iridium,46.75144,-113.94659,1290,4.4,3D Valid,Nothing Detected,14,3.28,3.6,
46030,10/26/2024 16:01,2024-10-26 10:01:54-06:00,10/27/2024 16:02,2024-10-27 10:02:50-06:00,Iridium,46.75156,-113.9467,1291,5.6,3D Valid,Nothing Detected,10,3.28,3.6,
46030,10/26/2024 15:00,2024-10-26 09:00:12-06:00,10/27/2024 16:02,2024-10-27 10:02:50-06:00,Iridium,46.75166,-113.94661,1281,3,3D Valid,Nothing Detected,12,3.28,3.6,
46030,10/26/2024 14:00,2024-10-26 08:00:09-06:00,10/27/2024 16:02,2024-10-27 10:02:50-06:00,Iridium,46.75142,-113.94495,1254,2.2,3D Valid,Nothing Detected,15,3.28,3.6,
46030,10/26/2024 13:00,2024-10-26 07:00:36-06:00,10/27/2024 16:02,2024-10-27 10:02:50-06:00,Iridium,46.7514,-113.94462,1248,1.8,3D Valid,Nothing Detected,15,3.28,3.6,
46030,10/26/2024 12:00,2024-10-26 06:00:36-06:00,10/26/2024 12:01,2024-10-26 06:01:15-06:00,Iridium,46.75136,-113.94448,1233,3.8,3D Valid,Nothing Detected,10,3.28,3.6,
46030,10/26/2024 11:00,2024-10-26 05:00:29-06:00,10/26/2024 12:01,2024-10-26 06:01:15-06:00,Iridium,46.75127,-113.94374,1266,3,3D Valid,Nothing Detected,11,3.28,3.6,
46030,10/26/2024 10:00,2024-10-26 04:00:36-06:00,10/26/2024 12:01,2024-10-26 06:01:15-06:00,Iridium,46.75118,-113.94388,1227,2.2,3D Valid,Nothing Detected,10,3.28,3.6,
46030,10/26/2024 9:00,2024-10-26 03:00:10-06:00,10/26/2024 12:01,2024-10-26 06:01:15-06:00,Iridium,46.75116,-113.94389,1229,3.6,3D Valid,Nothing Detected,11,3.28,3.6,
46030,10/26/2024 8:00,2024-10-26 02:00:36-06:00,10/26/2024 8:01,2024-10-26 02:01:03-06:00,Iridium,46.75114,-113.94392,1234,2.4,3D Valid,Nothing Detected,13,3.28,3.6,
46030,10/26/2024 7:00,2024-10-26 01:00:38-06:00,10/26/2024 8:01,2024-10-26 02:01:03-06:00,Iridium,46.75171,-113.94388,1204,4.6,3D Valid,Nothing Detected,15,3.28,3.6,
46030,10/26/2024 6:00,2024-10-26 00:00:09-06:00,10/26/2024 8:01,2024-10-26 02:01:03-06:00,Iridium,46.75731,-113.94838,1274,3.4,3D Valid,Nothing Detected,17,3.28,3.6,
46030,10/26/2024 5:00,2024-10-25 23:00:36-06:00,10/26/2024 8:01,2024-10-26 02:01:03-06:00,Iridium,46.75938,-113.95298,1335,2.6,3D Valid,Nothing Detected,17,3.28,3.6,
46030,10/26/2024 4:00,2024-10-25 22:00:15-06:00,10/26/2024 4:00,2024-10-25 22:00:49-06:00,Iridium,46.75885,-113.95334,1375,2.4,3D Valid,Nothing Detected,17,3.28,3.6,
46030,10/26/2024 3:00,2024-10-25 21:00:36-06:00,10/26/2024 4:00,2024-10-25 22:00:49-06:00,Iridium,46.75952,-113.95372,1381,2,3D Valid,Nothing Detected,18,3.28,3.6,
46030,10/26/2024 2:00,2024-10-25 20:00:10-06:00,10/26/2024 4:00,2024-10-25 22:00:49-06:00,Iridium,46.75953,-113.95373,1367,3.2,3D Valid,Nothing Detected,16,3.28,3.6,
46030,10/26/2024 1:00,2024-10-25 19:00:38-06:00,10/26/2024 4:00,2024-10-25 22:00:49-06:00,Iridium,46.75941,-113.95383,1384,1.8,3D Valid,Nothing Detected,17,3.28,3.6,
46030,10/26/2024 0:00,2024-10-25 18:00:38-06:00,10/26/2024 0:01,2024-10-25 18:01:16-06:00,Iridium,46.75863,-113.95259,1345,2.6,3D Valid,Nothing Detected,16,3.28,3.6,
46030,10/25/2024 23:00,2024-10-25 17:00:10-06:00,10/26/2024 0:01,2024-10-25 18:01:16-06:00,Iridium,46.75688,-113.95029,1314,5.8,3D Valid,Nothing Detected,17,3.28,3.6,
46030,10/25/2024 22:00,2024-10-25 16:00:54-06:00,10/26/2024 0:01,2024-10-25 18:01:16-06:00,Iridium,46.75708,-113.94971,1280,3.4,3D Valid,Nothing Detected,17,3.28,3.6,
46030,10/25/2024 21:00,2024-10-25 15:00:38-06:00,10/26/2024 0:01,2024-10-25 18:01:16-06:00,Iridium,46.75751,-113.95046,1286,2.8,3D Valid,Nothing Detected,17,3.28,3.6,
46030,10/25/2024 20:00,2024-10-25 14:00:15-06:00,10/26/2024 0:01,2024-10-25 18:01:27-06:00,Iridium,46.75756,-113.95036,1309,4.2,3D Valid,Nothing Detected,18,3.28,3.6,
46030,10/25/2024 19:00,2024-10-25 13:00:34-06:00,10/26/2024 0:01,2024-10-25 18:01:27-06:00,Iridium,46.75734,-113.94981,1277,2,3D Valid,Nothing Detected,20,3.28,3.6,
46030,10/25/2024 18:00,2024-10-25 12:00:14-06:00,10/26/2024 0:01,2024-10-25 18:01:27-06:00,Iridium,46.75724,-113.95056,1315,2.6,3D Valid,Nothing Detected,19,3.28,3.6,
46030,10/25/2024 17:01,2024-10-25 11:01:00-06:00,10/26/2024 0:01,2024-10-25 18:01:27-06:00,Iridium,46.75838,-113.95193,1324,4.6,3D Valid,Nothing Detected,17,3.28,3.6,
46030,10/25/2024 16:00,2024-10-25 10:00:36-06:00,10/26/2024 0:01,2024-10-25 18:01:45-06:00,Iridium,46.75822,-113.95196,1325,3,3D Valid,Nothing Detected,14,3.28,3.6,
46030,10/25/2024 15:00,2024-10-25 09:00:32-06:00,10/26/2024 0:01,2024-10-25 18:01:45-06:00,Iridium,46.75823,-113.95197,1324,1.8,3D Valid,Nothing Detected,10,3.28,3.6,
46030,10/25/2024 14:00,2024-10-25 08:00:09-06:00,10/26/2024 0:01,2024-10-25 18:01:45-06:00,Iridium,46.75817,-113.95194,1331,4.2,3D Valid,Nothing Detected,9,3.36,3.6,
46030,10/25/2024 13:00,2024-10-25 07:00:37-06:00,10/26/2024 0:01,2024-10-25 18:01:45-06:00,Iridium,46.75819,-113.95196,1328,2.6,3D Valid,Nothing Detected,9,3.28,3.6,
46030,10/25/2024 12:00,2024-10-25 06:00:09-06:00,10/26/2024 0:01,2024-10-25 18:01:52-06:00,Iridium,46.75819,-113.95194,1328,4.4,3D Valid,Nothing Detected,11,3.28,3.6,
46030,10/25/2024 11:00,2024-10-25 05:00:37-06:00,10/26/2024 0:01,2024-10-25 18:01:52-06:00,Iridium,46.75797,-113.95177,1321,8.8,3D Valid,Nothing Detected,11,3.2,3.52,
46030,10/25/2024 10:00,2024-10-25 04:00:36-06:00,10/26/2024 0:01,2024-10-25 18:01:52-06:00,Iridium,46.75805,-113.95216,1334,5.6,3D Valid,Nothing Detected,11,3.2,3.52,
46030,10/25/2024 9:00,2024-10-25 03:00:10-06:00,10/26/2024 0:01,2024-10-25 18:01:52-06:00,Iridium,46.75867,-113.95472,1432,3.8,3D Valid,Nothing Detected,11,3.28,3.52,
46030,10/25/2024 8:00,2024-10-25 02:00:38-06:00,10/25/2024 8:01,2024-10-25 02:01:29-06:00,Iridium,46.75883,-113.95618,1486,2.4,3D Valid,Nothing Detected,12,3.2,3.52,
46030,10/25/2024 7:00,2024-10-25 01:00:42-06:00,10/25/2024 8:01,2024-10-25 02:01:29-06:00,Iridium,46.76083,-113.96237,1508,4.4,3D Valid,Nothing Detected,13,3.2,3.52,
46030,10/25/2024 6:00,2024-10-25 00:00:09-06:00,10/25/2024 8:01,2024-10-25 02:01:29-06:00,Iridium,46.76427,-113.96616,1566,3,3D Valid,Nothing Detected,12,3.28,3.52,
46030,10/25/2024 5:00,2024-10-24 23:00:09-06:00,10/25/2024 8:01,2024-10-25 02:01:29-06:00,Iridium,46.76229,-113.96993,1646,2.4,3D Valid,Nothing Detected,12,3.28,3.52,
46030,10/25/2024 4:00,2024-10-24 22:00:32-06:00,10/25/2024 4:01,2024-10-24 22:01:11-06:00,Iridium,46.75884,-113.96457,1928,2,3D Valid,Nothing Detected,12,3.28,3.52,
46030,10/25/2024 3:00,2024-10-24 21:00:17-06:00,10/25/2024 4:01,2024-10-24 22:01:11-06:00,Iridium,46.75572,-113.95947,2358,2.8,3D Valid,Nothing Detected,12,3.28,3.6,
46030,10/25/2024 2:00,2024-10-24 20:00:31-06:00,10/25/2024 4:01,2024-10-24 22:01:11-06:00,Iridium,46.75539,-113.96516,1508,3,3D Valid,Nothing Detected,12,3.28,3.6,
46030,10/25/2024 1:00,2024-10-24 19:00:23-06:00,10/25/2024 4:01,2024-10-24 22:01:11-06:00,Iridium,46.75452,-113.9609,1475,5.2,3D Valid,Nothing Detected,14,3.28,3.6,
46030,10/25/2024 0:00,2024-10-24 18:00:38-06:00,10/25/2024 0:01,2024-10-24 18:01:01-06:00,Iridium,46.75339,-113.95328,1415,2,3D Valid,Nothing Detected,15,3.28,3.6,
46030,10/24/2024 23:00,2024-10-24 17:00:13-06:00,10/25/2024 0:01,2024-10-24 18:01:01-06:00,Iridium,46.75252,-113.95086,1396,6.4,3D Valid,Nothing Detected,14,3.28,3.6,
46030,10/24/2024 22:00,2024-10-24 16:00:38-06:00,10/25/2024 0:01,2024-10-24 18:01:01-06:00,Iridium,46.75125,-113.94473,1252,2.6,3D Valid,Nothing Detected,13,3.28,3.6,
46030,10/24/2024 21:00,2024-10-24 15:00:38-06:00,10/25/2024 0:01,2024-10-24 18:01:01-06:00,Iridium,46.75119,-113.94483,1269,3,3D Valid,Nothing Detected,16,3.28,3.6,
46030,10/24/2024 20:00,2024-10-24 14:00:10-06:00,10/25/2024 0:01,2024-10-24 18:01:22-06:00,Iridium,46.75113,-113.94478,1240,4.6,3D Valid,Nothing Detected,14,3.28,3.6,
46030,10/24/2024 19:00,2024-10-24 13:00:36-06:00,10/25/2024 0:01,2024-10-24 18:01:22-06:00,Iridium,46.75118,-113.94475,1254,2,3D Valid,Nothing Detected,14,3.28,3.6,
46030,10/24/2024 18:00,2024-10-24 12:00:38-06:00,10/25/2024 0:01,2024-10-24 18:01:22-06:00,Iridium,46.75129,-113.94473,1265,2.4,3D Valid,Nothing Detected,15,3.28,3.6,
46030,10/24/2024 17:00,2024-10-24 11:00:38-06:00,10/25/2024 0:01,2024-10-24 18:01:22-06:00,Iridium,46.75117,-113.94473,1258,5,3D Valid,Nothing Detected,11,3.28,3.6,
46030,10/24/2024 16:00,2024-10-24 10:00:12-06:00,10/25/2024 0:01,2024-10-24 18:01:33-06:00,Iridium,46.75124,-113.94476,1251,3.2,3D Valid,Nothing Detected,10,3.28,3.6,
46030,10/24/2024 15:00,2024-10-24 09:00:38-06:00,10/25/2024 0:01,2024-10-24 18:01:33-06:00,Iridium,46.75122,-113.94473,1255,1.8,3D Valid,Nothing Detected,10,3.28,3.6,
46030,10/24/2024 14:00,2024-10-24 08:00:10-06:00,10/25/2024 0:01,2024-10-24 18:01:33-06:00,Iridium,46.75132,-113.94455,1248,2.8,3D Valid,Nothing Detected,13,3.28,3.6,
46030,10/24/2024 13:00,2024-10-24 07:00:38-06:00,10/25/2024 0:01,2024-10-24 18:01:33-06:00,Iridium,46.75137,-113.94456,1245,3.6,3D Valid,Nothing Detected,12,3.28,3.6,
46030,10/24/2024 12:00,2024-10-24 06:00:38-06:00,10/25/2024 0:01,2024-10-24 18:01:42-06:00,Iridium,46.75139,-113.94419,1232,4.4,3D Valid,Nothing Detected,12,3.28,3.6,
46030,10/24/2024 11:00,2024-10-24 05:00:12-06:00,10/25/2024 0:01,2024-10-24 18:01:42-06:00,Iridium,46.75119,-113.94385,1242,3.4,3D Valid,Nothing Detected,10,3.28,3.6,
46030,10/24/2024 10:00,2024-10-24 04:00:37-06:00,10/25/2024 0:01,2024-10-24 18:01:42-06:00,Iridium,46.75125,-113.94385,1227,1.6,3D Valid,Nothing Detected,13,3.28,3.6,
46030,10/24/2024 9:01,2024-10-24 03:01:08-06:00,10/25/2024 0:01,2024-10-24 18:01:42-06:00,Iridium,46.7512,-113.94392,1199,4.4,3D Valid,Nothing Detected,13,3.28,3.6,
46030,10/24/2024 8:00,2024-10-24 02:00:10-06:00,10/25/2024 0:01,2024-10-24 18:01:54-06:00,Iridium,46.75122,-113.94394,1225,4.2,3D Valid,Nothing Detected,13,3.28,3.6,
46030,10/24/2024 7:00,2024-10-24 01:00:38-06:00,10/25/2024 0:01,2024-10-24 18:01:54-06:00,Iridium,46.7512,-113.9439,1230,2.6,3D Valid,Nothing Detected,11,3.28,3.6,
46030,10/24/2024 6:00,2024-10-24 00:00:10-06:00,10/25/2024 0:01,2024-10-24 18:01:54-06:00,Iridium,46.75114,-113.9439,1223,3.4,3D Valid,Nothing Detected,13,3.28,3.6,
46030,10/24/2024 5:00,2024-10-23 23:00:37-06:00,10/25/2024 0:01,2024-10-24 18:01:54-06:00,Iridium,46.75117,-113.94394,1225,2.4,3D Valid,Nothing Detected,12,3.28,3.6,
46030,10/24/2024 4:00,2024-10-23 22:00:17-06:00,10/24/2024 4:00,2024-10-23 22:00:44-06:00,Iridium,46.75059,-113.94242,1286,2,3D Valid,Nothing Detected,13,3.28,3.6,
46030,10/24/2024 3:00,2024-10-23 21:00:10-06:00,10/24/2024 4:00,2024-10-23 22:00:44-06:00,Iridium,46.74837,-113.95041,1435,2,3D Valid,Nothing Detected,15,3.28,3.6,
46030,10/24/2024 2:00,2024-10-23 20:00:38-06:00,10/24/2024 4:00,2024-10-23 22:00:44-06:00,Iridium,46.7467,-113.95788,1577,2.4,3D Valid,Nothing Detected,14,3.28,3.6,
46030,10/24/2024 1:00,2024-10-23 19:00:10-06:00,10/24/2024 4:00,2024-10-23 22:00:44-06:00,Iridium,46.74557,-113.95749,1583,2.8,3D Valid,Nothing Detected,14,3.28,3.6,
46030,10/24/2024 0:00,2024-10-23 18:00:38-06:00,10/24/2024 4:00,2024-10-23 22:00:54-06:00,Iridium,46.74455,-113.95576,1543,2.8,3D Valid,Nothing Detected,14,3.28,3.6,
46030,10/23/2024 23:00,2024-10-23 17:00:10-06:00,10/24/2024 4:00,2024-10-23 22:00:54-06:00,Iridium,46.745,-113.95284,1461,7,3D Valid,Nothing Detected,19,3.28,3.6,
46030,10/23/2024 22:00,2024-10-23 16:00:36-06:00,10/24/2024 4:00,2024-10-23 22:00:54-06:00,Iridium,46.74625,-113.9552,1506,2.6,3D Valid,Nothing Detected,20,3.28,3.6,
46030,10/23/2024 21:00,2024-10-23 15:00:36-06:00,10/24/2024 4:00,2024-10-23 22:00:54-06:00,Iridium,46.75036,-113.95255,1425,3,3D Valid,Nothing Detected,19,3.28,3.6,
46030,10/23/2024 20:00,2024-10-23 14:00:09-06:00,10/24/2024 4:01,2024-10-23 22:01:02-06:00,Iridium,46.75042,-113.95191,1407,4.8,3D Valid,Nothing Detected,17,3.28,3.6,
46030,10/23/2024 19:00,2024-10-23 13:00:35-06:00,10/24/2024 4:01,2024-10-23 22:01:02-06:00,Iridium,46.75074,-113.95141,1385,2.4,3D Valid,Nothing Detected,15,3.28,3.6,
46030,10/23/2024 18:00,2024-10-23 12:00:09-06:00,10/24/2024 4:01,2024-10-23 22:01:02-06:00,Iridium,46.75068,-113.95139,1397,4.2,3D Valid,Nothing Detected,16,3.28,3.6,
46030,10/23/2024 17:00,2024-10-23 11:00:38-06:00,10/24/2024 4:01,2024-10-23 22:01:02-06:00,Iridium,46.75014,-113.9482,1343,5.2,3D Valid,Nothing Detected,12,3.28,3.6,
46030,10/23/2024 16:00,2024-10-23 10:00:35-06:00,10/24/2024 4:01,2024-10-23 22:01:11-06:00,Iridium,46.75029,-113.94833,1364,1.8,3D Valid,Nothing Detected,14,3.28,3.6,
46030,10/23/2024 15:00,2024-10-23 09:00:10-06:00,10/24/2024 4:01,2024-10-23 22:01:11-06:00,Iridium,46.75044,-113.94812,1326,3.2,3D Valid,Nothing Detected,14,3.28,3.6,
46030,10/23/2024 14:00,2024-10-23 08:00:36-06:00,10/24/2024 4:01,2024-10-23 22:01:11-06:00,Iridium,46.75118,-113.94441,1240,2.4,3D Valid,Nothing Detected,14,3.28,3.6,
46030,10/23/2024 13:00,2024-10-23 07:00:36-06:00,10/24/2024 4:01,2024-10-23 22:01:11-06:00,Iridium,46.7512,-113.94392,1235,1.8,3D Valid,Nothing Detected,14,3.28,3.6,
46030,10/23/2024 12:00,2024-10-23 06:00:09-06:00,10/24/2024 4:01,2024-10-23 22:01:20-06:00,Iridium,46.75119,-113.94395,1225,4.4,3D Valid,Nothing Detected,11,3.28,3.6,
46030,10/23/2024 11:00,2024-10-23 05:00:38-06:00,10/24/2024 4:01,2024-10-23 22:01:20-06:00,Iridium,46.75118,-113.9439,1221,2.4,3D Valid,Nothing Detected,9,3.28,3.6,
46030,10/23/2024 10:00,2024-10-23 04:00:36-06:00,10/24/2024 4:01,2024-10-23 22:01:20-06:00,Iridium,46.75128,-113.94376,1249,5.2,3D Valid,Nothing Detected,8,3.28,3.6,
46030,10/23/2024 9:00,2024-10-23 03:00:12-06:00,10/24/2024 4:01,2024-10-23 22:01:20-06:00,Iridium,46.75114,-113.94381,1225,4.8,3D Valid,Nothing Detected,10,3.28,3.6,
46030,10/23/2024 8:00,2024-10-23 02:00:36-06:00,10/23/2024 8:01,2024-10-23 02:01:31-06:00,Iridium,46.75024,-113.94311,1202,2.8,3D Valid,Nothing Detected,11,3.28,3.6,
46030,10/23/2024 7:01,2024-10-23 01:01:08-06:00,10/23/2024 8:01,2024-10-23 02:01:31-06:00,Iridium,46.74731,-113.94723,1274,8.6,3D Valid,Nothing Detected,14,3.28,3.6,
46030,10/23/2024 6:00,2024-10-23 00:00:12-06:00,10/23/2024 8:01,2024-10-23 02:01:31-06:00,Iridium,46.74741,-113.94712,1313,2.6,3D Valid,Nothing Detected,11,3.28,3.6,
46030,10/23/2024 5:00,2024-10-22 23:00:38-06:00,10/23/2024 8:01,2024-10-23 02:01:31-06:00,Iridium,46.74731,-113.94722,1277,2.8,3D Valid,Nothing Detected,12,3.28,3.6,
