Collar ID,Acq. Time [UTC],Acq. Time [LMT],SCTS [UTC],SCTS [LMT],Origin,Latitude[deg],Longitude[deg],Altitude[m],DOP,Fix Type,Mortality Status,Temp[°C],Main[V],Beacon [V],Animal
40882,1/1/2024 1:39,2023-12-31 18:39:58-07:00,2/25/2024 1:03,2024-02-24 18:03:20-07:00,Iridium,,,,0,No Fix,Nothing Detected,14,3.28,3.6,Animal with Collar 40882
40882,12/31/2023 1:38,2023-12-30 18:38:19-07:00,2/25/2024 1:03,2024-02-24 18:03:20-07:00,Iridium,,,,0,No Fix,Nothing Detected,12,3.28,3.6,Animal with Collar 40882
40882,12/30/2023 1:36,2023-12-29 18:36:40-07:00,2/25/2024 1:03,2024-02-24 18:03:20-07:00,Iridium,,,,0,No Fix,Nothing Detected,16,3.28,3.6,Animal with Collar 40882
40882,12/29/2023 1:01,2023-12-28 18:01:39-07:00,2/25/2024 1:03,2024-02-24 18:03:20-07:00,Iridium,,,,0,No Fix,Nothing Detected,13,3.28,3.6,Animal with Collar 40882
40882,12/29/2023 0:01,2023-12-28 17:01:39-07:00,2/25/2024 5:01,2024-02-24 22:01:32-07:00,Iridium,,,,0,No Fix,Nothing Detected,15,3.28,3.6,Animal with Collar 40882
40882,12/28/2023 23:03,2023-12-28 16:03:21-07:00,2/25/2024 5:01,2024-02-24 22:01:32-07:00,Iridium,,,,0,No Fix,Nothing Detected,15,3.28,3.6,Animal with Collar 40882
40882,12/28/2023 22:59,2023-12-28 15:59:51-07:00,2/25/2024 5:01,2024-02-24 22:01:32-07:00,Iridium,,,,0,No Fix,Nothing Detected,15,3.28,3.6,Animal with Collar 40882
40882,12/27/2023 22:58,2023-12-27 15:58:12-07:00,2/25/2024 5:01,2024-02-24 22:01:32-07:00,Iridium,,,,0,No Fix,Nothing Detected,13,3.28,3.6,Animal with Collar 40882
40882,12/26/2023 22:56,2023-12-26 15:56:33-07:00,2/25/2024 5:01,2024-02-24 22:01:58-07:00,Iridium,,,,0,No Fix,Nothing Detected,9,3.28,3.6,Animal with Collar 40882
40882,12/25/2023 22:54,2023-12-25 15:54:54-07:00,2/25/2024 5:01,2024-02-24 22:01:58-07:00,Iridium,,,,0,No Fix,Nothing Detected,20,3.28,3.6,Animal with Collar 40882
40882,12/24/2023 22:53,2023-12-24 15:53:15-07:00,2/25/2024 5:01,2024-02-24 22:01:58-07:00,Iridium,,,,0,No Fix,Nothing Detected,12,3.28,3.6,Animal with Collar 40882
40882,12/23/2023 22:51,2023-12-23 15:51:36-07:00,2/25/2024 5:01,2024-02-24 22:01:58-07:00,Iridium,,,,0,No Fix,Nothing Detected,10,3.28,3.6,Animal with Collar 40882
40882,12/22/2023 22:49,2023-12-22 15:49:57-07:00,2/25/2024 5:02,2024-02-24 22:02:07-07:00,Iridium,,,,0,No Fix,Nothing Detected,14,3.28,3.6,Animal with Collar 40882
40882,12/21/2023 22:48,2023-12-21 15:48:19-07:00,2/25/2024 5:02,2024-02-24 22:02:07-07:00,Iridium,,,,0,No Fix,Nothing Detected,16,3.28,3.6,Animal with Collar 40882
40882,12/20/2023 22:46,2023-12-20 15:46:40-07:00,2/25/2024 5:02,2024-02-24 22:02:07-07:00,Iridium,,,,0,No Fix,Nothing Detected,17,3.28,3.6,Animal with Collar 40882
40882,12/19/2023 22:01,2023-12-19 15:01:39-07:00,2/25/2024 5:02,2024-02-24 22:02:07-07:00,Iridium,,,,0,No Fix,Nothing Detected,17,3.28,3.6,Animal with Collar 40882
40882,12/19/2023 21:01,2023-12-19 14:01:39-07:00,2/25/2024 5:02,2024-02-24 22:02:14-07:00,Iridium,,,,0,No Fix,Nothing Detected,14,3.28,3.6,Animal with Collar 40882
40882,12/19/2023 20:01,2023-12-19 13:01:39-07:00,2/25/2024 5:02,2024-02-24 22:02:14-07:00,Iridium,,,,0,No Fix,Nothing Detected,15,3.28,3.6,Animal with Collar 40882
40882,12/19/2023 19:01,2023-12-19 12:01:41-07:00,2/25/2024 5:02,2024-02-24 22:02:14-07:00,Iridium,,,,0,No Fix,Nothing Detected,16,3.28,3.6,Animal with Collar 40882
40882,12/19/2023 18:01,2023-12-19 11:01:39-07:00,2/25/2024 5:02,2024-02-24 22:02:14-07:00,Iridium,,,,0,No Fix,Nothing Detected,19,3.28,3.6,Animal with Collar 40882
40882,12/19/2023 17:01,2023-12-19 10:01:39-07:00,2/25/2024 5:02,2024-02-24 22:02:21-07:00,Iridium,,,,0,No Fix,Nothing Detected,18,3.28,3.6,Animal with Collar 40882
40882,12/19/2023 16:01,2023-12-19 09:01:39-07:00,2/25/2024 5:02,2024-02-24 22:02:21-07:00,Iridium,,,,0,No Fix,Nothing Detected,18,3.28,3.6,Animal with Collar 40882
40882,12/19/2023 15:01,2023-12-19 08:01:39-07:00,2/25/2024 5:02,2024-02-24 22:02:21-07:00,Iridium,,,,0,No Fix,Nothing Detected,18,3.28,3.6,Animal with Collar 40882
40882,12/19/2023 14:01,2023-12-19 07:01:39-07:00,2/25/2024 5:02,2024-02-24 22:02:21-07:00,Iridium,,,,0,No Fix,Nothing Detected,18,3.28,3.6,Animal with Collar 40882
40882,12/19/2023 13:01,2023-12-19 06:01:39-07:00,2/25/2024 5:02,2024-02-24 22:02:28-07:00,Iridium,,,,0,No Fix,Nothing Detected,17,3.28,3.6,Animal with Collar 40882
40882,12/19/2023 12:01,2023-12-19 05:01:39-07:00,2/25/2024 5:02,2024-02-24 22:02:28-07:00,Iridium,,,,0,No Fix,Nothing Detected,15,3.28,3.6,Animal with Collar 40882
40882,12/19/2023 11:01,2023-12-19 04:01:39-07:00,2/25/2024 5:02,2024-02-24 22:02:28-07:00,Iridium,,,,0,No Fix,Nothing Detected,14,3.28,3.6,Animal with Collar 40882
40882,12/19/2023 10:01,2023-12-19 03:01:39-07:00,2/25/2024 5:02,2024-02-24 22:02:28-07:00,Iridium,,,,0,No Fix,Nothing Detected,15,3.28,3.6,Animal with Collar 40882
40882,12/19/2023 9:01,2023-12-19 02:01:39-07:00,2/25/2024 5:02,2024-02-24 22:02:45-07:00,Iridium,,,,0,No Fix,Nothing Detected,14,3.28,3.6,Animal with Collar 40882
40882,12/19/2023 8:01,2023-12-19 01:01:39-07:00,2/25/2024 5:02,2024-02-24 22:02:45-07:00,Iridium,,,,0,No Fix,Nothing Detected,19,3.28,3.6,Animal with Collar 40882
40882,12/19/2023 7:01,2023-12-19 00:01:39-07:00,2/25/2024 5:02,2024-02-24 22:02:45-07:00,Iridium,,,,0,No Fix,Nothing Detected,20,3.28,3.6,Animal with Collar 40882
40882,12/19/2023 6:01,2023-12-18 23:01:39-07:00,2/25/2024 5:02,2024-02-24 22:02:45-07:00,Iridium,,,,0,No Fix,Nothing Detected,17,3.28,3.6,Animal with Collar 40882
40882,12/19/2023 5:01,2023-12-18 22:01:39-07:00,2/25/2024 5:02,2024-02-24 22:02:53-07:00,Iridium,,,,0,No Fix,Nothing Detected,16,3.28,3.6,Animal with Collar 40882
40882,12/19/2023 4:01,2023-12-18 21:01:39-07:00,2/25/2024 5:02,2024-02-24 22:02:53-07:00,Iridium,,,,0,No Fix,Nothing Detected,17,3.28,3.6,Animal with Collar 40882
40882,12/19/2023 3:01,2023-12-18 20:01:39-07:00,2/25/2024 5:02,2024-02-24 22:02:53-07:00,Iridium,,,,0,No Fix,Nothing Detected,14,3.36,3.6,Animal with Collar 40882
40882,12/19/2023 2:01,2023-12-18 19:01:39-07:00,2/25/2024 5:02,2024-02-24 22:02:53-07:00,Iridium,,,,0,No Fix,Nothing Detected,12,3.28,3.6,Animal with Collar 40882
40882,12/19/2023 1:01,2023-12-18 18:01:39-07:00,2/25/2024 5:03,2024-02-24 22:03:04-07:00,Iridium,,,,0,No Fix,Nothing Detected,13,3.28,3.6,Animal with Collar 40882
40882,12/19/2023 0:01,2023-12-18 17:01:39-07:00,2/25/2024 5:03,2024-02-24 22:03:04-07:00,Iridium,,,,0,No Fix,Nothing Detected,14,3.28,3.6,Animal with Collar 40882
40882,12/18/2023 23:01,2023-12-18 16:01:41-07:00,2/25/2024 5:03,2024-02-24 22:03:04-07:00,Iridium,,,,0,No Fix,Nothing Detected,19,3.28,3.6,Animal with Collar 40882
40882,12/18/2023 22:01,2023-12-18 15:01:39-07:00,2/25/2024 5:03,2024-02-24 22:03:04-07:00,Iridium,,,,0,No Fix,Nothing Detected,19,3.28,3.6,Animal with Collar 40882
40882,12/18/2023 21:01,2023-12-18 14:01:39-07:00,2/25/2024 5:03,2024-02-24 22:03:15-07:00,Iridium,,,,0,No Fix,Nothing Detected,16,3.28,3.6,Animal with Collar 40882
40882,12/18/2023 20:01,2023-12-18 13:01:39-07:00,2/25/2024 5:03,2024-02-24 22:03:15-07:00,Iridium,,,,0,No Fix,Nothing Detected,14,3.28,3.6,Animal with Collar 40882
40882,12/18/2023 19:01,2023-12-18 12:01:39-07:00,2/25/2024 5:03,2024-02-24 22:03:15-07:00,Iridium,,,,0,No Fix,Nothing Detected,16,3.28,3.6,Animal with Collar 40882
40882,12/18/2023 18:01,2023-12-18 11:01:39-07:00,2/25/2024 5:03,2024-02-24 22:03:15-07:00,Iridium,,,,0,No Fix,Nothing Detected,15,3.28,3.6,Animal with Collar 40882
40882,12/18/2023 17:06,2023-12-18 10:06:35-07:00,2/25/2024 5:03,2024-02-24 22:03:22-07:00,Iridium,,,,0,No Fix,Nothing Detected,15,3.28,3.6,Animal with Collar 40882
40882,12/17/2023 17:04,2023-12-17 10:04:56-07:00,2/25/2024 5:03,2024-02-24 22:03:22-07:00,Iridium,,,,0,No Fix,Nothing Detected,13,3.28,3.6,Animal with Collar 40882
40882,12/16/2023 17:03,2023-12-16 10:03:17-07:00,2/25/2024 5:03,2024-02-24 22:03:22-07:00,Iridium,,,,0,No Fix,Nothing Detected,12,3.28,3.6,Animal with Collar 40882
40882,12/15/2023 17:01,2023-12-15 10:01:38-07:00,2/25/2024 5:03,2024-02-24 22:03:22-07:00,Iridium,,,,0,No Fix,Nothing Detected,11,3.36,3.6,Animal with Collar 40882
40882,12/15/2023 16:01,2023-12-15 09:01:39-07:00,2/25/2024 5:03,2024-02-24 22:03:31-07:00,Iridium,,,,0,No Fix,Nothing Detected,18,3.28,3.6,Animal with Collar 40882
40882,12/15/2023 15:01,2023-12-15 08:01:39-07:00,2/25/2024 5:03,2024-02-24 22:03:31-07:00,Iridium,,,,0,No Fix,Nothing Detected,19,3.28,3.6,Animal with Collar 40882
40882,12/15/2023 14:01,2023-12-15 07:01:39-07:00,2/25/2024 5:03,2024-02-24 22:03:31-07:00,Iridium,,,,0,No Fix,Nothing Detected,22,3.28,3.6,Animal with Collar 40882
40882,12/15/2023 13:01,2023-12-15 06:01:39-07:00,2/25/2024 5:03,2024-02-24 22:03:31-07:00,Iridium,,,,0,No Fix,Nothing Detected,21,3.28,3.6,Animal with Collar 40882
40882,12/15/2023 12:01,2023-12-15 05:01:39-07:00,2/25/2024 5:03,2024-02-24 22:03:41-07:00,Iridium,,,,0,No Fix,Nothing Detected,19,3.28,3.6,Animal with Collar 40882
40882,12/15/2023 11:01,2023-12-15 04:01:39-07:00,2/25/2024 5:03,2024-02-24 22:03:41-07:00,Iridium,,,,0,No Fix,Nothing Detected,21,3.28,3.6,Animal with Collar 40882
40882,12/15/2023 10:01,2023-12-15 03:01:39-07:00,2/25/2024 5:03,2024-02-24 22:03:41-07:00,Iridium,,,,0,No Fix,Nothing Detected,22,3.28,3.6,Animal with Collar 40882
40882,12/15/2023 9:01,2023-12-15 02:01:39-07:00,2/25/2024 5:03,2024-02-24 22:03:41-07:00,Iridium,,,,0,No Fix,Nothing Detected,20,3.28,3.6,Animal with Collar 40882
40882,12/15/2023 8:01,2023-12-15 01:01:39-07:00,2/25/2024 5:03,2024-02-24 22:03:57-07:00,Iridium,,,,0,No Fix,Nothing Detected,18,3.28,3.6,Animal with Collar 40882
40882,12/15/2023 7:01,2023-12-15 00:01:38-07:00,2/25/2024 5:03,2024-02-24 22:03:57-07:00,Iridium,,,,0,No Fix,Nothing Detected,16,3.28,3.6,Animal with Collar 40882
40882,12/15/2023 6:01,2023-12-14 23:01:38-07:00,2/25/2024 5:03,2024-02-24 22:03:57-07:00,Iridium,,,,0,No Fix,Nothing Detected,9,3.28,3.6,Animal with Collar 40882
40882,12/15/2023 5:00,2023-12-14 22:00:11-07:00,2/25/2024 5:03,2024-02-24 22:03:57-07:00,Iridium,46.64743,-113.947845,1311,3.2,3D Validated,Nothing Detected,6,3.36,3.6,Animal with Collar 40882
40882,12/15/2023 4:00,2023-12-14 21:00:38-07:00,2/25/2024 5:04,2024-02-24 22:04:05-07:00,Iridium,46.647354,-113.94783,1313,3,3D Validated,Nothing Detected,7,3.36,3.6,Animal with Collar 40882
40882,12/15/2023 3:00,2023-12-14 20:00:38-07:00,12/15/2023 3:01,2023-12-14 20:01:04-07:00,Iridium,46.647392,-113.94784,1315,3.2,3D Validated,Nothing Detected,6,3.36,3.6,Animal with Collar 40882
40882,12/15/2023 2:00,2023-12-14 19:00:38-07:00,12/15/2023 3:01,2023-12-14 20:01:04-07:00,Iridium,46.647415,-113.9478,1313,3,3D Validated,Nothing Detected,6,3.36,3.6,Animal with Collar 40882
40882,12/15/2023 1:00,2023-12-14 18:00:12-07:00,12/15/2023 3:01,2023-12-14 20:01:04-07:00,Iridium,46.647522,-113.94793,1329,2.8,3D Validated,Nothing Detected,6,3.36,3.6,Animal with Collar 40882
40882,12/15/2023 0:00,2023-12-14 17:00:39-07:00,12/15/2023 3:01,2023-12-14 20:01:04-07:00,Iridium,46.647415,-113.94784,1318,3,3D Validated,Nothing Detected,6,3.36,3.6,Animal with Collar 40882
40882,12/14/2023 23:00,2023-12-14 16:00:24-07:00,12/14/2023 23:00,2023-12-14 16:00:48-07:00,Iridium,46.647366,-113.94779,1310,4.4,3D Validated,Nothing Detected,9,3.28,3.6,Animal with Collar 40882
40882,12/14/2023 22:01,2023-12-14 15:01:08-07:00,12/14/2023 23:00,2023-12-14 16:00:48-07:00,Iridium,46.647434,-113.947876,1319,4.4,3D Validated,Nothing Detected,13,3.28,3.6,Animal with Collar 40882
40882,12/14/2023 21:01,2023-12-14 14:01:39-07:00,12/14/2023 23:00,2023-12-14 16:00:48-07:00,Iridium,,,,0,No Fix,Nothing Detected,17,3.28,3.6,Animal with Collar 40882
40882,12/14/2023 20:01,2023-12-14 13:01:39-07:00,12/14/2023 23:00,2023-12-14 16:00:48-07:00,Iridium,,,,0,No Fix,Nothing Detected,18,3.28,3.6,Animal with Collar 40882
40882,12/14/2023 19:01,2023-12-14 12:01:39-07:00,12/14/2023 23:00,2023-12-14 16:00:59-07:00,Iridium,,,,0,No Fix,Nothing Detected,17,3.28,3.6,Animal with Collar 40882
40882,12/14/2023 18:01,2023-12-14 11:01:39-07:00,12/14/2023 23:00,2023-12-14 16:00:59-07:00,Iridium,,,,0,No Fix,Nothing Detected,17,3.28,3.6,Animal with Collar 40882
40882,12/14/2023 17:08,2023-12-14 10:08:19-07:00,12/14/2023 23:00,2023-12-14 16:00:59-07:00,Iridium,,,,0,No Fix,Nothing Detected,12,3.28,3.6,Animal with Collar 40882
40882,12/13/2023 17:06,2023-12-13 10:06:40-07:00,12/14/2023 23:00,2023-12-14 16:00:59-07:00,Iridium,,,,0,No Fix,Nothing Detected,15,3.28,3.6,Animal with Collar 40882
40882,12/12/2023 17:01,2023-12-12 10:01:39-07:00,12/14/2023 23:01,2023-12-14 16:01:08-07:00,Iridium,,,,0,No Fix,Nothing Detected,17,3.28,3.6,Animal with Collar 40882
40882,12/12/2023 16:01,2023-12-12 09:01:38-07:00,12/14/2023 23:01,2023-12-14 16:01:08-07:00,Iridium,,,,0,No Fix,Nothing Detected,14,3.28,3.6,Animal with Collar 40882
40882,12/12/2023 15:01,2023-12-12 08:01:39-07:00,12/14/2023 23:01,2023-12-14 16:01:08-07:00,Iridium,,,,0,No Fix,Nothing Detected,15,3.28,3.6,Animal with Collar 40882
40882,12/12/2023 14:01,2023-12-12 07:01:41-07:00,12/14/2023 23:01,2023-12-14 16:01:08-07:00,Iridium,,,,0,No Fix,Nothing Detected,15,3.28,3.6,Animal with Collar 40882
40882,12/12/2023 13:01,2023-12-12 06:01:38-07:00,12/14/2023 23:01,2023-12-14 16:01:15-07:00,Iridium,,,,0,No Fix,Nothing Detected,15,3.28,3.6,Animal with Collar 40882
40882,12/12/2023 12:21,2023-12-12 05:21:35-07:00,12/14/2023 23:01,2023-12-14 16:01:15-07:00,Iridium,,,,0,No Fix,Nothing Detected,13,3.28,3.6,Animal with Collar 40882
40882,12/11/2023 12:19,2023-12-11 05:19:57-07:00,12/14/2023 23:01,2023-12-14 16:01:15-07:00,Iridium,,,,0,No Fix,Nothing Detected,18,3.28,3.6,Animal with Collar 40882
40882,12/10/2023 12:18,2023-12-10 05:18:18-07:00,12/14/2023 23:01,2023-12-14 16:01:15-07:00,Iridium,,,,0,No Fix,Nothing Detected,18,3.28,3.6,Animal with Collar 40882
40882,12/9/2023 12:16,2023-12-09 05:16:40-07:00,12/14/2023 23:01,2023-12-14 16:01:23-07:00,Iridium,,,,0,No Fix,Nothing Detected,12,3.28,3.6,Animal with Collar 40882
40882,12/8/2023 12:01,2023-12-08 05:01:39-07:00,12/14/2023 23:01,2023-12-14 16:01:23-07:00,Iridium,,,,0,No Fix,Nothing Detected,12,3.28,3.6,Animal with Collar 40882
40882,12/8/2023 11:01,2023-12-08 04:01:38-07:00,12/14/2023 23:01,2023-12-14 16:01:23-07:00,Iridium,,,,0,No Fix,Nothing Detected,13,3.28,3.6,Animal with Collar 40882
40882,12/8/2023 10:01,2023-12-08 03:01:38-07:00,12/14/2023 23:01,2023-12-14 16:01:23-07:00,Iridium,,,,0,No Fix,Nothing Detected,12,3.28,3.6,Animal with Collar 40882
40882,12/8/2023 9:01,2023-12-08 02:01:39-07:00,12/14/2023 23:01,2023-12-14 16:01:30-07:00,Iridium,,,,0,No Fix,Nothing Detected,11,3.28,3.6,Animal with Collar 40882
40882,12/8/2023 8:01,2023-12-08 01:01:38-07:00,12/14/2023 23:01,2023-12-14 16:01:30-07:00,Iridium,,,,0,No Fix,Nothing Detected,11,3.28,3.6,Animal with Collar 40882
40882,12/8/2023 7:01,2023-12-08 00:01:39-07:00,12/14/2023 23:01,2023-12-14 16:01:30-07:00,Iridium,,,,0,No Fix,Nothing Detected,10,3.28,3.6,Animal with Collar 40882
40882,12/8/2023 6:01,2023-12-07 23:01:39-07:00,12/14/2023 23:01,2023-12-14 16:01:30-07:00,Iridium,,,,0,No Fix,Nothing Detected,10,3.28,3.6,Animal with Collar 40882
40882,12/8/2023 5:11,2023-12-07 22:11:37-07:00,12/14/2023 23:01,2023-12-14 16:01:37-07:00,Iridium,,,,0,No Fix,Nothing Detected,11,3.28,3.6,Animal with Collar 40882
40882,12/7/2023 5:09,2023-12-06 22:09:58-07:00,12/14/2023 23:01,2023-12-14 16:01:37-07:00,Iridium,,,,0,No Fix,Nothing Detected,17,3.28,3.6,Animal with Collar 40882
40882,12/6/2023 5:08,2023-12-05 22:08:19-07:00,12/14/2023 23:01,2023-12-14 16:01:37-07:00,Iridium,,,,0,No Fix,Nothing Detected,19,3.28,3.6,Animal with Collar 40882
40882,12/5/2023 5:06,2023-12-04 22:06:40-07:00,12/14/2023 23:01,2023-12-14 16:01:37-07:00,Iridium,,,,0,No Fix,Nothing Detected,14,3.28,3.6,Animal with Collar 40882
40882,12/4/2023 5:01,2023-12-03 22:01:39-07:00,12/14/2023 23:01,2023-12-14 16:01:48-07:00,Iridium,,,,0,No Fix,Nothing Detected,16,3.28,3.6,Animal with Collar 40882
40882,12/4/2023 4:01,2023-12-03 21:01:39-07:00,12/14/2023 23:01,2023-12-14 16:01:48-07:00,Iridium,,,,0,No Fix,Nothing Detected,16,3.28,3.6,Animal with Collar 40882
40882,12/4/2023 3:01,2023-12-03 20:01:39-07:00,12/14/2023 23:01,2023-12-14 16:01:48-07:00,Iridium,,,,0,No Fix,Nothing Detected,16,3.28,3.6,Animal with Collar 40882
40882,12/4/2023 2:01,2023-12-03 19:01:41-07:00,12/14/2023 23:01,2023-12-14 16:01:48-07:00,Iridium,,,,0,No Fix,Nothing Detected,15,3.28,3.6,Animal with Collar 40882
40882,12/4/2023 1:01,2023-12-03 18:01:39-07:00,12/14/2023 23:01,2023-12-14 16:01:55-07:00,Iridium,,,,0,No Fix,Nothing Detected,15,3.28,3.6,Animal with Collar 40882
40882,12/4/2023 0:01,2023-12-03 17:01:39-07:00,12/14/2023 23:01,2023-12-14 16:01:55-07:00,Iridium,,,,0,No Fix,Nothing Detected,16,3.28,3.6,Animal with Collar 40882
40882,12/3/2023 23:01,2023-12-03 16:01:39-07:00,12/14/2023 23:01,2023-12-14 16:01:55-07:00,Iridium,,,,0,No Fix,Nothing Detected,15,3.28,3.6,Animal with Collar 40882
40882,12/3/2023 22:01,2023-12-03 15:01:39-07:00,12/14/2023 23:01,2023-12-14 16:01:55-07:00,Iridium,,,,0,No Fix,Nothing Detected,15,3.28,3.6,Animal with Collar 40882
40882,12/3/2023 21:01,2023-12-03 14:01:39-07:00,12/14/2023 23:02,2023-12-14 16:02:03-07:00,Iridium,,,,0,No Fix,Nothing Detected,16,3.28,3.6,Animal with Collar 40882
40882,12/3/2023 20:01,2023-12-03 13:01:39-07:00,12/14/2023 23:02,2023-12-14 16:02:03-07:00,Iridium,,,,0,No Fix,Nothing Detected,15,3.28,3.6,Animal with Collar 40882
40882,12/3/2023 19:01,2023-12-03 12:01:39-07:00,12/14/2023 23:02,2023-12-14 16:02:03-07:00,Iridium,,,,0,No Fix,Nothing Detected,16,3.28,3.6,Animal with Collar 40882
40882,12/3/2023 18:01,2023-12-03 11:01:39-07:00,12/14/2023 23:02,2023-12-14 16:02:03-07:00,Iridium,,,,0,No Fix,Nothing Detected,17,3.28,3.6,Animal with Collar 40882
40882,12/3/2023 17:01,2023-12-03 10:01:39-07:00,12/14/2023 23:02,2023-12-14 16:02:16-07:00,Iridium,,,,0,No Fix,Nothing Detected,23,3.28,3.6,Animal with Collar 40882
40882,12/3/2023 16:01,2023-12-03 09:01:39-07:00,12/14/2023 23:02,2023-12-14 16:02:16-07:00,Iridium,,,,0,No Fix,Nothing Detected,20,3.28,3.6,Animal with Collar 40882
40882,12/3/2023 15:01,2023-12-03 08:01:39-07:00,12/14/2023 23:02,2023-12-14 16:02:16-07:00,Iridium,,,,0,No Fix,Nothing Detected,18,3.28,3.6,Animal with Collar 40882
40882,12/3/2023 14:01,2023-12-03 07:01:39-07:00,12/14/2023 23:02,2023-12-14 16:02:16-07:00,Iridium,,,,0,No Fix,Nothing Detected,20,3.28,3.6,Animal with Collar 40882
40882,12/3/2023 13:01,2023-12-03 06:01:39-07:00,12/15/2023 3:01,2023-12-14 20:01:31-07:00,Iridium,,,,0,No Fix,Nothing Detected,19,3.28,3.6,Animal with Collar 40882
40882,12/3/2023 12:01,2023-12-03 05:01:39-07:00,12/15/2023 3:01,2023-12-14 20:01:31-07:00,Iridium,,,,0,No Fix,Nothing Detected,18,3.28,3.6,Animal with Collar 40882
40882,12/3/2023 11:01,2023-12-03 04:01:39-07:00,12/15/2023 3:01,2023-12-14 20:01:31-07:00,Iridium,,,,0,No Fix,Nothing Detected,18,3.28,3.6,Animal with Collar 40882
40882,12/3/2023 10:01,2023-12-03 03:01:39-07:00,12/15/2023 3:01,2023-12-14 20:01:31-07:00,Iridium,,,,0,No Fix,Nothing Detected,19,3.28,3.6,Animal with Collar 40882
40882,12/3/2023 9:01,2023-12-03 02:01:39-07:00,12/15/2023 3:01,2023-12-14 20:01:40-07:00,Iridium,,,,0,No Fix,Nothing Detected,19,3.28,3.6,Animal with Collar 40882
40882,12/3/2023 8:01,2023-12-03 01:01:39-07:00,12/15/2023 3:01,2023-12-14 20:01:40-07:00,Iridium,,,,0,No Fix,Nothing Detected,21,3.28,3.6,Animal with Collar 40882
40882,12/3/2023 7:01,2023-12-03 00:01:39-07:00,12/15/2023 3:01,2023-12-14 20:01:40-07:00,Iridium,,,,0,No Fix,Nothing Detected,21,3.28,3.6,Animal with Collar 40882
40882,12/3/2023 6:01,2023-12-02 23:01:41-07:00,12/15/2023 3:01,2023-12-14 20:01:40-07:00,Iridium,,,,0,No Fix,Nothing Detected,21,3.28,3.6,Animal with Collar 40882
40882,12/3/2023 5:01,2023-12-02 22:01:39-07:00,12/15/2023 3:01,2023-12-14 20:01:48-07:00,Iridium,,,,0,No Fix,Nothing Detected,15,3.28,3.6,Animal with Collar 40882
40882,12/3/2023 4:01,2023-12-02 21:01:39-07:00,12/15/2023 3:01,2023-12-14 20:01:48-07:00,Iridium,,,,0,No Fix,Nothing Detected,14,3.28,3.6,Animal with Collar 40882
40882,12/3/2023 3:01,2023-12-02 20:01:39-07:00,12/15/2023 3:01,2023-12-14 20:01:48-07:00,Iridium,,,,0,No Fix,Nothing Detected,13,3.28,3.6,Animal with Collar 40882
40882,12/3/2023 2:01,2023-12-02 19:01:39-07:00,12/15/2023 3:01,2023-12-14 20:01:48-07:00,Iridium,,,,0,No Fix,Nothing Detected,14,3.28,3.6,Animal with Collar 40882
40882,12/3/2023 1:01,2023-12-02 18:01:39-07:00,12/15/2023 3:01,2023-12-14 20:01:58-07:00,Iridium,,,,0,No Fix,Nothing Detected,15,3.28,3.6,Animal with Collar 40882
40882,12/3/2023 0:01,2023-12-02 17:01:39-07:00,12/15/2023 3:01,2023-12-14 20:01:58-07:00,Iridium,,,,0,No Fix,Nothing Detected,15,3.28,3.6,Animal with Collar 40882
40882,12/2/2023 23:11,2023-12-02 16:11:40-07:00,12/15/2023 3:01,2023-12-14 20:01:58-07:00,Iridium,,,,0,No Fix,Nothing Detected,16,3.28,3.6,Animal with Collar 40882
40882,12/1/2023 23:01,2023-12-01 16:01:39-07:00,12/15/2023 3:01,2023-12-14 20:01:58-07:00,Iridium,,,,0,No Fix,Nothing Detected,16,3.28,3.6,Animal with Collar 40882
40882,12/1/2023 22:01,2023-12-01 15:01:39-07:00,12/15/2023 3:02,2023-12-14 20:02:06-07:00,Iridium,,,,0,No Fix,Nothing Detected,16,3.28,3.6,Animal with Collar 40882
40882,12/1/2023 21:34,2023-12-01 14:34:58-07:00,12/15/2023 3:02,2023-12-14 20:02:06-07:00,Iridium,,,,0,No Fix,Nothing Detected,15,3.28,3.6,Animal with Collar 40882
40882,11/30/2023 21:33,2023-11-30 14:33:19-07:00,12/15/2023 3:02,2023-12-14 20:02:06-07:00,Iridium,,,,0,No Fix,Nothing Detected,13,3.28,3.6,Animal with Collar 40882
40882,11/29/2023 21:31,2023-11-29 14:31:40-07:00,12/15/2023 3:02,2023-12-14 20:02:06-07:00,Iridium,,,,0,No Fix,Nothing Detected,12,3.28,3.6,Animal with Collar 40882
40882,11/28/2023 21:01,2023-11-28 14:01:39-07:00,12/15/2023 3:02,2023-12-14 20:02:17-07:00,Iridium,,,,0,No Fix,Nothing Detected,11,3.28,3.6,Animal with Collar 40882
40882,11/28/2023 20:01,2023-11-28 13:01:39-07:00,12/15/2023 3:02,2023-12-14 20:02:17-07:00,Iridium,,,,0,No Fix,Nothing Detected,12,3.28,3.6,Animal with Collar 40882
40882,11/28/2023 19:01,2023-11-28 12:01:39-07:00,12/15/2023 3:02,2023-12-14 20:02:17-07:00,Iridium,,,,0,No Fix,Nothing Detected,11,3.28,3.6,Animal with Collar 40882
40882,11/28/2023 18:01,2023-11-28 11:01:39-07:00,12/15/2023 3:02,2023-12-14 20:02:17-07:00,Iridium,,,,0,No Fix,Nothing Detected,10,3.28,3.6,Animal with Collar 40882
40882,11/28/2023 17:01,2023-11-28 10:01:39-07:00,12/15/2023 3:02,2023-12-14 20:02:25-07:00,Iridium,,,,0,No Fix,Nothing Detected,9,3.28,3.6,Animal with Collar 40882
40882,11/28/2023 16:01,2023-11-28 09:01:39-07:00,12/15/2023 3:02,2023-12-14 20:02:25-07:00,Iridium,,,,0,No Fix,Nothing Detected,8,3.28,3.6,Animal with Collar 40882
40882,11/28/2023 15:01,2023-11-28 08:01:39-07:00,12/15/2023 3:02,2023-12-14 20:02:25-07:00,Iridium,,,,0,No Fix,Nothing Detected,8,3.28,3.6,Animal with Collar 40882
40882,11/28/2023 14:01,2023-11-28 07:01:41-07:00,12/15/2023 3:02,2023-12-14 20:02:25-07:00,Iridium,,,,0,No Fix,Nothing Detected,9,3.28,3.6,Animal with Collar 40882
40882,11/28/2023 13:01,2023-11-28 06:01:39-07:00,2/25/2024 5:04,2024-02-24 22:04:05-07:00,Iridium,,,,0,No Fix,Nothing Detected,8,3.28,3.6,Animal with Collar 40882
40882,11/28/2023 12:01,2023-11-28 05:01:39-07:00,2/25/2024 5:04,2024-02-24 22:04:05-07:00,Iridium,,,,0,No Fix,Nothing Detected,11,3.28,3.6,Animal with Collar 40882
40882,11/28/2023 11:01,2023-11-28 04:01:39-07:00,2/25/2024 5:04,2024-02-24 22:04:05-07:00,Iridium,,,,0,No Fix,Nothing Detected,11,3.28,3.6,Animal with Collar 40882
40882,11/28/2023 10:01,2023-11-28 03:01:39-07:00,2/25/2024 5:04,2024-02-24 22:04:16-07:00,Iridium,,,,0,No Fix,Nothing Detected,10,3.28,3.6,Animal with Collar 40882
40882,11/28/2023 9:01,2023-11-28 02:01:39-07:00,2/25/2024 5:04,2024-02-24 22:04:16-07:00,Iridium,,,,0,No Fix,Nothing Detected,7,3.28,3.6,Animal with Collar 40882
40882,11/28/2023 8:01,2023-11-28 01:01:39-07:00,2/25/2024 5:04,2024-02-24 22:04:16-07:00,Iridium,,,,0,No Fix,Nothing Detected,10,3.28,3.6,Animal with Collar 40882
40882,11/28/2023 7:01,2023-11-28 00:01:39-07:00,2/25/2024 5:04,2024-02-24 22:04:16-07:00,Iridium,,,,0,No Fix,Nothing Detected,16,3.28,3.6,Animal with Collar 40882
40882,11/28/2023 6:01,2023-11-27 23:01:39-07:00,2/25/2024 5:04,2024-02-24 22:04:23-07:00,Iridium,,,,0,No Fix,Nothing Detected,16,3.28,3.6,Animal with Collar 40882
40882,11/28/2023 5:01,2023-11-27 22:01:39-07:00,2/25/2024 5:04,2024-02-24 22:04:23-07:00,Iridium,,,,0,No Fix,Nothing Detected,19,3.28,3.6,Animal with Collar 40882
40882,11/28/2023 4:01,2023-11-27 21:01:39-07:00,2/25/2024 9:01,2024-02-25 02:01:12-07:00,Iridium,,,,0,No Fix,Nothing Detected,18,3.28,3.6,Animal with Collar 40882
40882,11/28/2023 3:01,2023-11-27 20:01:39-07:00,2/25/2024 9:01,2024-02-25 02:01:12-07:00,Iridium,,,,0,No Fix,Nothing Detected,16,3.28,3.6,Animal with Collar 40882
40882,11/28/2023 2:01,2023-11-27 19:01:39-07:00,2/25/2024 9:01,2024-02-25 02:01:12-07:00,Iridium,,,,0,No Fix,Nothing Detected,12,3.28,3.6,Animal with Collar 40882
40882,11/28/2023 1:01,2023-11-27 18:01:39-07:00,2/25/2024 9:01,2024-02-25 02:01:12-07:00,Iridium,,,,0,No Fix,Nothing Detected,12,3.28,3.6,Animal with Collar 40882
40882,11/28/2023 0:01,2023-11-27 17:01:39-07:00,2/25/2024 9:01,2024-02-25 02:01:24-07:00,Iridium,,,,0,No Fix,Nothing Detected,13,3.28,3.6,Animal with Collar 40882
40882,11/27/2023 23:01,2023-11-27 16:01:39-07:00,2/25/2024 9:01,2024-02-25 02:01:24-07:00,Iridium,,,,0,No Fix,Nothing Detected,16,3.28,3.6,Animal with Collar 40882
40882,11/27/2023 22:01,2023-11-27 15:01:48-07:00,2/25/2024 9:01,2024-02-25 02:01:24-07:00,Iridium,,,,0,No Fix,Nothing Detected,19,3.28,3.6,Animal with Collar 40882
40882,11/27/2023 21:58,2023-11-27 14:58:18-07:00,2/25/2024 9:01,2024-02-25 02:01:24-07:00,Iridium,,,,0,No Fix,Nothing Detected,18,3.28,3.6,Animal with Collar 40882
40882,11/26/2023 21:56,2023-11-26 14:56:39-07:00,2/25/2024 9:01,2024-02-25 02:01:33-07:00,Iridium,,,,0,No Fix,Nothing Detected,11,3.28,3.6,Animal with Collar 40882
40882,11/25/2023 21:01,2023-11-25 14:01:39-07:00,2/25/2024 9:01,2024-02-25 02:01:33-07:00,Iridium,,,,0,No Fix,Nothing Detected,12,3.28,3.6,Animal with Collar 40882
40882,11/25/2023 20:01,2023-11-25 13:01:41-07:00,2/25/2024 9:01,2024-02-25 02:01:33-07:00,Iridium,,,,0,No Fix,Nothing Detected,15,3.28,3.6,Animal with Collar 40882
40882,11/25/2023 19:01,2023-11-25 12:01:39-07:00,2/25/2024 9:01,2024-02-25 02:01:33-07:00,Iridium,,,,0,No Fix,Nothing Detected,14,3.28,3.6,Animal with Collar 40882
40882,11/25/2023 18:01,2023-11-25 11:01:39-07:00,2/25/2024 9:01,2024-02-25 02:01:43-07:00,Iridium,,,,0,No Fix,Nothing Detected,14,3.28,3.6,Animal with Collar 40882
40882,11/25/2023 17:01,2023-11-25 10:01:39-07:00,2/25/2024 9:01,2024-02-25 02:01:43-07:00,Iridium,,,,0,No Fix,Nothing Detected,13,3.28,3.6,Animal with Collar 40882
40882,11/25/2023 16:01,2023-11-25 09:01:39-07:00,2/25/2024 9:01,2024-02-25 02:01:43-07:00,Iridium,,,,0,No Fix,Nothing Detected,12,3.28,3.6,Animal with Collar 40882
40882,11/25/2023 15:01,2023-11-25 08:01:39-07:00,2/25/2024 9:01,2024-02-25 02:01:43-07:00,Iridium,,,,0,No Fix,Nothing Detected,11,3.28,3.6,Animal with Collar 40882
40882,11/25/2023 14:01,2023-11-25 07:01:39-07:00,2/25/2024 9:01,2024-02-25 02:01:53-07:00,Iridium,,,,0,No Fix,Nothing Detected,9,3.28,3.6,Animal with Collar 40882
40882,11/25/2023 13:01,2023-11-25 06:01:39-07:00,2/25/2024 9:01,2024-02-25 02:01:53-07:00,Iridium,,,,0,No Fix,Nothing Detected,9,3.28,3.6,Animal with Collar 40882
40882,11/25/2023 12:01,2023-11-25 05:01:39-07:00,2/25/2024 9:01,2024-02-25 02:01:53-07:00,Iridium,,,,0,No Fix,Nothing Detected,10,3.28,3.6,Animal with Collar 40882
40882,11/25/2023 11:01,2023-11-25 04:01:39-07:00,2/25/2024 9:01,2024-02-25 02:01:53-07:00,Iridium,,,,0,No Fix,Nothing Detected,11,3.28,3.6,Animal with Collar 40882
40882,11/25/2023 10:01,2023-11-25 03:01:39-07:00,2/25/2024 9:02,2024-02-25 02:02:00-07:00,Iridium,,,,0,No Fix,Nothing Detected,11,3.28,3.6,Animal with Collar 40882
40882,11/25/2023 9:01,2023-11-25 02:01:39-07:00,2/25/2024 9:02,2024-02-25 02:02:00-07:00,Iridium,,,,0,No Fix,Nothing Detected,9,3.28,3.6,Animal with Collar 40882
40882,11/25/2023 8:01,2023-11-25 01:01:39-07:00,2/25/2024 9:02,2024-02-25 02:02:00-07:00,Iridium,,,,0,No Fix,Nothing Detected,9,3.28,3.6,Animal with Collar 40882
40882,11/25/2023 7:01,2023-11-25 00:01:39-07:00,2/25/2024 9:02,2024-02-25 02:02:00-07:00,Iridium,,,,0,No Fix,Nothing Detected,12,3.28,3.6,Animal with Collar 40882
40882,11/25/2023 6:01,2023-11-24 23:01:39-07:00,2/25/2024 9:02,2024-02-25 02:02:10-07:00,Iridium,,,,0,No Fix,Nothing Detected,13,3.28,3.6,Animal with Collar 40882
40882,11/25/2023 5:01,2023-11-24 22:01:39-07:00,2/25/2024 9:02,2024-02-25 02:02:10-07:00,Iridium,,,,0,No Fix,Nothing Detected,15,3.28,3.6,Animal with Collar 40882
40882,11/25/2023 4:01,2023-11-24 21:01:39-07:00,2/25/2024 9:02,2024-02-25 02:02:10-07:00,Iridium,,,,0,No Fix,Nothing Detected,15,3.28,3.6,Animal with Collar 40882
40882,11/25/2023 3:51,2023-11-24 20:51:40-07:00,2/25/2024 9:02,2024-02-25 02:02:10-07:00,Iridium,,,,0,No Fix,Nothing Detected,15,3.28,3.6,Animal with Collar 40882
40882,11/24/2023 3:01,2023-11-23 20:01:39-07:00,2/25/2024 9:02,2024-02-25 02:02:17-07:00,Iridium,,,,0,No Fix,Nothing Detected,16,3.28,3.6,Animal with Collar 40882
40882,11/24/2023 2:01,2023-11-23 19:01:39-07:00,2/25/2024 9:02,2024-02-25 02:02:17-07:00,Iridium,,,,0,No Fix,Nothing Detected,17,3.28,3.6,Animal with Collar 40882
40882,11/24/2023 1:01,2023-11-23 18:01:41-07:00,2/25/2024 9:02,2024-02-25 02:02:17-07:00,Iridium,,,,0,No Fix,Nothing Detected,16,3.28,3.6,Animal with Collar 40882
40882,11/24/2023 0:01,2023-11-23 17:01:39-07:00,2/25/2024 9:02,2024-02-25 02:02:17-07:00,Iridium,,,,0,No Fix,Nothing Detected,15,3.28,3.6,Animal with Collar 40882
40882,11/23/2023 23:01,2023-11-23 16:01:39-07:00,2/25/2024 9:02,2024-02-25 02:02:24-07:00,Iridium,,,,0,No Fix,Nothing Detected,16,3.28,3.6,Animal with Collar 40882
40882,11/23/2023 22:01,2023-11-23 15:01:39-07:00,2/25/2024 9:02,2024-02-25 02:02:24-07:00,Iridium,,,,0,No Fix,Nothing Detected,15,3.28,3.6,Animal with Collar 40882
40882,11/23/2023 21:01,2023-11-23 14:01:39-07:00,2/25/2024 9:02,2024-02-25 02:02:24-07:00,Iridium,,,,0,No Fix,Nothing Detected,15,3.28,3.6,Animal with Collar 40882
40882,11/23/2023 20:01,2023-11-23 13:01:39-07:00,2/25/2024 9:02,2024-02-25 02:02:24-07:00,Iridium,,,,0,No Fix,Nothing Detected,15,3.28,3.6,Animal with Collar 40882
40882,11/23/2023 19:26,2023-11-23 12:26:40-07:00,2/25/2024 9:02,2024-02-25 02:02:31-07:00,Iridium,,,,0,No Fix,Nothing Detected,15,3.28,3.6,Animal with Collar 40882
40882,11/22/2023 19:01,2023-11-22 12:01:39-07:00,2/25/2024 9:02,2024-02-25 02:02:31-07:00,Iridium,,,,0,No Fix,Nothing Detected,18,3.28,3.6,Animal with Collar 40882
40882,11/22/2023 18:01,2023-11-22 11:01:39-07:00,2/25/2024 9:02,2024-02-25 02:02:31-07:00,Iridium,,,,0,No Fix,Nothing Detected,18,3.28,3.6,Animal with Collar 40882
40882,11/22/2023 17:01,2023-11-22 10:01:39-07:00,2/25/2024 9:02,2024-02-25 02:02:31-07:00,Iridium,,,,0,No Fix,Nothing Detected,17,3.28,3.6,Animal with Collar 40882
40882,11/22/2023 16:01,2023-11-22 09:01:39-07:00,2/25/2024 9:02,2024-02-25 02:02:39-07:00,Iridium,,,,0,No Fix,Nothing Detected,17,3.28,3.6,Animal with Collar 40882
40882,11/22/2023 15:01,2023-11-22 08:01:39-07:00,2/25/2024 9:02,2024-02-25 02:02:39-07:00,Iridium,,,,0,No Fix,Nothing Detected,16,3.28,3.6,Animal with Collar 40882
40882,11/22/2023 14:01,2023-11-22 07:01:39-07:00,2/25/2024 9:02,2024-02-25 02:02:39-07:00,Iridium,,,,0,No Fix,Nothing Detected,13,3.28,3.6,Animal with Collar 40882
40882,11/22/2023 13:01,2023-11-22 06:01:39-07:00,2/25/2024 9:02,2024-02-25 02:02:39-07:00,Iridium,,,,0,No Fix,Nothing Detected,12,3.28,3.6,Animal with Collar 40882
40882,11/22/2023 12:01,2023-11-22 05:01:39-07:00,2/25/2024 9:02,2024-02-25 02:02:48-07:00,Iridium,,,,0,No Fix,Nothing Detected,11,3.28,3.6,Animal with Collar 40882
40882,11/22/2023 11:01,2023-11-22 04:01:39-07:00,2/25/2024 9:02,2024-02-25 02:02:48-07:00,Iridium,,,,0,No Fix,Nothing Detected,12,3.28,3.6,Animal with Collar 40882
40882,11/22/2023 10:01,2023-11-22 03:01:39-07:00,2/25/2024 9:02,2024-02-25 02:02:48-07:00,Iridium,,,,0,No Fix,Nothing Detected,12,3.28,3.6,Animal with Collar 40882
40882,11/22/2023 9:01,2023-11-22 02:01:39-07:00,2/25/2024 9:02,2024-02-25 02:02:48-07:00,Iridium,,,,0,No Fix,Nothing Detected,11,3.28,3.6,Animal with Collar 40882
40882,11/22/2023 8:01,2023-11-22 01:01:39-07:00,2/25/2024 9:02,2024-02-25 02:02:58-07:00,Iridium,,,,0,No Fix,Nothing Detected,14,3.28,3.6,Animal with Collar 40882
40882,11/22/2023 7:46,2023-11-22 00:46:40-07:00,2/25/2024 9:02,2024-02-25 02:02:58-07:00,Iridium,,,,0,No Fix,Nothing Detected,14,3.28,3.6,Animal with Collar 40882
40882,11/21/2023 7:01,2023-11-21 00:01:41-07:00,2/25/2024 9:02,2024-02-25 02:02:58-07:00,Iridium,,,,0,No Fix,Nothing Detected,16,3.28,3.6,Animal with Collar 40882
40882,11/21/2023 6:01,2023-11-20 23:01:39-07:00,2/25/2024 9:02,2024-02-25 02:02:58-07:00,Iridium,,,,0,No Fix,Nothing Detected,17,3.28,3.6,Animal with Collar 40882
40882,11/21/2023 5:01,2023-11-20 22:01:39-07:00,2/25/2024 9:03,2024-02-25 02:03:18-07:00,Iridium,,,,0,No Fix,Nothing Detected,16,3.28,3.6,Animal with Collar 40882
40882,11/21/2023 4:01,2023-11-20 21:01:39-07:00,2/25/2024 9:03,2024-02-25 02:03:18-07:00,Iridium,,,,0,No Fix,Nothing Detected,17,3.28,3.6,Animal with Collar 40882
40882,11/21/2023 3:01,2023-11-20 20:01:39-07:00,2/25/2024 9:03,2024-02-25 02:03:18-07:00,Iridium,,,,0,No Fix,Nothing Detected,18,3.28,3.6,Animal with Collar 40882
40882,11/21/2023 2:01,2023-11-20 19:01:39-07:00,2/25/2024 9:03,2024-02-25 02:03:18-07:00,Iridium,,,,0,No Fix,Nothing Detected,18,3.28,3.6,Animal with Collar 40882
40882,11/21/2023 1:01,2023-11-20 18:01:39-07:00,2/25/2024 9:03,2024-02-25 02:03:49-07:00,Iridium,,,,0,No Fix,Nothing Detected,17,3.28,3.6,Animal with Collar 40882
40882,11/21/2023 0:01,2023-11-20 17:01:39-07:00,2/25/2024 9:03,2024-02-25 02:03:49-07:00,Iridium,,,,0,No Fix,Nothing Detected,15,3.28,3.6,Animal with Collar 40882
40882,11/20/2023 23:01,2023-11-20 16:01:39-07:00,2/25/2024 9:03,2024-02-25 02:03:49-07:00,Iridium,,,,0,No Fix,Nothing Detected,17,3.28,3.6,Animal with Collar 40882
40882,11/20/2023 22:01,2023-11-20 15:01:39-07:00,2/25/2024 9:03,2024-02-25 02:03:49-07:00,Iridium,,,,0,No Fix,Nothing Detected,17,3.28,3.6,Animal with Collar 40882
40882,11/20/2023 21:01,2023-11-20 14:01:39-07:00,2/25/2024 9:04,2024-02-25 02:04:09-07:00,Iridium,,,,0,No Fix,Nothing Detected,18,3.28,3.6,Animal with Collar 40882
40882,11/20/2023 20:01,2023-11-20 13:01:39-07:00,2/25/2024 9:04,2024-02-25 02:04:09-07:00,Iridium,,,,0,No Fix,Nothing Detected,18,3.28,3.6,Animal with Collar 40882
40882,11/20/2023 19:01,2023-11-20 12:01:39-07:00,2/25/2024 9:04,2024-02-25 02:04:09-07:00,Iridium,,,,0,No Fix,Nothing Detected,18,3.28,3.6,Animal with Collar 40882
40882,11/20/2023 18:01,2023-11-20 11:01:39-07:00,2/25/2024 9:04,2024-02-25 02:04:09-07:00,Iridium,,,,0,No Fix,Nothing Detected,17,3.28,3.6,Animal with Collar 40882
40882,11/20/2023 17:01,2023-11-20 10:01:39-07:00,2/25/2024 9:04,2024-02-25 02:04:18-07:00,Iridium,,,,0,No Fix,Nothing Detected,17,3.28,3.6,Animal with Collar 40882
40882,11/20/2023 16:01,2023-11-20 09:01:39-07:00,2/25/2024 9:04,2024-02-25 02:04:18-07:00,Iridium,,,,0,No Fix,Nothing Detected,17,3.28,3.6,Animal with Collar 40882
40882,11/20/2023 15:01,2023-11-20 08:01:39-07:00,2/25/2024 17:01,2024-02-25 10:01:21-07:00,Iridium,,,,0,No Fix,Nothing Detected,17,3.28,3.6,Animal with Collar 40882
40882,11/20/2023 14:01,2023-11-20 07:01:39-07:00,2/25/2024 17:01,2024-02-25 10:01:21-07:00,Iridium,,,,0,No Fix,Nothing Detected,17,3.28,3.6,Animal with Collar 40882
40882,11/20/2023 13:01,2023-11-20 06:01:39-07:00,2/25/2024 17:01,2024-02-25 10:01:21-07:00,Iridium,,,,0,No Fix,Nothing Detected,16,3.28,3.6,Animal with Collar 40882
40882,11/20/2023 12:01,2023-11-20 05:01:39-07:00,2/25/2024 17:01,2024-02-25 10:01:21-07:00,Iridium,,,,0,No Fix,Nothing Detected,16,3.28,3.6,Animal with Collar 40882
40882,11/20/2023 11:01,2023-11-20 04:01:41-07:00,2/25/2024 17:01,2024-02-25 10:01:29-07:00,Iridium,,,,0,No Fix,Nothing Detected,15,3.28,3.6,Animal with Collar 40882
40882,11/20/2023 10:01,2023-11-20 03:01:39-07:00,2/25/2024 17:01,2024-02-25 10:01:29-07:00,Iridium,,,,0,No Fix,Nothing Detected,17,3.28,3.6,Animal with Collar 40882
40882,11/20/2023 9:01,2023-11-20 02:01:39-07:00,2/25/2024 17:01,2024-02-25 10:01:29-07:00,Iridium,,,,0,No Fix,Nothing Detected,16,3.28,3.6,Animal with Collar 40882
40882,11/20/2023 8:38,2023-11-20 01:38:19-07:00,2/25/2024 17:01,2024-02-25 10:01:29-07:00,Iridium,,,,0,No Fix,Nothing Detected,17,3.28,3.6,Animal with Collar 40882
40882,11/19/2023 8:36,2023-11-19 01:36:40-07:00,2/25/2024 17:01,2024-02-25 10:01:39-07:00,Iridium,,,,0,No Fix,Nothing Detected,18,3.28,3.6,Animal with Collar 40882
40882,11/18/2023 8:01,2023-11-18 01:01:39-07:00,2/25/2024 17:01,2024-02-25 10:01:39-07:00,Iridium,,,,0,No Fix,Nothing Detected,18,3.28,3.6,Animal with Collar 40882
40882,11/18/2023 7:01,2023-11-18 00:01:39-07:00,2/25/2024 17:01,2024-02-25 10:01:39-07:00,Iridium,,,,0,No Fix,Nothing Detected,15,3.28,3.6,Animal with Collar 40882
40882,11/18/2023 6:01,2023-11-17 23:01:39-07:00,2/25/2024 17:01,2024-02-25 10:01:39-07:00,Iridium,,,,0,No Fix,Nothing Detected,12,3.28,3.6,Animal with Collar 40882
40882,11/18/2023 5:01,2023-11-17 22:01:39-07:00,2/25/2024 17:01,2024-02-25 10:01:46-07:00,Iridium,,,,0,No Fix,Nothing Detected,13,3.28,3.6,Animal with Collar 40882
40882,11/18/2023 4:01,2023-11-17 21:01:39-07:00,2/25/2024 17:01,2024-02-25 10:01:46-07:00,Iridium,,,,0,No Fix,Nothing Detected,11,3.28,3.6,Animal with Collar 40882
40882,11/18/2023 3:01,2023-11-17 20:01:39-07:00,2/25/2024 17:01,2024-02-25 10:01:46-07:00,Iridium,,,,0,No Fix,Nothing Detected,12,3.28,3.6,Animal with Collar 40882
40882,11/18/2023 2:28,2023-11-17 19:28:19-07:00,2/25/2024 17:01,2024-02-25 10:01:46-07:00,Iridium,,,,0,No Fix,Nothing Detected,12,3.28,3.6,Animal with Collar 40882
40882,11/17/2023 2:26,2023-11-16 19:26:40-07:00,2/25/2024 17:01,2024-02-25 10:01:54-07:00,Iridium,,,,0,No Fix,Nothing Detected,13,3.28,3.6,Animal with Collar 40882
40882,11/16/2023 2:01,2023-11-15 19:01:39-07:00,2/25/2024 17:01,2024-02-25 10:01:54-07:00,Iridium,,,,0,No Fix,Nothing Detected,21,3.28,3.6,Animal with Collar 40882
40882,11/16/2023 1:01,2023-11-15 18:01:39-07:00,2/25/2024 17:01,2024-02-25 10:01:54-07:00,Iridium,,,,0,No Fix,Nothing Detected,18,3.28,3.6,Animal with Collar 40882
40882,11/16/2023 0:01,2023-11-15 17:01:39-07:00,2/25/2024 17:01,2024-02-25 10:01:54-07:00,Iridium,,,,0,No Fix,Nothing Detected,18,3.28,3.6,Animal with Collar 40882
40882,11/15/2023 23:01,2023-11-15 16:01:39-07:00,2/25/2024 17:02,2024-02-25 10:02:05-07:00,Iridium,,,,0,No Fix,Nothing Detected,21,3.28,3.6,Animal with Collar 40882
40882,11/15/2023 22:01,2023-11-15 15:01:39-07:00,2/25/2024 17:02,2024-02-25 10:02:05-07:00,Iridium,,,,0,No Fix,Nothing Detected,18,3.28,3.6,Animal with Collar 40882
40882,11/15/2023 21:01,2023-11-15 14:01:39-07:00,2/25/2024 17:02,2024-02-25 10:02:05-07:00,Iridium,,,,0,No Fix,Nothing Detected,17,3.28,3.6,Animal with Collar 40882
40882,11/15/2023 20:01,2023-11-15 13:01:39-07:00,2/25/2024 17:02,2024-02-25 10:02:05-07:00,Iridium,,,,0,No Fix,Nothing Detected,16,3.28,3.6,Animal with Collar 40882
40882,11/15/2023 19:01,2023-11-15 12:01:41-07:00,2/25/2024 17:02,2024-02-25 10:02:14-07:00,Iridium,,,,0,No Fix,Nothing Detected,16,3.28,3.6,Animal with Collar 40882
40882,11/15/2023 18:01,2023-11-15 11:01:39-07:00,2/25/2024 17:02,2024-02-25 10:02:14-07:00,Iridium,,,,0,No Fix,Nothing Detected,16,3.28,3.6,Animal with Collar 40882
40882,11/15/2023 17:01,2023-11-15 10:01:38-07:00,2/25/2024 17:02,2024-02-25 10:02:14-07:00,Iridium,,,,0,No Fix,Nothing Detected,14,3.28,3.6,Animal with Collar 40882
40882,11/15/2023 16:01,2023-11-15 09:01:39-07:00,2/25/2024 17:02,2024-02-25 10:02:14-07:00,Iridium,,,,0,No Fix,Nothing Detected,14,3.28,3.6,Animal with Collar 40882
40882,11/15/2023 15:01,2023-11-15 08:01:39-07:00,2/25/2024 17:02,2024-02-25 10:02:21-07:00,Iridium,,,,0,No Fix,Nothing Detected,14,3.28,3.6,Animal with Collar 40882
40882,11/15/2023 14:01,2023-11-15 07:01:39-07:00,2/25/2024 17:02,2024-02-25 10:02:21-07:00,Iridium,,,,0,No Fix,Nothing Detected,16,3.28,3.6,Animal with Collar 40882
40882,11/15/2023 13:01,2023-11-15 06:01:39-07:00,2/25/2024 17:02,2024-02-25 10:02:21-07:00,Iridium,,,,0,No Fix,Nothing Detected,15,3.28,3.6,Animal with Collar 40882
40882,11/15/2023 12:01,2023-11-15 05:01:39-07:00,2/25/2024 17:02,2024-02-25 10:02:21-07:00,Iridium,,,,0,No Fix,Nothing Detected,16,3.28,3.6,Animal with Collar 40882
40882,11/15/2023 11:23,2023-11-15 04:23:22-07:00,2/25/2024 17:02,2024-02-25 10:02:29-07:00,Iridium,,,,0,No Fix,Nothing Detected,16,3.28,3.6,Animal with Collar 40882
40882,11/14/2023 11:21,2023-11-14 04:21:43-07:00,2/25/2024 17:02,2024-02-25 10:02:29-07:00,Iridium,,,,0,No Fix,Nothing Detected,18,3.28,3.6,Animal with Collar 40882
40882,11/13/2023 11:01,2023-11-13 04:01:38-07:00,2/25/2024 17:02,2024-02-25 10:02:29-07:00,Iridium,,,,0,No Fix,Nothing Detected,19,3.28,3.6,Animal with Collar 40882
40882,11/13/2023 10:01,2023-11-13 03:01:38-07:00,2/25/2024 17:02,2024-02-25 10:02:29-07:00,Iridium,,,,0,No Fix,Nothing Detected,20,3.28,3.6,Animal with Collar 40882
40882,11/13/2023 9:01,2023-11-13 02:01:38-07:00,2/25/2024 17:02,2024-02-25 10:02:40-07:00,Iridium,,,,0,No Fix,Nothing Detected,19,3.28,3.6,Animal with Collar 40882
40882,11/13/2023 8:01,2023-11-13 01:01:38-07:00,2/25/2024 17:02,2024-02-25 10:02:40-07:00,Iridium,,,,0,No Fix,Nothing Detected,20,3.28,3.6,Animal with Collar 40882
40882,11/13/2023 7:01,2023-11-13 00:01:38-07:00,2/25/2024 17:02,2024-02-25 10:02:40-07:00,Iridium,,,,0,No Fix,Nothing Detected,19,3.28,3.6,Animal with Collar 40882
40882,11/13/2023 6:01,2023-11-12 23:01:39-07:00,2/25/2024 17:02,2024-02-25 10:02:40-07:00,Iridium,,,,0,No Fix,Nothing Detected,17,3.28,3.6,Animal with Collar 40882
40882,11/13/2023 5:01,2023-11-12 22:01:38-07:00,2/25/2024 17:02,2024-02-25 10:02:47-07:00,Iridium,,,,0,No Fix,Nothing Detected,17,3.28,3.6,Animal with Collar 40882
40882,11/13/2023 4:01,2023-11-12 21:01:38-07:00,2/25/2024 17:02,2024-02-25 10:02:47-07:00,Iridium,,,,0,No Fix,Nothing Detected,16,3.28,3.6,Animal with Collar 40882
40882,11/13/2023 3:01,2023-11-12 20:01:38-07:00,2/25/2024 17:02,2024-02-25 10:02:47-07:00,Iridium,,,,0,No Fix,Nothing Detected,16,3.28,3.6,Animal with Collar 40882
40882,11/13/2023 2:01,2023-11-12 19:01:38-07:00,2/25/2024 17:02,2024-02-25 10:02:47-07:00,Iridium,,,,0,No Fix,Nothing Detected,19,3.28,3.6,Animal with Collar 40882
40882,11/13/2023 1:01,2023-11-12 18:01:38-07:00,2/25/2024 17:02,2024-02-25 10:02:55-07:00,Iridium,,,,0,No Fix,Nothing Detected,17,3.28,3.6,Animal with Collar 40882
40882,11/13/2023 0:00,2023-11-12 17:00:38-07:00,11/13/2023 0:00,2023-11-12 17:00:58-07:00,Iridium,46.647327,-113.94786,1325,1.6,3D Validated,Nothing Detected,15,3.28,3.6,Animal with Collar 40882
40882,11/12/2023 23:00,2023-11-12 16:00:10-07:00,11/13/2023 0:00,2023-11-12 17:00:58-07:00,Iridium,46.647327,-113.94787,1322,2.6,3D Validated,Nothing Detected,19,3.36,3.6,Animal with Collar 40882
40882,11/12/2023 22:00,2023-11-12 15:00:38-07:00,11/13/2023 0:00,2023-11-12 17:00:58-07:00,Iridium,46.647346,-113.94782,1328,2.2,3D Validated,Nothing Detected,19,3.28,3.6,Animal with Collar 40882
40882,11/12/2023 21:01,2023-11-12 14:01:02-07:00,11/13/2023 0:00,2023-11-12 17:00:58-07:00,Iridium,46.647472,-113.9479,1331,3,3D Validated,Nothing Detected,18,3.28,3.6,Animal with Collar 40882
40882,11/12/2023 20:01,2023-11-12 13:01:39-07:00,11/13/2023 0:01,2023-11-12 17:01:08-07:00,Iridium,,,,0,No Fix,Nothing Detected,19,3.28,3.6,Animal with Collar 40882
40882,11/12/2023 19:01,2023-11-12 12:01:39-07:00,11/13/2023 0:01,2023-11-12 17:01:08-07:00,Iridium,,,,0,No Fix,Nothing Detected,19,3.28,3.6,Animal with Collar 40882
40882,11/12/2023 18:01,2023-11-12 11:01:39-07:00,11/13/2023 0:01,2023-11-12 17:01:08-07:00,Iridium,,,,0,No Fix,Nothing Detected,19,3.28,3.6,Animal with Collar 40882
40882,11/12/2023 17:01,2023-11-12 10:01:39-07:00,11/13/2023 0:01,2023-11-12 17:01:08-07:00,Iridium,,,,0,No Fix,Nothing Detected,18,3.28,3.6,Animal with Collar 40882
40882,11/12/2023 16:01,2023-11-12 09:01:39-07:00,11/13/2023 0:01,2023-11-12 17:01:16-07:00,Iridium,,,,0,No Fix,Nothing Detected,17,3.28,3.6,Animal with Collar 40882
40882,11/12/2023 15:01,2023-11-12 08:01:39-07:00,11/13/2023 0:01,2023-11-12 17:01:16-07:00,Iridium,,,,0,No Fix,Nothing Detected,16,3.28,3.6,Animal with Collar 40882
40882,11/12/2023 14:01,2023-11-12 07:01:39-07:00,11/13/2023 0:01,2023-11-12 17:01:16-07:00,Iridium,,,,0,No Fix,Nothing Detected,18,3.28,3.6,Animal with Collar 40882
40882,11/12/2023 13:01,2023-11-12 06:01:39-07:00,11/13/2023 0:01,2023-11-12 17:01:16-07:00,Iridium,,,,0,No Fix,Nothing Detected,18,3.28,3.6,Animal with Collar 40882
40882,11/12/2023 12:38,2023-11-12 05:38:21-07:00,11/13/2023 0:01,2023-11-12 17:01:23-07:00,Iridium,,,,0,No Fix,Nothing Detected,18,3.28,3.6,Animal with Collar 40882
40882,11/11/2023 12:36,2023-11-11 05:36:40-07:00,11/13/2023 0:01,2023-11-12 17:01:23-07:00,Iridium,,,,0,No Fix,Nothing Detected,14,3.28,3.6,Animal with Collar 40882
40882,11/10/2023 12:01,2023-11-10 05:01:39-07:00,11/13/2023 0:01,2023-11-12 17:01:23-07:00,Iridium,,,,0,No Fix,Nothing Detected,19,3.28,3.6,Animal with Collar 40882
40882,11/10/2023 11:01,2023-11-10 04:01:39-07:00,11/13/2023 0:01,2023-11-12 17:01:23-07:00,Iridium,,,,0,No Fix,Nothing Detected,18,3.28,3.6,Animal with Collar 40882
40882,11/10/2023 10:01,2023-11-10 03:01:39-07:00,11/13/2023 0:01,2023-11-12 17:01:31-07:00,Iridium,,,,0,No Fix,Nothing Detected,18,3.28,3.6,Animal with Collar 40882
40882,11/10/2023 9:01,2023-11-10 02:01:39-07:00,11/13/2023 0:01,2023-11-12 17:01:31-07:00,Iridium,,,,0,No Fix,Nothing Detected,17,3.28,3.6,Animal with Collar 40882
40882,11/10/2023 8:01,2023-11-10 01:01:39-07:00,11/13/2023 0:01,2023-11-12 17:01:31-07:00,Iridium,,,,0,No Fix,Nothing Detected,17,3.28,3.6,Animal with Collar 40882
40882,11/10/2023 7:01,2023-11-10 00:01:39-07:00,11/13/2023 0:01,2023-11-12 17:01:31-07:00,Iridium,,,,0,No Fix,Nothing Detected,19,3.28,3.6,Animal with Collar 40882
40882,11/10/2023 6:01,2023-11-09 23:01:39-07:00,11/13/2023 0:01,2023-11-12 17:01:40-07:00,Iridium,,,,0,No Fix,Nothing Detected,23,3.28,3.6,Animal with Collar 40882
40882,11/10/2023 5:01,2023-11-09 22:01:39-07:00,11/13/2023 0:01,2023-11-12 17:01:40-07:00,Iridium,,,,0,No Fix,Nothing Detected,23,3.28,3.6,Animal with Collar 40882
40882,11/10/2023 4:01,2023-11-09 21:01:39-07:00,11/13/2023 0:01,2023-11-12 17:01:40-07:00,Iridium,,,,0,No Fix,Nothing Detected,19,3.28,3.6,Animal with Collar 40882
40882,11/10/2023 3:01,2023-11-09 20:01:39-07:00,11/13/2023 0:01,2023-11-12 17:01:40-07:00,Iridium,,,,0,No Fix,Nothing Detected,20,3.28,3.6,Animal with Collar 40882
40882,11/10/2023 2:01,2023-11-09 19:01:39-07:00,11/13/2023 0:01,2023-11-12 17:01:48-07:00,Iridium,,,,0,No Fix,Nothing Detected,22,3.28,3.6,Animal with Collar 40882
40882,11/10/2023 1:53,2023-11-09 18:53:19-07:00,11/13/2023 0:01,2023-11-12 17:01:48-07:00,Iridium,,,,0,No Fix,Nothing Detected,21,3.28,3.6,Animal with Collar 40882
40882,11/9/2023 1:51,2023-11-08 18:51:40-07:00,11/13/2023 0:01,2023-11-12 17:01:48-07:00,Iridium,,,,0,No Fix,Nothing Detected,18,3.28,3.6,Animal with Collar 40882
40882,11/8/2023 1:01,2023-11-07 18:01:39-07:00,11/13/2023 0:01,2023-11-12 17:01:48-07:00,Iridium,,,,0,No Fix,Nothing Detected,21,3.28,3.6,Animal with Collar 40882
40882,11/8/2023 0:01,2023-11-07 17:01:39-07:00,11/13/2023 0:01,2023-11-12 17:01:57-07:00,Iridium,,,,0,No Fix,Nothing Detected,21,3.28,3.6,Animal with Collar 40882
40882,11/7/2023 23:01,2023-11-07 16:01:39-07:00,11/13/2023 0:01,2023-11-12 17:01:57-07:00,Iridium,,,,0,No Fix,Nothing Detected,21,3.28,3.6,Animal with Collar 40882
40882,11/7/2023 22:01,2023-11-07 15:01:39-07:00,11/13/2023 0:01,2023-11-12 17:01:57-07:00,Iridium,,,,0,No Fix,Nothing Detected,21,3.28,3.6,Animal with Collar 40882
40882,11/7/2023 21:01,2023-11-07 14:01:39-07:00,11/13/2023 0:01,2023-11-12 17:01:57-07:00,Iridium,,,,0,No Fix,Nothing Detected,17,3.28,3.6,Animal with Collar 40882
40882,11/7/2023 20:01,2023-11-07 13:01:41-07:00,11/13/2023 0:02,2023-11-12 17:02:07-07:00,Iridium,,,,0,No Fix,Nothing Detected,17,3.28,3.6,Animal with Collar 40882
40882,11/7/2023 19:01,2023-11-07 12:01:39-07:00,11/13/2023 0:02,2023-11-12 17:02:07-07:00,Iridium,,,,0,No Fix,Nothing Detected,21,3.28,3.6,Animal with Collar 40882
40882,11/7/2023 18:01,2023-11-07 11:01:39-07:00,11/13/2023 0:02,2023-11-12 17:02:07-07:00,Iridium,,,,0,No Fix,Nothing Detected,21,3.28,3.6,Animal with Collar 40882
40882,11/7/2023 17:01,2023-11-07 10:01:38-07:00,11/13/2023 0:02,2023-11-12 17:02:07-07:00,Iridium,,,,0,No Fix,Nothing Detected,21,3.28,3.6,Animal with Collar 40882
40882,11/7/2023 16:01,2023-11-07 09:01:38-07:00,11/13/2023 0:02,2023-11-12 17:02:16-07:00,Iridium,,,,0,No Fix,Nothing Detected,21,3.28,3.6,Animal with Collar 40882
40882,11/7/2023 15:01,2023-11-07 08:01:38-07:00,11/13/2023 0:02,2023-11-12 17:02:16-07:00,Iridium,,,,0,No Fix,Nothing Detected,19,3.28,3.6,Animal with Collar 40882
40882,11/7/2023 14:01,2023-11-07 07:01:39-07:00,11/13/2023 0:02,2023-11-12 17:02:16-07:00,Iridium,,,,0,No Fix,Nothing Detected,20,3.28,3.6,Animal with Collar 40882
40882,11/7/2023 13:01,2023-11-07 06:01:39-07:00,11/13/2023 0:02,2023-11-12 17:02:16-07:00,Iridium,,,,0,No Fix,Nothing Detected,19,3.28,3.6,Animal with Collar 40882
40882,11/7/2023 12:01,2023-11-07 05:01:39-07:00,11/13/2023 0:02,2023-11-12 17:02:24-07:00,Iridium,,,,0,No Fix,Nothing Detected,20,3.28,3.6,Animal with Collar 40882
40882,11/7/2023 11:01,2023-11-07 04:01:39-07:00,11/13/2023 0:02,2023-11-12 17:02:24-07:00,Iridium,,,,0,No Fix,Nothing Detected,20,3.28,3.6,Animal with Collar 40882
40882,11/7/2023 10:01,2023-11-07 03:01:39-07:00,11/13/2023 0:02,2023-11-12 17:02:24-07:00,Iridium,,,,0,No Fix,Nothing Detected,21,3.28,3.6,Animal with Collar 40882
40882,11/7/2023 9:01,2023-11-07 02:01:39-07:00,11/13/2023 0:02,2023-11-12 17:02:24-07:00,Iridium,,,,0,No Fix,Nothing Detected,20,3.28,3.6,Animal with Collar 40882
40882,11/7/2023 8:01,2023-11-07 01:01:38-07:00,11/13/2023 0:02,2023-11-12 17:02:33-07:00,Iridium,,,,0,No Fix,Nothing Detected,20,3.28,3.6,Animal with Collar 40882
40882,11/7/2023 7:01,2023-11-07 00:01:38-07:00,11/13/2023 0:02,2023-11-12 17:02:33-07:00,Iridium,,,,0,No Fix,Nothing Detected,20,3.28,3.6,Animal with Collar 40882
40882,11/7/2023 6:01,2023-11-06 23:01:38-07:00,11/13/2023 0:02,2023-11-12 17:02:33-07:00,Iridium,,,,0,No Fix,Nothing Detected,22,3.28,3.6,Animal with Collar 40882
40882,11/7/2023 5:01,2023-11-06 22:01:38-07:00,11/13/2023 0:02,2023-11-12 17:02:33-07:00,Iridium,,,,0,No Fix,Nothing Detected,23,3.28,3.6,Animal with Collar 40882
40882,11/7/2023 4:01,2023-11-06 21:01:38-07:00,11/13/2023 0:02,2023-11-12 17:02:43-07:00,Iridium,,,,0,No Fix,Nothing Detected,19,3.28,3.6,Animal with Collar 40882
40882,11/7/2023 3:01,2023-11-06 20:01:38-07:00,11/13/2023 0:02,2023-11-12 17:02:43-07:00,Iridium,,,,0,No Fix,Nothing Detected,19,3.28,3.6,Animal with Collar 40882
40882,11/7/2023 2:01,2023-11-06 19:01:38-07:00,11/13/2023 0:02,2023-11-12 17:02:43-07:00,Iridium,,,,0,No Fix,Nothing Detected,20,3.28,3.6,Animal with Collar 40882
40882,11/7/2023 1:01,2023-11-06 18:01:38-07:00,11/13/2023 0:02,2023-11-12 17:02:43-07:00,Iridium,,,,0,No Fix,Nothing Detected,21,3.28,3.6,Animal with Collar 40882
40882,11/7/2023 0:01,2023-11-06 17:01:38-07:00,11/13/2023 0:02,2023-11-12 17:02:54-07:00,Iridium,,,,0,No Fix,Nothing Detected,24,3.28,3.6,Animal with Collar 40882
40882,11/6/2023 23:01,2023-11-06 16:01:00-07:00,11/13/2023 0:02,2023-11-12 17:02:54-07:00,Iridium,46.647434,-113.94789,1335,3,3D Validated,Nothing Detected,31,3.28,3.6,Animal with Collar 40882
40882,11/6/2023 22:31,2023-11-06 15:31:41-07:00,11/13/2023 0:02,2023-11-12 17:02:54-07:00,Iridium,,,,0,No Fix,Nothing Detected,30,3.28,3.6,Animal with Collar 40882
40882,11/5/2023 22:00,2023-11-05 15:00:42-07:00,11/13/2023 0:02,2023-11-12 17:02:54-07:00,Iridium,46.647335,-113.947754,1307,4.2,3D Validated,Nothing Detected,16,3.36,3.6,Animal with Collar 40882
40882,11/5/2023 21:00,2023-11-05 14:00:38-07:00,11/13/2023 0:03,2023-11-12 17:03:01-07:00,Iridium,46.6474,-113.947845,1323,2.4,3D Validated,Nothing Detected,18,3.28,3.6,Animal with Collar 40882
40882,11/5/2023 20:01,2023-11-05 13:01:30-07:00,11/13/2023 0:03,2023-11-12 17:03:01-07:00,Iridium,46.647408,-113.947754,1338,4.8,3D Validated,Nothing Detected,18,3.28,3.6,Animal with Collar 40882
40882,11/5/2023 19:00,2023-11-05 12:00:24-07:00,11/13/2023 0:03,2023-11-12 17:03:01-07:00,Iridium,46.64751,-113.94795,1322,6,3D Validated,Nothing Detected,23,3.28,3.6,Animal with Collar 40882
40882,11/5/2023 18:00,2023-11-05 11:00:39-07:00,11/13/2023 0:03,2023-11-12 17:03:01-07:00,Iridium,46.647335,-113.94774,1313,6.2,3D Validated,Nothing Detected,15,3.28,3.6,Animal with Collar 40882
40882,11/5/2023 17:00,2023-11-05 10:00:40-07:00,11/5/2023 17:02,2023-11-05 10:02:44-07:00,Iridium,46.647377,-113.9478,1330,5.2,3D Validated,Nothing Detected,16,3.28,3.6,Animal with Collar 40882
40882,11/5/2023 16:00,2023-11-05 09:00:38-07:00,11/5/2023 17:02,2023-11-05 10:02:44-07:00,Iridium,46.64747,-113.947845,1315,2.4,3D Validated,Nothing Detected,15,3.28,3.6,Animal with Collar 40882
40882,11/5/2023 15:00,2023-11-05 08:00:12-07:00,11/5/2023 17:02,2023-11-05 10:02:44-07:00,Iridium,46.647465,-113.94787,1316,3,3D Validated,Nothing Detected,11,3.36,3.6,Animal with Collar 40882
40882,11/5/2023 14:00,2023-11-05 07:00:40-07:00,11/5/2023 17:02,2023-11-05 10:02:44-07:00,Iridium,46.64736,-113.947845,1318,2.4,3D Validated,Nothing Detected,13,3.28,3.6,Animal with Collar 40882
40882,11/5/2023 13:00,2023-11-05 06:00:38-07:00,11/13/2023 0:03,2023-11-12 17:03:19-07:00,Iridium,46.647415,-113.94783,1321,2,3D Validated,Nothing Detected,12,3.36,3.6,Animal with Collar 40882
40882,11/5/2023 12:00,2023-11-05 05:00:41-07:00,11/13/2023 0:03,2023-11-12 17:03:19-07:00,Iridium,46.647377,-113.947815,1306,7,3D Validated,Nothing Detected,13,3.36,3.6,Animal with Collar 40882
40882,11/5/2023 11:00,2023-11-05 04:00:42-07:00,11/13/2023 0:03,2023-11-12 17:03:19-07:00,Iridium,46.647373,-113.947845,1320,1.8,3D Validated,Nothing Detected,13,3.36,3.6,Animal with Collar 40882
40882,11/5/2023 10:00,2023-11-05 03:00:11-07:00,11/13/2023 0:03,2023-11-12 17:03:19-07:00,Iridium,46.647366,-113.94766,1329,3.8,3D Validated,Nothing Detected,14,3.36,3.6,Animal with Collar 40882
40882,11/5/2023 9:01,2023-11-05 02:01:08-07:00,11/13/2023 0:03,2023-11-12 17:03:30-07:00,Iridium,46.647396,-113.94777,1312,9.6,3D Validated,Nothing Detected,14,3.36,3.6,Animal with Collar 40882
40882,11/5/2023 8:00,2023-11-05 01:00:40-07:00,11/13/2023 0:03,2023-11-12 17:03:30-07:00,Iridium,46.647423,-113.947876,1317,3,3D Validated,Nothing Detected,15,3.36,3.6,Animal with Collar 40882
40882,11/5/2023 7:00,2023-11-05 01:00:38-06:00,2/25/2024 17:02,2024-02-25 10:02:55-07:00,Iridium,46.647427,-113.94779,1317,2.4,3D Validated,Nothing Detected,16,3.36,3.6,Animal with Collar 40882
40882,11/5/2023 6:00,2023-11-05 00:00:40-06:00,2/25/2024 17:02,2024-02-25 10:02:55-07:00,Iridium,46.64732,-113.94775,1309,3,3D Validated,Nothing Detected,15,3.36,3.6,Animal with Collar 40882
40882,11/5/2023 5:00,2023-11-04 23:00:38-06:00,11/5/2023 5:01,2023-11-04 23:01:24-06:00,Iridium,46.6474,-113.94786,1317,9.6,3D Validated,Nothing Detected,14,3.36,3.6,Animal with Collar 40882
40882,11/5/2023 4:01,2023-11-04 22:01:10-06:00,11/5/2023 5:01,2023-11-04 23:01:24-06:00,Iridium,46.647385,-113.94781,1316,8,3D Validated,Nothing Detected,14,3.36,3.6,Animal with Collar 40882
40882,11/5/2023 3:00,2023-11-04 21:00:16-06:00,11/5/2023 5:01,2023-11-04 23:01:24-06:00,Iridium,46.64742,-113.94777,1315,5,3D Validated,Nothing Detected,14,3.36,3.6,Animal with Collar 40882
40882,11/5/2023 2:00,2023-11-04 20:00:11-06:00,11/5/2023 5:01,2023-11-04 23:01:24-06:00,Iridium,46.64743,-113.94776,1338,4.8,3D Validated,Nothing Detected,15,3.36,3.6,Animal with Collar 40882
40882,11/5/2023 1:00,2023-11-04 19:00:38-06:00,11/5/2023 1:01,2023-11-04 19:01:09-06:00,Iridium,46.64745,-113.94785,1326,1.6,3D Validated,Nothing Detected,16,3.28,3.6,Animal with Collar 40882
40882,11/5/2023 0:00,2023-11-04 18:00:11-06:00,11/5/2023 1:01,2023-11-04 19:01:09-06:00,Iridium,46.64747,-113.94782,1343,2,3D Validated,Nothing Detected,18,3.28,3.6,Animal with Collar 40882
40882,11/4/2023 23:00,2023-11-04 17:00:40-06:00,11/5/2023 1:01,2023-11-04 19:01:09-06:00,Iridium,46.6474,-113.94783,1325,2.6,3D Validated,Nothing Detected,20,3.28,3.6,Animal with Collar 40882
40882,11/4/2023 22:00,2023-11-04 16:00:13-06:00,11/5/2023 1:01,2023-11-04 19:01:09-06:00,Iridium,46.647343,-113.94784,1331,2.8,3D Validated,Nothing Detected,23,3.28,3.6,Animal with Collar 40882
40882,11/4/2023 21:00,2023-11-04 15:00:09-06:00,11/4/2023 21:00,2023-11-04 15:00:28-06:00,Iridium,46.647324,-113.94786,1331,2.2,3D Validated,Nothing Detected,23,3.36,3.6,Animal with Collar 40882
40882,11/4/2023 20:00,2023-11-04 14:00:40-06:00,11/4/2023 21:00,2023-11-04 15:00:28-06:00,Iridium,46.647305,-113.94788,1330,2,3D Validated,Nothing Detected,23,3.28,3.6,Animal with Collar 40882
40882,11/4/2023 19:00,2023-11-04 13:00:12-06:00,11/4/2023 21:00,2023-11-04 15:00:28-06:00,Iridium,46.64739,-113.94786,1332,3.4,3D Validated,Nothing Detected,21,3.36,3.6,Animal with Collar 40882
40882,11/4/2023 18:00,2023-11-04 12:00:39-06:00,11/4/2023 21:00,2023-11-04 15:00:28-06:00,Iridium,46.647354,-113.94791,1330,2.4,3D Validated,Nothing Detected,21,3.28,3.6,Animal with Collar 40882
40882,11/4/2023 17:00,2023-11-04 11:00:10-06:00,11/4/2023 17:00,2023-11-04 11:00:35-06:00,Iridium,46.64735,-113.94783,1319,2.8,3D Validated,Nothing Detected,18,3.28,3.6,Animal with Collar 40882
40882,11/4/2023 16:01,2023-11-04 10:01:08-06:00,11/4/2023 17:00,2023-11-04 11:00:35-06:00,Iridium,46.647373,-113.94783,1322,1.6,3D Validated,Nothing Detected,17,3.28,3.6,Animal with Collar 40882
40882,11/4/2023 15:00,2023-11-04 09:00:38-06:00,11/4/2023 17:00,2023-11-04 11:00:35-06:00,Iridium,46.64745,-113.94772,1323,2.8,3D Validated,Nothing Detected,14,3.28,3.6,Animal with Collar 40882
40882,11/4/2023 14:00,2023-11-04 08:00:13-06:00,11/4/2023 17:00,2023-11-04 11:00:35-06:00,Iridium,46.647427,-113.94779,1317,3.8,3D Validated,Nothing Detected,13,3.36,3.6,Animal with Collar 40882
40882,11/4/2023 13:00,2023-11-04 07:00:40-06:00,11/4/2023 13:01,2023-11-04 07:01:03-06:00,Iridium,46.64735,-113.9478,1305,1.8,3D Validated,Nothing Detected,13,3.36,3.6,Animal with Collar 40882
40882,11/4/2023 12:00,2023-11-04 06:00:16-06:00,11/4/2023 13:01,2023-11-04 07:01:03-06:00,Iridium,46.647423,-113.94785,1301,3.6,3D Validated,Nothing Detected,10,3.36,3.6,Animal with Collar 40882
40882,11/4/2023 11:00,2023-11-04 05:00:38-06:00,11/4/2023 13:01,2023-11-04 07:01:03-06:00,Iridium,46.647392,-113.94783,1318,2.4,3D Validated,Nothing Detected,9,3.36,3.6,Animal with Collar 40882
40882,11/4/2023 10:00,2023-11-04 04:00:39-06:00,11/4/2023 13:01,2023-11-04 07:01:03-06:00,Iridium,46.647392,-113.94784,1315,3.2,3D Validated,Nothing Detected,9,3.36,3.6,Animal with Collar 40882
40882,11/4/2023 9:00,2023-11-04 03:00:09-06:00,11/4/2023 9:00,2023-11-04 03:00:30-06:00,Iridium,46.647408,-113.94784,1311,5.6,3D Validated,Nothing Detected,10,3.36,3.6,Animal with Collar 40882
40882,11/4/2023 8:00,2023-11-04 02:00:08-06:00,11/4/2023 9:00,2023-11-04 03:00:30-06:00,Iridium,46.647408,-113.947815,1316,2.8,3D Validated,Nothing Detected,7,3.36,3.6,Animal with Collar 40882
40882,11/4/2023 7:00,2023-11-04 01:00:38-06:00,11/4/2023 9:00,2023-11-04 03:00:30-06:00,Iridium,46.64738,-113.94783,1316,1.6,3D Validated,Nothing Detected,10,3.36,3.6,Animal with Collar 40882
40882,11/4/2023 6:00,2023-11-04 00:00:40-06:00,11/4/2023 9:00,2023-11-04 03:00:30-06:00,Iridium,46.647366,-113.94777,1315,2.2,3D Validated,Nothing Detected,7,3.36,3.6,Animal with Collar 40882
40882,11/4/2023 5:01,2023-11-03 23:01:08-06:00,11/4/2023 9:00,2023-11-04 03:00:39-06:00,Iridium,46.64744,-113.947914,1296,9.8,3D Validated,Nothing Detected,9,3.28,3.6,Animal with Collar 40882
40882,11/4/2023 4:01,2023-11-03 22:01:38-06:00,11/4/2023 9:00,2023-11-04 03:00:39-06:00,Iridium,,,,0,No Fix,Nothing Detected,15,3.28,3.6,Animal with Collar 40882
40882,11/4/2023 3:00,2023-11-03 21:00:09-06:00,11/4/2023 9:00,2023-11-04 03:00:39-06:00,Iridium,46.647408,-113.947754,1316,2.2,3D Validated,Nothing Detected,15,3.28,3.6,Animal with Collar 40882
40882,11/4/2023 2:00,2023-11-03 20:00:38-06:00,11/4/2023 9:00,2023-11-04 03:00:39-06:00,Iridium,46.647408,-113.94775,1319,2.4,3D Validated,Nothing Detected,16,3.28,3.6,Animal with Collar 40882
40882,11/4/2023 1:01,2023-11-03 19:01:57-06:00,11/4/2023 1:02,2023-11-03 19:02:28-06:00,Iridium,46.647453,-113.94785,1320,4,3D Validated,Nothing Detected,17,3.28,3.6,Animal with Collar 40882
40882,11/4/2023 0:01,2023-11-03 18:01:39-06:00,11/4/2023 1:02,2023-11-03 19:02:28-06:00,Iridium,,,,0,No Fix,Nothing Detected,16,3.28,3.6,Animal with Collar 40882
40882,11/3/2023 23:01,2023-11-03 17:01:39-06:00,11/4/2023 1:02,2023-11-03 19:02:28-06:00,Iridium,,,,0,No Fix,Nothing Detected,15,3.28,3.6,Animal with Collar 40882
40882,11/3/2023 22:01,2023-11-03 16:01:39-06:00,11/4/2023 1:02,2023-11-03 19:02:28-06:00,Iridium,,,,0,No Fix,Nothing Detected,16,3.28,3.6,Animal with Collar 40882
40882,11/3/2023 21:01,2023-11-03 15:01:39-06:00,11/4/2023 1:02,2023-11-03 19:02:35-06:00,Iridium,,,,0,No Fix,Nothing Detected,17,3.28,3.6,Animal with Collar 40882
40882,11/3/2023 20:01,2023-11-03 14:01:39-06:00,11/4/2023 1:02,2023-11-03 19:02:35-06:00,Iridium,,,,0,No Fix,Nothing Detected,15,3.28,3.6,Animal with Collar 40882
40882,11/3/2023 19:01,2023-11-03 13:01:39-06:00,11/4/2023 1:02,2023-11-03 19:02:35-06:00,Iridium,,,,0,No Fix,Nothing Detected,16,3.28,3.6,Animal with Collar 40882
40882,11/3/2023 18:01,2023-11-03 12:01:39-06:00,11/4/2023 1:02,2023-11-03 19:02:35-06:00,Iridium,,,,0,No Fix,Nothing Detected,17,3.28,3.6,Animal with Collar 40882
40882,11/3/2023 17:01,2023-11-03 11:01:39-06:00,11/4/2023 1:02,2023-11-03 19:02:45-06:00,Iridium,,,,0,No Fix,Nothing Detected,15,3.28,3.6,Animal with Collar 40882
40882,11/3/2023 16:01,2023-11-03 10:01:39-06:00,11/4/2023 1:02,2023-11-03 19:02:45-06:00,Iridium,,,,0,No Fix,Nothing Detected,14,3.28,3.6,Animal with Collar 40882
40882,11/3/2023 15:01,2023-11-03 09:01:39-06:00,11/4/2023 1:02,2023-11-03 19:02:45-06:00,Iridium,,,,0,No Fix,Nothing Detected,15,3.28,3.6,Animal with Collar 40882
40882,11/3/2023 14:01,2023-11-03 08:01:08-06:00,11/4/2023 1:02,2023-11-03 19:02:45-06:00,Iridium,46.647434,-113.94788,1316,2.8,3D Validated,Nothing Detected,13,3.28,3.6,Animal with Collar 40882
40882,11/3/2023 13:00,2023-11-03 07:00:15-06:00,11/4/2023 9:00,2023-11-04 03:00:47-06:00,Iridium,46.64749,-113.947845,1305,4.6,3D Validated,Nothing Detected,13,3.36,3.6,Animal with Collar 40882
40882,11/3/2023 12:00,2023-11-03 06:00:09-06:00,11/4/2023 9:00,2023-11-04 03:00:47-06:00,Iridium,46.647354,-113.94788,1313,2.4,3D Validated,Nothing Detected,14,3.36,3.6,Animal with Collar 40882
40882,11/3/2023 11:01,2023-11-03 05:01:04-06:00,11/4/2023 9:00,2023-11-04 03:00:47-06:00,Iridium,46.64735,-113.947876,1322,2.2,3D Validated,Nothing Detected,19,3.28,3.6,Animal with Collar 40882
40882,11/3/2023 10:01,2023-11-03 04:01:41-06:00,11/4/2023 9:00,2023-11-04 03:00:47-06:00,Iridium,,,,0,No Fix,Nothing Detected,18,3.28,3.6,Animal with Collar 40882
40882,11/3/2023 9:01,2023-11-03 03:01:39-06:00,11/4/2023 9:00,2023-11-04 03:00:55-06:00,Iridium,,,,0,No Fix,Nothing Detected,16,3.28,3.6,Animal with Collar 40882
40882,11/3/2023 8:01,2023-11-03 02:01:39-06:00,11/4/2023 9:00,2023-11-04 03:00:55-06:00,Iridium,,,,0,No Fix,Nothing Detected,14,3.28,3.6,Animal with Collar 40882
40882,11/3/2023 7:01,2023-11-03 01:01:39-06:00,11/4/2023 9:00,2023-11-04 03:00:55-06:00,Iridium,,,,0,No Fix,Nothing Detected,15,3.28,3.6,Animal with Collar 40882
40882,11/3/2023 6:01,2023-11-03 00:01:39-06:00,11/4/2023 9:00,2023-11-04 03:00:55-06:00,Iridium,,,,0,No Fix,Nothing Detected,20,3.28,3.6,Animal with Collar 40882
40882,11/3/2023 5:01,2023-11-02 23:01:39-06:00,11/4/2023 9:01,2023-11-04 03:01:05-06:00,Iridium,,,,0,No Fix,Nothing Detected,18,3.28,3.6,Animal with Collar 40882
40882,11/3/2023 4:01,2023-11-02 22:01:39-06:00,11/4/2023 9:01,2023-11-04 03:01:05-06:00,Iridium,,,,0,No Fix,Nothing Detected,18,3.28,3.6,Animal with Collar 40882
40882,11/3/2023 3:01,2023-11-02 21:01:39-06:00,11/4/2023 9:01,2023-11-04 03:01:05-06:00,Iridium,,,,0,No Fix,Nothing Detected,18,3.28,3.6,Animal with Collar 40882
40882,11/3/2023 2:01,2023-11-02 20:01:38-06:00,11/4/2023 9:01,2023-11-04 03:01:05-06:00,Iridium,,,,0,No Fix,Nothing Detected,16,3.28,3.6,Animal with Collar 40882
40882,11/3/2023 1:01,2023-11-02 19:01:39-06:00,11/4/2023 9:01,2023-11-04 03:01:25-06:00,Iridium,,,,0,No Fix,Nothing Detected,16,3.28,3.6,Animal with Collar 40882
40882,11/3/2023 0:01,2023-11-02 18:01:38-06:00,11/4/2023 9:01,2023-11-04 03:01:25-06:00,Iridium,,,,0,No Fix,Nothing Detected,15,3.28,3.6,Animal with Collar 40882
40882,11/2/2023 23:01,2023-11-02 17:01:39-06:00,11/4/2023 9:01,2023-11-04 03:01:25-06:00,Iridium,,,,0,No Fix,Nothing Detected,15,3.28,3.6,Animal with Collar 40882
40882,11/2/2023 22:01,2023-11-02 16:01:39-06:00,11/4/2023 9:01,2023-11-04 03:01:25-06:00,Iridium,,,,0,No Fix,Nothing Detected,16,3.28,3.6,Animal with Collar 40882
40882,11/2/2023 21:01,2023-11-02 15:01:38-06:00,11/4/2023 9:01,2023-11-04 03:01:33-06:00,Iridium,,,,0,No Fix,Nothing Detected,19,3.28,3.6,Animal with Collar 40882
40882,11/2/2023 20:01,2023-11-02 14:01:39-06:00,11/4/2023 9:01,2023-11-04 03:01:33-06:00,Iridium,,,,0,No Fix,Nothing Detected,17,3.28,3.6,Animal with Collar 40882
40882,11/2/2023 19:01,2023-11-02 13:01:38-06:00,11/4/2023 9:01,2023-11-04 03:01:33-06:00,Iridium,,,,0,No Fix,Nothing Detected,16,3.28,3.6,Animal with Collar 40882
40882,11/2/2023 18:01,2023-11-02 12:01:39-06:00,11/4/2023 9:01,2023-11-04 03:01:33-06:00,Iridium,,,,0,No Fix,Nothing Detected,16,3.28,3.6,Animal with Collar 40882
40882,11/2/2023 17:01,2023-11-02 11:01:39-06:00,11/4/2023 9:01,2023-11-04 03:01:40-06:00,Iridium,,,,0,No Fix,Nothing Detected,19,3.28,3.6,Animal with Collar 40882
40882,11/2/2023 16:01,2023-11-02 10:01:38-06:00,11/4/2023 9:01,2023-11-04 03:01:40-06:00,Iridium,,,,0,No Fix,Nothing Detected,17,3.28,3.6,Animal with Collar 40882
40882,11/2/2023 15:01,2023-11-02 09:01:38-06:00,11/4/2023 9:01,2023-11-04 03:01:40-06:00,Iridium,,,,0,No Fix,Nothing Detected,19,3.28,3.6,Animal with Collar 40882
40882,11/2/2023 14:01,2023-11-02 08:01:38-06:00,11/4/2023 9:01,2023-11-04 03:01:40-06:00,Iridium,,,,0,No Fix,Nothing Detected,16,3.28,3.6,Animal with Collar 40882
40882,11/2/2023 13:00,2023-11-02 07:00:11-06:00,11/2/2023 13:02,2023-11-02 07:02:21-06:00,Iridium,46.64742,-113.947754,1318,3.2,3D Validated,Nothing Detected,12,3.36,3.6,Animal with Collar 40882
40882,11/2/2023 12:00,2023-11-02 06:00:36-06:00,11/2/2023 13:02,2023-11-02 07:02:21-06:00,Iridium,46.647377,-113.94779,1311,4.6,3D Validated,Nothing Detected,12,3.36,3.6,Animal with Collar 40882
40882,11/2/2023 11:00,2023-11-02 05:00:38-06:00,11/2/2023 13:02,2023-11-02 07:02:21-06:00,Iridium,46.647385,-113.94775,1316,2.2,3D Validated,Nothing Detected,12,3.36,3.6,Animal with Collar 40882
40882,11/2/2023 10:00,2023-11-02 04:00:13-06:00,11/2/2023 13:02,2023-11-02 07:02:21-06:00,Iridium,46.64735,-113.94772,1311,2.2,3D Validated,Nothing Detected,11,3.36,3.6,Animal with Collar 40882
40882,11/2/2023 9:00,2023-11-02 03:00:36-06:00,11/2/2023 13:02,2023-11-02 07:02:41-06:00,Iridium,46.64745,-113.947815,1314,2,3D Validated,Nothing Detected,12,3.36,3.6,Animal with Collar 40882
40882,11/2/2023 8:00,2023-11-02 02:00:13-06:00,11/2/2023 13:02,2023-11-02 07:02:41-06:00,Iridium,46.647423,-113.947845,1325,3.2,3D Validated,Nothing Detected,11,3.36,3.6,Animal with Collar 40882
40882,11/2/2023 7:00,2023-11-02 01:00:36-06:00,11/2/2023 13:02,2023-11-02 07:02:41-06:00,Iridium,46.647354,-113.947784,1311,2.2,3D Validated,Nothing Detected,10,3.36,3.6,Animal with Collar 40882
40882,11/2/2023 6:00,2023-11-02 00:00:10-06:00,11/2/2023 13:02,2023-11-02 07:02:41-06:00,Iridium,46.647377,-113.94786,1308,3,3D Validated,Nothing Detected,11,3.36,3.6,Animal with Collar 40882
40882,11/2/2023 5:00,2023-11-01 23:00:37-06:00,11/2/2023 5:01,2023-11-01 23:01:14-06:00,Iridium,46.64741,-113.94782,1307,2.4,3D Validated,Nothing Detected,12,3.36,3.6,Animal with Collar 40882
40882,11/2/2023 4:00,2023-11-01 22:00:09-06:00,11/2/2023 5:01,2023-11-01 23:01:14-06:00,Iridium,46.647385,-113.94786,1316,2.6,3D Validated,Nothing Detected,13,3.36,3.6,Animal with Collar 40882
40882,11/2/2023 3:00,2023-11-01 21:00:38-06:00,11/2/2023 5:01,2023-11-01 23:01:14-06:00,Iridium,46.64739,-113.94786,1310,2.2,3D Validated,Nothing Detected,16,3.36,3.6,Animal with Collar 40882
40882,11/2/2023 2:00,2023-11-01 20:00:14-06:00,11/2/2023 5:01,2023-11-01 23:01:14-06:00,Iridium,46.647327,-113.94789,1294,5.8,3D Validated,Nothing Detected,16,3.36,3.6,Animal with Collar 40882
40882,11/2/2023 1:00,2023-11-01 19:00:36-06:00,11/2/2023 1:01,2023-11-01 19:01:03-06:00,Iridium,46.647396,-113.94784,1309,1.8,3D Validated,Nothing Detected,16,3.28,3.6,Animal with Collar 40882
40882,11/2/2023 0:00,2023-11-01 18:00:13-06:00,11/2/2023 1:01,2023-11-01 19:01:03-06:00,Iridium,46.647392,-113.947876,1298,4.6,3D Validated,Nothing Detected,17,3.36,3.6,Animal with Collar 40882
40882,11/1/2023 23:00,2023-11-01 17:00:37-06:00,11/2/2023 1:01,2023-11-01 19:01:03-06:00,Iridium,46.64743,-113.947754,1319,3.4,3D Validated,Nothing Detected,18,3.28,3.6,Animal with Collar 40882
40882,11/1/2023 22:00,2023-11-01 16:00:15-06:00,11/2/2023 1:01,2023-11-01 19:01:03-06:00,Iridium,46.647354,-113.94768,1322,2,3D Validated,Nothing Detected,17,3.28,3.6,Animal with Collar 40882
40882,11/1/2023 21:00,2023-11-01 15:00:37-06:00,11/1/2023 21:00,2023-11-01 15:00:59-06:00,Iridium,46.647408,-113.947815,1316,2.6,3D Validated,Nothing Detected,17,3.28,3.6,Animal with Collar 40882
40882,11/1/2023 20:01,2023-11-01 14:01:39-06:00,11/1/2023 21:00,2023-11-01 15:00:59-06:00,Iridium,,,,0,No Fix,Nothing Detected,15,3.28,3.6,Animal with Collar 40882
40882,11/1/2023 19:01,2023-11-01 13:01:39-06:00,11/1/2023 21:00,2023-11-01 15:00:59-06:00,Iridium,,,,0,No Fix,Nothing Detected,15,3.28,3.6,Animal with Collar 40882
40882,11/1/2023 18:01,2023-11-01 12:01:39-06:00,11/1/2023 21:00,2023-11-01 15:00:59-06:00,Iridium,,,,0,No Fix,Nothing Detected,14,3.28,3.6,Animal with Collar 40882
40882,11/1/2023 17:01,2023-11-01 11:01:39-06:00,11/1/2023 21:01,2023-11-01 15:01:07-06:00,Iridium,,,,0,No Fix,Nothing Detected,13,3.28,3.6,Animal with Collar 40882
40882,11/1/2023 16:01,2023-11-01 10:01:39-06:00,11/1/2023 21:01,2023-11-01 15:01:07-06:00,Iridium,,,,0,No Fix,Nothing Detected,9,3.28,3.6,Animal with Collar 40882
40882,11/1/2023 15:01,2023-11-01 09:01:39-06:00,11/1/2023 21:01,2023-11-01 15:01:07-06:00,Iridium,,,,0,No Fix,Nothing Detected,9,3.28,3.6,Animal with Collar 40882
40882,11/1/2023 14:01,2023-11-01 08:01:39-06:00,11/1/2023 21:01,2023-11-01 15:01:07-06:00,Iridium,,,,0,No Fix,Nothing Detected,12,3.28,3.6,Animal with Collar 40882
40882,11/1/2023 13:01,2023-11-01 07:01:39-06:00,11/1/2023 21:01,2023-11-01 15:01:15-06:00,Iridium,,,,0,No Fix,Nothing Detected,13,3.28,3.6,Animal with Collar 40882
40882,11/1/2023 12:01,2023-11-01 06:01:39-06:00,11/1/2023 21:01,2023-11-01 15:01:15-06:00,Iridium,,,,0,No Fix,Nothing Detected,13,3.28,3.6,Animal with Collar 40882
40882,11/1/2023 11:01,2023-11-01 05:01:39-06:00,11/1/2023 21:01,2023-11-01 15:01:15-06:00,Iridium,,,,0,No Fix,Nothing Detected,15,3.28,3.6,Animal with Collar 40882
40882,11/1/2023 10:01,2023-11-01 04:01:39-06:00,11/1/2023 21:01,2023-11-01 15:01:15-06:00,Iridium,,,,0,No Fix,Nothing Detected,15,3.28,3.6,Animal with Collar 40882
40882,11/1/2023 9:01,2023-11-01 03:01:39-06:00,11/1/2023 21:01,2023-11-01 15:01:23-06:00,Iridium,,,,0,No Fix,Nothing Detected,15,3.28,3.6,Animal with Collar 40882
40882,11/1/2023 8:01,2023-11-01 02:01:39-06:00,11/1/2023 21:01,2023-11-01 15:01:23-06:00,Iridium,,,,0,No Fix,Nothing Detected,17,3.28,3.6,Animal with Collar 40882
40882,11/1/2023 7:01,2023-11-01 01:01:39-06:00,11/1/2023 21:01,2023-11-01 15:01:23-06:00,Iridium,,,,0,No Fix,Nothing Detected,13,3.28,3.6,Animal with Collar 40882
40882,11/1/2023 6:01,2023-11-01 00:01:39-06:00,11/1/2023 21:01,2023-11-01 15:01:23-06:00,Iridium,,,,0,No Fix,Nothing Detected,14,3.2,3.6,Animal with Collar 40882
40882,11/1/2023 5:00,2023-10-31 23:00:10-06:00,11/1/2023 5:00,2023-10-31 23:00:33-06:00,Iridium,46.648518,-113.94651,1337,5.6,3D Validated,Nothing Detected,12,3.28,3.6,Animal with Collar 40882
40882,11/1/2023 4:00,2023-10-31 22:00:12-06:00,11/1/2023 5:00,2023-10-31 23:00:33-06:00,Iridium,46.646584,-113.939835,1378,1.6,3D Validated,Nothing Detected,15,3.28,3.6,Animal with Collar 40882
40882,11/1/2023 3:00,2023-10-31 21:00:06-06:00,11/1/2023 5:00,2023-10-31 23:00:33-06:00,Iridium,46.646667,-113.93981,1358,1.8,3D Validated,Nothing Detected,13,3.28,3.6,Animal with Collar 40882
40882,11/1/2023 2:00,2023-10-31 20:00:40-06:00,11/1/2023 5:00,2023-10-31 23:00:33-06:00,Iridium,46.645374,-113.93979,1384,1.8,3D Validated,Nothing Detected,12,3.28,3.52,Animal with Collar 40882
40882,11/1/2023 1:00,2023-10-31 19:00:11-06:00,11/1/2023 1:01,2023-10-31 19:01:57-06:00,Iridium,46.64761,-113.93198,1298,2.6,3D Validated,Nothing Detected,12,3.28,3.6,Animal with Collar 40882
40882,11/1/2023 0:00,2023-10-31 18:00:38-06:00,11/1/2023 1:01,2023-10-31 19:01:57-06:00,Iridium,46.64463,-113.92435,1379,2.4,3D Validated,Nothing Detected,5,3.28,3.6,Animal with Collar 40882
40882,10/31/2023 23:00,2023-10-31 17:00:12-06:00,11/1/2023 1:01,2023-10-31 19:01:57-06:00,Iridium,46.648304,-113.91504,1371,3.8,3D Validated,Nothing Detected,11,3.28,3.6,Animal with Collar 40882
40882,10/31/2023 22:00,2023-10-31 16:00:38-06:00,11/1/2023 1:01,2023-10-31 19:01:57-06:00,Iridium,46.64828,-113.91501,1376,2.2,3D Validated,Nothing Detected,9,3.36,3.6,Animal with Collar 40882
40882,10/31/2023 21:00,2023-10-31 15:00:12-06:00,11/1/2023 1:02,2023-10-31 19:02:40-06:00,Iridium,46.648186,-113.91502,1375,2.2,3D Validated,Nothing Detected,7,3.36,3.6,Animal with Collar 40882
40882,10/31/2023 20:00,2023-10-31 14:00:39-06:00,11/1/2023 1:02,2023-10-31 19:02:40-06:00,Iridium,46.648388,-113.91505,1387,2.8,3D Validated,Nothing Detected,7,3.36,3.6,Animal with Collar 40882
40882,10/31/2023 19:00,2023-10-31 13:00:29-06:00,11/1/2023 1:02,2023-10-31 19:02:40-06:00,Iridium,46.64832,-113.91501,1380,3.2,3D Validated,Nothing Detected,7,3.36,3.6,Animal with Collar 40882
40882,10/31/2023 18:00,2023-10-31 12:00:40-06:00,11/1/2023 1:02,2023-10-31 19:02:40-06:00,Iridium,46.648293,-113.915,1380,3.6,3D Validated,Nothing Detected,7,3.36,3.6,Animal with Collar 40882
40882,10/31/2023 17:01,2023-10-31 11:01:08-06:00,11/1/2023 1:02,2023-10-31 19:02:47-06:00,Iridium,46.648346,-113.915016,1352,6.4,3D Validated,Nothing Detected,9,3.36,3.6,Animal with Collar 40882
40882,10/31/2023 16:00,2023-10-31 10:00:40-06:00,11/1/2023 1:02,2023-10-31 19:02:47-06:00,Iridium,46.648285,-113.915016,1367,4.2,3D Validated,Nothing Detected,10,3.36,3.6,Animal with Collar 40882
40882,10/31/2023 15:00,2023-10-31 09:00:12-06:00,11/1/2023 1:02,2023-10-31 19:02:47-06:00,Iridium,46.648335,-113.91504,1367,2.2,3D Validated,Nothing Detected,7,3.36,3.6,Animal with Collar 40882
40882,10/31/2023 14:00,2023-10-31 08:00:40-06:00,11/1/2023 1:02,2023-10-31 19:02:47-06:00,Iridium,46.64834,-113.91504,1362,3,3D Validated,Nothing Detected,5,3.36,3.6,Animal with Collar 40882
40882,10/31/2023 13:00,2023-10-31 07:00:28-06:00,11/1/2023 1:02,2023-10-31 19:02:57-06:00,Iridium,46.648197,-113.9151,1351,5,3D Validated,Nothing Detected,10,3.36,3.6,Animal with Collar 40882
40882,10/31/2023 12:00,2023-10-31 06:00:38-06:00,11/1/2023 1:02,2023-10-31 19:02:57-06:00,Iridium,46.64828,-113.915054,1365,2.2,3D Validated,Nothing Detected,10,3.36,3.6,Animal with Collar 40882
40882,10/31/2023 11:00,2023-10-31 05:00:34-06:00,11/1/2023 1:02,2023-10-31 19:02:57-06:00,Iridium,46.648266,-113.91502,1355,2.6,3D Validated,Nothing Detected,10,3.36,3.6,Animal with Collar 40882
40882,10/31/2023 10:00,2023-10-31 04:00:38-06:00,11/1/2023 1:02,2023-10-31 19:02:57-06:00,Iridium,46.648285,-113.91502,1364,2.2,3D Validated,Nothing Detected,10,3.36,3.6,Animal with Collar 40882
40882,10/31/2023 9:00,2023-10-31 03:00:09-06:00,11/1/2023 1:03,2023-10-31 19:03:05-06:00,Iridium,46.648315,-113.91499,1369,2.8,3D Validated,Nothing Detected,9,3.36,3.6,Animal with Collar 40882
40882,10/31/2023 8:00,2023-10-31 02:00:40-06:00,11/1/2023 1:03,2023-10-31 19:03:05-06:00,Iridium,46.648296,-113.915016,1369,2,3D Validated,Nothing Detected,10,3.36,3.6,Animal with Collar 40882
40882,10/31/2023 7:00,2023-10-31 01:00:23-06:00,11/1/2023 1:03,2023-10-31 19:03:05-06:00,Iridium,46.648163,-113.91502,1366,4.2,3D Validated,Nothing Detected,11,3.36,3.6,Animal with Collar 40882
40882,10/31/2023 6:00,2023-10-31 00:00:41-06:00,11/1/2023 1:03,2023-10-31 19:03:05-06:00,Iridium,46.64833,-113.91503,1376,4.8,3D Validated,Nothing Detected,11,3.36,3.6,Animal with Collar 40882
40882,10/31/2023 5:00,2023-10-30 23:00:11-06:00,10/31/2023 5:00,2023-10-30 23:00:55-06:00,Iridium,46.648323,-113.91501,1352,4.8,3D Validated,Nothing Detected,11,3.36,3.6,Animal with Collar 40882
40882,10/31/2023 4:00,2023-10-30 22:00:39-06:00,10/31/2023 5:00,2023-10-30 23:00:55-06:00,Iridium,46.648304,-113.915054,1368,2.4,3D Validated,Nothing Detected,11,3.36,3.6,Animal with Collar 40882
40882,10/31/2023 3:01,2023-10-30 21:01:38-06:00,10/31/2023 5:00,2023-10-30 23:00:55-06:00,Iridium,,,,0,No Fix,Nothing Detected,13,3.28,3.6,Animal with Collar 40882
40882,10/31/2023 2:00,2023-10-30 20:00:58-06:00,10/31/2023 5:00,2023-10-30 23:00:55-06:00,Iridium,46.648323,-113.91503,1382,4.2,3D Validated,Nothing Detected,12,3.28,3.6,Animal with Collar 40882
40882,10/31/2023 1:01,2023-10-30 19:01:23-06:00,10/31/2023 5:01,2023-10-30 23:01:04-06:00,Iridium,46.64836,-113.91501,1379,3,3D Validated,Nothing Detected,11,3.28,3.6,Animal with Collar 40882
40882,10/31/2023 0:00,2023-10-30 18:00:40-06:00,10/31/2023 5:01,2023-10-30 23:01:04-06:00,Iridium,46.648285,-113.915016,1367,2.8,3D Validated,Nothing Detected,10,3.28,3.6,Animal with Collar 40882
40882,10/30/2023 23:00,2023-10-30 17:00:12-06:00,10/31/2023 5:01,2023-10-30 23:01:04-06:00,Iridium,46.648335,-113.91498,1384,4,3D Validated,Nothing Detected,9,3.36,3.6,Animal with Collar 40882
40882,10/30/2023 22:00,2023-10-30 16:00:38-06:00,10/31/2023 5:01,2023-10-30 23:01:04-06:00,Iridium,46.648304,-113.915016,1376,3,3D Validated,Nothing Detected,8,3.36,3.6,Animal with Collar 40882
40882,10/30/2023 21:00,2023-10-30 15:00:09-06:00,10/30/2023 21:00,2023-10-30 15:00:37-06:00,Iridium,46.64828,-113.91504,1368,2.8,3D Validated,Nothing Detected,5,3.36,3.6,Animal with Collar 40882
40882,10/30/2023 20:00,2023-10-30 14:00:40-06:00,10/30/2023 21:00,2023-10-30 15:00:37-06:00,Iridium,46.648273,-113.915054,1371,2.4,3D Validated,Nothing Detected,5,3.36,3.6,Animal with Collar 40882
40882,10/30/2023 19:00,2023-10-30 13:00:38-06:00,10/30/2023 21:00,2023-10-30 15:00:37-06:00,Iridium,46.648315,-113.91504,1372,4,3D Validated,Nothing Detected,8,3.36,3.6,Animal with Collar 40882
40882,10/30/2023 18:00,2023-10-30 12:00:40-06:00,10/30/2023 21:00,2023-10-30 15:00:37-06:00,Iridium,46.64829,-113.91496,1381,2.8,3D Validated,Nothing Detected,8,3.36,3.6,Animal with Collar 40882
40882,10/30/2023 17:03,2023-10-30 11:03:00-06:00,10/30/2023 21:00,2023-10-30 15:00:44-06:00,Iridium,46.648262,-113.91499,1370,8.8,3D,Nothing Detected,8,3.36,3.6,Animal with Collar 40882
40882,10/30/2023 16:00,2023-10-30 10:00:39-06:00,10/30/2023 21:00,2023-10-30 15:00:44-06:00,Iridium,46.648315,-113.915,1367,2.6,3D Validated,Nothing Detected,8,3.36,3.6,Animal with Collar 40882
40882,10/30/2023 15:00,2023-10-30 09:00:10-06:00,10/30/2023 21:00,2023-10-30 15:00:44-06:00,Iridium,46.64824,-113.91502,1375,2.4,3D Validated,Nothing Detected,5,3.36,3.6,Animal with Collar 40882
40882,10/30/2023 14:00,2023-10-30 08:00:40-06:00,10/30/2023 21:00,2023-10-30 15:00:44-06:00,Iridium,46.64828,-113.915054,1365,2.4,3D Validated,Nothing Detected,6,3.36,3.6,Animal with Collar 40882
40882,10/30/2023 13:00,2023-10-30 07:00:14-06:00,10/30/2023 21:00,2023-10-30 15:00:51-06:00,Iridium,46.648426,-113.915016,1377,4,3D Validated,Nothing Detected,6,3.36,3.6,Animal with Collar 40882
40882,10/30/2023 12:00,2023-10-30 06:00:40-06:00,10/30/2023 21:00,2023-10-30 15:00:51-06:00,Iridium,46.64829,-113.91499,1367,3,3D Validated,Nothing Detected,7,3.36,3.6,Animal with Collar 40882
40882,10/30/2023 11:00,2023-10-30 05:00:38-06:00,10/30/2023 21:00,2023-10-30 15:00:51-06:00,Iridium,46.648247,-113.915016,1363,2.4,3D Validated,Nothing Detected,7,3.36,3.6,Animal with Collar 40882
40882,10/30/2023 10:00,2023-10-30 04:00:38-06:00,10/30/2023 21:00,2023-10-30 15:00:51-06:00,Iridium,46.648308,-113.91502,1367,3.8,3D Validated,Nothing Detected,6,3.36,3.6,Animal with Collar 40882
40882,10/30/2023 9:00,2023-10-30 03:00:11-06:00,10/30/2023 21:01,2023-10-30 15:01:16-06:00,Iridium,46.648323,-113.91504,1366,3,3D Validated,Nothing Detected,7,3.36,3.6,Animal with Collar 40882
40882,10/30/2023 8:00,2023-10-30 02:00:38-06:00,10/30/2023 21:01,2023-10-30 15:01:16-06:00,Iridium,46.64829,-113.915085,1358,1.8,3D Validated,Nothing Detected,7,3.36,3.6,Animal with Collar 40882
40882,10/30/2023 7:00,2023-10-30 01:00:38-06:00,10/30/2023 21:01,2023-10-30 15:01:16-06:00,Iridium,46.64829,-113.915016,1361,3.8,3D Validated,Nothing Detected,7,3.36,3.6,Animal with Collar 40882
40882,10/30/2023 6:00,2023-10-30 00:00:38-06:00,10/30/2023 21:01,2023-10-30 15:01:16-06:00,Iridium,46.648296,-113.91504,1363,2.6,3D Validated,Nothing Detected,6,3.36,3.6,Animal with Collar 40882
40882,10/30/2023 5:02,2023-10-29 23:02:08-06:00,10/30/2023 21:01,2023-10-30 15:01:24-06:00,Iridium,46.6483,-113.91504,1357,2.6,3D Validated,Nothing Detected,6,3.36,3.6,Animal with Collar 40882
40882,10/30/2023 4:00,2023-10-29 22:00:21-06:00,10/30/2023 21:01,2023-10-30 15:01:24-06:00,Iridium,46.648277,-113.91499,1365,4.8,3D Validated,Nothing Detected,8,3.36,3.6,Animal with Collar 40882
40882,10/30/2023 3:00,2023-10-29 21:00:20-06:00,10/30/2023 21:01,2023-10-30 15:01:24-06:00,Iridium,46.648273,-113.91508,1365,3,3D Validated,Nothing Detected,8,3.36,3.6,Animal with Collar 40882
40882,10/30/2023 2:00,2023-10-29 20:00:39-06:00,10/30/2023 21:01,2023-10-30 15:01:24-06:00,Iridium,46.648273,-113.91501,1368,2.6,3D Validated,Nothing Detected,7,3.28,3.6,Animal with Collar 40882
40882,10/30/2023 1:00,2023-10-29 19:00:13-06:00,10/30/2023 21:01,2023-10-30 15:01:43-06:00,Iridium,46.648304,-113.914986,1371,3,3D Validated,Nothing Detected,9,3.28,3.6,Animal with Collar 40882
40882,10/30/2023 0:00,2023-10-29 18:00:40-06:00,10/30/2023 21:01,2023-10-30 15:01:43-06:00,Iridium,46.648273,-113.915016,1366,2.6,3D Validated,Nothing Detected,9,3.36,3.6,Animal with Collar 40882
40882,10/29/2023 23:00,2023-10-29 17:00:24-06:00,10/30/2023 21:01,2023-10-30 15:01:43-06:00,Iridium,46.64831,-113.91499,1375,3.6,3D Validated,Nothing Detected,10,3.28,3.6,Animal with Collar 40882
40882,10/29/2023 22:48,2023-10-29 16:48:02-06:00,10/30/2023 21:01,2023-10-30 15:01:43-06:00,Iridium,46.648315,-113.91503,1375,4,3D,Nothing Detected,9,3.28,3.6,Animal with Collar 40882
40882,10/28/2023 22:00,2023-10-28 16:00:20-06:00,10/28/2023 22:00,2023-10-28 16:00:44-06:00,Iridium,46.648136,-113.91504,1344,4.8,3D Validated,Nothing Detected,11,3.36,3.6,Animal with Collar 40882
40882,10/28/2023 21:00,2023-10-28 15:00:36-06:00,10/28/2023 22:00,2023-10-28 16:00:44-06:00,Iridium,46.648304,-113.91506,1365,2.4,3D Validated,Nothing Detected,10,3.36,3.6,Animal with Collar 40882
40882,10/28/2023 20:00,2023-10-28 14:00:36-06:00,10/28/2023 22:00,2023-10-28 16:00:44-06:00,Iridium,46.648273,-113.915016,1366,3.4,3D Validated,Nothing Detected,11,3.36,3.6,Animal with Collar 40882
40882,10/28/2023 19:00,2023-10-28 13:00:40-06:00,10/28/2023 22:00,2023-10-28 16:00:44-06:00,Iridium,46.64828,-113.91503,1370,2.6,3D Validated,Nothing Detected,11,3.36,3.6,Animal with Collar 40882
40882,10/28/2023 18:01,2023-10-28 12:01:21-06:00,10/28/2023 22:01,2023-10-28 16:01:01-06:00,Iridium,46.64832,-113.91506,1361,6.6,3D Validated,Nothing Detected,11,3.28,3.6,Animal with Collar 40882
40882,10/28/2023 17:01,2023-10-28 11:01:38-06:00,10/28/2023 22:01,2023-10-28 16:01:01-06:00,Iridium,,,,0,No Fix,Nothing Detected,10,3.28,3.6,Animal with Collar 40882
40882,10/28/2023 16:00,2023-10-28 10:00:27-06:00,10/28/2023 22:01,2023-10-28 16:01:01-06:00,Iridium,46.64823,-113.91501,1370,2.8,3D Validated,Nothing Detected,10,3.36,3.6,Animal with Collar 40882
40882,10/28/2023 15:00,2023-10-28 09:00:36-06:00,10/28/2023 22:01,2023-10-28 16:01:01-06:00,Iridium,46.64828,-113.915016,1373,2.2,3D Validated,Nothing Detected,10,3.36,3.6,Animal with Collar 40882
40882,10/28/2023 14:00,2023-10-28 08:00:36-06:00,10/28/2023 14:00,2023-10-28 08:00:58-06:00,Iridium,46.648354,-113.91503,1379,4.2,3D Validated,Nothing Detected,10,3.36,3.6,Animal with Collar 40882
40882,10/28/2023 13:00,2023-10-28 07:00:11-06:00,10/28/2023 14:00,2023-10-28 08:00:58-06:00,Iridium,46.648163,-113.915016,1353,4.6,3D Validated,Nothing Detected,13,3.36,3.6,Animal with Collar 40882
40882,10/28/2023 12:00,2023-10-28 06:00:54-06:00,10/28/2023 14:00,2023-10-28 08:00:58-06:00,Iridium,46.64829,-113.91504,1356,4,3D Validated,Nothing Detected,11,3.36,3.6,Animal with Collar 40882
40882,10/28/2023 11:00,2023-10-28 05:00:54-06:00,10/28/2023 14:00,2023-10-28 08:00:58-06:00,Iridium,46.64826,-113.91495,1367,3.8,3D Validated,Nothing Detected,11,3.36,3.6,Animal with Collar 40882
40882,10/28/2023 10:00,2023-10-28 04:00:13-06:00,10/28/2023 10:01,2023-10-28 04:01:54-06:00,Iridium,46.64826,-113.91497,1362,4.4,3D Validated,Nothing Detected,11,3.36,3.6,Animal with Collar 40882
40882,10/28/2023 9:00,2023-10-28 03:00:36-06:00,10/28/2023 10:01,2023-10-28 04:01:54-06:00,Iridium,46.6483,-113.915016,1363,2.6,3D Validated,Nothing Detected,9,3.36,3.6,Animal with Collar 40882
40882,10/28/2023 8:00,2023-10-28 02:00:14-06:00,10/28/2023 10:01,2023-10-28 04:01:54-06:00,Iridium,46.648273,-113.91502,1363,3.6,3D Validated,Nothing Detected,9,3.36,3.6,Animal with Collar 40882
40882,10/28/2023 7:00,2023-10-28 01:00:36-06:00,10/28/2023 10:01,2023-10-28 04:01:54-06:00,Iridium,46.648308,-113.91504,1365,2,3D Validated,Nothing Detected,9,3.36,3.6,Animal with Collar 40882
40882,10/28/2023 6:00,2023-10-28 00:00:38-06:00,10/28/2023 10:02,2023-10-28 04:02:38-06:00,Iridium,46.64833,-113.915016,1379,5.6,3D Validated,Nothing Detected,7,3.36,3.6,Animal with Collar 40882
40882,10/28/2023 5:01,2023-10-27 23:01:39-06:00,10/28/2023 10:02,2023-10-28 04:02:38-06:00,Iridium,,,,0,No Fix,Nothing Detected,7,3.36,3.6,Animal with Collar 40882
40882,10/28/2023 4:00,2023-10-27 22:00:15-06:00,10/28/2023 10:02,2023-10-28 04:02:38-06:00,Iridium,46.648335,-113.91504,1367,2.4,3D Validated,Nothing Detected,8,3.36,3.6,Animal with Collar 40882
40882,10/28/2023 3:01,2023-10-27 21:01:24-06:00,10/28/2023 10:02,2023-10-28 04:02:38-06:00,Iridium,46.648216,-113.91493,1358,7.6,3D Validated,Nothing Detected,7,3.36,3.6,Animal with Collar 40882
40882,10/27/2023 3:00,2023-10-26 21:00:39-06:00,10/27/2023 3:02,2023-10-26 21:02:33-06:00,Iridium,46.64829,-113.914986,1369,3.6,3D Validated,Nothing Detected,11,3.36,3.6,Animal with Collar 40882
40882,10/26/2023 3:00,2023-10-25 21:00:10-06:00,10/27/2023 3:02,2023-10-26 21:02:33-06:00,Iridium,46.648266,-113.91504,1366,4.6,3D Validated,Nothing Detected,6,3.36,3.6,Animal with Collar 40882
40882,10/26/2023 2:00,2023-10-25 20:00:39-06:00,10/26/2023 2:01,2023-10-25 20:01:08-06:00,Iridium,46.648315,-113.915016,1364,3.2,3D Validated,Nothing Detected,5,3.36,3.6,Animal with Collar 40882
40882,10/26/2023 1:00,2023-10-25 19:00:10-06:00,10/26/2023 2:01,2023-10-25 20:01:08-06:00,Iridium,46.648304,-113.914986,1371,2,3D Validated,Nothing Detected,7,3.36,3.6,Animal with Collar 40882
40882,10/26/2023 0:01,2023-10-25 18:01:32-06:00,10/26/2023 2:01,2023-10-25 20:01:08-06:00,Iridium,46.64825,-113.91505,1371,3.8,3D Validated,Nothing Detected,8,3.36,3.6,Animal with Collar 40882
40882,10/25/2023 23:00,2023-10-25 17:00:11-06:00,10/26/2023 2:01,2023-10-25 20:01:08-06:00,Iridium,46.648293,-113.915054,1366,4.2,3D Validated,Nothing Detected,8,3.36,3.6,Animal with Collar 40882
40882,10/25/2023 22:01,2023-10-25 16:01:08-06:00,10/25/2023 22:01,2023-10-25 16:01:27-06:00,Iridium,46.64827,-113.915054,1377,3,3D Validated,Nothing Detected,7,3.36,3.6,Animal with Collar 40882
40882,10/25/2023 21:00,2023-10-25 15:00:38-06:00,10/25/2023 22:01,2023-10-25 16:01:27-06:00,Iridium,46.648304,-113.915016,1376,4,3D Validated,Nothing Detected,8,3.36,3.6,Animal with Collar 40882
40882,10/25/2023 20:00,2023-10-25 14:00:13-06:00,10/25/2023 22:01,2023-10-25 16:01:27-06:00,Iridium,46.648254,-113.91504,1365,2.4,3D Validated,Nothing Detected,6,3.36,3.6,Animal with Collar 40882
40882,10/25/2023 19:00,2023-10-25 13:00:38-06:00,10/25/2023 22:01,2023-10-25 16:01:27-06:00,Iridium,46.648304,-113.91503,1373,2.2,3D Validated,Nothing Detected,3,3.36,3.6,Animal with Collar 40882
40882,10/25/2023 18:00,2023-10-25 12:00:38-06:00,10/25/2023 22:01,2023-10-25 16:01:37-06:00,Iridium,46.64829,-113.91503,1378,3,3D Validated,Nothing Detected,2,3.36,3.6,Animal with Collar 40882
40882,10/25/2023 17:00,2023-10-25 11:00:38-06:00,10/25/2023 22:01,2023-10-25 16:01:37-06:00,Iridium,46.648327,-113.91502,1363,5.2,3D Validated,Nothing Detected,3,3.36,3.6,Animal with Collar 40882
40882,10/25/2023 16:01,2023-10-25 10:01:26-06:00,10/25/2023 22:01,2023-10-25 16:01:37-06:00,Iridium,46.648235,-113.91508,1361,3.6,3D Validated,Nothing Detected,5,3.36,3.6,Animal with Collar 40882
40882,10/24/2023 16:00,2023-10-24 10:00:39-06:00,10/25/2023 22:01,2023-10-25 16:01:37-06:00,Iridium,46.648266,-113.91496,1372,3.2,3D Validated,Nothing Detected,14,3.28,3.6,Animal with Collar 40882
40882,10/24/2023 15:00,2023-10-24 09:00:38-06:00,10/24/2023 15:01,2023-10-24 09:01:24-06:00,Iridium,46.648296,-113.91497,1366,2.2,3D Validated,Nothing Detected,13,3.36,3.6,Animal with Collar 40882
40882,10/24/2023 14:00,2023-10-24 08:00:40-06:00,10/24/2023 15:01,2023-10-24 09:01:24-06:00,Iridium,46.64822,-113.914955,1360,5,3D Validated,Nothing Detected,12,3.36,3.6,Animal with Collar 40882
40882,10/24/2023 13:00,2023-10-24 07:00:20-06:00,10/24/2023 15:01,2023-10-24 09:01:24-06:00,Iridium,46.648315,-113.915085,1361,2.2,3D Validated,Nothing Detected,11,3.36,3.6,Animal with Collar 40882
40882,10/24/2023 12:02,2023-10-24 06:02:09-06:00,10/24/2023 15:01,2023-10-24 09:01:24-06:00,Iridium,46.64825,-113.91493,1362,2,3D Validated,Nothing Detected,14,3.36,3.6,Animal with Collar 40882
40882,10/23/2023 12:01,2023-10-23 06:01:26-06:00,10/23/2023 12:02,2023-10-23 06:02:08-06:00,Iridium,46.64717,-113.91645,1457,2.4,3D Validated,Nothing Detected,18,3.36,3.6,Animal with Collar 40882
40882,10/22/2023 12:00,2023-10-22 06:00:12-06:00,10/23/2023 12:02,2023-10-23 06:02:08-06:00,Iridium,46.64713,-113.916306,1425,4.2,3D Validated,Nothing Detected,17,3.36,3.6,Animal with Collar 40882
40882,10/22/2023 11:01,2023-10-22 05:01:37-06:00,10/23/2023 12:02,2023-10-23 06:02:08-06:00,Iridium,,,,0,No Fix,Nothing Detected,19,3.28,3.6,Animal with Collar 40882
40882,10/22/2023 10:02,2023-10-22 04:02:01-06:00,10/23/2023 12:02,2023-10-23 06:02:08-06:00,Iridium,46.647133,-113.91672,1408,3.4,3D Validated,Nothing Detected,30,3.28,3.6,Animal with Collar 40882
40882,10/22/2023 9:01,2023-10-22 03:01:38-06:00,10/23/2023 12:02,2023-10-23 06:02:25-06:00,Iridium,,,,0,No Fix,Nothing Detected,21,3.28,3.6,Animal with Collar 40882
40882,10/22/2023 8:00,2023-10-22 02:00:40-06:00,10/23/2023 12:02,2023-10-23 06:02:25-06:00,Iridium,46.647163,-113.91645,1449,2,3D Validated,Nothing Detected,18,3.28,3.6,Animal with Collar 40882
40882,10/22/2023 7:00,2023-10-22 01:00:14-06:00,10/23/2023 12:02,2023-10-23 06:02:25-06:00,Iridium,46.647152,-113.91649,1453,2.6,3D Validated,Nothing Detected,18,3.36,3.6,Animal with Collar 40882
40882,10/22/2023 6:00,2023-10-22 00:00:38-06:00,10/22/2023 6:01,2023-10-22 00:01:17-06:00,Iridium,46.647163,-113.91649,1454,2,3D Validated,Nothing Detected,17,3.36,3.6,Animal with Collar 40882
40882,10/22/2023 5:00,2023-10-21 23:00:14-06:00,10/22/2023 6:01,2023-10-22 00:01:17-06:00,Iridium,46.64718,-113.916534,1458,3.2,3D Validated,Nothing Detected,23,3.36,3.6,Animal with Collar 40882
40882,10/22/2023 4:00,2023-10-21 22:00:40-06:00,10/22/2023 6:01,2023-10-22 00:01:17-06:00,Iridium,46.647167,-113.916534,1457,2.2,3D Validated,Nothing Detected,22,3.28,3.6,Animal with Collar 40882
40882,10/22/2023 3:00,2023-10-21 21:00:13-06:00,10/22/2023 6:01,2023-10-22 00:01:17-06:00,Iridium,46.647163,-113.9165,1452,3.8,3D Validated,Nothing Detected,22,3.36,3.6,Animal with Collar 40882
40882,10/22/2023 2:00,2023-10-21 20:00:40-06:00,10/22/2023 2:01,2023-10-21 20:01:08-06:00,Iridium,46.647186,-113.91644,1455,2.8,3D Validated,Nothing Detected,21,3.36,3.6,Animal with Collar 40882
40882,10/22/2023 1:00,2023-10-21 19:00:40-06:00,10/22/2023 2:01,2023-10-21 20:01:08-06:00,Iridium,46.647205,-113.916435,1450,2.4,3D Validated,Nothing Detected,20,3.36,3.6,Animal with Collar 40882
40882,10/22/2023 0:01,2023-10-21 18:01:02-06:00,10/22/2023 2:01,2023-10-21 20:01:08-06:00,Iridium,46.647194,-113.916374,1465,3.6,3D Validated,Nothing Detected,22,3.28,3.6,Animal with Collar 40882
40882,10/21/2023 23:00,2023-10-21 17:00:12-06:00,10/22/2023 2:01,2023-10-21 20:01:08-06:00,Iridium,46.647152,-113.91644,1450,4.6,3D Validated,Nothing Detected,23,3.36,3.6,Animal with Collar 40882
40882,10/21/2023 22:00,2023-10-21 16:00:38-06:00,10/22/2023 6:01,2023-10-22 00:01:26-06:00,Iridium,46.64718,-113.91647,1459,2,3D Validated,Nothing Detected,23,3.36,3.6,Animal with Collar 40882
40882,10/21/2023 21:00,2023-10-21 15:00:40-06:00,10/22/2023 6:01,2023-10-22 00:01:26-06:00,Iridium,46.6472,-113.91646,1467,5.8,3D Validated,Nothing Detected,22,3.28,3.6,Animal with Collar 40882
40882,10/21/2023 20:00,2023-10-21 14:00:40-06:00,10/22/2023 6:01,2023-10-22 00:01:26-06:00,Iridium,46.647266,-113.916504,1455,3.6,3D Validated,Nothing Detected,21,3.36,3.6,Animal with Collar 40882
40882,10/21/2023 19:00,2023-10-21 13:00:13-06:00,10/22/2023 6:01,2023-10-22 00:01:26-06:00,Iridium,46.64715,-113.91646,1467,3.2,3D Validated,Nothing Detected,21,3.36,3.6,Animal with Collar 40882
40882,10/21/2023 18:00,2023-10-21 12:00:38-06:00,10/21/2023 18:00,2023-10-21 12:00:58-06:00,Iridium,46.647205,-113.91647,1456,2.6,3D Validated,Nothing Detected,20,3.28,3.6,Animal with Collar 40882
40882,10/21/2023 17:00,2023-10-21 11:00:11-06:00,10/21/2023 18:00,2023-10-21 12:00:58-06:00,Iridium,46.64717,-113.91649,1462,5.2,3D Validated,Nothing Detected,19,3.36,3.6,Animal with Collar 40882
40882,10/21/2023 16:00,2023-10-21 10:00:38-06:00,10/21/2023 18:00,2023-10-21 12:00:58-06:00,Iridium,46.64717,-113.91645,1457,3,3D Validated,Nothing Detected,20,3.28,3.6,Animal with Collar 40882
40882,10/21/2023 15:00,2023-10-21 09:00:39-06:00,10/21/2023 18:00,2023-10-21 12:00:58-06:00,Iridium,46.647205,-113.916504,1447,3.4,3D Validated,Nothing Detected,21,3.28,3.6,Animal with Collar 40882
40882,10/21/2023 14:00,2023-10-21 08:00:22-06:00,10/21/2023 14:00,2023-10-21 08:00:45-06:00,Iridium,46.647327,-113.916466,1457,5,3D Validated,Nothing Detected,20,3.28,3.6,Animal with Collar 40882
40882,10/21/2023 13:00,2023-10-21 07:00:38-06:00,10/21/2023 14:00,2023-10-21 08:00:45-06:00,Iridium,46.647186,-113.91645,1452,2,3D Validated,Nothing Detected,21,3.28,3.6,Animal with Collar 40882
40882,10/21/2023 12:00,2023-10-21 06:00:40-06:00,10/21/2023 14:00,2023-10-21 08:00:45-06:00,Iridium,46.647068,-113.916306,1453,5.2,3D Validated,Nothing Detected,20,3.28,3.6,Animal with Collar 40882
40882,10/21/2023 11:00,2023-10-21 05:00:38-06:00,10/21/2023 14:00,2023-10-21 08:00:45-06:00,Iridium,46.6386,-113.914185,1457,3.6,3D Validated,Nothing Detected,18,3.28,3.6,Animal with Collar 40882
40882,10/21/2023 10:00,2023-10-21 04:00:40-06:00,10/21/2023 10:01,2023-10-21 04:01:01-06:00,Iridium,46.630642,-113.92694,1327,5.4,3D Validated,Nothing Detected,18,3.28,3.6,Animal with Collar 40882
40882,10/21/2023 9:00,2023-10-21 03:00:56-06:00,10/21/2023 10:01,2023-10-21 04:01:01-06:00,Iridium,46.63052,-113.932434,1326,3,3D Validated,Nothing Detected,19,3.28,3.6,Animal with Collar 40882
40882,10/21/2023 8:00,2023-10-21 02:00:38-06:00,10/21/2023 10:01,2023-10-21 04:01:01-06:00,Iridium,46.642002,-113.92917,1430,3.8,3D Validated,Nothing Detected,21,3.28,3.6,Animal with Collar 40882
40882,10/21/2023 7:00,2023-10-21 01:00:38-06:00,10/21/2023 10:01,2023-10-21 04:01:01-06:00,Iridium,46.63843,-113.949165,1263,3,3D Validated,Nothing Detected,19,3.28,3.6,Animal with Collar 40882
40882,10/21/2023 6:00,2023-10-21 00:00:12-06:00,10/21/2023 6:00,2023-10-21 00:00:30-06:00,Iridium,46.645912,-113.96207,1193,5,3D Validated,Nothing Detected,20,3.28,3.6,Animal with Collar 40882
40882,10/21/2023 5:00,2023-10-20 23:00:38-06:00,10/21/2023 6:00,2023-10-21 00:00:30-06:00,Iridium,46.64763,-113.955025,1246,1.4,3D Validated,Nothing Detected,22,3.28,3.6,Animal with Collar 40882
40882,10/21/2023 4:00,2023-10-20 22:00:13-06:00,10/21/2023 6:00,2023-10-21 00:00:30-06:00,Iridium,46.64891,-113.947876,1321,5,3D Validated,Nothing Detected,23,3.36,3.6,Animal with Collar 40882
40882,10/21/2023 3:00,2023-10-20 21:00:10-06:00,10/21/2023 6:00,2023-10-21 00:00:30-06:00,Iridium,46.64902,-113.947426,1317,6.8,3D Validated,Nothing Detected,22,3.36,3.6,Animal with Collar 40882
40882,10/21/2023 2:00,2023-10-20 20:00:38-06:00,10/21/2023 2:02,2023-10-20 20:02:28-06:00,Iridium,46.64889,-113.947495,1328,2,3D Validated,Nothing Detected,22,3.36,3.6,Animal with Collar 40882
40882,10/21/2023 1:00,2023-10-20 19:00:12-06:00,10/21/2023 2:02,2023-10-20 20:02:28-06:00,Iridium,46.648865,-113.94742,1315,2,3D Validated,Nothing Detected,22,3.36,3.6,Animal with Collar 40882
40882,10/21/2023 0:00,2023-10-20 18:00:40-06:00,10/21/2023 2:02,2023-10-20 20:02:28-06:00,Iridium,46.64891,-113.94741,1343,2.6,3D Validated,Nothing Detected,24,3.36,3.6,Animal with Collar 40882
40882,10/20/2023 23:00,2023-10-20 17:00:17-06:00,10/21/2023 2:02,2023-10-20 20:02:28-06:00,Iridium,46.648914,-113.94744,1328,3,3D Validated,Nothing Detected,25,3.28,3.6,Animal with Collar 40882
40882,10/20/2023 22:00,2023-10-20 16:00:40-06:00,10/20/2023 22:01,2023-10-20 16:01:02-06:00,Iridium,46.648903,-113.947495,1330,2.2,3D Validated,Nothing Detected,25,3.28,3.6,Animal with Collar 40882
40882,10/20/2023 21:00,2023-10-20 15:00:40-06:00,10/20/2023 22:01,2023-10-20 16:01:02-06:00,Iridium,46.648922,-113.94731,1319,4,3D Validated,Nothing Detected,23,3.28,3.6,Animal with Collar 40882
40882,10/20/2023 20:00,2023-10-20 14:00:40-06:00,10/20/2023 22:01,2023-10-20 16:01:02-06:00,Iridium,46.64897,-113.94743,1344,2.4,3D Validated,Nothing Detected,22,3.36,3.6,Animal with Collar 40882
40882,10/20/2023 19:00,2023-10-20 13:00:40-06:00,10/20/2023 22:01,2023-10-20 16:01:02-06:00,Iridium,46.648903,-113.94746,1324,2,3D Validated,Nothing Detected,22,3.28,3.6,Animal with Collar 40882
40882,10/20/2023 18:00,2023-10-20 12:00:12-06:00,10/20/2023 18:00,2023-10-20 12:00:33-06:00,Iridium,46.64895,-113.94747,1311,5.8,3D Validated,Nothing Detected,21,3.36,3.6,Animal with Collar 40882
40882,10/20/2023 17:00,2023-10-20 11:00:38-06:00,10/20/2023 18:00,2023-10-20 12:00:33-06:00,Iridium,46.648884,-113.94748,1323,2.2,3D Validated,Nothing Detected,21,3.28,3.6,Animal with Collar 40882
40882,10/20/2023 16:00,2023-10-20 10:00:12-06:00,10/20/2023 18:00,2023-10-20 12:00:33-06:00,Iridium,46.64902,-113.94752,1345,2.2,3D Validated,Nothing Detected,19,3.28,3.6,Animal with Collar 40882
